User Type,Username,Date,Text
[V],twentyforty,2010-09-15T11:56Z,"Funny, my favored shows and movies are most unpopular ones. Past season of Parenthood is the only one which I watched in entirety, in one day, in single breath... and so far only three downloads. Same as with Monk, I guess... "
,lilars26,2010-09-15T14:10Z,Thanks 20-40.I think the numbers will rise as America rises.
[V],twentyforty,2010-09-15T14:26Z,"@lilars: Yes, America MUST rise up !!! 
LOL, it sounds like calling for Revolution..."
,lilars26,2010-09-15T14:55Z,"Nothing wrong with a little revolution,but not today.I'm too tired.(LOL)"
