User Type,Username,Date,Text
,nandor90,2010-11-12T12:40Z,"Upload this if u can:
http://www.katzporn.com/download/6690487/XXX/Max-Faktor-17/"
,zion666,2010-11-13T10:45Z,"Great Upload!!  I'd love to see more Max.
I've seen almost all his vids....but there is one scene with Catalina and Summerluv (not the puke machine one),  it was shot just before he went to jail can't seem to find it anywhere.  thanks again."
[V],dias_vld,2010-11-15T17:01Z,Funny you mention Max Hardcore...thing is i will post a massive number of his stuff starting today...i dont know if i have that one with summer luv...will see!
