User Type,Username,Date,Text
,indian7777,2010-10-23T20:43Z,"Very Nice. But where is da seed, man? You know... you must seed sometime in the near future!"
,gnubeest,2010-10-24T08:24Z,"The police AND the FBI are monitoring ALL downloads in all of Scandinavia? Wow, they're gonna be pretty busy. Guess this would be a good day to rob a Norwegian bank, huh?"
,FastSLob,2010-10-24T20:26Z,Ummm OK? How is this illegal viking?
,boblaw023,2010-12-09T06:52Z,thx 4 the up. wife pics=illegal??? its not children
,boblaw023,2010-12-09T07:14Z,thx
