User Type,Username,Date,Text
,gerrard9099,2010-01-13T00:34Z,sweet hope it works :)
,aslafouine,2010-01-19T23:30Z,"hi everybody ;)
is it work or not please ?
thks ;)"
,aslafouine,2010-01-20T06:45Z,"Faudrait arreter de mettre, ou de laisser des Torrents si ils ne vont plus, ou si ils ne fonctionnent pas.

Cet ""iso"", se monte sans soucis avec le daemon, seulement, le jeu, ne peux pas se lancer.

Il MANQUE le fichier suivant, ""d3dx9_40.dll"" !!

Marre un peu de tout sa, et vous tuer le Torrent et les bons Seedeurs. fucking !!

Faudrait sans doute faire une mise Ă  jour de tous les Torrents, sa serai bien !!??"
,Ian.K,2010-01-22T19:07Z,what do u open it with
,coolintorrents,2010-02-02T22:06Z,seed! i start to down it now
,mattjus,2010-02-07T21:25Z,Guys this version is really old... now i'm releasing the version 0.9...  please help me I need a program for create an installer!
,coollife,2010-05-08T15:11Z,colapses very often......
,coollife,2010-05-08T15:13Z,"to mattjus..

pl give the mods used so that i can correct it....."
,vanko9797,2010-07-30T13:16Z,Hey way the game crash when he the end of loading ? Im with WIN7 PLS help
,Carlos888Video,2011-05-18T17:31Z,"ty m8 the torrent took 22min and 1mb

Only how do you turn on ENB Series"
,Carlos888Video,2011-05-26T09:26Z,can you make enb series work
