User Type,Username,Date,Text
,galidaniel,2009-09-14T10:11Z,Demo?
,domi86,2010-11-14T15:52Z,this is the full game and it is working perfectly - thx for the uploading :) 
,Baghera80,2011-03-06T21:36Z,I get a message telling me that i got the wrong cd.. And the the Crack file wount open.. Any help?
,binyo66,2011-05-03T00:24Z,thx
,richnk8,2011-05-05T04:22Z,"wat a waste of time, DO NOT DL, VERY POOR UL"
,TheBees,2011-09-01T17:40Z,"shite torrent!
don't waste your time"
,dario1607,2011-10-31T17:00Z,why i can't load last save game
