User Type,Username,Date,Text
[V],raymondhome,2010-02-06T03:04Z,"http://www.imdb.com/title/tt1226273/

SCREENSHOTS
http://img519.imageshack.us/img519/9697/19263497012050377084.jpg

My other uploads...

http://thepiratebay.org/user/raymondhome/

*****help what we can with haiti...the world is ONE big family*****"
,william999,2010-02-06T04:20Z,"Look's like the real deal , might b wrong though,if the screenshot's are right this is a gr8 copy.........We'll see but!!!!!!!!!"
,william999,2010-02-06T05:15Z,You can never tell these days on this site if a torrents real or not even with these green skulled muth fukkers.Been watin for decent copy a dis for ages Hope it's o.k.WILL COMMENT WHEN D/L IS COMPLETE!!!!!!!!!!!!!!!!!!!!!!!!!!!!!
,vietvet52,2010-02-06T05:39Z,u can still trusts the skull and cross bones  
,OGma59,2010-02-06T07:27Z,a/v? please
,GPB2008,2010-02-06T07:47Z,"Thanks For Another Upload @raymondhome

A-6
V-9

The Audio Is Very Hissy and Noisy

Watchable If You REALLY Need To See This..

Enjoy and Seed!! "
,smerkn,2010-02-06T11:41Z,"this is hella funny.. the cam rip looks shiity sounds perfect. 

this looks perfect...sounds shiity.. 


your hella whack for putting this out..

unless someone out there can do the dub .. dont waste your time...
"
,carnagel1,2010-02-06T11:51Z,"The picture quality is fine 8/10

But the sound...absolutely horrible sound. It is out of sync after halfway through and gets worse as the movie progresses, and you can hardly understand the actual speaking it is that bad, even adjusting the equalizer settings to the best possible sound quality it is still terrible.

Thanks for uploading, but it is unwatchable."
,william999,2010-02-06T11:55Z,A4V7 --- AUdio kinda shitty.
,schenker1,2010-02-06T17:04Z,"I'll repeat what others have said, the movie is very watchable for a cam but the audio is bad. "
,demo69ca,2010-02-06T17:11Z,audio makes the movie unwatchable. really really horrible sound. v5/a-2
,scoopnohlee,2010-02-06T17:12Z,um... video 8 sound 3  If you don't mind the tin can sound then you'll have no problem with this torrent.
,belfast50,2010-02-06T19:59Z,Thanks for the effort but the audio is a 2 shame because it would be watchable Vid 7 Still appreciate your  work TY
,Kelly77,2010-02-06T21:09Z,"shit copy

but thx for the upl"
,ZenRhino,2010-02-06T21:44Z,thanks for the up... but why can't someone come up with a copy of Boondock Saints 2???
,willy_wonker,2010-02-06T22:40Z,"Sound is terrible, I gave up after 10 mins.

Wait for a better copy"
,princelove,2010-02-06T23:03Z,i hope this copy is good
,scoopnohlee,2010-02-06T23:09Z,"@princeclove

not trying to be billigerent but if you took two seconds to read the comments above the one you posted you'd see that at 20 people say the sound is terrible.  You're probably so lazy you won't read this either.   "
,born2b,2010-02-07T02:16Z,"Cant hear what they are saying... 
Kan inte hĂśra vad de sĂ¤ger... "
,schenker1,2010-02-07T05:06Z,"Just to clarify a bit for those wondering about the sound.  It's not just that it's ""tinny"".  It's bad enough and distorted to the point where half of the movie is unintelligible.  You literally can't understand half of what's being said. "
,NullSociety,2010-02-07T14:45Z,"Video is about a 7 pretty good and very watchable.
Audio is about a 2 The Right side was way too loud and distorted and the left side was barley audible.  The Audio is so bad it makes the Movie unwatchable which is bad because the video is actually good.  Props for the Up though."
,outpatient730,2010-02-08T00:26Z,"Instead of bitching like whining ungrateful sissies! Why not just take the dub from another copy of Edge of Darkness, use that mp3 and stop fucking whining. I mean for someone who goes out of their way to give to you low life ungrateful pieces of shit is beyond me. If I were Raymondhome I'd be like...fuck you, YOU make a copy! Instead of bitching why not try to accomplish something yourself or just wait for a better copy! How can you bitch about something free...you can critique it tastefully but these guys go out of their way and well I profit from that so Godbless em!! Thank you Raymondhome, you're fucking awesome...."
,eagle_poacher,2010-02-08T19:40Z,"Hey I dumb a question...
Are seeders the people who have the torrent completed and letting others upload off of it??

And are leachers are still in the process of DL'n it while letting other upload??"
,ephozzin,2010-02-09T03:55Z,"not very good, thanks for the effort
v: 7
a: 3
audio sounds like its in a pipe underwater, with lots of hisses and other noises.
video is decent."
,OGma59,2010-02-09T09:52Z,"question to ""outpatient730"".....how do i ""dub the sound off another copy and use the mp3"" as you said that we ungrateful sons of bitches should do?  
i don't know how to do that.....do you?
if so, fucktard, then why don't you do it and up a decent quality torrent?
i would if i knew how, but i don't.  convertxtodvd is supposed to fix sound anomalies like out of sync, but it doesn't.  so, not being a genius like you, i am stuck with this lovely pic and shit for sound.
i appreciate the uppers efforts, but would like to be able to hear the movie.
so, go for it, asshole and give us one we can hear"
,outpatient730,2010-02-09T13:36Z,OGma59: Haha I can't believe I'm responding to a internet noobster who woke up retarded like Corky from Life goes on! Guess what fag?? he did it for you!! At least you showed some gratitude. but you'll never get far with that attitude. Depends on what program you're running anyways and since you didn't specify and insulted me. I'll say fuck your worthless mother on a bell tower and have a nice day! Oh and if you don't feel like looking cause I know how hard of work it is: Let me pace this http://thepiratebay.org/torrent/5344970/Edge_of_Darkness_TS_XviD_Ghostman-_%28ELITE%29__G%5BExtraTorrent%5D...did you need your hand held?? Was that difficult for you? What an cum guzzling mega homo with involuntary drooling from waking up with a helmet cause he's retarded. Fuck your whole genetic specimen and any offspring that is regenerated from your worthless existence.
,lilars26,2010-02-09T20:15Z,"WTFpeople...can't you read??The uploader was honest with you.He told you in the movie description exactly what you were getting.Don't come back complaining about what you've already been told.Once you've chosen to download,his hands are clean."
,lilars26,2010-02-09T20:20Z,...and stay away from these scammer posts like the ones above.They aren't what they pretend to be.
,stlctan,2010-02-09T21:29Z,"V7 A2 audio is shit, unwatchable because of audio"
,philtaylor007,2010-02-11T08:29Z,"visual 6
audio - 5034567372

why waste my time with this crap
if i want my ears hurt i'll get married"
,philtaylor007,2010-02-11T08:32Z,"outpatient730 
i fucked your mother and she begged for more!
stupid cunt"
,dexter77,2010-02-13T07:27Z,ah look at you all quarrelling like pre-schoolers
