User Type,Username,Date,Text
[V],Murlok,2009-10-10T12:42Z,Thanks for help me seeding:) I know its more of this up difference is here is also a fix to a problem! 
,jersson,2009-10-10T14:04Z,"Oh yeah this is the best ever, thank's for all your marvellous uploads man"
,D3xsT3r,2009-10-10T19:39Z,"i will seed all your uploads as long as i can
:)"
,Rathorazz,2009-10-10T22:05Z,"Awesome upload m8

ill try to seed this atleast untill i have a gig up"
[V],Murlok,2009-10-10T22:55Z,Thanks peer for help me seeding :)
[T],bulletzz74,2009-10-27T23:17Z,thanks will help seed 2 :)
