User Type,Username,Date,Text
,solamande,2010-07-05T03:10Z,Thanks for this. Will Seed.
,davidbisok,2010-07-09T05:49Z,"This won\'t download for me. Other files on PB are working. I\'m perplexed, really wanna hear this .  =["
,alejandro70,2010-11-17T13:57Z,GRACIAS    !!!!!!!!!!!
,tennesse_jed,2011-04-12T05:05Z,Thanks for seeding good folks!
,hkgrguy,2012-04-06T21:23Z,Can someone please seed. I enjoyed the film and would like to listen to the tunes... so... please... someone... S E E D ! ! ! cheers.
,ioannisarc,2012-05-25T20:27Z,Thank you very much.
