User Type,Username,Date,Text
,inianlion,2010-03-02T09:17Z,"Hi SaM, what happened to your previous uploads. "
[V],SaM,2010-03-02T14:29Z,some nob helper reported me as a faker for which they have removed all my uploads and banned me..:(
,inianlion,2010-03-03T08:59Z,"How can that be possible SaM, everybody in here knows you stand for quality. 
 Is that stupid a retard or something. Who is that joker."
[V],SaM,2010-03-03T18:27Z,"i wish i could know
:)"
,inianlion,2010-03-05T07:08Z,Sorry to hear that SaM.
,oatgarum,2011-08-02T07:53Z,thanks for this
