User Type,Username,Date,Text
,killbush,2010-09-22T13:44Z,Thanks! Great series
,danickista,2010-10-01T02:43Z,CAN YOU PLEASE UPLOAD EPISODE 11 - THE FINALE????
,darkbyke,2010-10-02T19:14Z,"danickista: I'M SURE THEY WILL, HOW ABOUT WAITING A FUCKING SECOND TILL IT COMES?  "
,Malibu2,2010-10-08T03:49Z,"Thanks! I like the Oz version much better than the U.S. version. The whole atmosphere is more appealing, as were the contestants (IMHO)."
,hexrider,2010-10-09T07:55Z,"where the heck is ep.11??  i cant find it anywhere, can somebody plz upload???  ty"
