User Type,Username,Date,Text
,drlovejones,2009-12-21T16:36Z,why  not give me pernission  please
,awadim,2009-12-21T21:35Z,"What the permission you mean, drlovejones?"
,dragos_adrian_ro,2010-01-08T03:22Z,"any body can tell me haw is the quality ? I don`t need garbage in my comp...
thanx"
,awadim,2010-01-12T23:13Z,"The quality - are different, but mostly there is good and very good."
,TheBlackPirate,2010-02-02T07:32Z,"GREAT UPLOAD THX!
Please someone help me. I am looking for a disco song from 90's (maybe 80's I am not sure).
In that song they sing 2 times ""pump, pump, pump, pump me up""
Thanks!"
,awadim,2010-06-08T19:11Z,"Sorry, don't know."
,Mileschau,2010-06-11T04:03Z,"A rap song named ""Pump Me Up"" was made by Grandmaster Melle Mel & The Furious Five in 1985."
,mrizzo2,2011-08-16T04:55Z,nice on the whole for certain! thanks for posting this collection for everyone! Good taste still abounds thank goodness - Michael Rizzo
