User Type,Username,Date,Text
,Soviet_Union,2010-05-09T20:01Z,"Uhg, comrade is it the full? "
,tonygestaple,2010-05-09T21:18Z,@snusm  many thanks for this - my son was amongst the welsh guards marching in moscow this morning! 
,asdhokker,2010-05-10T23:34Z,"so all the new leaders celebrated the culling of ordinary people aka slaves?
new world order is right in front of our eyes !

is some may not know, then roosevelt, churchill and stalin made a post-ww2 deal which meant that all the future wars are going to be pseudo-wars which wont have a winner or a loser.... just to keep the money flowing and population under control and people in fear...

there might be a terrorist in your fridge! go check it out until its too late!"
,asdhokker,2010-05-10T23:35Z,were going to be*
