User Type,Username,Date,Text
,tp2103,2010-01-01T03:09Z,nah just pantys n teasin watch the trailer on utube 
,carmabelle,2010-01-01T10:15Z,SEEDERS PLEASE 
[T],Knaster,2010-01-01T10:59Z,damn it i had hoped to get some good porn
,fergus62,2010-01-03T23:35Z,My ISP has been up and down all weekend and I apologize. Hopefully it's fixed and things will proceed smoothly. I will continue to seed and hope for the the best. Again - I am sorry.
,thunderstruck666,2010-01-07T06:03Z,Can someone please seed? I only need 14 megs to complete the download
