User Type,Username,Date,Text
,beanyman,2010-05-15T09:28Z,"Hi there vitashko, some of us are stuck at 38%. Could you please seed some more?"
,dhays,2010-10-21T00:22Z,There is some blessed soul in Portugal that has been seeded this (albeit very slowly and only part-time) for a bit.  I'll seed it it and hopefully will have the entire torrent in a few days.
,vitashku,2010-11-17T18:30Z,"decided to help you. It's my old torrent, i already forgot about this. 

vitashko exists no more - lost passwd"
,vitashku,2010-12-11T11:21Z,"Alternative links here:
http://fatgarry.org/music/8549-robin-spielberg-diskografiya-10-albomov-1993-2008.html"
,dhays,2010-12-27T17:31Z,"I'm still seeding this, but it looks like I'm the only one.  Please seed once you have completed it.  I'll not seed it forever."
