User Type,Username,Date,Text
[V],merzedes,2010-05-27T16:45Z,A sincere thankyou to all those of you who take the time to comment on all the uploaders' work. It is appreciated.     Cheers  :-)
,bakaonna,2010-05-27T17:53Z,"Thanks, much appreciated as always."
,ChefEm,2010-05-27T23:12Z,"Thanks Man, looks good"
,mafiadog,2010-05-28T03:12Z,"Thanks man,love TopGrl.
As anyone seen the one with Bronte and the one with Devi Lynn?"
,dk1854,2010-05-28T10:33Z,Thanks Merzedes.  Love the shoots with Lavander.
