User Type,Username,Date,Text
,RockyMM,2010-03-04T13:11Z,"I would've payed for this, but f*****ing retards won't let me, 'cause I'm not from USA!!!

Take that, record companies, and DIEEEEEEEE!"
,RockyMM,2010-03-04T13:25Z,"BTW, stuck at 99.5% :)"
,wkgn129,2010-03-05T09:39Z,I found an error in my torrent. It's fixed now so download away. I can't wait for March 16th!
,syndre,2010-03-10T23:41Z,Thanks!  Been waiting for this.
,xatzis012,2010-03-11T08:39Z,thanks.have been looking for this one like crazy
,Count666,2010-03-12T04:39Z,Thanks alot...Ill seed for as long as I can
