User Type,Username,Date,Text
[V],Mbb15,2009-07-15T22:13Z,nice :)
,yaqwsx666,2009-07-16T09:04Z,"Guitar Hero Wolrd Tour System Requirements:
http://gamesystemrequirements.com/games.php?id=932"
,nabilishes,2009-07-18T17:26Z,"ive downloaded this file and in the folder there are a MSINFO doc which i could open with texpad, a SFV file and 001 files till 066. i already combined the 001 files and rename it with .rar. duirng extraction it says 066 file is corrupted
any other way to extract the file?"
,degtop,2009-07-29T17:20Z,"@nabilishes, did you just try to double click the first rar and drag that iso file onto your desktop? "
,PredatorRules214,2009-07-31T08:06Z,"how can I change the controlls? I can't find it, in GH3 you could change them"
,degtop,2009-08-07T01:56Z,anyone with questions go to the other one with the .iso...... and they might already be answered.
,freaky_doll,2009-11-01T21:32Z,"the torrent is baaad .. i've dloaded this from mininova and the game just crashes when u try to play in career or quick play or any other thing ...f*ck,i want it so badly =("
