User Type,Username,Date,Text
,woody1815,2009-12-02T13:39Z,"works fine,, thx uploader."
,StuBoi,2009-12-28T06:27Z,I apologize for being that guy that asks the question: Why wont this work for me? I put it through abgx and burned it to disk but it only comes up with the XBOX360 logo when I try to play. Thanks for the help. You guys rock
,xFlawleZx,2009-12-30T23:53Z,"i might know the answer.
the problem is that your xbox is not yet flashed,
or isn't flashed with the newest filmware.
so u should go look at the internet for flash information so u can play this game :P"
,StuBoi,2009-12-31T03:39Z,legend. Tahnks heaps mate
,mr.kmhtet,2010-02-02T11:24Z,"He is correct that you haven't mod your xbox but if you even have mod, you will going to need activate iso for play all the wave 4 games."
