User Type,Username,Date,Text
[V],merzedes,2009-12-31T16:27Z,"Screens  http://www.devicebondage.com/site/shoot.jsp?shootId=7795

Cheerz  :-)"
[V],merzedes,2009-12-31T16:33Z,Ihope all off you out there have enjoy my collection from Kink in 2009 
,grifter3125,2009-12-31T16:43Z,Thanks Merzedes!  Hope you have a fantastic new year!
,shallow_,2009-12-31T16:53Z,"Thanx alot for all your great uploads, you are the man!!!
Happy new year to everyone!"
,car1989,2009-12-31T17:24Z,We did!thanks!
,mafiadog,2010-01-01T03:48Z,"It was fantastic,couldn't be any better.
Thanks  so much for your great work,all the best for the New Year."
,dk1854,2010-01-02T02:16Z,"Thanks Merzedes, your stuff is awesome.  Happy New Year."
,nemez504,2010-01-03T10:37Z,thx for sharing your kink collection) we love you!
,dlmax63,2010-01-14T18:13Z,Thanks for the up
,SirSwed,2010-01-15T01:22Z,Many thanks for you work!!
