User Type,Username,Date,Text
,Piraat1695,2010-10-31T16:40Z,I need seeders so I can play this game tonight =D
[V],webchella,2010-10-31T19:03Z,AS IF THAT RUNS
,Piraat1695,2010-11-01T19:03Z,"How do I put the language on English? I've downloaded the game, burned it and everything is in Spain...... :("
,Piraat1695,2010-11-01T19:11Z,"How do I put the language on English? I've downloaded, burned and everything is in Spanish.... :( not really what I was looking for xD"
,Piraat1695,2010-11-01T19:35Z,"I found the menu to change the languages, looks like this game is only Spanish. Can't change the language setting ingame."
,reoric,2010-11-07T09:22Z,"Can't choose English, only Spanish spoken and subtitled."
,Hell_Ryder,2011-01-11T20:22Z,yeah thanks a lot uploader for tricking us to believe it has english.... i've just wasted 2âŹ
,Quasso,2011-06-07T15:35Z,yeah!! Thanks a'lot... You mabey should check the games before uploading! -.-
