User Type,Username,Date,Text
,colmonhs,2010-06-22T19:05Z,"Hi,
I heard about this movie on account of Gackt being in it and I would be very gratefull if some seeds and I promise I will seed back!
Thanks."
,[TRI],2010-06-23T11:42Z,"Hi colmonhs, my main laptop is currently being repaired so I'm having to use my spare. As soon as I get my main back at the end of the week I'll be seeding pretty much constantly."
,AegeanC,2011-07-13T01:16Z,"It's a strange movie!!! Good video and audio but it could've been better!!!
Thank you for uploading it, I really wanted to see it!"
,chocorem,2011-10-24T21:36Z,"thanks for uploading it but I'm having troubles downloading it. no seeders unfortunately. :(

first time I saw this i laughed my ass of because of the tandem. XD"
,Tsukiakari,2012-05-18T01:21Z,"Thank you so much for uploading this movie, I really wanna see it, I've heard Gackt and Hyde are great on it."
