User Type,Username,Date,Text
,apexnine,2009-10-09T20:53Z,"Always need my fill of M. Savage.


Thanks as always."
,misterbishop,2009-10-09T21:50Z,"Thanks a bunch Atom.  Ever since KNEW dropped him, I have no way of getting the show.

Are most of you listening because you agree with him, or because he's an audio trainwreck?"
,steveg32,2009-10-09T23:49Z,"Check out radio time!
http://radiotime.com/options/p_20626/The_Savage_Nation.aspx"
,satman20082008,2009-10-10T00:47Z,I listen because he speaks truth to power and those cowards in england are pissing in their pink panties at very thought of hearing what he has to say!!!!! Thanks again atom your the man :-)
,Dookieshoes,2009-10-11T17:17Z,Michael Savage is a genius. He scares marionette puppets in Washington. Government lies constantly. Savage tells the truth!  Thanks for the upload.
