User Type,Username,Date,Text
,Zeppoleon,2011-01-10T01:27Z,Thanks!
,Saki33,2011-01-21T21:04Z,"Thanks for the 720p. I downloaded both to compare, and the hi def quality is easy to see the difference. Incredibly better."
,7r0j4n,2011-01-30T15:14Z,thx for the uploads in 720 m8
,kylehill,2011-05-14T04:16Z,"Great torrent, i just registered to say thanks, excellent quality and got 1900kb/s from it! cheers cenkota"
,Sanyi001,2011-05-16T06:47Z,"could somebody make a compilation of all the 720p into one torrent? That would be awesome. 
The 720p is needed much more here than most other programs because the places are real and Karl's facial expressions are priceless."
,zakybpro,2011-08-10T21:36Z,To anyone who cant play thesse files download this   http://thepiratebay.org/torrent/6533708/Bigasoft.MKV.Converter.v3.3.14.4128.Incl.Keymaker-BLiZZARD
