User Type,Username,Date,Text
,Ufreaker,2010-05-20T18:53Z,"Comments Highly Appreciated !
 plz fell free to Comment .............
Thnx U "
[T],minifrepper,2010-05-20T19:12Z,"Well, it would be nice if you said a few words about you upload, quality and so on instead. So we have an idea of what we can expect?

People are waiting for something better you know."
,barry421,2010-05-20T20:15Z,would be helpful if somebody would seed
,Redperil,2010-05-20T20:26Z,"So, can anyone comment on the quality?"
,look555,2010-05-20T22:37Z,"ballbags who have dl-ed, comments please!"
,hardtofind,2010-05-21T02:12Z,encrypted. do not download
,Ufreaker,2010-05-21T14:23Z,"its not  encrypted ""hardtofind"". and the quality is good "
,ggggone,2010-05-21T17:13Z,fake fake all his downloads  are dont waste your time
,Hisham747,2010-05-26T19:45Z,wow.....25 seeders.....now dats good...!!!!!!!!
,1wihtori,2010-05-29T23:41Z,Low quality CAM/TS
