User Type,Username,Date,Text
,ketapaketapa,2009-09-02T14:55Z,this crack doesnt work for me. after each 5 minutes new added loops are in a wrong sync. same error like in the team-air version.
,jamrobot,2009-09-07T10:41Z,REQUEST: ABLETON EXTEND: MAX FOR LIVE PLEEEASE AIR H20
,jamrobot,2009-09-07T10:41Z,REQUEST: ABLETON EXTEND: MAX FOR LIVE PLEEEASE AIR H20.
,technoris,2009-10-08T15:00Z,"It works well for me but there's an annoying bug. Each time I open a VSTi, I have to activate it no matter how often I did that before. In other applications they are activated."
,slabovmeat,2009-10-13T20:31Z,@ technoris . open ableton as adminstrator then register your vsts then open it normally
,Zeppelin-Astroforest,2009-11-30T00:15Z,"Please Ableton suite 8 FULL for (mac) 
will be awesome
some one can help us !!!!!!!!"
