User Type,Username,Date,Text
,sillyscrewy,2009-09-26T07:45Z,"Thanks. This is the last season, so I'm religiously downloading every episode as it arrives."
,xgp_alex28,2009-09-26T16:43Z,subs: http://www.addic7ed.com/serie/Monk/8/7/Mr._Monk_and_the_Voodoo_Curse
,sillyscrewy,2009-09-30T17:05Z,I didn't have any problems with audio. The pics is great and the sound recording levels are good. I can play it on my laptop or HDTV and it's fine.
,goldlite,2010-01-03T15:31Z,Thanks for all the great downloads VTV.  Am seeding as long as possible.   I am looking for season 4 complete.  Does anyone have this?  
,ForFun00,2010-01-22T18:33Z,Thanks a lot!!!!
