User Type,Username,Date,Text
,clandher,2010-01-13T13:05Z,"CU tot respectul pentru post, poate ar fi corect sa spui ca nu este un DVD original, ci unul facut dupa o captura TV"
,clandher,2010-01-13T13:24Z,"UPS! Sorry, acuma am vazut ca e scris."
,siru,2010-01-13T14:55Z,"Cred ca DVD original nu a aparut inca pe piata.
Intr-adevar e captura TV si nu se vede chiar foarte bine, uneori imaginea e un pic cam 'stearsa'"
,andreibancianu,2010-03-25T08:56Z,"E importanta mai are daca se vede bine sau nu, impotant este filmul in sine si acei actori care u mia sunt si care ne-au fericit sufletele cu filme bune."
,cogeanu,2010-11-26T21:56Z,"Huge thanks for all the effort, much appreciated, keep doing it"
