User Type,Username,Date,Text
,zerstuckelung,2010-01-01T06:00Z,Thanks for all your work?and nicely done.
,djdjura,2010-01-02T15:02Z,"This PDF has been further polished (OCRed and shrinked in filesize) by Daniel C. You can get his version from http://thepiratebay.org/torrent/5252096
"
,acollegestudent,2010-01-04T00:07Z,"@ djdjura, 
I would not call this obsolete, this should also be shared.

I'm just trying to figure out how to do all this in Windows. 

I was pleading for some user friendly tutorial on Y0uTube or the like."
