User Type,Username,Date,Text
,jersson,2010-10-10T19:33Z,"Which vers is this ? 9.1, 9.2, or 9.3 ? I got 9.0 right now, Thank's"
[V],DeGun,2010-10-10T21:18Z,"THIS torrent is only PATCH and keygen 

for the adobe version pro 9 it is the version 9.2.00.20 which is available here : http://thepiratebay.org/torrent/5654643"
,Alboy76,2010-10-27T11:48Z,"Hello 

How can i use this patch and keygen....can you please help me cause i`ve tryed some times and does not work..."
,Endsieg,2011-02-25T19:55Z,"Hey man, the patch doesn't work. I downloaded the keygen you uploaded to see if that would do the trick but it's not working either.

Figured I'd let you know."
,wgann,2011-03-07T09:56Z,Thanks a lot!!!
,donkeydick121,2011-04-16T05:12Z,Works a treat.
