User Type,Username,Date,Text
,05playboy,2010-10-22T17:35Z,how do you change the language to ENGLISH???
,05playboy,2010-10-22T17:44Z,its in Russian so unless there is a way to change this its useless unless u speak Russian 
,taibaby,2010-11-02T13:17Z,tHX
,nickyaa2,2010-11-11T18:52Z,"YEAH, HOW DO YOU CHANGE THE LANGUAGE?"
,AllenWalker257,2010-12-30T21:19Z,can u seed pls 
,xxfreshizsalvixx,2011-01-13T06:27Z,well its downloading at 1mb per second thanks do i have to mount the picture?
,LUIKANG1,2011-01-20T17:50Z,Thanks ; i' ll try it .
,blugames,2011-02-24T14:59Z,Please pirates I need help..how  I get this game in English ...my Russian sux
,miguelv64,2011-07-05T14:36Z,"hey yo i downloaded your 2k11 and i have to play in russian, and i don't understand nothing of russian... PLease tell us how to change to english or to other languages"
,torontoraps054,2011-12-18T22:01Z,"I've uploaded a roster for the 2011-2012 season. Accurate rosters as of dec,17,2011. 

Will be seeding for a while"
