User Type,Username,Date,Text
,Fito33,2010-02-02T04:29Z,Tack så mycket för detta! lillgrabben blir jätte glad :)
,binks82,2010-02-14T20:12Z,"Antingen är de min bd spelare (lg bd370) eller filmen, men bilden blir att fastna hela tiden där allt rör sig så de funkar inte att kolla.
Provat att bränna med img burn udf 2.50 men blir samma jobbiga bild. Vad göra? "
,Gr0ver,2010-02-17T18:52Z,"How do I burn this, and with what?
I´ve tried for a while now, downloading img burn, but the thing won´t install..
Why the f*ck can´t this be used with any of the other gazillion video formats? Every day something new, codecs, burn-sw..  Makes it appealing to buy the f*cking disc instead..  (Tired and grumpy, I know;)"
,mickepicke63,2010-02-19T16:31Z,"tusen tack funka utmärkt att bränna ut med nero vision,, provat i flera olika dvd."
,mickepicke63,2010-02-19T16:32Z,burn with nero vision
,jumjum99,2010-02-20T08:52Z,Går naturligtvis att se direkt med VLC (m2ts-filen i STREAM-mappen).
,raceman00000001,2010-02-20T17:44Z,"Nån som kan förklara lite nogranare hur man gör för att få den att funka på en dvd skiva?
Kan inte packa upp filen med varken winrar eller winzip som andra filmer,,,,"
,adonis1976,2010-02-23T12:24Z,dvd-rip hade varit super..
,raceman00000001,2010-02-23T14:41Z,Ingen som kan säga hur man gör för att spela upp den på en dvd????
,cisso_,2010-03-06T07:40Z,Använd AVS Video Converter 6. funka bra. blev bra bild och så. filen blir inte mycket mer större. 
,Nepacha,2010-03-19T09:35Z,borde gå att konvertera med xilisofts superba svit till valfritt format... och detta är väl framtiden.. bara att vänja sig... dvdripparna haglar inte lika tätt längre..TACK
,SamSpandex,2010-04-06T11:34Z,Finns orginal-ludet på engelska med också?
,mfuisea,2010-06-16T03:20Z,snälla seeda :)
