User Type,Username,Date,Text
,Zas1237,2009-11-12T16:37Z,"Nice unmixed music. 320 kbps. not even a name to know who to thank.

Thx uploader whoever you are. Its guys like you that make this world a better place."
,Cpt.Milkcan,2010-01-03T21:36Z,"Figured this out just a few seconds ago, but the song: Fear Death by Negative A and Counterfeit is not in the Download. It is Promo and Armageddon with Righteous Infliction Of Retribution.

 Not a real problem though... 

Thanks for the awesome download :D"
,Cpt.Milkcan,2010-01-03T21:37Z,*I mean that the song titled Fear Death is not Fear Death. It's Righteous Infliction Of Retribution .
