User Type,Username,Date,Text
,satanlunar,2010-02-14T15:49Z,hey could you upload subtitles for your movies.....and thanks for all the movies!!!
,computerkid234,2010-02-14T16:07Z,"Hey HR, which trackers do you use??"
,nnder06,2010-02-14T16:56Z,"Hello HolyRoses!
I LOVE YOUR TORRENTS!!!
Is it possible to upload all the seasons of Gilmore Girls? "
,mrgreen77,2010-02-14T23:01Z,can you upload the high res version on The Collector
,jcja123,2010-02-15T06:23Z,"@mrgreen77  if u download from HR then you know that he always does hand-held and hi res, so why the F*** do u bother asking?? "
,julio_brown,2010-02-16T11:24Z,Thank you HolyRoses for all the great torrents!! 
,sharenneedles,2010-03-10T04:36Z,"i just wanted to say thanks for taking the time to give us the great uploads.i know at times it may seem like people are ungrateful and demanding and they probably are, but i really appreciate you taking the time to give us perfect uploads. i download almost everything you put out because i know the quality doesn't get any better than yours. thanks again"
,RIggsta,2010-05-09T03:25Z,"high res? its a dvdr, its GREAT quality"
,mike08081979,2010-05-22T10:37Z,Thank you...Thank you HolyRoses for all the great torrents!!!u r the best
,Feetback,2011-01-23T05:24Z,A/ V 10 - Thank You ! - HolyRoses - keep EEm coming more - LOLL!
