User Type,Username,Date,Text
,rikowal,2010-01-24T22:50Z,Don't bother downloading this piece of shit.  Someone trying to mine money offa ringtones.
,DaemonXR,2010-02-05T15:14Z,yeah. 26 MB was suspicious to me for dvds from eat 3d.
,daneraw,2010-03-18T08:35Z,is there a REAL one around?
,Ratio_Yup,2012-01-19T13:40Z,"Misleading SPAM! Fake!

The zip file contains a malware application that attempts to install software and claims that the file you wanted can be unlocked via ... 

whatever. It's garbage. Don't waste your time."
,cgfull,2012-06-28T08:25Z,please some one give me the link for full eat 3d collection...i desperately need it....
