User Type,Username,Date,Text
[V],neon,2010-06-08T13:37Z,watched this...good film...great copy thanks :)
,ghostreaper25,2011-01-21T08:08Z,please people seed this. pretty please
,ghostreaper25,2011-02-02T07:07Z,please seed please please
,ghostreaper25,2011-02-03T15:51Z,seed pleeeeeeeeeeeeeeeeeeeeeeeeeeeeeessssssssssssssssssssssssssssssssssssssseeeeeeeeeeeeeeeeeeeeeeee
,bryentheartist,2011-10-20T17:18Z,thnx
,david420,2011-12-13T21:35Z,not to be a troll but this is Just the Orignak Fright Night remade Scene for Scene with Werewolfs and With a chick replacing charlie Brewster and a Big Game hunter replacing the Vampire hunter
