User Type,Username,Date,Text
,disciple6,2010-05-03T02:30Z,"isnt ""wish right now"" actually airplanes part 2? an b.o.b..? ah well em is on it lol good enough thanks for the up"
,rocheroy,2010-05-08T03:30Z,thank you...
,pystdante,2010-05-08T04:22Z,"Dope, good lookin son"
,Fab04,2010-05-08T07:04Z,Thanks for this man.
,hotrod001,2010-05-09T01:50Z,how do i play this file anyone?
,Dexter101,2010-05-13T02:53Z,does this have random DJs screaming in the songs too????
,Lindane,2010-05-20T08:37Z,"Why is there 0 info about this collection?
not just here, anywhere, apparently it doesn't exist, hopefully this isn't a disappointing d/l"
,Lindane,2010-05-20T08:51Z,"this is a shit mixtape with a fake name by a shitty faggot with lame beats + the 3 new eminem songs added to make it look like a new CD, not worth the bandwidth, it is really awful."
,XoLWoX,2010-06-09T15:08Z,got it from datpiff.com all the info there
