User Type,Username,Date,Text
,vaibhav6,2010-06-28T12:05Z,thx
,laptopdog,2010-06-28T12:14Z,"This is cool, Blueman - thank you!"
,hakuna_matata,2010-09-13T16:58Z,"Thanks as always dear Blueman. I am seeding some of the work as well.

@All New Guys
Please keep the torrents on, do not remove them after you are finished with download. Keep Ratio above 1:1. And dont worry your ISP donot charge you for the uploads. So help Others. sharing is Caring. God Bless "
,zeppelyn,2011-09-28T19:49Z,this episode downloaded in less than 30 min. WOW TY Blueman. PLEASE SEED episode 1 and 2 of season 3 much appreciated :)
