User Type,Username,Date,Text
,simpledood,2010-03-20T00:25Z,"I love this movie, thank you!"
,Mamba4ever,2010-03-20T19:13Z,Any chance of Notting Hill mate and/or Cliffhanger?
,SERZT42,2010-03-24T14:59Z,http://www.imdb.com/title/tt0093894/
,simonjpa,2010-05-17T03:55Z,"Great speed downloading at 302 kb/s.

22 Seeders out of 57.

12 peers out of 129."
,uppers_and_downers,2011-05-06T21:02Z,i could almost feel the g-force when they fly down those shoots into the game zone haha!! quality up bricktophd thanx
,micnor14,2012-06-11T03:44Z,"I'm seeding as much as I can, but I've only got 40% of it! GOD DAMN ALL YOU LEECHES! "
