User Type,Username,Date,Text
,johnfokker,2009-12-02T00:58Z,"Hoe brand ik dit?
Mijn nero zegt dat hij te groot is voor een dvd."
,Nagtie,2009-12-02T16:01Z,"Hallo 
Ik heb de vorige gedownload. Daar zit alles gewoon in. Moet ik nu weer deze gaan downloaden> 
Volgens mij heeft Pliek de verkeerde weggehaald want degene met alleen een leesmij bestand die staat er nog.

Nu hij er op staat heb ik een image bestand inclussief nog wat andere dingen. Moet ik alleen de image branden of ook de andere dingen?
"
,happylinks,2009-12-03T16:08Z,"Even ter verduidelijking:
De gelijknamige torrent was alleen het leesmij bestand (foutje bedankt) en is nu verwijderd.
En deze torrent was enkele dagen verwijderd (geen idee waarom) dus daarom deze herupload.
DIT IS DE ECHTE TORRENT.
Dat wil zeggen dat als je Pliek Windows 7 van mijn acount al hebt gedownload het gewoon dezelfde is.

Over de inhoud:
Pliek heeft gewoon een basis-iso gemaakt, waarschijnlijk zal je deze alleen nodig hebben.
Ook staan er enkele Covers bij, wat extra Dreamscenes en een Driver Checker.. dit zijn allemaal extra dingen."
,Richfeen1,2009-12-08T20:42Z,He bedankt
,erikrdam,2009-12-09T07:13Z,"HELP; werkt op mn hp en asus laptop perfect dank hiervoor!!!!
Maar mn andere laptop vraagt om activatie na de instal. 
lukt niet,ook niet niet met activators / loaders etc.

Wat moet ik doen??
"
,erikrdam,2009-12-09T14:16Z,Dankjewel Jesse voor je reactie ik heb de dvd gebrand met de laagste brand instelling maar nog steeds werkt het niet helaas. 
,Rineke,2009-12-12T21:21Z,"Waarom overstappen van Vista naar windows 7?
Wie kan mij het grote voordeel van windows 7 uitleggen? Windows 7 mist na mijn idee een heel belangrijk element en dat is de mail applicatie!
Ben al wel aan het downloaden maar begin nu toch te twijfelen..."
,Rineke,2009-12-12T22:01Z,Duh! Ik zie net dat deze versie wel incl windows mail is :)
,FurkNite,2009-12-18T00:06Z,"dag heren,

ik zal het even kort houden. ik heb dit account gemaakt om even hier te kunne reageren.

ik heb deze torrent vandaag op me pc geinstaleerd [32 Bit] met succes en al maar hij wilt alleen niet activeren, wat doe ik verkeerd?

het is echt een tof pakket en props voor pliek voor dit pakket maar zo jammer als hij niet wilt werken. kan iemand me misschien hierbij helpen?"
,FurkNite,2009-12-18T00:12Z,oja en handmatig activeren lukt niet als jullie daar nog wat aan hebben.
,FurkNite,2009-12-18T14:45Z,"hey jessedebruine bedankt voor je snelle reactie, ik kon op de dvd de crack niet vinden dus heb je link gwn gevolgd bedankt man het is gelukt

groeten uit amsterdam!"
,gerdje,2009-12-29T23:25Z,"Geregistreerd om ""dank je wel, Pliek!"" te zeggen. :-)
Heb één bijkomende vraag. Mag ik die hier stellen of doe ik dat beter via e-mail of zo? Indien ja, kan iemand me dan een mail-adres geven aub?
Thx en grtz :-)"
,gerdje,2009-12-30T09:39Z,"Dank je, jessfe. :-)
Ik heb w7 geïnstalleerd 'bovenop' vista, omdat ik niet goed durfde te formatteren. Het resultaat is natuurlijk niet je dàt hé... Ik wil het nu graag opnieuw doen, mèt formatteren. Heb back ups van alles op externe schijf, alsook links naar sites voor drivers. 
Kan ik het overdoen en deze keer een 'maagdelijke' start nemen?
Alvast dank en groetjes,
Gerd"
,gerdje,2009-12-30T09:40Z,"oeps.. sorry voor de typfout in je naam, jesse... :-s"
,gerdje,2009-12-30T11:06Z,"Heel veel dank, jesse! Nu kan ik met een gerust hart herbeginnen. 
Tot later! :-)"
,nobodybutme,2009-12-30T13:35Z,"Versie trekt op niets!! aero shake, peek en snap werken niet, enkele games zoals tinker, hold'em werken niet. heb oplossingen gezocht op i-net maar geen enkele helpt. heb zelfs in het register zitten graven maar geen uitsluitsel! Werk aan de winkel bij de makers, please geen versies vol bugs uploaden!!! "
,dewalt246,2009-12-30T15:55Z,"Geweldig deze Windows 7 pliek doet het helemaal op mijn Amilo 2528, zelfs de FN toetsen en de afstandbediening werken weer (en daar liet windows XP het afweten)

Toppie ga o door"
,gerdje,2009-12-30T17:30Z,"Hallo jesse, ik ben helemaal terug! :-)
Alles werkt perfect! Taakbalk is aangepast (die was wèl buiten proporties hihi :-p), de partities zijn aangemaakt en overzetten van back ups kan beginnen.
Dan terug wat software installeren en we zijn weer vertrokken. :-)
In tegenstelling tot nobodybutme heb ik geen enkele bug ontdekt (gisteren niet en vandaag niet), maar ik heb dan ook enkel de ISO van het OS gebrand en geïnstalleerd. Niks dreams of games of zo... :-)
En, niet onbelangrijk, ik heb me goed  voorbereid alvorens 'de grote stap' te zetten.
Om maar te zeggen dat je éérst moet nadenken en niet zomaar lukraak moet gaan downloaden en installeren zonder de mogelijkheden en comptabiliteit van je pc te checken. :-)

Toch één opmerkingske (en die heeft ALLES met W7 zèlf te maken!!) : die voorbeeldvenstertjes boven de taakbalk storen soms. Als je bvb iets onderaan een pagina wil aanklikken, dan komt dat venstertje tevoorschijn en dat zou ik liever weg willen.
Maar als het niet kan dan wil ik daar wel mee leren leven. :-)
Ik ben alvast een héél contente madam! :-D

Dank aan jou jesse voor je snelle en hulpvaardige reply's, en natuuuuurlijk heel veel dank aan PLIEK!
Ik wens jullie heel fijne eindejaarsdagen, en een super aangenaam 2010! :-)"
,gerdje,2009-12-30T20:21Z,"alles gaat tot hiertoe prima, jesse. :-)
thx :-)"
,anbu-kakashi,2009-12-31T06:51Z,"Ik heb de pliek versie al 1 maand? Ik krijg nu een melding van :Dit Exemplaar Van Windows Is Niet Legitiem: Ik heb dat vandaag namelijk gekregen weet iemand misschien hoe ik dat weg kan doen net als de xp versie met een patch ofzo?

Thanks In Advance."
,anbu-kakashi,2009-12-31T19:48Z,"Thanks jessedebruine,

Hij doet het weer helemaal goed ik heb 1ste gedaan. (The Old 1 But It Works) Die."
,nocurbahead,2010-01-02T11:47Z,"Allereerst hartelijk dank voor de upload en een gelukkig 2010 allemaal hier!
Kan iemand iets toelichten wat ""Pliek"" nou eigenlijk inhoud? Is er verschil tussen Pliek windows 7 en windows 7 origineel?
Ik ben niet écht thuis in de Pliekwereld, vandaar deze vraag. Ben inmiddels met downloaden begonnen, en hoop dat mijn computer na installatie stabiel gaat lopen. Ik heb nu Vista Home Premium, en dat is 3 keer niks. De ene vastloper na de andere."
,nocurbahead,2010-01-02T15:10Z,"Hallo Jesse, fijn zo'n snelle reactie! Dank je wel!
Ik ben nog bezig met de download, maar ik verwacht dat het vanmiddag binnen is. Daarna zal ik installeren, en als het gelukt is dit uiteraard laten weten.Ben uiterst benieuwd!"
,nocurbahead,2010-01-02T20:53Z,"Heb een image gebrand van het gedownloade bestand, maar de schijf eenmaal gebrand doet niets.Er komen alleen 10 icoontjes met bestanden, maar in geen van deze zit een opstart mogelijheid. Automatisch afspelen helpt ook niks.
Wat heb ik verkeerd gedaan?"
,nocurbahead,2010-01-03T00:34Z,"Uiteindelijk is de installatie schijnbaar probleemloos verlopen, maar nu zit ik toch even raar te kijken, want ik moet enorm veel instellingen naar mijn hand gaan zetten.
Zo is internet explorer 8 een stap terug in vergelijking met internet explorer 7 met IE PRO.
En ook al die irritante blokken onderaan de taakbalk storen me mateloos.
Op zich is de installatie dus naar het schijnt goed verlopen, maar of ik nu blij ben met windows 7 is een vraag die nog even open blijft."
,nocurbahead,2010-01-03T11:35Z,"Hallo Jessebebruine, Ik heb even gekeken, maar misschien doe ik iets fout. Ik ga naar systeem,en helemaal onderaan staat dat Windows is geactiveerd. Tot zover alles in orde. Het ziet er allemaal goed uit.Maar ik wou het liefst Internet Explorer 7 terugzetten, maar deze is niet compatibel met W7, helaas. Ik vindt Internet Explorer 8 een enorme stap terug, het is een complete stap terug. Ik wordt helemaal horendol van deze vervelende balken onderaan de taakbalk die steeds voor je beeld opduiken.
Is er iemand die weet of dit te verwijderen is, en dan vooral: HOE ?

Verder kan ik een ieder die Windows 7 wil hebben, dieze download van harte aanbevelen."
,dasharky,2010-01-06T15:46Z,"Beste allen,
Misschiene een rare vraag maar kan iemand mij vertellen hoe dit op een cd te branden? Moet ik de grote file eerst unzippen? Wat moet ik precies unzippen? En hoe zit het met de kraak code waar men over praat? Zou iemand mij a.u.b. kunnen vertellen wat men moet doen na het downloaden van de torrent? Sorry voor de overlast en zoveel vragen. Ik ben echt een leek hierin :s Bijvoorbaad dank!"
,wurmpj,2010-01-12T23:55Z,"hey , heb al alles geprobeerd om deze op cd te krijgen , maar lukt niet , zie hier overal goede comentaar , dus zal iets verkeerd doen zeker ? 
ik doe het via power iso....

moet ik alle bestanden op de dvd schrijven ? of moet ik iets uitpakken ofzo ? "
,2mat1,2010-01-13T21:36Z,"sorry ben een leek
wat is het verschil tussen met en zonder drivers"
,antrassansas,2010-01-14T20:26Z,"Hoi alles werkt goed alleen ik krijg hem met geen mogelijkheid in slaapstand als ik de klep sluit van mijn laptop.
ook is hij niet zichtbaar (slaapstand bedoel ik)"
,antrassansas,2010-01-15T21:59Z,"Heb het voor elkaar niet op de normale manier
maar via de website lukt het nu wel.
bedankt voor de info

http://www.vandersluijs.nl/2009/11/13/sluimerstand-hibernate-aanzetten-in-windows-7/"
,download4Fun69,2010-01-28T17:18Z,"Sorry hoor maar probeer via deze Download Tis Torrent te downloaden maar kom niet verder dan een klein bestandje in DAP waar ik verder niet mee verder kom.
Iemand tip ?"
,nirgoen,2010-01-31T18:03Z,"Bedankt Happylinks. 
En goed werk ""jessedebruine"" dat je mensen met je duidelijke info helpt. 
Ik ga dit voor voor een vriend installeren maar ik denk dat het wel gaat werken. Ik heb zelf een gewone versie die ik na installatie zelf heb geactiveerd. Voor het eerst kom ik een unattended win 7 version tegen.

Met vriendelijke groeten uit Suriname."
,Vagger,2010-02-08T20:31Z,Draai deze versie nu een drietal weken. Alles werkt perfekt. Thx voor de upload en het prachtige werk.
,Danza24,2010-02-08T22:58Z,"Heej,
 Vraagje,.. Eindelijk heb ik de installatie aan de praat gekregen.  Ik heb hem op een nieuwe sata hdd geinstaleerd. Hij doorloopt de setup netjes, maar als ik hem na de instalatie herstart, Dan komt mijn computer niet verder dan een zwart scherm, en linksboven een - dat knippert!  HELP!!!!"
,Hjtel,2010-02-09T16:11Z,"Jesse, fantastisch zoals jij hulp biedt! Ik heb hetzelfde probleem als Danze24. Heb al tig keer om naast mijn Vista Home Premium op een aparte schijf W 7 te installeren. Maar zodra de installatie is afgerond krijg ik een zwart scherm, en linksboven een - dat knippert. Toch is mijn Acer 7720 laptop nog geen jaar oud en van een goede videokaart voorzien NVIDIA Geforce 8400 M GS. Wil je nog eens een aanwijzing geven? Bedankt bij voorbaat."
,antrassansas,2010-02-10T15:16Z,"Ik heb steeds na het opstarten een probleem met de systeem pictogram van volume en  onderhoud centrum.
De pictogrammen zijn dan niet meer te zien.
Ook kan ik ze niet meer aanzetten op de normale manier. Ik moet dan in het register duiken.
heeft iemand dit ook en de oplossing."
,CDJanet,2010-02-12T19:22Z,"Bij mijn systeem staat dat het activeren over 3 dagen zal worden uitgevoerd, nu nog maar 2 dagen.
Ik kan ook direct handmatig activeren, maar dan is de code fout????

Iemand ?"
,Samber11,2010-02-12T22:00Z,"Hartelijk dank voor deze prima installatie. Het starten van deze versie duurt wel iets langer dan de RC, maar daar staat veel tegenover. Ik heb echter 1 klein probleempje. Ik krijg bij het inlogscherm steeds eerst de melding "" Gebruikersnaam of het wachtwoord is ongeldig"" nog voordat ik iets kan invoeren""Wat ik ook geprobeerd heb, ik krijg het niet weg.

Samber11"
,Samber11,2010-02-13T11:31Z,"Hallo Jesse, die enter had ik al ontdekt, daar valt wel mee te leven. Het grappige is dat ik het 1 keer niet heb gehad. Verder is het starten perfect nu (ik had vergeten mijn hub met externe harde schijven van mijn laptop af te koppelen). Verder echt mijn complimenten voor het mooie complete werk en de snelle reactie. FYI, ik draai de 64 bit-versie op een HP dv9780 met 4GB intern geheugen ipv 3. Perfect. "
,jerrelv,2010-02-19T16:18Z,"Beste mensen,

tot op heden heb ik de XP van Pliek gebruikt. Heel tevreden, maar wilde nu toch graag Windows 7 proberen, alleen loop ik tegen een probleem aan bij het installeren.
Eerst krijg ik een minuut of 5 het zwarte opstartscherm met de gele balk onderin, daarna krijg ik een achtergrond waarin ik de muis kan bewegen, maar verder komt er niets in beeld. Waar kan dit aan liggen?"
,jerrelv,2010-03-02T15:06Z,"Ik zal m wel te snel gebrand hebben dan, ging geloof ik met 18 keer. Denk dat mijn Geforce 8800GTS wel ondersteund wordt. ;) Dan brand ik m wat trager. Bedankt voor de tip!"
,BennietM,2010-03-08T17:32Z,"Hoi Jesse, hoe kan het dat win 7 naar een driver voor de cd/dvd vraagt.
Krijg het niet voor elkaar om hem te instaleren."
,nschreud,2010-03-11T16:13Z,Ik heb 'm op 3x gebrand en nóg loopt ie 'm straal voorbij tijdens het booten. Boot sequence staat goed. Wat doe ik fout?
,BennietM,2010-03-11T19:17Z,"Klopt Jesse de dvd wordt niet herkent, het begin start hij op tot dat hij moet gaan instaleren, dus na dat je de taal tijd en toetsenbord hebt in gegeven.
Dan vraagt hij naar een driver voor de cd/dvd loopwerk.
Heb elke map geopend en geprobeerd of daar een driver in zit niet dus.
Het gekke is hij ziet mijn cd player wel, maar de samsung uit eind 2009 niet."
,BennietM,2010-03-11T19:20Z,"Maar ik kan ook nergens een driver voor de samsung vinden, wel een firmware update, heb ik dus ook al gedaan maar noppes niks nadda.
Hij wordt niet herkent door windows 7."
,BennietM,2010-03-11T20:21Z,"Sorry mijn fout, hij ziet de cd player ook niet.
Heb het net nog geprobeerd."
,nschreud,2010-03-12T12:05Z,"@jesse
Mijn HP laptop is een jaar oud."
,BennietM,2010-03-12T16:26Z,"Jesse heb hem bij mijn zoon geprobeerd maar zonder suc6.
Waar kan dat aan liggen, zou denken dat het aan de pc's ligt omdat er toch een aantal zijn die hem wel hebben geinstalleerd."
,BennietM,2010-03-12T16:28Z,"Heb een engelse versie, en die laat zich zonder morren instaleren."
,BennietM,2010-03-13T17:07Z,"Jesse, daar zul je wel gelijk in hebben, maar we geven niet op.
Wil toch de versie van pliek hebben."
,BennietM,2010-03-16T17:26Z,"Hoi jesse, heb het probleem opgelost.
Na een aantal Dvd players en branders te hebben geprobeerd, is het met een oude dvd speler wel gelukt.
Dus win7 kent de nieuwe branders niet allemaal.

Grt."
,reef2009,2010-04-18T18:26Z,is there olso a verson 1.2?
,gLITZ1987,2010-04-30T10:37Z,"Kan ik tijdens installatie wel zelf een partitie kiezen waar ik windows wil installeren?
Ik wil namelijk een dualboot waarbij ik op m'n C partitie m'n OS wil behouden en windows 7 op een andere partitie wil installeren."
,gLITZ1987,2010-05-01T12:18Z,"Okee merci bien!
Ik ga er nu mee aan de slag."
,lampie69,2010-05-13T16:19Z,dank je wel....werkt als een trein...al meerdere pc's geinstalleerd zonder problemen....
,foxiedriver1,2010-06-19T00:30Z,"Ik heb deze torrent in 3u gedownload, heb hem op 2 computers geïnstalleerd, een Pentium IV Intel 2,6GHz en een Intel Core2 Quad  2,5GHz, en zowel de 32 als de 64bit versie, en die werken nu al twee weken zonder enkel probleem! Alle Windows downloads zijn ook geïnstalleerd. Alleen de Windows mail wil niet in gang schieten en heb daarom de Windows Live Mail gedownload en het hele systeem werkt perfect. Ook nog even de Office 2007 Pro via Pirate Bay verkregen en die staat er nu ook op. Ik hoop dat het zo blijft en hartelijk bedankt Pliek en happylinks!!!  :-)"
,tangovic,2010-06-22T02:16Z,thanxxxxxx man
,peaceupp,2010-08-04T22:12Z,"POWER INN THE HOUSE , kijk hier heeft een mens wat aan , bedankt voor jullie werk , werkt als een tierelier !! heeeel tof !!!!!!!!!!!!!!!!! "
,boboste,2010-08-08T10:53Z,"Hi,

Werkte prima maar krijg nu melding niet legitiem.
Wat kan dat zijn en hoe dit op te lossen?

Groetjes Bob"
,sammyboy19,2010-10-12T14:32Z,"Hey,

Werkte bij vanaf juli goed tot ik daarnet een melding kreeg dat hij niet legitiem is.
Wat kan dat ineens zijn en hoe los ik het op?
"
,furbieno,2010-10-19T18:32Z,"Ik heb hem nu al twee keer gebrand met imgburn (max snelheid wat k altijd doe en goed ging) alleen op een gegeven moment heeft die het over 'failed to read sector'. Ik kon kiezen tussen opnieuw of doorgaan. Dus eerst een paar keer opnieuw gedaan, maar dat kwam niet vooruit, dus koos ik voor doorgaan wat ik ook deed bij de volgende errors waardoor hij nu automatisch 'doorgaan' doet en het staat dus nu al op bijna 500 errors en 49% die niet echt vooruit lijkt te gaan. 
Heeft iemand een oplossing of een idee waar de fout ligt?"
,feyyaz-fatillio,2010-10-30T02:51Z,"ff een domme vraagje, Kan ik ook updaten?"
,kafre,2010-11-08T08:22Z,Kan ik de updates die hij aan geeft gewoon updaten zonder een melding te krijgen dat hij legitiem is?
,kafre,2010-11-08T08:28Z,"tnx voor deze download , ik heb  1 vraagje kan ik gewoon de updates uitvoeren? en krijg ik dan geen melding dat deze legitiem is na een update?en wat moet ik doen als ik zo een melding krijg?"
,thabrasmen,2010-11-24T12:30Z,"Hey,

ik zat ff wat opmerkingen te lezen en paar van jullie hadden het over dat ie niet werkt bij activatie, of dat ie aangaf Windows is niet legitiem.

Ik had een keer gelezen dat je dan juist een of andere update van Windows Update juist NIET moet installeren,omdat dat updateje dan ziet of ie legitiem of niet is en dat wordt dan doorgezonden naar miicrosoft.

alleen: ik weet niet meer wat de naam van die update was en/of welke code hij had, maar dat ga ik uitzoeken en dan laat ik het hier wel weten.

Alvast succes.

Thabrasmen"
,nulnegenhonderd,2011-01-07T23:07Z,"God, nou baal ik echt als een stekker. De hele dag bezig geweest deze Torrent op een DVD te branden (3e poging lukte), te installeren (5 keer geprobeerd, bij de 1e poging met de 3e DVD lukte het) blijkt het een versie te zijn met allerlei dingen waar ik niet om heb gevraagd. Kan ik bijvoorbeeld die W7C LogonUI changer van het startmenu af krijgen? Sorry dat ik een beetje chagrijnig over kom, waardeer het zeer dat er een Nederlandse versie van Win7 te vinden was, maar heb de hele dag niks kunnen doen voor mijn werk omdat die computer niet werkte, en nu lijkt het er ook nog op dat ik opnieuw kan..."
,resul4e,2011-03-13T00:42Z,"@sammyboy19 & boboste,

Ik zat ff de comments door te lezen toen ik deze 2 zag,ik had een soort gelijk probleem:
op een dag... :P ik zat gewoon te computeren, wil ik kladblok starten krijg ik opeens te zien dat het geen legetieme versie is van windows (deh) ik dus ""shit"" wat heb ik verkeerd gedaan, maar ik drukte tog op maar op verder (ofzo) en toen bracht hij mij naar de windows site, daar ging ie na of ik een legetieme versie had en toen hij klaar was zei hij dat mijn versie legetiem was.
heb er daarna niets meer van gehoord

nou veel suc6 met die van jullie maar ik wou alleen maar laten zien hoe ik het heb gedaan"
,babyfabiola,2011-09-26T00:22Z,"Misschien legt het aan mijn pc maar, maar na een schone en ongewijzigde instalatie krijg ik het volgende.

""automatische activering wordt over drie dagen gestart. Klik hier als u windows 7 nu wilt activeren.""

Via de validator van de website van microsoft zegt hij dat ik een geldige versie heb.
Dus zou de bovenstaande regel niet van toepassing mogen zijn.
mijn vraag is dan ook wat gebeurd er werkelijk na die drie dagen?

Gaat het beeld op zwart, wat gaat er gebeuren"
,babyfabiola,2011-09-26T23:44Z,"Het zal misschien bij mij liggen maar het systeem blijft zeuren over activatie

automatische activatie in 3 dagen, klik hier, etc

Valt na die drie dagen het scherm op zwart?
Wie kan mij dat vertellen voordat ik verder mijn pc instaleer"
,harut,2012-04-04T05:44Z,dank je
