User Type,Username,Date,Text
,fatnero,2009-12-21T02:22Z,wheres the movie??? only BBW porn lol
,nohump,2010-05-08T17:16Z,"I is NOT BBW porn. It is valid movie.
I just watched it today..."
,Webberjo,2010-10-31T05:49Z,One of my favourite movies ever. To the Stars is the saddest instrumental I have ever heard.
,Sanctam,2010-11-30T16:44Z,"Being watched by BayTSP, got a warning letter. Don't download this one..."
,serenity3212,2011-02-23T00:24Z,There's nothing wrong with this torrent it's just the movie and it has the most seeders. I'd like real info posted in the comments thank you!
,MangyHobo,2011-03-22T06:56Z,What the hell is this! I asked for dragon heart not BBW porn! o wait thats a dragon.. my bad it is the movie.. 
,djvapid,2011-09-04T03:04Z,"Movie is being tracked, don't download without proxy/ipblocker."
,Tarburz,2011-10-23T21:49Z,Because Universal S. cares about a movie with fucking 29 seeds on it....
,Akkaraju,2012-01-06T02:49Z,"Flagged. Internet broke the law and terminated my internet without warning. Now filing lawsuit. FTW.

This torrent needs to be deleted."
,blombardo,2012-02-15T06:18Z,Thx for the movie. STOP using internet service providers who HELP those people track you down...  Use a GOOD isp that will NOT monitor your traffic...
,lildon,2012-03-26T02:23Z,"Great Quality. Nice Upload.

Thanks Blitz."
