User Type,Username,Date,Text
,MegatonSE,2010-05-19T02:33Z,Fake. This torrent is mostly animal porn. 
,magahi,2010-05-19T03:43Z,Thanks for the heads up
,slicedt,2010-05-19T05:51Z,"lol, 502 MB for all apps....
If this was true I'd loose all faith in the android."
,CountC00l,2010-05-19T22:53Z,"Asks 4 a password...
Anyone??"
,Dragon5005,2010-05-19T23:18Z,"Not fake, not porn.

Pass: apps2010"
,piratebay6969,2010-05-20T00:03Z,Dont download haves you load apps from bad web pages that track you dont do it danger
,nofear24,2010-05-21T15:18Z,So whats the verdict people?? is this worth it or does it compromise your security and privacy??
,nofear24,2010-05-21T21:12Z,"Not all paid apps, some quiet outdated. looks ok gonna try some now. settlers works :) installed overclock 4 G1 and text to speech not working. but dont see anything else wrong can someone plz post some new Android apps and maybe some content for xperia X10"
,crazysoccerman14,2010-05-22T10:03Z,"What are the dates of these?

I'm looking for a new version of the full GameBoid"
,ster444,2010-06-03T23:40Z,"The Pass: apps2010 don't work for my :S
Anyone else have the pass ?"
,Hmacrew,2010-06-14T20:50Z,LMFAO @ ALL OF THEM!!  Not even close most of these are now FREE...
,moyaboss,2010-07-13T07:26Z,This torrent works 100% great on my phone and no its not animal porn
,dpell79,2010-07-22T15:18Z,So is mAaTa5 the password cause the link in yexy file brings you to a foreign twitter page...lol
,carlos_manuel,2011-03-21T21:56Z,"@adam9807
 Thank You!... =) "
,jpdeveau0,2011-06-08T02:22Z,just install an antivirus / antimalware app on your phone its easy to make sure you dont have tracking apps. Also ya it cant possibly be all Apps or even any notable fraction of them at 600mb. I'm not going to bother with this torrent.
