User Type,Username,Date,Text
,Frenkster,2010-03-30T14:03Z,thousand times thanks for the upload.
,_garby_,2010-03-31T12:56Z,"No offence, but what is the point of adding a 25Mib sample inside the archives? It doesent make sense to download the whole stuff to see the sample..

But thanks for your sharing anyway :)"
,_garby_,2010-03-31T12:58Z,"Sorry, my bad. The sample is outside the archives."
,2jz-415,2010-05-05T11:40Z,"Many Many Thanx! 
do you perhaps have any .pdf ebooks on Raymond Blanc? struggln 2find really really good cook books"
