Filename,Size,Unit
Bliss/01 Dido (Armin van Buuren Remix) [In.mp3,6.97,M
Bliss/02 Precious.mp3,14.54,M
Bliss/03 Unknown Name.mp3,6.55,M
Bliss/04 Unknown Name.mp3,9.41,M
Bliss/05 The Anthem 2003 (Orange Remix).mp3,8.52,M
Bliss/06 Second Sight.mp3,12.99,M
Bliss/07 Naked Angel.mp3,12.41,M
Bliss/08 Sincere (Original Mix).mp3,14.49,M
Bliss/09 Vagabond (Original Mix).mp3,10.38,M
Bliss/10 Sushi Lover(Original Mix).mp3,10.77,M
Bliss/11 Timeless.mp3,12.48,M
Bliss/12 Synergy (Original '99 Mix).mp3,16.88,M
Bliss/13 Metropolis.mp3,8.92,M
Bliss/14 Nocturnal Creatures.mp3,11.73,M
Bliss/15 Prototype 1 (Synthetica).mp3,15.16,M
Bliss/16 Destiny Destiny (Ace's Delight Mi.mp3,13.96,M
Dark Trance/01 Prison Break Theme (Ferry Corsten.mp3,13.82,M
Dark Trance/02 Another Tomorrow (Adam's Inside O.mp3,12.38,M
Dark Trance/03 Sliding Doors.mp3,10.62,M
Dark Trance/04 The Future (Original Mix).mp3,8.36,M
Dark Trance/05 Stardust.mp3,10.83,M
Dark Trance/06 Disko Teka.mp3,10.04,M
Dark Trance/07 Above The Clouds (Mark Norman Mix.mp3,11.89,M
Dark Trance/08 Unknown.mp3,12.03,M
Dark Trance/09 Super Imposed (Mark Sherry's Outb.mp3,11.06,M
Dark Trance/10 Ich Will Raus (Alphazone Vs. Ralp.mp3,13.57,M
Dark Trance/11 Contact (Original Mix).mp3,8.33,M
Dark Trance/12 Teleportation.mp3,11.21,M
Dark Trance/13 Your Love (B.v.R Mix).mp3,12.04,M
Dark Trance/14 Desolate 1.mp3,8.92,M
Dark Trance/15 Cocaine (Scot Project Remix).mp3,17.62,M
Soundfixation Pack/1-01 You Are Sleeping (Acapella).mp3,2.56,M
Soundfixation Pack/1-02 Clubliner One.mp3,4.83,M
Soundfixation Pack/1-03 Lecker Madche.mp3,6.55,M
Soundfixation Pack/1-04 Psycho Confusion.mp3,6.71,M
Soundfixation Pack/1-05 Wanna Go Insane.mp3,5.14,M
Soundfixation Pack/1-06 Brainshooter.mp3,4.46,M
Soundfixation Pack/1-07 Get Down.mp3,8.01,M
Soundfixation Pack/1-08 Hardventure.mp3,6.48,M
Soundfixation Pack/1-09 Bassline Kicking.mp3,4.6,M
Soundfixation Pack/1-10 Follow Me.mp3,6.69,M
Soundfixation Pack/1-11 Louder Softer (Hennes & Cold Re.mp3,7.89,M
Soundfixation Pack/1-12 Hard Drive.mp3,3.83,M
Soundfixation Pack/1-13 Go Burn A Fatty Ass.mp3,6.19,M
Soundfixation Pack/1-14 Bubble In Your Head.mp3,5.6,M
Soundfixation Pack/1-15 Unknown.mp3,4.58,M
Soundfixation Pack/2-01 Haze.mp3,9.39,M
Soundfixation Pack/2-02 2 Dance 2.mp3,4.73,M
Soundfixation Pack/2-03 Tekno.mp3,4.07,M
Soundfixation Pack/2-04 D-Tech.mp3,3.88,M
Soundfixation Pack/2-05 Cingram.mp3,6.11,M
Soundfixation Pack/2-06 The Soul Of Cel.mp3,7.82,M
Soundfixation Pack/2-07 Jazeker!.mp3,8.01,M
Soundfixation Pack/2-08 The Poem.mp3,4.42,M
Soundfixation Pack/2-09 Acid + Bass.mp3,5.39,M
Soundfixation Pack/2-10 Give Me Your Rhytham.mp3,7.2,M
Soundfixation Pack/2-11 Wicked Generation.mp3,6.4,M
Soundfixation Pack/2-12 Static.mp3,4.51,M
Soundfixation Pack/2-13 Afraid.mp3,5.85,M
Soundfixation Pack/2-14 Once Again.mp3,7.06,M
Soundfixation Pack/2-15 Dominatin' Again.mp3,7.34,M
Soundfixation Pack/3-01 Hard Creation.mp3,5.61,M
Soundfixation Pack/3-02 The Way It Should Be.mp3,6.91,M
Soundfixation Pack/3-03 Pushin' (Hennes & Cold Remix).mp3,6.47,M
Soundfixation Pack/3-04 Spaceman (The Gladheadz Remix).mp3,5.86,M
Soundfixation Pack/3-05 The Soul Of Cell.mp3,7.55,M
Soundfixation Pack/3-06 Scream Or Die (Scream Mix).mp3,7.09,M
Soundfixation Pack/3-07 Jazeker!.mp3,7.72,M
Soundfixation Pack/3-08 Give Me Your Rhytham.mp3,7.3,M
"Soundfixation Pack/3-09 Bigger, Harder, Louder.mp3",7.39,M
Soundfixation Pack/3-10 Trance + Acid (Derb Remix).mp3,6.3,M
Soundfixation Pack/3-11 Infectious.mp3,5.8,M
Soundfixation Pack/3-12 Devestation Of Thought.mp3,6.97,M
Soundfixation Pack/4-01 Another Day (Hard Trance Remix).mp3,3.84,M
Soundfixation Pack/4-02 Invisible Limits.mp3,6.21,M
Soundfixation Pack/4-03 Drop Shot.mp3,6.86,M
Soundfixation Pack/4-04 Deadlock.mp3,5.94,M
Soundfixation Pack/4-05 Above the Clouds (Original Mix).mp3,6.33,M
Soundfixation Pack/4-06 Ready To F....mp3,4.29,M
Soundfixation Pack/4-07 Outer Limits (Warmduscher Remix.mp3,6.78,M
Soundfixation Pack/4-08 Eat Dis.mp3,4.28,M
Soundfixation Pack/4-09 God.mp3,5.89,M
Soundfixation Pack/4-10 E-Town.mp3,6.69,M
Soundfixation Pack/4-11 Eye of the Strom.mp3,7.66,M
Soundfixation Pack/4-12 Turn Me On.mp3,6.18,M
Soundfixation Pack/4-13 Missing You.mp3,7.37,M
Soundfixation Pack/4-14 Widowmaker.mp3,6.22,M
Soundfixation Pack/4-15 D.F.C. (DJ Scot Project Mix).mp3,7.61,M
Soundfixation Pack/4-16 Powerstroke.mp3,8.34,M
Soundfixation Pack/4-17 What U Get.mp3,3.12,M
