User Type,Username,Date,Text
,m0vie__dr,2010-07-13T02:25Z,"Thankyou bone .... nThis is much better audio than the last few nBADOOK AKA BADBOY AKA JOHN.RAAAASSH AKA DEATHTROOPER AKA DEATHTROOPER100 an more / fuck off spamming an saying you have a high quality movie , you dont your full of shit you have hit every upload of this movie saying fake an to go to your site just fuck off you little prick this is a torrent site not a place for you to hit your shit site up, i also have a movie site but i dont slag others work an pimp my own shit cause what i use is work like this an upload it for others to watch free stream on my site, now do us all a treat an stay on your site !!!"
,madmann718,2010-07-13T02:25Z,"You\'re a useless piece of shit, badookl89. You can stop shitting in all the valid torrent threads at any time. Like you actually think people will click on your spam? Like they\'re asking \""Who should I trust, BONE or this anonymous dickweed?\"" Still haven\'t figured out what the skulls mean, eh?nnI hope you get leprosy of the peen. nn.BONE. ... thanks."
,deathtrooper30,2010-07-13T02:27Z,@m0vie__drnnI\'m not the spammer u fucking moron!
[V],.BONE.,2010-07-13T03:50Z,most of the spam they put on here u have 2 fill out surveys 4 anyways and this has not been released long so the copys that are on them are from the torrent world anyways so they will have the hissin sound in the audio well untill they rip this release off :)
,wetpanties,2010-07-13T12:00Z,a lot better v8 / a6 thankyou
,aWeeGuyFaeGlasgow24,2010-07-15T01:36Z,"WOW 2.3 MB\\S DOWNLOAD SPEED :)  , WILL COMMENT ON A\\V SOON . Thanks"
,oksypo,2010-07-15T09:16Z,"Thanks to  you mate(s), torrent \'s fine :)"
,LEERV,2010-07-20T21:28Z,"Does anyone know what a spammer is?

What a bunch of fuckwits....."
,sopheee,2010-08-01T05:17Z,thanks heaps.. perfect copy!
