User Type,Username,Date,Text
,syndre,2010-09-21T01:30Z,why do you remove the -DOH from everything ??
,mindinjection,2010-09-26T09:58Z,What about third DVD disc?..........
,dropper1,2010-09-28T07:02Z,"HEY!! Fuck YOU mindin, FUCK you man..no man FUCK THIS GUY nah dog im coo fuck this bitch HEY!? bitches chill out en enjoy free shiz babeez"
,bmxej2,2010-09-30T18:53Z,is black rain the one with dethklock?
[T],kimeesteres,2010-10-24T01:08Z,"The music video DVD can be downloaded from:
http://thepiratebay.org/torrent/5879142"
,Luciphage,2010-11-10T06:23Z,Very nice! Thanx!
