User Type,Username,Date,Text
,Piller Triller,2010-06-30T20:49Z,"Tackar, igen!

Dock står denna och Dexter helt still för mig :("
,MarcusN0,2010-07-01T15:53Z,"aa, jag vet. har strul med datorn till och från (ostabil klockning) men det ska jag försöka fixa.."
,MarcusN0,2010-08-20T18:24Z,"loltja, sitter du fortafande fast? (jag seedar nu)"
,LadyZanna,2010-08-31T19:38Z,Har hållt på denna nedladdning i 4 dagar nu.. Du kan inte tänka dig att släppa din uploadgräns? Bara en stund så jag får ner det? står på 52% nu... Skulle uppskatta det väldigt :)
,MarcusN0,2010-09-13T10:40Z,"LadyZanna: Jag har släppt gränsen nu, seedar i 60 kB/s .. Hoppas du får ner den inom rimlig tid nu!"
,Telepicker101,2010-09-28T18:53Z,"Hej ! asså   ja måste ha de här avsnitten ! så grymma asså !

Sjukt grymt att du lagt upp men de e inga seeders nu ... så ja kan inte få hem de ! :/ 

Går de att ordna ?!?

Tack på förhand !"
,hejjagheterinteerik,2010-09-30T10:31Z,"står still på 93.1%!
finns det någon vänlig själ som kan seeda lite?
snälla, denna torrent är hela min barndom!"
,glank,2010-12-06T08:04Z,"tack som fan, dock saknas en hel del avsnitt.
ingen som vet var man kan hitta återstående avsnitt med svenskt tal?"
,krabbby,2010-12-20T08:28Z,Hur får jag kontakt med dig marcusN0  har lite också avsnitt.     Msn fb? kontakta gärna:) fliessweden@live.se
,DoubleDPlz,2010-12-31T13:57Z,Finns det nåt annat sätt att få tag på denna? eftersom denna står helt still.
,bigge_a,2011-02-06T01:24Z,ahh som jag letat efter dom där dårarna tackar så mycket.....
,MarcusN0,2011-02-28T21:54Z,"krabbby, jag addade dig på msn nyss.

FÖR ÖVRIG TILL ALLA ANDRA:

Resten av alla kurage avsnitten ligger nu uppe.
Kommer även lägga upp alla Johny Bravo avsnitt.
Och alla Cow and Chicken avsnitt."
,Klaymoar,2012-07-10T10:19Z,"Spørsmål til MarcusNO:
Hvordan har du klart å skaffe hele serien med svensk tale? Jeg prøver å skaffe den med norsk.
Tusen takk!"
