User Type,Username,Date,Text
,Balsack,2010-07-10T10:34Z,awesome upload but im getting no download whatsover :\'((  comeon help plzzzz
,dolan2007,2010-08-03T01:02Z,"thanks for the upload. ive been looking for something like this for ages :)
what converter do u use because when i converted the girl with the dragon tattoo before..the subtitles disappeared :("
,fredfan,2010-08-03T03:31Z,"How can I convert this to DVD (9 or 5)?  I also need to keep English subs.  Help, somebody, please!  This is so hard to find in DVD format, along w/ English subs."
,choucroot,2010-08-12T00:42Z,"""Written by Stieg Larsson and director David Fincher""
WTF ? fincher's adaptation does not event exist yet, those movies are by Daniel Alfredson, a swedish director..."
,jahbulosiris,2011-02-23T06:28Z,"""director David Fincher""
I am sorry. wrong info there. It is not he Hollywood version but the original version."
,jahbulosiris,2011-02-24T00:31Z,"This is also active with dual audio.

http://thepiratebay.org/torrent/6132860/The_Millennium_Trilogy_%5BDual_Audio%5D_720p_mkv_-_YIFY"
,MikeyMetal,2012-05-06T16:54Z,Can someone please seed this fucking thing? I've been at 95% for a fucking week man. C'mon!!
