User Type,Username,Date,Text
,gullashdk,2010-10-20T15:05Z,"Tanis og hans venner flakker vildt omkring på Krynn, hvor både onde og gode drager deltager i den verdensomspændende kamp.
Men skridt for skridt fører deres vej dem til det fjerne Neraka.
Her samles ondskabens hær af mennesker og drageyngel

- de venter på at Takhisis vil vise sig i al mørke majestæt."
,grissesvin,2011-02-21T12:07Z,"Er der ik nogen der kan seede de 6 krøniker, jeg har skal nok lade dem ligge oppe når jeg får dem ned!"
