User Type,Username,Date,Text
[T],Valdo_PT,2009-07-27T18:38Z,"Hitler was a repressed loser with gay style, just look at the way he made his own raise hand sign, a very small dog that barked loud...
Politics = any shit can have much power...
I hope that queer burns in hell forever."
[T],insinuendo,2009-08-16T17:01Z,"yey!

people with opinions on tpb.

can you people stick to commenting on the fucking torrent! like we want to here what y'all hold as political ideals. if this is not your cup o' tea, then don't fucking drink it!!!

now, can we just stick to quality comments for sharing's sake. there are other forums where you can voice your political bravado and pomp.

thanks."
