User Type,Username,Date,Text
,Moorrr,2009-12-13T16:32Z,jag fick virus marlow av denna. Men kul spel 채r de!! 
[V],Colombo-bt,2009-12-13T17:41Z,"@Moorrr
speak English, please... ^.^'
there aren't virus, no virus. Change your antivirus.. and if you have any problem again, buy the game! Thanks... :)"
,Valverine,2010-05-24T17:10Z,Hey man cna u upload english version? iv been searching this sly 4ever i have alredy played sly 2 and sly3 manymany times 
,Valverine,2010-09-25T08:37Z,"what happened to seeders just 5min go 7 seed , now 0"
,geosxd,2011-04-18T16:41Z,is this italian version?
,tachaqua,2011-06-29T12:31Z,"works beautifully thank you, definitely seeding this.
could you do dr muto next? "
