User Type,Username,Date,Text
,Baatsii,2009-11-20T00:28Z,Thanx!
[T],suavecito195782,2009-11-20T19:55Z,"OK guys im coming back from a break i took this whole time i was working on movies for my own collection but its time too share so here is the a list of movies i have ready to upload in the same format 1080p 4 gigs i know what you did last summer, i am legend,hellboy2,girl next door,eagle eye,deep impact,21, 10,000 b.c.,feast,felon,ground hog day, halloween, interview with the vampire,journey to the center of the earth,superbad,step brothers extened edition, silence of the lambs, staurday night fever, the soloist, the air i breath, wanted, the day after tommorrow,point break, quantom of solace,rescue dawn,risky business, paycheck, mr brooks, jumper, man on fire, menace 2 society,ferrie bueller,childs play,apocalypto,30 days of night, gattaca so if theres any on here u want to see just vote for ur movie or send me a pm "
,toyamikage88,2010-03-22T17:43Z,Thanks so much for this upload Brick!! u have great taste in movies!! thanks for all the hard work~
,renars132,2010-11-25T22:29Z,"@toyamikeage33

Pixar did the hard work, not brick."
