User Type,Username,Date,Text
,-Murali-,2009-11-18T16:46Z,thanks.....
[T],janisito,2010-10-03T08:55Z,Thank you!
,printer32,2011-02-23T05:03Z,am i the only one getting 2 kb/s on the download speed? at one point it was a LOT faster until about 50% of the way in.
,printer32,2011-02-23T05:41Z,nonetheless it finished thanks for the torrent
,1stnlast,2011-03-01T18:31Z,Thanks for this. I'll be seeding.
,trimer34,2011-11-30T08:59Z,"I do have this book, and is an excellent book BTW. I'll be seeding for those that don't have the money, but help the author and buy one or more of his titles whenever you can..  "
