User Type,Username,Date,Text
,Godslayer187,2010-08-21T22:30Z,Note: To use maps copy map pack folder contents to documents\starcraft 2 folder and then use add maps from folder feature in SC2ALLin1 to add the maps and be able to play on them.
,pagudpudxiii,2010-08-22T04:38Z,"Poor Blizzard, doesn't want kids playing via LAN =,("
,Steve_Ph,2010-08-23T02:58Z,"will this work with the liberty iso starcraft II cause I dont have the reloaded version

lemme know.thanks!"
,Godslayer187,2010-08-23T07:35Z,these maps work 100% on any SC2 version retail or cracked. 
,elwisklp,2010-08-31T01:50Z,can this be played LAN?
,Godslayer187,2010-08-31T17:38Z,"Their is no Lan option as of yet that I know of.

These maps work with any SC2 version."
,BIGNOOBY,2010-08-31T22:08Z,Thanks godslayer187  i've beem looking for this thanks a lot =)
,BIGNOOBY,2010-08-31T22:10Z,Been**
,avatar8,2010-09-04T05:18Z,"For those noob like me..... below are the steps to make this work 

1. Create this folder under C:\User\"
,bham99,2010-09-04T13:27Z,does this work?
,Godslayer187,2010-09-14T22:10Z,"Get map pack 02 here - http://thepiratebay.org/torrent/5830275/Starcraft_2_Map_pack__02

20 more maps - Enjoy!"
,viah,2010-10-24T02:47Z,can u help me? why i cant lunch sc2allin1??application failed why??
,ltdeamon,2011-04-17T07:08Z,turn off ur virus scanners
,sasafurian,2011-07-08T23:35Z,pls someone help me . i want to install all these maps and i cannot find this goddammm sc2allinone shit.i've been searching and i found on this site fileplanet but its not working ! i just wanna install these maps thats all..the crack from razor is amazing not like the reloaded version. i can play skirmish games vs A.I  but i am bored with all the maps from blizzard that are within the game.apparently there is no folder for maps anywhere i think they are inside a big file with another extention wich i cannot access.advice is welcomed 
,FailMaor,2011-09-07T06:58Z,Works great with SC2 RELOADED Thank You Very Much! :D Cheers!
,Godslayer187,2011-09-28T02:38Z,"SC2allinone is in my other torrent for SC2, just go get it there, click my name above to access my uploads, its in the list"
,smokeyN7,2012-01-02T19:51Z,i installed the game and all but when i start my starcraft i can't find the maps tab. i've searched it over and over again but i can't find it. anyone else have this problem or may know a solution it would be a big help.
,JBalboa21,2012-03-12T04:01Z,"I don't have your version of starcraft2, but the one I have now lacks the map packs,it has available skirmish and campaign, bu no maps for skirmish. and no scallinone?any help with JUST getting that?"
