User Type,Username,Date,Text
[V],FXG_team,2010-02-22T22:53Z,"Ok new resolution 1280 x 720 !
Bigger size means its a bigger movie,
Have fun guys !!"
,TommyBlade2018,2010-02-22T22:57Z,Thanks FXG Team
,RIggsta,2010-02-22T23:08Z,Thanks to the real FXG..youve had your share of duppers...
[V],.BONE.,2010-02-22T23:11Z,http://www.imdb.com/title/tt0887912/
,allrockedout,2010-02-22T23:12Z,great job thanks
,PureMental,2010-02-23T00:23Z,"Cheers Fxg Team, i dont comment on every upload you do.. but your work is much appreciated....  Have a beer on me :)"
,subadra,2010-02-23T01:04Z,request-the wild bunch please
,subadra,2010-02-23T01:05Z,i forgat thanks
,moviemasti,2010-02-23T10:31Z,The wild bunch is already uploaded by GOPO. Just search for gopo.
,edward_ezy,2010-02-23T15:10Z,thanks
,GoldRain,2010-02-23T19:11Z,"Great copy V:10 A:10

FXG, Please upload a good copy of New Moon or shutter island if you can, Thanks"
,2vsm,2010-02-23T20:23Z,"Thanks FXG Team... I love your work..

I think in DVDRips you guys are number 1...

One reason I preferred you guys was you kept the size within 700MB... though quality always comes first...

You guys have started uploading BDRips which is great.. The size is OK for such resolutions...

I stumbled upon this torrent:

http://thepiratebay.org/torrent/5305273/The_Informant__2009_BRrip_720p_5.1_h264_avchd_mp4_-RipMinion

And the quality is mind-boggling awesome ... and the size... just 500MB... its TRUe 720p.. The ripper has given the method... I know you guys are great, if you can replicate the same for all your torrents, you guys will rule the torrent world..

Cheers to FXG Team !!!"
,fleetkid,2010-02-24T17:16Z,FXG awesome. this is the way you should be ripping from now. Thanks :) 
,scottielass,2010-02-25T05:18Z,"This is a terrific copy, perfect DVD quality. Many thanks FXG team."
,jaykapadiya,2010-02-25T07:45Z,damn awesome print & movie...
,boulgour,2010-02-25T19:47Z,thank you very much guys
,juned123,2010-02-27T13:22Z,"Yeah.... Thx FXG...mind blowing job as u do always
Please can u upload a film which is based on the US  Jail fighting i dont no exactly the name of the film but the movie was excellent i think its name is ONFIRE maybe i dont remember..i hope u will do it soon "
,JujitsuFreak,2010-03-01T02:11Z,"iraelis_r_sum: eat shit and die troll

Thank you FXG"
,stickybeak,2010-03-01T13:50Z,Thank you very much!!!
,Ta11b0y,2010-03-02T12:08Z,"Thanks FXG team,
Never tried your up's before and would like to say this is quality."
,Sharda89,2010-03-02T17:53Z,"Video is good quality, but there's no sound =( I don't get it.. And I've never heard of MKV file! DivX says I need to download a Directshow decoder but I don't know what that is.. Help me pls??"
,NorSub.com,2010-03-03T10:36Z,Norsk tekst: http://norsub.com/undertekst/The-Hurt-Locker/4436
,juned123,2010-03-03T20:11Z,hi i m having problem wid the video guys i m using vlc 9.9 .. which players  should i need to wacth this mkv file...
,zappai,2010-03-05T00:49Z,"I saw this at the theater last week and thoroughly enjoyed it, I hope it wins best picture. William James has balls the size of the moon."
,lophuker,2010-03-05T14:54Z,i haven't gotten over 16 kb/s on this file
,lmckellar,2010-03-07T05:20Z,"same trouble as juned123, cant get the video to work only audio, tried wmp and wmp classic. do i need some sort of codec? or a diff program? please help as this took a few days to download!!!! peaked at 56kb :("
,lmckellar,2010-03-07T18:42Z,"managed to get video working after downloading VCL media player and running it through that. AUDIO 10, VIDEO 10, only problem was every 10 secs it would skip. as if it had been paused for 2 secs. any advice how to correct this? was only just watchable.."
,raj2020,2010-03-08T06:23Z,"Grabbed 6 OSCARS....Am i right?
Will download & watch it whether it is worth that Oscars..."
,elax666,2010-03-08T08:22Z,"Thx, I`ve just seen the Oscars n due 2 the fact that this 1 won best film I just had 2 dl it. So yet again n with no further do, Thanks."
,AusMakka,2010-03-08T08:32Z,Thanks for the upload. Can anyone please tell me if blue ray rips of this size can be put onto DVD instead using for instance ConvertXtoDVD?
,GambitMKD,2010-03-08T10:26Z,"I can see why you would whant to make it a BR rip, but you didnt hade to remove the old dvd rip that you had posted a while back. Both rip's can coexist togheter. Pls get it back"
,roskruge,2010-03-08T10:53Z,"The Hurt Locker - Academy Award, Best Picture 2009"
,rarely.reply,2010-03-08T14:44Z,"This movie is not worth getting the oscar. Absolutely boring, and the shooting technique they used, quick zoom-in zoom-out, shaky camera, make me dizzy.

Thanks for the upload though."
,theoquda,2010-03-08T16:05Z,rarely.reply  - you are the most idiot person in the world. Die!
,cody2266,2010-03-08T16:40Z,When i play this torrent in vlc its not clear at all? 
,STANOLY-DK,2010-03-08T18:43Z,SEEED PLEASE!
[V],lan3y,2010-03-08T19:28Z,"For mkv playback use vlc media player:

http://videolan.org

lan3y"
,kamaldeepsingh,2010-03-08T20:07Z,"Because this 2008 film was not originally released in the U.S. (at least in an Oscar-qualifying run in L.A.) until 2009, it was eligible for the following year's Oscars

AWESOME MOVIE - 10/10
V-10/10
A-10/10"
,junkman,2010-03-08T20:21Z,Nederlands ondertitles?
,junkman,2010-03-08T20:23Z,Where is the hurt locker? I do not understand. Where in the film is the injured locker? All the lockers in the film are unharmed. Please explain.
,jake_man,2010-03-08T20:29Z,that's a quality I'm talking about thank you.
,martialis,2010-03-08T21:29Z,"It doesn't work because .mkv is an obscure, bullshit format and you don't have the right codec.  There is no easy way to fix this.

Skip this and dl the other one.  I don't know what FXG was smoking when they did this, but I'm disappointed.

fxg are a bunch of idiots seriously unbelievable"
,jetpower,2010-03-08T22:27Z,it can actually be MKV-AVI converted in like 3 minutes lol. And MKV is the best container ever.
,kiere,2010-03-08T22:43Z,why you wanna convert it to avi then ?
,jetpower,2010-03-08T22:53Z,"you asking me? i wrote it ""CAN"" be converted, not that there's much sense in doing so. 
@Kumome:
MKV can be opened by all good media players. I whole-heartedly recommend kmplayer for all your movie watching needs.
http://kmplayer.en.softonic.com/"
,Robin9876,2010-03-08T23:00Z,"Stop whining assholes! If you dont like .mkv, rip a better file you lazy shit! Hate this idiots, who are only whining. DO IT YOURSELF fucker!"
,Robin9876,2010-03-08T23:02Z,"Thanks FXG, dont listen these fucking lazy idiots. They dont do nothing to others. "
,PunkArmy,2010-03-08T23:31Z,"oh no is the format not good enough for you guys?

FXG puts allot of work into all there torrents"
,kbuddy,2010-03-08T23:50Z,"mkv is a cool format.... to convert mkv to vob ...or w.e ...may be this can help you ... if u r thinking of PS3 playing .. 
http://www.videohelp.com/tools/mkv2vob"
,jollie1,2010-03-09T00:59Z,"good film, good u/l...u alll wanna watch it NOW? now it's own an osar or 2...get the net ladies...it was on tpb ages ago! n y r u freaking out about mvk. files? bumboholes! i bet u lot use itunes,,,n as 4 u 'watch this movies at this site, no download' fuckers...u can watch this movie on this site...www.eatmypussyholebattyfucker.ja"
,Lovesmovies,2010-03-09T01:50Z,HOW DO I GET A SKULL ANYONE CAN TELL ME PLZ.. THANK YOU..
,clover323,2010-03-09T01:53Z,"@jetpower

I have a need to convert a couple .mkv files to .avi files. I saw you mentioned a converter that could do mkv-avi in 3 minutes. Does that program cut down the quality at all? And if you would be so kind as to give me the name if the program you're talking about it would be greatly appreciated. Thank You

Great upload btw. Thank you FXG!"
,sirus_499,2010-03-09T03:51Z,lol funny how just because this movie wins an oscar now everyone is downloading it and its number 1 on piratebay.
,pimpmobile,2010-03-09T06:35Z,"This is nothing, but U.S. government propaganda!
If you want to be brainwashed into believing that the people they are fighting are terrorist's then watch this, but know this George Washington and his revolutionaries were also called terrorists!  So if you want to breed more hate then watch this crap!"
,hyfly1,2010-03-09T10:25Z,"Seeedd plzzz.
Thnx for the up!"
,SpitvenoM,2010-03-09T10:39Z,@pimpmobile i am gunna breed more hate and watch this crap. lol thanks for the upload FXG.
,Agent.25i,2010-03-09T11:33Z,"Now everyone wants to see this movie. 

It's good, but the attention it got at the awards the other day, simply war propaganda. Like how they give the awards to the actor that died that year... looking at you Heath Ledger.
Sad really.
I bet the US government bought up those awards.  "
,romi1208,2010-03-09T11:44Z,"AVATAR! was way better. Still, I liked this movie."
,jeffro-,2010-03-09T11:58Z,"The U.S government have got more money than the entire world movie industry. why would it be so hard for them to gain 10% in the poles by producing one of these hero orientated middle eastern war lies. Bout time the western world woke up to who the real terrorists are in this materialistic greedy excuse we call life. Did everyone like the ""first ever female"" ""Best Director winner""devoting her efforts to those who serve in Iraq and afganistan. Great use of conection to females and emotion of the moment. Go and plan another sacrifice when everyone has poured there hard earned back into the markets george."
,jetpower,2010-03-09T18:27Z,"@clover323
There's no 1-click converter like this yet AFAIK.
First understand that MKV and AVI are containers for A/V streams. Think of them as boxes where you put video track and audio track.
To ""convert"" you take both video and audio stream out and put it into another container. 
Google MkvExtractGUI for the former and AviMuxGUI for the latter.

However I suspect that you need AVI for some device - then, most likely, it won't like these A/V codecs anyway so you'll have to TRANSCODE (google what that means if you don't know) to the codecs that your device accepts. This will obviously take usual time as every frame has to be recompressed.


"
,Daicek,2010-03-09T19:07Z,This movie really sucks. But its a nice torrent
,Stephen123456,2010-03-09T20:29Z,great torrent but what a pathetic film. its so damn boring and just a total let-down. still.. gotta see it to believe how lame it is
,iGLGred,2010-03-09T21:41Z,"Really don't see how this is war propaganda.  My friend and I are both very liberal and we do not support the war in Iraq at all.  We both went to see this and loved it.  The film is about the men who fight and why they fight, not about the war itself."
,Stephen123456,2010-03-10T05:33Z,Brothers (2009) much better story
,NapoleonBonafart,2010-03-10T08:09Z,"How did this turd win any oscars? It totally sucks. I switched it off after an hour. Avoid this piece of shit like the plague.    
"
,md_anas,2010-03-10T15:40Z,"saale kaminon , jab tak ke oscar nahi mila tha tab to koi janta bhai nahi is movie ke baare men , aur jab parson mila hai to sab ugarwadi aa gaye hain download karne !

BHAK !
Amity Sucks !"
,gibresh,2010-03-10T22:59Z,"WoW, great Quality... by far your greatest upload I have ever seen.
keep up the BDrips and the good job
thanx"
,felipon,2010-03-11T03:16Z,"Oscar for best movie????
Oscar for best script????
What a load of crap! 
The dialouge is so fucking cheap it´s embarrassing. 
War propaganda like this can only be rewarded in the USA.....Disgusting.
This movie has nothing, absolutely nothing on Inglorious Basterds. Period! "
,7torrents,2010-03-11T15:59Z,"Its a shame, this won the best movie in oscar and avatar didnt"
,robjbay,2010-03-11T17:05Z,dude wtf this doesnt work......it doesnt open in media player it opens in a movie editor and says its a 5 second clip...FTW
,muse-13-bliss,2010-03-12T19:16Z,"SEED PLEASE
0.1kb/sec download rate -__-"""
,Phatfish,2010-03-13T05:07Z,"V - Good

A - Good

M - Don't believe the hype. This movie is pure drivel.
Not a matter of opinion it's a obvious fact.
"
,md_anas,2010-03-13T14:13Z,"israelis_r_filth u r my hero 
always fuck these jews as hard as u can !
fuck "
,md_anas,2010-03-13T14:14Z,"saale kaminon , jab tak ke oscar nahi mila tha tab to koi janta bhai nahi is movie ke baare men , aur jab parson mila hai to sab ugarwadi aa gaye hain download karne !

BHAK !
Amity Sucks !
Previous"
,md_anas,2010-03-13T14:14Z,"saale kaminon , jab tak ke oscar nahi mila tha tab to koi janta bhai nahi is movie ke baare men , aur jab parson mila hai to sab ugarwadi aa gaye hain download karne !

BHAK !
Amity Sucks !"
,maqsmihil,2010-03-13T17:41Z,"I'm expecting earth moving quality.I hope film also that much worth watching, All Hail FXG."
,somedude.1001,2010-03-15T23:50Z,"My brother hates this movie. He couldnt even finish watching it. Personally I think its yet another case of Shakespeare In Love.

But then again, we are not Americans. The Iraq war is nothing but a news story to us..."
,johndoe2085,2010-03-18T23:30Z,"I cannot get any audio???  Video quality is excellent!  Someone please help!  I am using divx player....
Thanks"
,fleetkid,2010-03-22T18:18Z,http://www.matroska.org/technical/guides/faq/index.html
,elvilleira,2010-03-24T21:58Z,"Played good in my computer (VLC), but the sound went badly off sync in when playing it in my WD TV. Never happened before until this torrent, don't know why."
,spacelynx,2010-03-30T13:45Z,"Anyone know how to convert a file like this?

@FXG: Thanks a bunch for all the good quality uploads! You rock! Peace from the Netherlands."
,TheNameless23,2010-03-31T01:18Z,"Great quality , Loved the movie 
Thnx dude ."
,fly2stars,2010-05-09T16:45Z,"The video is too grey compared to the original bluray screenshots. Ac3-vision has a better release, I think."
,totenkopf1891,2010-06-18T19:45Z,"Movie is selling crap about some weak minded bomb squaddies... Not a war movie, just some psychological bollocks... Some nice action moments thogh. "
,Skogswald,2010-06-27T20:42Z,"Swedish subtitles:
http://undertexter.se/?p=undertext&id=21297"
,firesafetybear,2010-07-31T03:59Z,if i download blu ray movies...can i watch them on my computer? even if my computer doesnt have a blu ray player? like watch it in windows media player
,boxorats,2010-12-23T21:26Z,"@somedude.1001 -

I'm American and didn't go to see this in cinemas because, if I understand your comment correctly, I agree - the Iraq war was/is not a backdrop for soulful American soldiers to have a journey of self-discovery or whatever - it's terribly offensive to make a movie about American soldiers in Iraq and have the film be about the soldiers, not Iraq and Iraqis and the atrocities we Americans inflicted on their people, society, and culture. Basically the movie is a way for Americans to see themselves as the ""underdogs"" - even when they've invaded and occupied a previously peaceful country! It's perverted and ugly that this movie exists, really (although it is only one film, and just a symptom of the way Americans prefer to think about the world & themselves in general). The problem, of course, is that it also sounds like it might be an interesting film to watch, so for example even though I feel bad about it, I went looking for a copy online because I thought it might be a good/fun/interesting movie (""at least I won't be giving any money to the filmmakers if I steal it!""). If there is any point to me saying all of this besides trying to look like I'm not as purely evil as ""the other"" Americans, it's to illustrate that it is possible for an American to understand more than Americans generally feel like understanding; that means people can, in a practical as well as theoretical sense, expect a lot more of us as individuals than they usually seem to resign themselves to accepting. What I'm trying to say is, everyone should be _more_ angry at we Americans (me included; don't let the individual off the hook just because of some ingratiating words and because he's a human being too; he's a _bad_ human being for being part of America, even if we don't choose where we are born, because somebody IS responsible when Americans burn down cities and murder everyone)."
,boxorats,2010-12-23T21:27Z,"... Anyway, for these reasons I think Shakespeare in Love wasn't as irresponsible as this movie! (Actually I remember liking it, although that probably had a lot to do with Gwyneth Paltrow and how great she is to watch, even in the scenes where she has her clothes on...) But of course, as you suggest, both movies are a stupid American fantasy about how cultures or history that are fundamentally different than American culture are things Americans can understand without trying to know anything new, to make our lazy assumptions that everything is really the same as America make sense, even if only in a stupid Hollywood movie that has nothing to do with reality."
,jiggysiggy,2011-03-09T13:27Z,"warnung an alle deutschen nutzer!!! dieser torrent wird von der kriminellen abzocker-kanzlei ""waldorf und frommer"" ueberwacht. mit dem download dieses films riskiert ihr eine abmahnung von 1000 euro. ehrlich gesagt ist dieser film eh ziemlich kacke, er ist es jedenfalls nicht wert dafuer geld auszugeben. wenn ihr den film unbedingt haben wollt dann holt ihn euch bei einem one-klick-hoster, dann koennen euch zumindest die waldorf-frommer-hurensoehne nichts anhaben."
,SeanIzen,2011-08-15T11:00Z,"@boxorats 
-shut up liberal hippie. your endless banter is nothing but regurgitated ABC and Bush-hating rants. For shits sake they make a word limit for a reason, because nothing pertaining to the film that would be of ANY use to ANYONE needs to be explained that much.

@somedude.1001
The movie probably does suck if the lady is suing everyone for downloading it.  She probably is frustrated that she hasn't made a dime yet! 
And that's a very eye opening way of looking at American's main point of debate and inner quarrels amongst each other. By the way, not all of us believe in boxorats horse shit. 
"
,kronos88,2012-05-01T23:15Z,"V:10
A:9

Better than most torrents I've seen. As for the movie itself, this ain't CNN - comments about America's political system hardly matter on this site.

For those having issues, the latest version of VLC will play it just fine as long as your computer meets the minimum specs to play high-res movies. I don't got 'em off the top of my head but your system needs to be capable of running a high-def movie for it to work properly.

@firesafetybear

Yes, you can play Blu-Ray ripped movies straight from your hard-drive without a Blu-Ray player. Though as I stated above, don't use Windows Media Player, use VLC or something like it."
,Guija,2012-07-07T22:23Z,"Nice quality, good movie, thank you!"
