User Type,Username,Date,Text
,smasudi,2010-11-04T02:26Z,Thanks for this bro...please do KISS KISS BANG BANG in 720p also...
,tylr,2010-11-04T09:23Z,"strange.. why noBody bothers to change the Quality mark?!

..tHanks for the share.."
,yomamoves,2010-11-07T02:44Z,a/v please..:))
,D3xsT3r,2010-11-23T01:43Z,isnt there a death race 2?? i'm looking for it and cant find it.
,spiritualiste,2011-04-29T16:04Z,Thanks a lot for sharing your work...+1...
,thefast5,2011-10-09T16:16Z,screens?!
,dandalis,2012-01-29T22:57Z,pretty decent quality for its size.
