User Type,Username,Date,Text
,guarino2002,2010-09-25T20:18Z,From what I heard this movie is anything but legendary. Cena and Danny Glover who could have ever guessed it wasnt going to be that good.
,Backlit01,2010-09-25T21:55Z,is this a movie about Barney Stinson? :P:P:P
,martialis,2010-09-26T03:03Z,"I hope it's not about Doug Wilson, although that might be an improvement"
,guarino2002,2010-09-26T04:13Z,It was a decent movie. But the video quality looked like a good vhsscr. Its still watchable though
,cenation80,2010-09-26T12:05Z,"hustle, respect and loyalty

CENATiON

thanks uploader"
,huntluck,2010-09-26T12:11Z,is it rip really?
[V],Lindoff41,2010-09-26T15:37Z,4.6/10
,lovethemovies19,2010-09-26T23:22Z,will comment on A/V when done dl
,Ykkandil,2010-09-27T09:50Z,"unfortunatly that quality pretty sucks, well doesnt matter cause the movie is cheap anyway 
a 8/10
v 6/10
m 2/10"
,mattn63,2010-10-01T07:51Z,I will never watch anything that the filthy nigger commie traitor danny glover is in. Fucking douchebag!
,5iF3R,2010-10-05T03:34Z,"mattn63, you're obviously a bigot. Read a book, or get help.."
,5iF3R,2010-10-05T09:59Z,"Plot: A book-smart teenager joins his school's wrestling team as a way to reunite his surviving family members, who split apart after the death of his father, a college wrestling legend, 10 years ago."
,odiecat99,2010-10-16T06:41Z,thank you for seeding i shall for a while also. :P
,XchosenX,2010-12-12T17:03Z,Truly not a DVDrip and if it is.. you probably need to upgrade what your using.. quality absolutely sucks. And thats just me being nice
,a15457,2011-01-09T02:14Z,"Poor RIP dodgy sound dodgy dogdy vid. gonna get another RIP from somewhere else. :)

Thanks for all your other uploads though BONE :)"
