User Type,Username,Date,Text
,dobffc,2009-10-31T15:45Z,Thanks man great job. We don't get the 24/7 in England and you've made my day!!!!! Will you be doing the othe 3 episodes? I hope so im kinda counting on you now!!!! 
,hapitots,2009-11-01T00:32Z,Most definitely. I'll be completing this 4 part series. I hope pacman wins...........
,killjoy408,2009-11-02T01:59Z,SUH-WEET!!! Do you have number 2 up yet? Thanks for the uploads! 
,xsept,2009-11-02T06:41Z,Great episode.  Looking forward to seeding the other parts.
,hapitots,2009-11-02T08:59Z,"Companero y Companera here's the latest of the Pacman vs Cotto HBO 24/7 episode. 

http://thepiratebay.org/torrent/5144561/Pacquiao_vs_Cotto_24_7_part_2

I uploaded it so TPB folks can just get it here. PEACE!!!!"
,nishelou,2009-11-14T09:16Z,"thanks man,"
,phoenix73,2009-11-15T19:54Z,"somebody upload the pacquiao-cotto fight, please?"
,chillin8,2009-11-16T01:56Z,"For those wanting the ppv fight HDTV paquiao vs cotto main event ...enjoy 

http://thepiratebay.org/torrent/5164626/Manny.Paquiao.vs.Miguel.Cotto.HDTV.720p.CHILLIN"
