User Type,Username,Date,Text
,yosoyusuario,2010-06-30T05:17Z,"Is this the same as ""TALES FROM THE CRYPT""? Thanks by the way."
,Prisoner21,2010-07-07T15:47Z,So? What do you think about subtitles? Who can?
,Antula,2010-09-13T05:15Z,if i knew how to creat subtitles...i would...but until then i will seed. :D
,morrimoto,2010-10-13T23:47Z,"Arigatou for this awsome torrent. You don't know how long I've been looking for these. Big up, Pris."
,Prisoner21,2010-11-18T20:38Z,"Antula, would you really make subtitles if you'd know how to?"
,half.breed,2011-03-16T21:38Z,Is this the cartoon one??
[T],ServiusTheBear,2011-06-07T12:14Z,"@half.breed yes this is the cartoon one.

A = 8
V = 8"
