User Type,Username,Date,Text
,ciscoman,2009-12-31T03:38Z,audio is cam and sux shit...trust me
,Robo88,2010-01-07T18:58Z,This in NOT R5 !
,Kasinath,2010-01-08T03:19Z,Thanks man!
,YULYRAPID,2010-01-08T16:51Z,"video 9.5-10 , audio 6.5-7.5  good to watch , good movie thank's NOIR"
,patuli,2010-01-11T01:31Z,"it seems no one have a good audio for this movie ts a shame all the torrent's, have the horrendous crap cam audio , time to go to blockbuster , i hate to pay but the cam audio...."
,handsoftime,2010-01-20T17:04Z,"This has people talking really loudly all way through, not worth downloading"
,crash2burn,2010-01-28T14:21Z,hi bone plss can u uplaod the claim movie(wes bentley)thnx
,funnygames81,2010-04-28T06:15Z,"Video 10

Audio 5

Audio is CAM, horrible!!!"
