User Type,Username,Date,Text
,lotr1980,2010-07-06T22:14Z,works on the old r4 no prob
,lotr1980,2010-07-06T23:37Z,my mistake it loads but the playscreen is corupted
[T],simmyboy80,2010-07-07T10:46Z,R4 team should be able to fix that problem with an update 
,lotr1980,2010-07-08T09:23Z,have you a link?
[T],simmyboy80,2010-07-19T23:56Z,if you google woods 1.10 firmware and install and install moonshell 2.10 also this will work for most DS releases
,51t,2010-07-22T09:00Z,Confirmed with AceKard 2i - AKAIO Loader 07/15/10 - 51t
