User Type,Username,Date,Text
,therarjnzo,2009-09-13T18:07Z,is it possible to get this to work on a NTSC xbox 360? please lemme know
[T],gamerguuy,2009-09-13T19:18Z,sorry but i don't know.
,sjefen01,2009-09-14T23:04Z,is it possible to get this regionfree???
,chrisse75,2009-09-16T14:19Z,Can anyone confirm that the game works ?
,CamaroBill95,2009-09-18T18:22Z,If anyone can help me it would be appreciated. Im trying to burn a 360 game and i dont know what to do. From what i hear you need to use IMGBURN at about 2.4x and i hear alot about firmware and modchips but if someone could give me a step by step on what to do and how to do it. My email is camarobill95@yahoo.com
,tomo14,2009-09-21T21:10Z,"Does it work?
and one of these games must be region free"
,weasel5166,2009-09-30T13:09Z,"it's in PAL format. (Australia, New Zealand or UK only!)"
