User Type,Username,Date,Text
,yohohoandaBottleofRUM,2010-10-09T17:03Z,"OOO, could you please upload the program you use to convert your movies & what settings you use... im not out to try & compete with your uploads, i just want to convert my porn collection :o) Please & thanks "
,lekkeralgemeen,2010-10-09T17:35Z,Just search google for handbrake. It's the program OOO uses...
[T],on.off.on,2010-10-09T18:05Z,yes sir its Handbrake.. gigooggiille it lol
,TKOG11,2010-10-09T21:52Z,"@yohohoandaBottleofRUM

i'm sure you could upload your porn collection if you wanted, none of the other handheld uploaders do porn"
