User Type,Username,Date,Text
[S],velvet.,2010-01-13T02:39Z,Enjoy your pink skull.
[T],CODYBOSS1969,2010-02-09T14:57Z,"I've thanked already for that on Super-Bay forum!

But once more it's not too much: THANKS FOR YOUR POSITIVE EVALUATION !!!

[I've not checked the comments on this upload 'till now !]"
,Richardson_RD,2010-12-09T06:11Z,Thanks 4 Sharing :D
,shiv80,2011-05-25T19:53Z,"Thank you... But is this possible to make it into one single file, instead of 6 files...?"
,Thetruesong,2011-07-14T09:11Z,"This is such an emotional movie that everyone on Earth should watch. It's outstanding just how amazing this movie is and its a shame its one that many will be too ignorant to watch.
Rating: 12/10

It was based on a true story."
,ghandi253,2011-08-30T00:02Z,+1. Good job!
,StormDewleaf,2011-11-13T08:18Z,"@shiv80, the movie itself IS in one file. The other five are a sample file, an info txt file, a torrent into txt file, and two subtitle files."
