User Type,Username,Date,Text
,auchlinn,2010-08-03T00:13Z,guys dont download this my anti virus shows that its loaded with viruses
,DarkSnyper88,2010-08-16T04:01Z,It doesn't have any viruses. Antivirus software says it does because it doesnt recognize this program.
[V],DeGun,2011-05-07T14:26Z,"dvd shrink total size 948kb ? ya kiddin thinking this can be an EXE  ? 

DO NOT download this sh!t"
[V],DeGun,2011-05-07T14:30Z,"lol ... official size is 1.04MB ... 

no matter what DO NOT download torrents from unknown uploader.

ONLY TRUST pink green & blue SKULL .

or connfirmes noob by positive comments .

REPORT fake virus or child porn torrent TO :

http://SUPRBAY.ORG"
