User Type,Username,Date,Text
[V],RiddlerA,2010-07-18T08:34Z,Guys Enjoy & Please seed after Downloading ................................................................................................... Please provide feedback regarding the torrent ............................................................................ http://thepiratebay.org/user/RiddlerA ............. or ............. http://1337x.org/user/RiddlerA/ 
[V],RiddlerA,2010-07-18T08:55Z,Added A Sample. ...................................... Check it before Downloading. ..................................... Next Upload ---------> The Godfather 1 
,habibu,2010-07-18T10:16Z,"Hey RiddlerA
I asked you this one last time also u did not answer.plz answer my question.
I have downloaded the dark knight the print is excelent but there is a problem with the video.
The video keep changing the aspect ration from time to time. What is that man. If its the problem from your source can u upload the right viedo.
lol Thanks in advance"
,edelhart,2010-07-18T13:39Z,"Just you know but pluto already did the godfather collection.

Please do kingdom of heaven, I tought you planned that"
,tushar962,2010-07-18T14:34Z,ya sid is right upload some other movie
,muk0690,2010-07-18T16:36Z,@RiddlerA: can u upload the star wars episode 1 to 6 and the clone wars?
[V],RiddlerA,2010-07-18T16:58Z,"@ habibhu .................. I don't remember now but most probably Had to crop some scenes because of Black bars thats why the aspect ratio changes ..................... @ edelhart & Tushar ................... Dropping Godfather series, although had done it on request .......... Next Upload -------> Kingdom of Heaven ............. @ muku ............ No requests ATM ........... make it in 1st week of Aug & I will consider it"
,shytan,2010-07-18T19:38Z,@RiddlerA...............can u upload ironman 2 pls
,shytan,2010-07-18T19:40Z,"also prince of persia, karate kid etc"
,Djchaks,2010-07-18T20:19Z,PlutO has already uploaded The Godfather Trilogy.And its of same quality as urs.So I think u should not waste ur time by doing it again.
[V],RiddlerA,2010-07-18T20:28Z,"@ Shytan ......... Let a good print come .......... @ Djchaks ............ My & Pluto releases were different ......... His was HDrips, I was going to upload 720p"
,muk0690,2010-07-18T21:30Z,"@RiddlerA: I meant those star wars movies starting from 1977. http://www.imdb.com/title/tt0076759/

try this for more info

http://www.imdb.com/find?s=all&q=star+wars"
,Djchaks,2010-07-19T06:11Z,@RiddlerA ya thats right......but the quality is more or less the same...........but I prefer u man.......
,shi2010,2010-07-19T06:39Z,"hey love ur work , great quality ,great size ,just love it ,keep up the good work"
[V],RiddlerA,2010-07-19T08:27Z,You are welcome ...... Guys
,siddhart,2010-07-19T18:29Z,"@all
guys i found another uploader who uploads gud quality in small size....
he is new and needs our support... plzzz look for his torrents also so that he may upload more.
http://thepiratebay.org/user/Whiizz/
thanx"
,moviz247,2010-07-20T19:45Z,"harry potter overs may try the user yify .
He has done them all & he has done them all good "
,sherchan,2010-09-16T19:51Z,could you please upload NORTH BY NORTHWEST  and APOCALYPSE NOW?
,umarnawazkhan,2011-01-15T03:03Z,"good copy..
this movie is racist:- don't like paki"
,danyrx8,2011-02-28T16:28Z,Thanks for this one RidllerA. Let's see what England suburbs is all about!
,catfaceI,2011-06-24T00:20Z,seed please quality looks amazing really want this!
