User Type,Username,Date,Text
,marota,2010-01-01T17:52Z,THANKS
,Fira_A,2010-01-30T04:43Z,"Can you, by any chance, get a valid registration code for the Mac (PowerPC) version?"
,sweet_pce,2010-05-20T21:53Z,"ok, how do i get this to work? I'm kind of new to this, i've extracted the files and the program is running but there's no key gen and the program is asking me to update... is it my firewall? if so how do prevent Norton from removing/blocking and exclude the crack from being auto-protected & auto-scanned by Norton?"
,Daiquirii,2010-07-25T19:43Z,"I've got similar problems with Fira.

Any chance I can get registration codes for Mac?

Btw, intel based in my case."
,bermstien,2011-01-02T16:41Z,thanks this works great
,jacksp5,2011-02-14T23:26Z,"Hi. I love your torrents. Keep up the good work. By the way, is there any way you could get ""iSkysoft DVD Creator"" for Windows? Thanks."
,439,2011-04-27T03:49Z,Thanks A Lot Ima Searching For It!!!! Keep Rocking!!!!
,a_junkie,2011-09-30T06:02Z,Thanks!! Works well. Not bad for me as a newbie.
