User Type,Username,Date,Text
,thenat17,2010-09-13T13:18Z,i seeding this for 24/7 for 5-6 months ! dont delete !
,heyman1981,2010-09-14T13:36Z,"sounds cool, pics please"
,thenat17,2010-09-14T18:23Z,"read  the info of this torrent, there is a big : SCREENS : and link here"
,sspp112,2010-09-15T05:59Z,SEED stuck at 87%
,thenat17,2010-09-15T08:23Z,"im seeding, calm down ! :)"
,thenat17,2010-10-12T12:19Z,im seeding to year 2011 :) ( 2 moths)
,shinujov,2010-11-29T20:24Z,Please Seeeeed!! stuck at 42%. please set unlimited bandwidth....
,drx.94,2010-12-05T21:14Z,"Downloading now. It's quite large, but it sounds very good. I suppose it's WR2 but with a lot of cars maps and skins, right?"
,drx.94,2010-12-05T21:15Z,You will be seeding in 2011 also I hope?
,shinujov,2010-12-18T20:40Z,"please tell me how to install this game as i finished downloading this after over 1 month. i'm totally confused on how to install it...
Please help me. plz mail me at shinujoseph@gmail.com
thnx "
,thenat17,2011-01-16T17:25Z,"@shinju 
ist there around 5 seeds + me
game mount to daemon tools.

@drx.94
yes i think ;] i doing it right now


"
,nl1983,2011-01-28T15:54Z,ill seed if the game works
,thenat17,2011-02-05T07:42Z,it alll works ;]
,elturbo9077,2011-06-23T21:05Z,"@thenat17

thanks for the mod i love it car fans must download this torrent becuase its the best mod torrent of all time

CAN U UPLOAD RECENT MODS UPDATES ALSO PLEASE IN THE MOD WEBSITE THERE ARE 1370 CARS AND IN THIS MOD THERE ARE 1260 CARS PLUS THE 92 ORIGINAL CARS CAN U UPLOAD MODS TORRENTS LIKE THIS ONE IN DIFFRENT GAMES"
,elturbo9077,2011-06-23T21:11Z,"EVERYONE THIS IS THE BEST MOD OF ALL TIME

IT HAS 1260 EXTRA CARS PLUS THE 92 ORIGINAL ONES

IT HAS 179 TRACKS FAMOUS TRACKS LIKE TOP GEAR TRACK AUTOBAHN ROAD AMERICA LEMANS SOME WEIRD SPACE TRACK AND THIS ROLLER COSTER TRACK

MORE CAMERA VIEW WHICH INCLUDES COCKPIT 

IT HAS BETTER TEXTURES THE NEW ONES ARE MORE REALISTIC 

SOME OF THE MODDED TRACKS THE TRACK MAP DOES NOT APPEAR

U NEED TO DOWNLOAD A NO CD CRACK OVER AT GAMECOPYWORLD THE CRACK HAS TO BE 1.1.1.1 ALL

SOMETIMES THE MAPS DON'T LOAD CORRECLTY SOMETIMES THEY ARE IN BLACK AND WHITE 

BUT IN OTHER WORDS THE MODS ARE COOL THANKS UPLOADER"
,thenat17,2011-07-16T11:27Z,thx for telling me for some Bugs :)
,veggyvais,2011-07-19T15:35Z,SEEDS PLEASE! Thanks heaps
,thenat17,2011-07-31T08:43Z,"ok, i help seed."
,Drkpl8,2011-08-06T12:23Z,"I just hope that this still works.

If it does, im going to seed 3.0 mb/s 24/7 for about 2-3 months..

I mean.. 1300 cars.. just my dream.. You just made my dream realitiy, and if this game would be out in the stores (like WR 2 Gran Turismo) i'd pay 100 bucks for it.."
,Drkpl8,2011-08-06T12:25Z,"Also :

I just see the DL speed is a little bit fucked up, because of the not so big number of seeders.

Im supposed to get 7 MB / S download speed, but im getting only 300 KB / S"
,Drkpl8,2011-08-07T19:05Z,"Ok i installe now everything.. copied the MOD folders over the original ones..

But when i try to load ur profile (thenat) it says 

Cars owned : 1354..

if i click then, it changes back to 92, and i can only find the original 92..

Where are the promised cars and tracks?

i can still only race where i could before.. nothing changed!"
,Drkpl8,2011-08-07T19:09Z,"ok again its me..

when i extracted the MOD folder, there was no folder such as ""Autos"" or ""Cars"" or ""Vehicles""..

and also the packed size was 13 Gigas, when i extracted it was 6 gigas??"
,Drkpl8,2011-08-07T20:56Z,"OK DO NOT DOWNLOAD IT!

SECUROM WILL FUCK UP YOUR REGISTRY, SO EVERY SINGLE ONE OF YOUR GAMES, EVERY SINGLE GAME INSTALLED ON YOUR PC WILL GIVE YOU AN ERROR WHEN STARTING.

IT FUCKS UP YOUR WHOLE REGISTRY, SO YOU HAVE TO RE INSTALL EVERYTHING AGAIN, AND MAYBE EVEN THEN IT DOESNT WORK!

WARNING TO ALL :)"
,Philonetic,2011-08-31T22:29Z,"@Drkpl8
It works fine, dunno what you did to your computer, was your own fault I'm sure, stop bullshitting."
,thenat17,2011-09-18T14:17Z,"yeah, bullshit...

Securom has nothig to do with registry."
,veggyvais,2011-10-08T12:50Z,"Finished after 2weeks (ELAPSED TIME as per uTorrent), but took more than 2months to finish (REAL TIME).

Still trying to figure out how to make this thing work. "
,veggyvais,2011-10-08T13:00Z,"Sorry but the instructions attached are terrible.
What do I do next after DL?
Do I need to Extract all RAR files to it's specified folders? Then what?
Thanks!"
,veggyvais,2011-10-10T12:52Z,"WTF? It does NOT work on Windows7.
What's my solution? HELP!"
,mitrapt,2012-04-07T20:22Z,SEEDING WITH 100MB/s SEEDBOX and HOME NET 100MB/s !!! 
,ciprian1994,2012-04-16T20:24Z,pleade seed all i download with 1kb/s 18 gb and is gonna last long very long in utorrent it writes it will last 1year so please seed i son't want do download 1year PLS PLS PLS PLS PLS!!!!! SEED SEED 
