User Type,Username,Date,Text
,awsomethanks,2010-10-01T13:23Z,just downloaded this and the video is great but the sound is shit???? im using vlc
,direct2dance,2010-10-01T16:58Z,True. Don't waste your time downloading. Sound is has a weird background noise throughout the movie. Unwatchable!
,SECREThacker4fun,2010-10-01T18:21Z,"i FULLY downloaded it but ..... Fuck i want my lost time back xD
v 4
a -3
l0v3 that you try to upload this shit but i'm sorry this is a bad torrent and a waste of time ...
Downloaded in the Netherlands ... 400kb ps 

Gr33tz secrethacker4fun"
