Filename,Size,Unit
Recursive/10 Massacre of the 9th Hell.mp3,13.99,M
Recursive/05 Fallen Angel.mp3,13.63,M
Recursive/07 Born of Obscurity.mp3,13.21,M
Recursive/08 A Night of Honest Lies.mp3,12.63,M
Recursive/02 Aborted Soul.mp3,11.42,M
Recursive/04 Mending the Dead Army Part II_ Py.mp3,10.81,M
Recursive/09 Repercussions of Thy Diminished S.mp3,10.56,M
Recursive/03 Mending the Dead Army Part I.mp3,9.93,M
Recursive/06 What Lurks Below.mp3,9.71,M
Recursive/01 One Final March (Intro).mp3,6.36,M
Recursive/Recursive.torrent,17.73,K
