User Type,Username,Date,Text
,buddbusta_101,2010-11-26T22:41Z,Can anyone confirm that this is real??
,jhonatanbombado,2010-11-29T01:03Z,is real but can download without fear
,chunghwei,2010-11-30T10:55Z,no seed to download...
,chunghwei,2010-11-30T10:56Z,no seed file to download
,Hails592,2011-01-04T17:30Z,no input file specified
,Hails592,2011-01-04T17:30Z,"cant download this, new page always says ""no input file specified"""
,Hails592,2011-01-04T17:36Z,"use and regester with torrentday. 

Your Shape Fitness Evolved XBOX360-GLoBAL

works everytime!! super fast with 50 seeders!"
