User Type,Username,Date,Text
,skeetskeetmf,2010-08-27T05:40Z,It's the end of the world as we know it.....I feel fine!
,Dig62,2010-09-10T23:45Z,"A classic 70's post-apocalyptic film that everyone should watch.  Totally NOT politically correct, and a lot of fun.  Great upload.  Thanks!"
,tom444422,2010-12-29T19:04Z,"Great never seen this one,cheers."
,AdinaB,2011-01-17T07:11Z,Thank you :)
,swanbrown,2011-02-03T07:35Z,"This Downloaded cleanly, and played smooth. 
Thanks."
,drunkenhomer,2011-04-07T05:33Z,skeetskeetmf: i see we have a great big sea fan
,Global_Warfare,2011-04-09T16:44Z,thank you!
,Atomsk1,2011-08-18T09:04Z,"@drunkenhomer Great Big Sea, are you kidding me? How could anyone not know thats an REM song?"
,xMajesticMeteorx,2011-11-13T17:39Z,I hear he gets a bunch of pussy in this movie.
,darrencaf,2012-02-18T19:36Z,"Wonderful, I've never heard of this one before.  Don't know why but I love all those post nuclear doom & gloom films :)"
,onett_home,2012-02-24T11:41Z,Thank you
