User Type,Username,Date,Text
,hplp20,2010-11-24T15:51Z,"Thanks, higher bitrate than the 6.5 GB one."
,telep_man,2010-12-20T21:08Z,Can someone please tell me if this is an r5 rip or not. Already wasted time with the Esir release.
[V],aoloffline,2010-12-22T17:47Z,"  All Inception releases uplaoded by me are  retail source(including the full disc also),not russian.
   The movie was made that way with stronger contrast,i don't exactly am a huge fan of it,but that is just how the warner Bluray looks.
If u don't belive it ,go buy it
  Check blu ray review http://www.blu-ray.com/movies/Inception-Blu-ray/14492/#Review 

and you can notice the reviever opinion about contarst.."
,madeec,2010-12-24T23:15Z,"How the hell, that the most HD movies are so pixelated, i downloaded these times, as this one?"
,telep_man,2011-01-27T02:06Z,"Thanks for the reply, aoloffline, as well as for the uploads. The reason I was looking for a better (sharper) video is because I wanted to re-encode it and with this source it's almost impossible. Oh, well..."
,Aristokrat,2011-02-06T14:00Z,"Do you use Daemon tools to mount it? Because I cant get it to work with daemon tools, nor any other HD movie. Is there something I do wrong? Or dont daemon tools take HD movies?"
,Aristokrat,2011-02-06T14:11Z,"Never mind, find out that I can use VLC media player. "
