User Type,Username,Date,Text
,yotsimitsu2,2010-03-02T16:04Z,if this does not seed i will add a link where you can download the songs. please let me know if you need the link.
,reah2011,2010-09-16T18:33Z,"I'm seeding this, and i will keep seeding it. pretty much all day everyday. its a great abum, and everyone deserves it :D 

Audio = 10!! :-)"
,Mooniekate,2011-02-15T10:57Z,"Please seed this! Or, I'll take those links if I may."
,Mooniekate,2011-02-19T07:28Z,"Sorry for double-posting but, I've noticed that anywhere else I've found this album torrent, even renamed, it is really this torrent with the same trackers. I'm guessing that you spread the love. I still can't find any seeds, though... *sad face*"
,icko91,2012-05-04T12:12Z,"Can you post that link, please? My download is stuck. :E"
