Filename,Size,Unit
"/Gould, Glenn - 01 - String Quartet, Op. 1.wav",365.89,M
"/Shostakovich, Dmitri - 04 - Quintet for Two Violins, Viola, Cello and Piano in G minor, Op. 57; II. Fugue.wav",102.08,M
"/Shostakovich, Dmitri - 05 - Quintet for Two Violins, Viola, Cello and Piano in G minor, Op. 57; V. Finale.wav",71.12,M
"/Gould, Glenn - 02 - ``So You Want to Write a Fugue-''.wav",52.45,M
"/Poulenc, Francis - 10 - Aubade; VIII. Conclusion. Adieux et depart de Diane.wav",51.38,M
"/Shostakovich, Dmitri - 03 - Quintet for Two Violins, Viola, Cello and Piano in G minor, Op. 57; I. Prelud.wav",46.39,M
"/Poulenc, Francis - 06 - Aubade; I. Toccata.wav",27.85,M
"/Poulenc, Francis - 08 - Aubade; V. Recitatif. Introduction a la variation de Diane.wav",22.78,M
"/Poulenc, Francis - 07 - Aubade; II. Recitatif. Les compagnes de Diane.wav",19.05,M
"/Poulenc, Francis - 09 - Aubade; VII. Allegro feroce. Desespoir de Diane.wav",7.04,M
