User Type,Username,Date,Text
[T],The_Day_Walker,2010-09-24T19:58Z,"@ Everyone - HR is back! (^_^) 

http://thepiratebay.org/user/HolyRoses/"
[T],The_Day_Walker,2010-09-24T20:04Z,I am about to test Machete R5 and Predators R5.
,TwoLOUD,2010-09-24T21:59Z,THANKS! Funny movie.
,penguin1-1,2010-09-24T23:51Z,i'm back hey dude how are you have you been working on my stuff at all. just finished white collar. need something new
,TwoLOUD,2010-09-25T00:22Z,"greed is never a good thing, even online"
,xiphone,2010-09-25T04:02Z,Day walker could you do Chuck ?
,ritalin987,2010-09-25T06:04Z,"all i remember from this movie is, Daddy would u like some sausage? Daddy would u like some sausage? couldn't get the song out of my head for years every time somebody mentioned sausage, and its not the most hetero thing to sing to yourself in public, and its not like anyone else but me rented the fucking thing so nobody would understand what i was singing, fuck you tom green for sticking a faggy song in my head, fuck you"
,htctouch,2010-09-25T10:54Z,plz do PREDATOR R5 of Lap release . it have good sound
[T],The_Day_Walker,2010-09-25T17:21Z,"@ penguin1-1 - I am working on your stuff and other peoples too. I should have The Inbetweeners S02 up today.   
Here are some other stuff you might like -  
Nikita S01E01-E02 and I will upload E03 in a few hours.  
http://thepiratebay.org/torrent/5828403/%28Recommend%29_Nikita_S01E01_%28G1__PSP__iPod__iPod_Touch__iPhone__Zu/ 
http://thepiratebay.org/torrent/5840222/Nikita_S01E02_(G1__PSP__iPod__iPod_Touch__iPhone__Zune)/ 

I should have these up in the next 10-12 hours - Cougar Town S02E01, Undercovers S01E01, Sons of Anarchy S03E03, Weeds S06E05, The Big C S01E05, Nikita S01E03, Outlaw S01E02, Machete (R5).

I am downloading A Nightmare On Elm Street DVD and Predators 2010 BDRip XviD-iMBT.  As soon as I have Predators, I will test it on the PS3 to see if there are any audio problems before encoding the BRRip.  "
,MandieAC,2010-09-26T02:31Z,Can you try to get True Blood Seasons 1 & 2??
,One_Burnt_Potato,2010-09-26T04:19Z,"Predator is already up, no need for a second..."
,Movieman17,2010-09-26T04:56Z,@Daywalker When Are You Going To Get The Sleeping Dictionary
,xiphone,2010-09-26T05:07Z,"@The_Day_Walker

Could you do all the Resident Evil ?
And then Chuck Season 1 and 2?"
,haznii,2010-09-26T08:18Z,LOST & HEROES?
,pspmala,2010-09-26T09:27Z,"The_Day_Walker  please do the shield , also good to see  holy is back ."
