User Type,Username,Date,Text
[V],BLACKTROY,2010-11-16T03:04Z,LATEST VERSION 4.2.6.1
,carljen11,2010-11-16T05:23Z,"works perfect 
copy to destination folder and then patch
thanks"
,LeXX13,2010-11-16T11:12Z,"Hi, Blacktroy, thanx for your torrents.Unfortunatly i can,t download Vector Works 2010 which you had - only 54 percents, can you seed it any more please, i need it very much. I'll seed then as far as a can. "
[V],BLACKTROY,2010-11-16T13:15Z,lexx13 i will try and upload the link for you. i doubt if i can re-upload this torrent you asking for.
,LeXX13,2010-11-16T15:16Z,Anyway thanx for trying. Please write here if re-upload will not be able.
,LeXX13,2010-11-16T15:21Z,Anyway thanx for trying. Plrease write here if re-upload will not be able.
,Torent.Spy,2010-12-13T01:31Z,"thanks,this is good staff"
