User Type,Username,Date,Text
[S],WTCSWE,2009-07-22T20:43Z,Enjoy your new status..Keep up the good work!
[T],FatFreddy756,2009-07-22T21:01Z,"@ WTCSWE

hey man thanx a bunch for the new rank man! :)"
,Crittarz,2009-07-23T17:08Z,"So how do i actually run it? I've done the two steps and currently have 15 chapters worth of files in the exercise files.
Thanks"
[T],FatFreddy756,2009-07-23T17:43Z,"@ Crittarz

you run the videos with windows media player or VLC player"
,adforum,2009-11-26T12:37Z,DVD.isz? What the hel is this!!
[T],FatFreddy756,2009-12-02T06:24Z,"@ adforum

use UltraIso to decompress to .iso"
[T],FatFreddy756,2010-03-28T03:01Z,"To All Of My Awesome Supporters
---------------------------------------
At the end of this week I am stepping down from the gordsmash title and giving it to my pal. I want to thank everyone for supporting gordsmash and uploading my torrents to keep them alive! I hoped that everyone of you has enjoyed my torrents! I want to thank all of you for supporting me! Thank you all and goodbye!"
,buchike,2012-02-23T12:22Z,"whats the password?
thanks man and more power.."
