User Type,Username,Date,Text
,zxkb4s29,2010-01-28T10:47Z,fix what?
,koko-goal,2010-01-28T19:12Z,"Markuf, we trust your torrents, but fix what?"
,elma1337,2010-01-29T02:26Z,"probably cause he upped the same file that shows no seeds like 10 mins before this one, so this is the real one, the other one just a torrent gone bad ..."
,koko-goal,2010-01-30T01:42Z,"...and this one is PAL version.

Anyways, works niiiiiiiiiiiicely. Thanks Markuf and thanks to seeders.

Burnt via Imgburn (the latest one) at 4X. Sony DVD-R

Softmodded Wii. Neogamma R8 Beta 17 "
