User Type,Username,Date,Text
,target1950,2010-06-08T02:51Z,are you just so fucking lazy that you can't have an imdb link or something other than the obvious?
,inkwell765,2010-06-08T03:49Z,"No, just interrupted.those on here now. :)"
,andydvd,2010-06-15T04:14Z,"target, why slag off an uploader? Doesn't make sense to me. 
Thanks ink, my GF likes horror movies, so gonna d'l this and hopefully scare the shit out of her!"
,fumunga,2011-10-14T00:39Z,Sorry target1950 but your an idiot...Take care.
