User Type,Username,Date,Text
,dxnwo1,2010-11-22T10:47Z,"Gracias, thank you man, gonna listen to it and go buy it on tuesday, these are my fav"
,iGabriel88,2010-11-25T05:40Z,quality? 320kbps??
,jcvatv,2010-11-25T15:05Z,best album in the world. calle 13 is the best and is like no other
,lgr7468,2010-12-01T11:28Z,Y de aqui de mi Puerto Rico!!! Orgullo boricual!!!!!
,buches,2012-04-22T01:51Z,de lo mejor pana....thank you
,lichudlat,2012-05-02T22:59Z,"gracias por compartir, a mi mujer le va a gustar"
