User Type,Username,Date,Text
,sistromo,2010-01-26T23:51Z,As braindead as ever.
,tlist,2010-01-27T00:12Z,thanks for uploading :D
,BarrySoetoro,2010-01-27T01:23Z,"Yes, we know you are sistromoo.

Thanks for the update, however..."
,gordonl,2010-01-27T06:39Z,"Thanks for the upload.  Mark Steyn is great, and a fellow Canadian."
,gordonl,2010-01-27T06:47Z,"Why is this fellow sistromo commenting on his medical condition on a torrent site?  Is he looking for sympathy, or maybe ""free"" health care?"
,lewispatin,2010-01-27T12:44Z,that is the only word the ass knows.
