User Type,Username,Date,Text
,DeShon,2010-11-30T01:06Z,Any feed back on this?
,leechgod,2010-12-02T11:16Z,so many seeds and no comments?
,Campbellsville,2010-12-04T12:25Z,been looking for the adfree.apk thanks any one know how many of these will work on a htc hero?
,JaySin420,2010-12-04T17:24Z,Awesome collection +1
,ram82,2010-12-04T21:01Z,may i know how many applications works for htc blackstone..
,Comtech1234,2010-12-20T22:53Z,"Downloading, will post a review of your torrent as soon as possible.

Comtech"
,jimmybeam,2011-01-22T00:41Z,This is great! Thanks damo!
,rbourke1,2011-02-06T01:28Z,Kindly Upload The Talking Apps Talking Santa Rex Harry Larry Roby Thanks Alot Cheers? 
,badboiz18,2011-02-06T10:39Z,wow.. lots o apps.. picked out 3 lol
,royalcola,2011-02-17T22:35Z,Anyone know if EasyTether is the full version?
,hareas,2011-05-12T18:29Z,is it for xperia x10 mini
,lynei_marie,2011-08-20T07:33Z,how do i put these on my phone
