User Type,Username,Date,Text
,hotplugin,2009-10-04T08:53Z,could you please upload them in separate files
,jdredd2k,2009-10-05T00:12Z,Thanks for all your efforts can't wait to get this one download. Looking forward already to vol5
,baka37,2009-10-08T22:37Z,Thanks man! You're doing a great job!!  Looking forward to the next one@!!
,thox90,2009-10-14T18:16Z,Thank you!
,Mindup,2009-10-15T00:52Z,Is it with sound this time? I really would appreciate that! =)
,hulud86,2009-10-15T09:11Z,"Yes. These are actual downloads from the site, unlike the ones without sound. Full quality here."
,john5246,2009-11-09T05:45Z,"thanks for this so much!!

Can't wait for vol 5

1-3 there were like 2 good videos the rest sucked"
,eth0s,2009-11-15T03:36Z,thx for upload keep it up!
,baka37,2009-11-16T02:25Z,Thanks for this!  Was just curious when you gonna upload vol.5 cause you said you would do it late october?  Thanks!!
,iArchonius,2009-12-10T21:50Z,Vol.5 coming soon =) ?
,legoanders,2009-12-12T02:09Z,hulud86 are u still alive? whats about volym 5? :)
,hulud86,2009-12-29T05:09Z,Okay guys. Volume 5 will be uploaded soon. I promise! Expect it within a week at the latest. I've been having issues with uploading to the pirate bay but ill get it up soon.
,jdredd2k,2010-01-04T23:49Z,Vol5 ..... looking forward to it thanks for the update. Happy New Year
,MrSack4,2010-01-11T07:44Z,waiting anxiously for volume 5 mate
,McFinnigan,2010-01-15T09:58Z,Cant wait for Volume 5 :D
,hulud86,2010-01-18T04:02Z,Volume 5 is now up!
