User Type,Username,Date,Text
,danikilltec,2010-01-01T09:38Z,"Thanks, seed !!!"
,dj_mm,2010-01-01T15:54Z,"Thx man! That's quick! Just released and already available :)
Seed dudes! Safe d/l!"
,skylamer,2010-01-01T17:46Z,gjm an
,d6mcd,2010-01-02T16:49Z,Thanks a lot mate. All good.
,Sickpup120,2010-01-03T18:47Z,"Thanks, the first serial i tried worked and i was able to update and turn on protection module but i have a question, will the serial i used eventually get blacklisted?"
,Ahmed1337x,2010-01-03T23:24Z,"Maybe but don't worry, every new version that I see I will upload with new codes if the codes got blacklisted"
,SuperGanjaman,2010-01-05T12:57Z,Works a treat cheers Ahmed
,john426m,2010-01-07T15:19Z,Thanks Ahmed!
,lampa023,2010-01-18T18:06Z,Thx man! 
,sam123456789,2010-10-02T08:36Z,"thnx ahmad,worked like a charm."
