User Type,Username,Date,Text
,sereminar,2010-12-23T05:46Z,"I,m new to this, so can you please tell me why it says that X3DAudio1_7.dll is missing, and how to fix this problem, no one else commented on it, so i feel kind of stupid, but any help would be greatly appreciated."
,Willy_B,2011-01-01T13:05Z,"This shit doesn't work!
""X3DAudio1_7.dll is missing"" error.
Test your stupid torrents before upload >_"
,Drymarro,2011-02-10T07:01Z,stop being fucking idiots. just download the dll file.
,Yahoozaaa,2011-02-20T19:25Z,"Re-install NVIDIA PhysX (included in the release) and/or run as an administrator for Dindows7 users.
Runs like a charm."
,pitchshifter77,2012-04-24T22:54Z,installing nvidia physx resolves the problem
