User Type,Username,Date,Text
,Jasper100,2009-10-02T16:20Z,people there is a bug: the keygen is not included! so i edited the discription by adding some gererated keys you can use!
,ramerudaj,2009-10-03T07:21Z,"what are forward translation? How much Ghz do I need?
ask for a response. thanks"
,Jasper100,2009-10-03T09:56Z,see the description^above
,GunnerFabri,2009-10-03T12:07Z,"Seed plz! It's f*cking slow!
Gaat verdomd traag!"
,Jasper100,2009-10-03T12:42Z,"geduld is een schone zaak mijn vriend, HIJ ZAL VOLTOOIEN want ik seed de hele tijd al!"
[V],Mbb15,2009-10-03T12:45Z,"thisone have seeds: 
http://thepiratebay.org/torrent/5105778/FIFA_10_dutch_english_french_german_italiano"
,tumtum100,2009-10-03T17:24Z,"Please seed nobody is doing it

alsjeblieft wil je seeden niemand doet het "
,Jasper100,2009-10-03T19:22Z,"I'm seeding just be patients i will seed forever so don't be afraid!

cheers! and Mbb15 don't spam with your torrent over here right?!"
[V],Mbb15,2009-10-03T20:12Z,"woow na 2 dagen al 28%!
and spam? denk je egt dat dat wat uit maakt op TPB?"
,ramerudaj,2009-10-03T21:21Z,"I have CPU: INTEL CORE 2 DUO PROCESSOR T8100, TECHNOLOGY 2.1OGHz. 
I can play the game on my VAIO?"
,Jasper100,2009-10-03T21:32Z,"to make sure go to http://canyourunit.com/
select fifa 10 and click on canyourunit then install the plugin and see the result!

btw. if the test fails because of your os: windows 7 and all other factors did go trough you can run it the test doesn't support windows 7 yet!"
,lamela,2009-10-04T11:59Z,hey someone pls answer me. where or how can i get the razor 1911 directory? its needed to run the game. =(
,Jasper100,2009-10-04T13:37Z,"what do you mean exactly? the crack is in the CRACK+KEYGEN map in this torrent other wise you can get it here: 

mega-upload_com/?d=QDNSODE4

change ""_"" to ""."" and delete ""-"""
,yaqwsx666,2009-10-04T19:43Z,System Requirements link: 	http://gamesystemrequirements.com/games.php?id=911
,sallavacis99,2009-10-04T21:25Z,"Jasper100
Is this in italian_
I mean the audio comentary"
,Jasper100,2009-10-04T21:43Z,yes this is Italian also commentary!
,Bosniejer,2009-10-06T19:11Z,"Ik heb alles geinstaleerd en als ik fifa10 wil opstarten krijg ik nog wel dat logo van Razor1911 met dat TE vette muziekje. En dan wordt mijn beeld zwart. Dus ik denk die start zich op. Maar dan kom er zo'n balkje met fifa10.exe. werkt niet!!

Wat the hell moet ik doen!?!?!?"
,Jasper100,2009-10-06T19:29Z,"ga eens naar: http://canyourunit.com/
selecteer fifa 10 en klik op canyourunit?
installeer nu de plugin en kijk of jouwn pc fifa 10 aankan! niet? kijk dan of je windows 7 hebt? niet? dan heb je pech! ja? zie dan of er verdere computer onderdelen niet door de test komen! ja? dan heb je ook pech! nee? dan kan je pc fifa wel aan!"
,Turbodave222,2009-10-06T20:34Z,"how do i seed :)? 

i got this torrent on 74,4 % now. i'm using vuze, how do i seed it? then i will seed also"
,Jasper100,2009-10-06T20:37Z,if you upload you seed ! probably the upload speed will stand next to the download speed! see if you upload and you seed! when you finish you just need to let the torrent stand in your client and it will upload so seed!
,sallavacis99,2009-10-06T21:35Z,"The Bay heaven is back. I thought it woud be down for ever,
Jasper, there are no seeds, I got little download from leechers?"
,Turbodave222,2009-10-06T22:26Z,"i'm at 80,2 % atm, and having quite good downloadspeed, around 200 kb...

Earlier this morning i had 1 MB, but it hasnt lasted that long :("
,Majestick89,2009-10-07T00:37Z,"Hey man is this working allright because I downloaded 2 other versions already and the graphics are crap! looks more like fifa 2001 to me. My pc can easily handle the game and should have no problems with the graphics, so I reckon it's just the game that's causing the problem.. I was just wondering if anyone has yet played the game and can confirm that this one's graphics are good, or maybe tell me what I'm doing wrong :P"
,Jasper100,2009-10-07T16:14Z,@Majestick89 this version is not more special than the others so if you have some problems it must be your computer!
,ramerudaj,2009-10-07T17:45Z,"wiso I can not play this game, my Vaio has the necessary prerequisites in order to play this game. I install everything as soon as the game itself loads, then restarts gehts not continue and my notebook? Can someone help me?"
,Jasper100,2009-10-07T21:15Z,can you run other games like the sims?
,Agadus,2009-10-07T23:39Z,"Ik heb hem net gedownload en je instructies gevolgd. Toen verscheen automatisch het FIFA10 pictogram op mijn bureaublad, net zoals je schreef. Maar als ik daarop klik, krijg ik een soort van MS-DOS schermpje, 1 seconde, in beeld en daarna niks... Wat nu?"
,Agadus,2009-10-07T23:41Z,"I downloaded it and followed the instructions. Then the FIFA 10 pictogram appeared at my desktop, but when I click it, a kind of MS-DOS screen appears and disappears in a second. Does someone know what I have to do?"
,Jasper100,2009-10-08T08:00Z,search the internet with google and maybe you find something!
,wesley_feyenoord,2009-10-08T19:29Z,"hey jasper100

ik heb het gedownload en ik heb het geïnstalleerd,
maar als ik het opstart staat er:
plaats de originele cd er in.
Ik weet dat je nog een programma moet downloaden voordat je fifa kunt spelen.
Maar ik weet t niet meer.
Weet jij het??
Laterz"
,Jasper100,2009-10-08T20:07Z,"je moet de crack kopiëren!
begin bij stap 3 in de beschrijving van deze torrent!
hopelijk kan je engels!"
,wesley_feyenoord,2009-10-08T21:41Z,"nee niet egt.xd
wil je me efe mailen
wesleybhajan@hotmail.com"
,wesley_feyenoord,2009-10-08T21:45Z,ik heb het vertaald naar NL maar hoe bedoel je ga terug naar crack+r ?? moet je terug gaan naar waar je t gedownload hebt?
,Agadus,2009-10-08T21:51Z,"Jasper100, ik heb op google gekeken, maar word daar niet veel wijzer van eerlijk gezegd. Heb je geen suggesties?"
,Jasper100,2009-10-10T09:49Z,@wesley_feyenoord ga terug naar de map crack+keygen (die map in de gemounte dvd)
[V],Mbb15,2009-10-17T01:11Z,jasper waarom hebbie me nou 'aangegeven' op suprbay? beetje kinderachtig voor iemand van 100 heh? voortan niet zo achterlijk doen joh
,sallavacis99,2009-10-18T12:05Z,"It works, but its an awful game, PES2009 far better,
They`re putting good marketing in this shit.."
,wesley_feyenoord,2009-10-21T15:44Z,"@Jasper100,hoe bedoel je in de gemounte map?
ik zie die map nergens staan."
,wesley_feyenoord,2009-10-22T14:10Z,Hij doet t al
,wesley_feyenoord,2009-10-24T03:45Z,"Jasper100,

Fifa 10 doet het:D
Alleen hoe kan je de commentaar in t Nederlands zetten??

Laterz"
,assie1978,2009-11-02T08:53Z,Dank je wel! Hij doet het perfect!
,Jochem1991,2009-11-07T19:02Z,"Hoiii Jasper.

Als ik FIFA10 heb geïnstalleerd dan vraagt ik of ik FIFA MANAGER wil downloaden ofzo. Ik vind dat ding aan, en klik dan op OK! Alleen dan valt me PC uit.

Wat moet ik doen?

Gr. Jochem

(add me even msn, als je wil natuurlijk: jochem_gamer@live.nl"
,Jasper100,2009-11-09T16:15Z,"download manager hoeft niet aangevinkt te worden, als dat jouw probleem oplost top! niet dan kijk even of jouw pc geschikt is voor fifa op http://canyourunit.com/
en selecteer fifa 10 installeer de plugin en zie of je fifa wel eens kunt spelen!"
,jacco95,2009-11-13T18:28Z,"hey jasper, ik heb dit gedownload door een virtuele schijf met poweriso en ik heb alleen maar problemen:

- ik kan die 2 bestandjes bij stap 3 helemaal niet kopiëren ivm. alleen lezen ofzo
- ik ben hier heel erg slecht mee(met computers)

als je me kunt helpen, wil je dan aub. even wat extra hulp mailen naar: jaccobreedijk@hotmail.com
alvast bedankt"
,Jasper100,2009-11-14T22:01Z,het kan zijn dat jij de torrent nog niet helemaal binnen hebt? check dat even! wel dan kopieer de iso en plak hem bijv. op jouw bureaublad en mount hem met daemontools vanaf daar! problem solved?
,EHV-Hools,2009-11-15T21:01Z,"Hey Jasper. Ik heb alles precies gedaan zoals het beschreven stond, het leek ook goed te gaan. Maar als ik de snelkoppeling van FIFA10 op m'n bureaublad open, krijg linksboven 1seconde een zwart schermpje te zien, wat dan verdwijnt. En het spel start niet op. Hoe kan ik dit probleem verhelpen?"
,Jasper100,2009-11-16T20:07Z,"of je hebt de crack niet goed gekopieerd of je kunt fifa 10 niet spelen op je pc check dat even op 

http://canyourunit.com/"
,tokkiet,2009-11-24T19:54Z,"ziet er netjes uit, ik zal m is ff uittesten ;)

en natuurlijk seeden als een malle

alvast bedankt :D"
,tokkiet,2009-11-25T10:05Z,"gedownload en geïnstalleerd en hij doet het:D

bedankt! En ik zal seeden"
,Nuraino,2009-11-27T23:21Z,De autorun werkt niet of wel? Ik bedoel dat hij niet automatisch opstart.
,Jasper100,2009-11-30T16:42Z,"moet je gewoon ff proberen, niet? dan gewoon via windows verkenner openen!"
,tijmen31,2009-12-04T21:27Z,"Hey guys, I just downloaded this torrent. went with an average speed of 150 kb/s taking me about 24 hours for the full download. Crack is included as stated the keys can be found in the edit.. for the rest no virusses or what so ever.. anyway still installing will let you know once I got it up and running"
,tijmen31,2009-12-04T21:35Z,"Okey, got it up and running.. posted the 2 files in CRACK KEYGEN folder into C:/Program Files/EA Sports/Fifa 10 folder.. worked perfectly... all honorz to jasper 100"
,Osman5314,2009-12-06T14:29Z,"Jasper wil je me toevoegen ik begrijp het niet :
osman_galata@live.nl"
,Osman5314,2009-12-06T14:30Z,Ik heb alles gedaan wat je zegt maar er komt steeds dat ik de orginele cd erin moet stoppen wil j met dat uitleggen alvast bedankt!
,MI111,2009-12-11T16:38Z,"ik vind nergens crack+keygen
kan iemand mij aub helpen "
,ryandezwart,2009-12-11T19:20Z,"ik heb het gedownload en geinstalleerd maar hij geeft aan plaats originele dvd enzo bla bla bla en dan moet je moet kopieren in program files maar daar staat geen fifa 10???

mail anders ff naar wesley-bakker@hotmail.com"
,rst123456,2009-12-14T12:41Z,"is this display config enough for runnin this game



Name	ATI RADEON XPRESS 200 Series
PNP Device ID	PCI\VEN_1002&DEV_5A61&SUBSYS_2A31103C&REV_00\4&1CF2FBB4&0&2808
Adapter Type	ATI RADEON XPRESS 200 Series (0x5A61), ATI Technologies Inc. compatible
Adapter Description	ATI RADEON XPRESS 200 Series
Adapter RAM	256.00 MB (268,435,456 bytes)
Installed Drivers	ati2dvag.dll
Driver Version	6.14.10.6571
INF File	oem3.inf (ati2mtag_RC410 section)
Color Planes	1
Color Table Entries	65536
Resolution	1024 x 768 x 60 hertz
Bits/Pixel	16
Memory Address	0xD0000000-0xDFFFFFFF
I/O Port	0x0000D000-0x0000DFFF
Memory Address	0xFEAF0000-0xFEAFFFFF
IRQ Channel	IRQ 17
I/O Port	0x000003B0-0x000003BB
I/O Port	0x000003C0-0x000003DF
Memory Address	0xA0000-0xBFFFF
Driver	c:\windows\system32\drivers\ati2mtag.sys (6.14.10.6571, 1.25 MB (1,313,792 bytes), 8/13/2005 9:35 PM)"
,guusclephas,2009-12-14T16:45Z,"hoi jasper 
kun je voor mij alleen de crack erop zetten heb namelijk wel het spel al gedownload met crack maar die crack werkt niet"
,ryandezwart,2009-12-20T15:51Z,het is mij gelukt. de namen van de crack bestanden moet je in de map van het spel zetten dan op fifa 10 of fia 10(2) paar keer klikke hij geeft aan dat de originele dvd er in moet maar je moet ff 20 sec wachten dan start het spel gewoon ;)
,triqvinden,2009-12-31T13:59Z,"Lol are you kidding !??!!??!?! This shiit is not fifa 10 its some old fifa so people dont dowload i did and when i start it , it was some crap i couldent even find La Liga and when i started to play the grafic suckt , diss shiit is not fifa 10 !"
,chris291068,2010-01-03T10:47Z,"dont download fifa it looks so cheap and nasty , download pes 10 , much better graphs and playability . But this download works perfect and respect to the uploader and dont forget to seed"
,redbull58,2010-01-04T23:21Z,"it works 
thanks "
,Planetmars,2010-01-06T20:28Z,"Fifa 10 werkt gewoon helemaal perfect!!!

Gewoon de handleiding volgen zoals Jasper deze heeft geschreven en niks aan het handje!

Alleen jammer dat Fifa 10 opstart met een Razor intro. Kan dat nog verwijderd worden?

Thnx voor de upload!!!

Gr, Planetmars."
,Jasper100,2010-01-17T16:00Z,"Nee helaas kan de razor intro er niet uit worden gehaald (het is namelijk verbonden met de crack).

People just read the description. "
,feytokkie,2010-01-31T22:54Z,"Hoi jasper,
allereerst dank voor je upload.
ik loop echter tegen hetvolgende aan:
Bij stap 2 staat er dat ik naar de download moet bladeren (Maar hij vindt de download niet als ik naar de map toega waar de download in staat)!

Kun je me hiermee helpen?

Alvast bedankt"
,Jasper100,2010-02-02T20:54Z,"Ja, dat weet ik ook niet 123. Je moet gewoon jouw utorrent map hebben!"
,omer1234,2010-02-05T16:18Z,ey mensen als ik fifa 10 opstart dan komt elke keer dat ik directx 9.0c moet downloaden maar dan heb ik al 80 duizend keer gedaan wat nu
,remcofeyenoord24,2010-03-11T19:08Z,hee jordy zou je me even kunnen vertellen hoe het nou precies gaat want ik krijg een zwart scherm in het middden en dan gaat alles weg en doet het spel niets meer. Ik krijg een zwart leeg scherm...
,remcofeyenoord24,2010-03-11T19:11Z,Ik bedoelde natuurlijk jasper sorry...
,Heibewoner90,2010-03-16T00:10Z,"Jasper,
Ik heb de game gedownload, en verder alle instructies gevolgd zoals beschreven.

Ik klik op de snelkoppeling en krijg het mooie Razor logo + nintendo tune. 
Vervolgens verdwijnt dit logo en komen er geen verdere handelingen van de computer.

Ik heb nogmaals de crack gekopieërd om te kijken of het hier aan lag, dit mocht niet baten.

Toen ben ik op canyourunit.com gaan kijken, en mijn computer komt er lachend doorheen.

M.a.w. wat is het probleem? Want ik heb alles uitgevoerd zoals staat beschreven. 

Maar er schijnt toch iets te zijn waardoor die op het laatste moment af haakt?! Ik heb trouwens windows 7, is die daar niet compatible mee?"
,julien96,2010-03-20T20:42Z,"he ik heb een vraagje..
als ik fifa 10 opstart zie ik het middelste deel van het scherm heel klein. ik heb al van alles geprobeerd met resolutie enzo maar hij blijft klein.
heeft iemand hier een oplossing voor?"
,jopvr,2010-06-04T14:07Z,"Ik heb het gedownload, en geinstalleerd, maar nu kan ik nergens de map vinden waarin de crack+keygen staat!"
,swaggerboy,2010-06-17T20:36Z,"hallo Jasper
ik heb alles gedownload, maar ik weet niet waar de Crack + Keygen dir staan.
ik kan hem maar niet vinden.
als ik fifa 10.exe start staat er: onjuiste cd/dvd geplaatst
kun je me helpen?

alvast bedankt"
,swaggerboy,2010-06-17T20:47Z,"hallo Jasper

laat maar zitten
ik heb het al gevonden
goede zaken man ;)
ik ben nu bezig met uploaden

bedankt man"
,larst46,2010-07-01T08:20Z,i dont get an dir CRACK+KEYGEN i only get the iso when i download???
,Valerioo,2010-07-05T14:57Z,"Hee Jasper,

Ik heb hem gedownlaod, maar nu zegt ie dat ik dirysock.dll niet gedownload heb, weet je hoe ik dit op moet lossen?

alvast bedankt."
,miltenbizzle,2010-07-26T13:49Z,"hey jasper, i am downloading right now.
with an speed of 360 kb per second.
thanks everyone for seeding!

didnt really saw a comment that said this game runs as it is supposed to. but hell.. i'll just give it a trie, you seem someone who can be trusted.
thanks again
greetz
miltenbizzle"
,miltenbizzle,2010-07-26T16:08Z,620 kp/s at the moment!
,miltenbizzle,2010-07-26T18:16Z,"graphics are like shit :S
wtf. it looks like fifa 2001 or something.
and graphci settings are at highest 
and its not my computer.. "
,jeffrey538,2010-09-06T17:07Z,"I'm downloading right now, I get 3.4 MB at the moment, thanks!"
,dennieboy,2010-09-28T16:13Z,"I get 2,2 MB´s! hope it will work"
,pirateman247,2010-10-21T18:20Z,"Hey Jasper, I have this one little problem.....ok I download it and install it correctly but then i posted the crack + keygen in the directory and when trying to play it only view the razor 1911 logo and it doesn't start.....10x for the assistance man !!!!"
,pirateman247,2010-10-21T18:22Z,"Hey Jasper, when I try to play the game it only views the razor 1911 logo....what should I do ???
by the way thx for assisitance !!!!"
,sahu12,2011-04-26T12:03Z,Will Intel(R) G33/G31 Express Chipset Family Graphics card work for this game??
,Ryaaan43,2011-05-06T12:05Z,Thank you verry mutch bro !
,LukasBoy35,2011-06-16T15:57Z,"I downloaded it, but now my computer aks for an original cd/dvd as I open the game "
,rosf98PSP-Fanatik,2011-08-08T12:34Z,Awesome!I download it with 2.6 MB/s.
,joy0207,2011-09-25T04:32Z,PLS SEED!!!PLSSSSS I NEED IT BADLY!!!
