User Type,Username,Date,Text
,coqlom,2009-11-18T13:43Z,do you need to jailbrake the iphone to use that file . if not thank you very much for that
,kikkomana,2009-11-18T23:25Z,"I'm wondering the same, do I need a jailbraked phone to use this software. How do I get it to my iPhone?"
,kikkomana,2009-11-19T02:26Z,"I just jailbreaked with blackra1n and installed Cydia, and installed Appsync for OS 3.1. Then I restarted the iPhone. Put the downloaded file in iTunes and synced, worked great!"
,confused.com,2009-11-27T19:36Z,New 1.2 available now see my fast download links torrent
,hollander92,2010-01-20T14:31Z,all urls won't work
