User Type,Username,Date,Text
,chubalz,2010-01-03T15:41Z,"Hi Big-dude!

Can you upload Ps2 Street Fighter Ex-3 NTSC? 

Thanks.

Godbless Always!"
[V],Big_dude,2010-01-07T13:32Z,"Can't upload sfex3 to dvd build crashes games.

some ps2 cd games cannot be rebuilt to dvd.

you can find the cd version here just search for it."
,stealthpatch,2010-01-13T06:59Z,"Dude, thanks for the upload. I've been looking for a good fishing game for PS2 for some time now. I say it was worth the wait.

Great game. Stunning graphics. Great gameplay."
