User Type,Username,Date,Text
,DrDumb,2009-11-13T03:46Z,"Hi all, how about a little thank you for all this time we put in to bring you these shows? Maybe a comment or two. "
,go_yukuri,2009-11-13T06:37Z,Thank ya sir.  Always appreciated!
,go_yukuri,2009-11-13T06:39Z,"Havin' a time and adding another thanks to show my appreciation doubly! (Not sure if that's a word).

Merci."
,leykial,2009-11-13T06:56Z,Love your efforts Doc!  You're a real American hero.:)
,A7pha,2009-11-13T21:48Z,Great upload Thanks for the dose Doctor Dumb
,mickfury,2009-11-17T09:27Z,Thanks budday
