User Type,Username,Date,Text
[V],Nepotu,2010-04-29T17:42Z,It's the last day of my seeding if no one else is interested in it. Sorry! 
[V],Nepotu,2010-04-30T14:53Z,If anyone wish to download this and it doesn't find any seeder please write me a comment and I will see what I can do! 
,chestamcnasty,2010-05-13T23:41Z,seed pleaaase!
,zenicaone,2010-12-04T23:04Z,"which language is the commentary
Spanish as I presume ?
I will wait for eng commentary version to appear but thank you very much for uploading this"
