User Type,Username,Date,Text
,Morpheus009,2010-07-26T00:44Z,"Ten times more leechers then seeders, bravo. And most of the leechers are american i see."
,TTKGoogle.dk,2010-07-26T02:01Z,Awesome..
,j-d-uk,2010-07-26T02:51Z,"Amazing that Bugatti Veyron SS, maxing out at 267MPH, now the fastest production car ever built and allowed on the road!

And Tom Cruse in a reasonably priced car too, what a fucking cunt he is and he gets first place on the leader broad as well!"
,j-d-uk,2010-07-26T02:53Z,Them American bastardos have been leeching shit for years!
,Chikist,2010-07-26T05:31Z,"its like ure not leeching right now >.<
ive been dling forza 3 for like 5 days now, and seeded 3 times more then downloaded..."
,pooloop,2010-07-26T06:20Z,"just ****off it is free you sad b*****d,no more needs saying,,,,,,,,,,,,,,,"
,download-man,2010-07-26T08:48Z,"Excellent video and audio, great show. Downloaded in less than half an hour and speed ranged from 170kb/s to 800kb/s. Recommended!"
,dantis1,2010-07-26T10:02Z,"Many thanks, d/l in 15 minutes at 600 kb/s."
,duxs,2010-07-26T17:32Z,Thank you for this...I wouldn't have seen this episode in Canada for years. Thank you again...
,pooloop,2010-07-28T06:44Z,"i comment 3 days after my last one,and THREE real people speak,i would say that these three people are the REAL SEEDS THAT MAKE 2P2 WORK,and others do seed,but i find the ones that cry seed,are the ones that dont,after they get what they want,i could do this but this guy is way too fast,and his quality is top,there will be the same crap again next week,,seed and all that crap....thank you is easier too type.............."
,Stuhank,2010-08-12T02:17Z,"Hey I'm one of those Amercian Bastards and I happen to love this show. Call me what you like I seed I watch and if you can't deal with that then to put it in proper English for you ""Piss Off""..."
,bigdfox,2010-09-06T09:23Z,stop complaining about american leechers at least you can watch current episodes on tv we have to pirate them off the internet
,Booo(-_-)mmm,2011-01-20T14:34Z,Thnx a lot...:)
