User Type,Username,Date,Text
,bhailog,2010-02-11T09:13Z,"I have a request, can you please get ""My Wife and Kids"", it will be much appreiciated"
[V],twentyforty,2010-02-11T10:29Z,"@bhailog: Oh my dear... 5 seasons.... over 100 episodes?

Nope, I'd need a year for that.

But, IF there is no torrent for this (what I doubt very much) you can drop me your secondary, some provisory e-mail address where I can send you a list of direct links to all 5 seasons."
,lilars26,2010-02-11T12:15Z,Thanks for the small size nip/tuck 20/40.Yours are the only ones I've ever seen.
