User Type,Username,Date,Text
[V],GoodFilms,2010-11-27T15:38Z,More extras: http://thepiratebay.org/torrent/5990493/Avatar.2009.EXTRAS.Pandoras.Box.720p.BluRay.x264-HiS_beAst
,a_Meanie,2010-11-27T16:09Z,is this like extra scenes that r not in the extended cut?
[V],GoodFilms,2010-11-27T16:21Z,Read what is says above. It is mostly previously unseen material.
,X3MEX,2010-11-27T17:07Z,let me rephrase; are any of these deleted scenes get included in the extended cut?
[V],GoodFilms,2010-11-27T17:47Z,"Read what is says above. ""the runtime is roughly 68 minutes, but only 45 minutes is new."" That is 45 minutes of of material that was not included in any cut. I hope this is clear enough for you..."
,tbone3181,2010-11-27T19:41Z,"eople are getting more and more stupid on this site. its fair enough to comment and ask questions if there is no info on the torrent but for fucks sake READ THE FUCKING DESCRIPTION. its much quicker than writing a comment and waiting for a response, DUMBASSES!!!"
,prank0007,2010-12-18T14:53Z,"thnks 4 this
can u do step up 3d bluray extras..........plz"
,kringo87,2010-12-27T21:01Z,"Can someone please help me? I'm seeding disc2 and 3 over a month, and I can’t use the subtitle watt is inside. Using KMPlayer and it wouldn't show any subtitle. If anyone can tell me how to use or if it's possible upload it. Many many tanks!
Sorry for my english:D"
