User Type,Username,Date,Text
[T],zombifuzz,2010-06-22T13:25Z,i hate to break this to you but every single one of these torrents has been uploaded by me months ago.  you are wasting your time man.  and that sucks.
,xNOxCLITSxINxTHExPIT,2010-06-22T19:03Z,"haha yeah i see you really know what your doing.
but i just started last night so ill be upping other shit later to come. "
[T],zombifuzz,2010-06-22T23:32Z,"well thats good.  i hope to find some stuff i'd like in your collection.  seems we have the same exact taste which is awesome.  

its nice to see someone else appreciates this genre of music as i do!"
,xNOxCLITSxINxTHExPIT,2010-06-23T06:53Z,"yeah man. i looked through your upps and you got everything i like hahaha.
and fuck yeah i love this music, can't live without it.
gotta have a wide taste!"
[T],zombifuzz,2010-06-24T22:16Z,absolutely.
,hardc0re_kid,2010-09-17T03:56Z,Any possibility of getting Haste the Day Pressure the Hinges Special Edition DVD on here. It is posted no where.
