User Type,Username,Date,Text
,kabsat,2010-07-20T15:23Z,"Confirmed and Its working great! No virus

THANX for sharing man!"
,lasgraffitas,2010-11-03T15:08Z,don't dowload... its full of some crap that freezed my computer...
,omikrone,2011-05-05T21:03Z,plase SEED !!!! plzzzzzzzzzzzz i need this game !
,omikrone,2011-05-05T21:04Z,plese seed ! plzzzzz
,omikrone,2011-05-05T21:05Z,seed seed seed seed seed seed seed seed seed seed seed seed seed seed seed seed seed seed seed seed seed seed seed seed seed seed seed seed seed seed seed seed seed seed seed seed seed seed seed seed seed seed seed seed seed seed seed seed seed seed seed seed seed seed seed seed seed seed seed seed seed seed seed seed seed seed seed seed seed seed seed seed
