User Type,Username,Date,Text
,Erocy,2010-04-04T00:30Z,"33 GB, omg"
,frank2009,2010-04-04T00:57Z,Yes Sorry... However there are  over 350 working Games and a few strategy Guides for good measure.. Hope you enjoy them as much as i have creating this torrent.
,leather522001,2010-04-05T22:23Z,"Could someone please seed!.
I've been trying to download 3 items and it has taken 12hrs to get 12mb!!!"
,frank2009,2010-04-06T03:25Z,Hi Leather I am seeding but there are over 118 leechers.. Says that there are 2 seeders and i feel i am the only seeder online 24/7
,thenosam,2010-07-28T19:25Z,"2 seed 31 peers  and im  seeding at  100kbs  approx 
well looks like this is gonna  be a long week lol 
but  well worth it all at the end 
hope we just  can get more seeders tbh "
,serenity1992,2011-06-12T20:40Z,this torrent comes with Trojens. i just had to remove 4 of the games so far.
