User Type,Username,Date,Text
,jollie1,2009-09-16T01:46Z,my anti-virus said there was a virus in this programme.
,enaam,2009-09-16T07:52Z,besides the virus warning. After cleaning it up it wont install properly. Any solutions?
,basha04,2009-12-07T05:50Z,the uploader is in the trusted group of pirate bay and yet the first 2 comments saying there's a virus on his upload. what gives?
,khiya98,2010-03-07T06:16Z,"whats wrong with this? TRUSTED? though a software with a virus... com'on
your accounts name 'ProDvDRipper'
i guess your good at dvd rips "
,ZackFairFF7,2012-04-17T19:03Z,"Virus found Win32.Induc, that it only infects Delphi 4 - 7 and no other programs or executables.
When you compile you exe will be infected.

http://www.gsa-online.de/products-delphi_induc_virus_remover.php"
