User Type,Username,Date,Text
,away1,2010-03-23T00:57Z,"Ik zag dat er ook al een anonieme release met dezelfde naam is. Niet downloaden zou ik zeggen!

Deze is echt!"
,balleboy,2010-03-23T13:07Z,"Ik zag dat er ook al een anonieme release met dezelfde naam is. Wel downloaden zou ik zeggen!

Deze is Wel echt! Muppert"
,zigster123,2010-03-23T17:14Z,en bedankt maar weer
,away1,2010-03-23T18:30Z,"@ balleboy

Ik heb die andere even gedownd en inderdaad, hij is echt.

Nu ben ik alleen even de draad kwijt. Ik was mij er namelijk niet van bewust dat er hier een soort wedstrijd gehouden werd. Had ik dat geweten dan had ik namelijk niet meegedaan (ik hou niet zo van dit soort wedstrijdjes).

Ik ga er nu echter vanuit dat jij, snel als je bent, het stokje overneemt. Kan ik weer fijn andere dingen gaan doen :)

Ik zou het echter wel op prijs stellen als je de volgende keer ook het onderscheid duidelijk maakt in de titel en de tekst hier op de P-Bay, zodat je in ieder geval niet de indruk wekt dat de release uit dezelfde stal komt."
,Ch4osSh4dow,2010-03-23T18:40Z,kan je dit ook branden op een dvd met menus en ondertitels zegmaar ? wat voor dvd zou je aanraden en programma om te gebruiken ? 
,balleboy,2010-03-23T19:59Z,"away1

Het gaat hier niet om een wedstrijd ?? ik was je net even voor,en ik had inderdaad even de titel van U overgenomen (net zo makelijk) maar daar hoef U toch niet zo moeilijk over te doen?? en gelijk lopen ****** dat het fake is...Maar tja zo zie je maar weer,ik doe het ook maar voor ieder die zo graag de Serie snel willen zien..

Gr @balleboy"
,joep1234,2010-03-26T23:24Z,komt er nog n dvd 4?
,Justdaany,2010-03-28T13:25Z,"Hoe werkt dit jongens?
Ik heb een Mac thuis staan, maar weet niet waar ik deze bestandjes die je krijgt bij deze torrent in moet verweken...
Iemand? Help? :)"
,away1,2010-03-28T22:34Z,"@ Justdaany:

Het zijn VOB bestanden, precies zoals ze op DVD staan. Je kunt ervoor kiezen om hiervan een DVD te branden met bijvoorbeeld NERO. Je kunt er ook voor kiezen om 'm op de PC te bekijken met bijvoorbeeld NERO Show Time of PowerDVD."
,away1,2010-03-28T22:37Z,"@ joep1234:

Ja er komen nog volgende DVD's. Die komen echter pas als er telkens drie afleveringen zijn uitgezonden (in de U.S). Dat betekent dus dat je DVD4 ergens in week 15 kunt verwachten."
,joep1234,2010-03-28T23:58Z,"ke tnks

dan moet ik nog even wachten helaas"
,Jordihintzen,2010-03-29T17:37Z,"Bedankt, is het bekent hoeveel afleveringen en totaal gaan komen?"
,handelaar,2010-04-02T14:29Z,"we kijken allemaal uit naar dvd4 met de volgende 3 afleveringen en hopen ze hier weer te vinden.
91 seeders en 144 leechers, mag je wel stellen dat deze serie erg in trek is."
,handelaar,2010-04-06T10:20Z,dvd 4 is sinds gisteren op enkele sites al gepost deze worden nu ingedeeld met 2 delen dus dvd5 krijgt ook nog 2 delen en dan is de serie compleet.
,Jordihintzen,2010-04-08T15:27Z,Wanneer komt er een 4de DVD?
,smidio,2010-04-14T17:44Z,SEED SEED
,Petertjuhhhhh,2010-04-25T14:21Z,Nice bedankt man!
