User Type,Username,Date,Text
,magnusbertil,2009-12-11T14:37Z,Köp den
,Fjonken_,2009-12-12T21:30Z,"Håller med, KÖP DEN OCH STÖD DOM!"
,godzillah,2009-12-20T23:17Z,"Tusen tack!!! Bästa bandet igenom alla tider, köp skivan och gå på release-partyt för att stödja grabbarna så att de kan fortsätta dominera!!! http://www.soilofsweden.com/releaseparty_UT.jpg-for-web-large.jpg"
,j3rk,2010-01-29T18:24Z,"ska se dom imorrn, ska köpa skivan då"
,JimboSlusk,2010-02-21T14:30Z,"Lätt att man köper denna med snart, man har dom ju i hyllan för att skivorna är snygga, att man lyssnar på filerna i datorn för att inte slita på finskivan är ju en annan sak :-O"
