User Type,Username,Date,Text
,Phanact,2010-09-21T03:37Z,Does this include lyrics? If so Ill download and help you seed :D
,GoldEaglez,2010-10-09T04:01Z,Common guys seed. Stop being LEACHERS DAMMIT! and no it doesnt have the lyrics :\
,TheNextRevolution,2010-12-18T23:13Z,"Fuckin A! I'll seed this all day, man. Spread the Sickness!!"
,fuckjews,2011-07-05T08:15Z,thanks for the upload hell yeah man ill spread the sickness i'll seed this all day
,killingmann,2011-08-15T23:52Z,Here are the lyrics http://www.elyrics.net/song/d/disturbed-lyrics.html
