User Type,Username,Date,Text
,dtraktor,2009-08-15T11:54Z,"holy cow, been looking for this for about 10 friggin' years! thx for sharing"
,revanzlayer,2010-05-06T16:43Z,hope this work
,TTYd,2011-07-24T23:46Z,"same, I remember it got slated but I always thought it was a decent strategy game. Shame I can't find the original cd ;) Thx for uploading"
,jorgen213,2011-08-28T04:24Z,Thanx
,carth1,2011-11-03T09:59Z,im having trouble running the game. ive installed it and everything and when i try to run it i get a message saying that d3drm.dll is missing. any feedback would be helpful thanks
