User Type,Username,Date,Text
,b00kaz,2010-05-19T11:50Z,"If you'd like a larger version I have it, just figured people would want something to carry around without a huge load."
,indiaman,2010-05-19T20:19Z,Thanks b00kaz for this great book.Just one complaint-the words are slightly blurred and hazy but readable.But thanks all the same.
,vmwhelan,2010-05-24T02:16Z,Would you be able to upload the larger version? Thanks :)
,b00kaz,2010-05-24T23:19Z,"Larger Version.

http://thepiratebay.org/torrent/5587358"
,promail44,2011-04-19T08:36Z,Do you have the solutions manual for this book?
