User Type,Username,Date,Text
,TBS-Tobias,2010-06-13T23:10Z,"I accidently removed the torrent. I tried to download it again, but it stops at 98.6%.

WHY?"
,TBS-Tobias,2010-06-13T23:34Z,Oh wait it's because I added coverart in iTunes later...
,Bramsko,2010-06-20T13:18Z,"it sucks anyway, only ""kutmuziek'' is cool. just dl that one."
,kapteinhaak,2010-10-18T13:53Z,"mine is also stuck at 98,6 % but mine is not fine. the tracks don't work."
,burningrabbit,2011-10-22T16:02Z,Kaffiirs to the rescue! Blancs need not apply. Go to the back door for your food...
