User Type,Username,Date,Text
,isisx3,2009-07-24T17:12Z,"Hi, could I make a request? I've been looking for this program Zillatube everywhere and I can't find it. If you could crack it and upload it that'd be really great :) Thanks ahead."
,Pete_The_Pirate,2009-07-26T14:09Z,"You definitely are the shiznit Kid, I have over 30 of your torrents and damn near every 1 of them I have tested on XP, Vista 32-64 bit, & Win 7 have all worked flawlessly.Keep up the good work and never give up."
,Pete_The_Pirate,2009-07-26T14:10Z,"Sorry I haven't left more comments, will do in the future..."
[V],kentucky-kid,2009-07-31T03:39Z,"@tse7en

thanks for that, i was actually looking for it to remove it. cause i realised it after RH post on SB.

thanks."
