User Type,Username,Date,Text
,Torrentviewer,2010-01-25T20:59Z,"Thanks TvT. Fantastic, worlks well. Do you no where I can find Su Animate...."
,tacoz,2010-01-27T23:17Z,thank you so much! really happy with this and it works! great.
,youknowifyoucouldyouwould,2010-02-05T05:59Z,what is the serial number? i didn't see it in what i downloaded.
,Torrentviewer,2010-02-08T02:56Z,Execute program. Copy Lic to plugin folder
,NPatto,2010-02-23T15:37Z,"Does this work for mac?
I have SketchUp Pro installed in my macbook..

Thanx in advance.."
,pupuhd,2010-03-08T17:26Z,"Excellent, thank you."
,livi99,2011-05-22T15:42Z,"sorry to sound like a total noob! could someone give some instructions to working this plug in, i have sketchup pro! :D thanks a million in advance!"
,rhomus74,2012-01-08T09:47Z,thank you very much!
