User Type,Username,Date,Text
,PIRATE718,2010-01-01T22:24Z,"Thanks a lot Morck22,NTSCU confirmed,you do need activate iso disc because it's wave 4."
,Yabab,2010-01-02T03:23Z,Working 100%. Great release.
,modxbox3pro60,2010-01-02T19:24Z,"If anyone needs their xbox 360 professionally modded, let me know. oakleys (at) live (dot) ca"
,christian_sese,2010-01-04T02:38Z,i cant get it verified it by abgx but im sure it will be in a couple of days
,rul_mtz7,2010-01-06T07:31Z,please seed!!!!!!!!!!!!!!!!!!!!!!!!!!
,PlixPlaxPlox,2010-02-25T13:53Z,"Is this working pal as well? Coz i tryed and it wont work on me, just gives me screen as i would watch movie. And yes my xbox is modded :D"
,rafaelporto2000,2010-02-26T17:21Z,"i did everything right, but when i tried to run the game, it gives me screen as i would watch movie. Why???"
,beni16,2010-03-07T18:34Z,is there any way to get this game working on pc
