Filename,Size,Unit
AliveEgnavägar/Fendox-Hemlighuset.mp3,4.38,M
AliveEgnavägar/Fendox-Lätt och lagom.mp3,4.01,M
AliveEgnavägar/Fendox-Nattens första ängel.mp3,3.93,M
AliveEgnavägar/Fendox-Kaffe med dopp.mp3,3.92,M
AliveEgnavägar/Fendox-Oh wee baby.mp3,3.77,M
AliveEgnavägar/Fendox-Lyckopinnen.mp3,3.56,M
AliveEgnavägar/Fendox-Silly love songs.mp3,3.5,M
AliveEgnavägar/Fendox-Kissemiss.mp3,3.44,M
AliveEgnavägar/Fendox-Tjej eller kille.mp3,3.38,M
AliveEgnavägar/Fendox-Baby would you hurt me.mp3,2.28,M
Dansband-Fendox-Malmö-Covers/Fendox Covers/AliveEgnavägar/Alivein.jpg,750.42,K
Dansband-Fendox-Malmö-Covers/Fendox Covers/AliveEgnavägar/Alivebak.jpg,727.88,K
Dansband-Fendox-Malmö-Covers/Fendox Covers/AliveEgnavägar/Alivefront.jpg,618.34,K
Dansband-Fendox-Malmö-Covers/Fendox Covers/godisar och medleys/godisarbak.jpg,745.05,K
Dansband-Fendox-Malmö-Covers/Fendox Covers/godisar och medleys/godisarfront.jpg,613.5,K
Dansband-Fendox-Malmö-Covers/Fendox Covers/puss och kram/pussfront.jpg,665.94,K
Dansband-Fendox-Malmö-Covers/Fendox Covers/puss och kram/pussbak.jpg,492.61,K
Dansband-Fendox-Malmö-Covers/Fendox Covers/Se där g Jeanette/jeanettefront.jpg,648.1,K
Dansband-Fendox-Malmö-Covers/Fendox Covers/Se där g Jeanette/jeanettebak.jpg,426.84,K
Dansband-Fendox-Malmö-Covers/Fendox Covers/Se där g Jeanette/jeanettein.jpg,411.85,K
Dansband-Fendox-Malmö-Covers/Fendox Covers/Sommar sol ljus/sommarbak.jpg,829.26,K
Dansband-Fendox-Malmö-Covers/Fendox Covers/Sommar sol ljus/sommarfront.jpg,647.61,K
Dansband-Fendox-Malmö-Covers/Fendox Covers/Så går vt Maxim/maximbak.jpg,633.41,K
Dansband-Fendox-Malmö-Covers/Fendox Covers/Så går vt Maxim/maximfront.jpg,514.42,K
Dansband-Fendox-Malmö-Covers/Fendox Covers/Så går vt Maxim/maximin.jpg,315.99,K
Godisar och medleys/Fendox-Lycka till med nästa kille.medley.mp3,5.08,M
Godisar och medleys/Fendox-Hälften så kär.mp3,4.97,M
"Godisar och medleys/Fendox-Liten,tårar.medley.mp3",4.7,M
Godisar och medleys/Fendox-Du gav bara löften.medley.mp3,4.57,M
"Godisar och medleys/Fendox-Hallå,hallå västindien.medley.mp3",3.93,M
Godisar och medleys/Fendox-Leende guldbruna ögon.medley.mp3,2.94,M
Godisar och medleys/Fendox-Oa hela natten.mp3,2.49,M
Puss och kram/Fendox-Close to you.mp3,4,M
Puss och kram/Fendox-Crusador.mp3,3.15,M
Puss och kram/Fendox-Have you seen my baby.mp3,3.11,M
Puss och kram/Fendox-It´s a heartache.mp3,2.97,M
Puss och kram/Fendox-Tro på Mig.mp3,2.87,M
Puss och kram/Fendox-Puss och kram.mp3,2.77,M
Puss och kram/Fendox-No one can tell.mp3,2.58,M
Puss och kram/Fendox-Ser du vad jag ser.mp3,2.43,M
Puss och kram/Fendox-Allt jag kan är drömma.mp3,2.35,M
Puss och kram/Fendox-Here you come again.mp3,2.33,M
Puss och kram/Fendox-Snobbige Sven.mp3,2.24,M
Puss och kram/Fendox-There´s a kind of hush.mp3,2.18,M
Puss och kram/Fendox-What now my love.mp3,2.11,M
Puss och kram/Fendox-Är det nån som vet hur man styr en rymdraket.mp3,1.68,M
Se där gå Jeanette/Fendox-Älskling.mp3,3.89,M
Se där gå Jeanette/Fendox-Varför.mp3,3.25,M
Se där gå Jeanette/Fendox-Skänk mig ditt hjärta Maria.mp3,3.05,M
Se där gå Jeanette/Fendox-Ett dumt misstag.mp3,2.74,M
Se där gå Jeanette/Fendox-Se där går Jeanette.mp3,2.72,M
Se där gå Jeanette/Fendox-Why did it have to be me.mp3,2.7,M
Se där gå Jeanette/Fendox-La Mer.mp3,2.66,M
Se där gå Jeanette/Fendox-En flicka i min fantasi.mp3,2.57,M
Se där gå Jeanette/Fendox-Forever.mp3,2.43,M
Se där gå Jeanette/Fendox-Cést si bon.mp3,2.41,M
Se där gå Jeanette/Fendox-Två små röda rosor.mp3,2.12,M
Sommar sol och ljus/Fendox-Du.mp3,3.93,M
Sommar sol och ljus/Fendox-Ditt liv mitt liv.mp3,3.77,M
Sommar sol och ljus/Fendox-Nej aldrig.mp3,3.43,M
Sommar sol och ljus/Fendox-Längtar efter dig.mp3,3.4,M
Sommar sol och ljus/Fendox-En kväll i somras.mp3,3.15,M
Sommar sol och ljus/Fendox-Början till slutet.mp3,2.89,M
Sommar sol och ljus/Fendox-Mest av allt.mp3,2.71,M
Sommar sol och ljus/Fendox-Kyss mig igen.mp3,2.7,M
Sommar sol och ljus/Fendox-Dag efter dag.mp3,2.6,M
Sommar sol och ljus/Fendox-Värmen här tar aldrig slut.mp3,2.36,M
Sommar sol och ljus/Fendox-Oh Julie.mp3,2.35,M
Sommar sol och ljus/Fendox-Sommar Sol och Ljus.mp3,2.23,M
Sommar sol och ljus/Fendox-Tiotusen röda rosor.mp3,2.21,M
Sommar sol och ljus/Fendox-Slit och släng.mp3,2.17,M
Så går vi till Maxim/Fendox-Rock´n roll medley.mp3,5.54,M
Så går vi till Maxim/Fendox-Still and One night.mp3,5.34,M
Så går vi till Maxim/Fendox-Unchained melody.mp3,4.11,M
Så går vi till Maxim/Fendox-Skall det bli du och jag.mp3,4.11,M
Så går vi till Maxim/Fendox-Twilight time.mp3,3.91,M
Så går vi till Maxim/Fendox-Last date.mp3,3.77,M
Så går vi till Maxim/Fendox-Can´t stop myself from loving you.mp3,3.59,M
Så går vi till Maxim/Fendox-Om en stund.mp3,3.55,M
Så går vi till Maxim/Fendox-Motorway.mp3,3.5,M
Så går vi till Maxim/Fendox-I en lille båd der gynger.mp3,3.48,M
Så går vi till Maxim/Fendox-En vanlig lördagkväll.mp3,3.32,M
Så går vi till Maxim/Fendox-Dancing party.mp3,3.07,M
Så går vi till Maxim/Fendox-Caramia.mp3,2.88,M
Så går vi till Maxim/Fendox-Du är mitt liv.mp3,2.64,M
Så går vi till Maxim/Fendox-You never can tell.mp3,2.59,M
Så går vi till Maxim/Fendox-Smoke gets in your eyes.mp3,2.47,M
Så går vi till Maxim/Fendox-HililiHilo.mp3,2.43,M
Så går vi till Maxim/Fendox-Must be in love.mp3,1.97,M
Så går vi till Maxim/Fendox-Sistan tonar ut.mp3,1.32,M
