Filename,Size,Unit
Others/Oxford Streamline English 4 Student's Book DIRECTIONS.torrent,22.98,K
Others/Oxford Streamline English 2 Student's Book CONNECTIONS.torrent,17.08,K
Others/Oxford Streamline English 3 Student's Book DESTINATIONS.torrent,16.53,K
Others/Penguin - Test Your Vocabulary 5.torrent,15.79,K
Others/Investing In Ongoing Income Vehicles -kiyosaki Robbins Harv Eker.torrent,15.62,K
Others/Penguin - Test Your Vocabulary 1.torrent,13.6,K
Others/earn_one_million Now.torrent,11.42,K
Others/Getting Your Dream Job Chapter4.torrent,11.1,K
Others/free-webdesign-ebook Updated.torrent,11.03,K
Others/Interview Beating the Competition.torrent,10.98,K
Others/Telecommuting_And_Freelance_Employment_Guide.torrent,10.98,K
Others/work-from-home-secrets-revealed.torrent,10.97,K
Others/The_Art_of_Money_Getting_by_P_T_Barnum.torrent,10.97,K
Others/Your guide to setting_goals.torrent,10.91,K
Others/404 Error Page secrets to making money.torrent,10.89,K
Others/How I Trade For A Living-chapter1.torrent,10.89,K
Others/How-to-make-fertilizer.torrent,10.58,K
Others/Buying_a_Home when you have bad credit.torrent,10.46,K
Others/Speak to Win.torrent,10.4,K
Others/How_To_Build_An_11_Plant_Hydroponic_Garden.torrent,10.35,K
Others/Businesses That Can Make You Millions.torrent,10.29,K
Others/Oxford Streamline English 1 Student's Book DEPARTURES.torrent,10.23,K
Others/Putting_Like_A_Pro_Now.torrent,10.21,K
Others/Online-Home-Business.torrent,10.2,K
Others/Dealing with Depression.torrent,10.18,K
Others/Recession Golden opportunity to become rich.torrent,10.16,K
Others/How_To_Make_Soap.torrent,10.06,K
Others/Derek Vitalio-Seduction Science Volumes 1 2and3.torrent,8.51,K
Others/Secrets revealed when Mars Venus Revisited.torrent,7.95,K
Others/The 8 Personality Types that Naturally Attract Women.torrent,7.91,K
Others/ebook More_secrets_of_Speed_Seduction.torrent,7.9,K
Others/GET LAID Tonight guide.torrent,7.9,K
Others/How to Seduce and Destroy.torrent,7.85,K
Others/FAQ on Women -what women want.torrent,7.85,K
Others/How to Defeat Shyness right now.torrent,7.79,K
Others/David DeAngelo Lover and Provider.torrent,7.79,K
Others/Swan - The Good Grammar Book.torrent,7.43,K
Others/Penguin - Test Your Vocabulary 3.torrent,7.37,K
Others/Penguin - Test Your Vocabulary 2.torrent,7.07,K
Others/David DeAngelo - Sex Secrets.torrent,6.84,K
Others/Penguin - Test Your Vocabulary 4.torrent,6.72,K
Others/Mortgage Advisor-Mike Bjork.torrent,5.27,K
Others/Why the Rich Get Richer -Robert Kiyosaki.torrent,5.25,K
Others/Rich Dad Poor Dad -Robert Kiyosaki.torrent,5.17,K
Others/Wealth_Midset -Robert Kiyosaki.torrent,5.14,K
Others/Network Marketing_By_Robert_Kiyosaki.torrent,4.91,K
Others/Kiyosaki Quotes.torrent,4.82,K
Others/Interview -Robert Kiyosaki.torrent,4.69,K
Others/How To Get Out of Debt-Kim Kiyosaki.torrent,4.6,K
Others/Cashflow 101-102 Curriculum-Robert Kiyosaki.torrent,4.5,K
Sexy Movies/Canadian Hot Virgin teen fucked first time in dorm.torrent,25.55,K
Sexy Movies/British red head fucked by 2 black guys at fire place.torrent,24.42,K
Sexy Movies/Young russian celebrity fuck older guy in luxury hotel.torrent,23.88,K
Sexy Movies/Asian Filipina teen fucked real hard by black boyfriend.torrent,23.67,K
Sexy Movies/Spanish amateur maid suck cock and fucked.torrent,23.09,K
Sexy Movies/Big breast Italian teen suck big black cock.torrent,22.33,K
Sexy Movies/Blonde Texas Cam teen fucked hard in living room.torrent,22.26,K
Sexy Movies/Cute Russian Teen Fuck American on campus.torrent,21.74,K
Sexy Movies/aaxxo Manila Filipina asian teen fucked hard in hotel.torrent,21.26,K
Sexy Movies/British Idian fuck american in bushes.torrent,21.09,K
Sexy Movies/French husband fuck Bride and bridesmaid on honeymoon.torrent,21.08,K
Sexy Movies/Amateur Japanese asian virgin fucked hard.torrent,21.05,K
Sexy Movies/German Teen fuck boyfriend at roadside camp.torrent,20.99,K
Sexy Movies/Texas Blonde teen fucked in bathroom at party by Canadian.torrent,20.1,K
Sexy Movies/American amateur Hottie fucked hard in living room.torrent,19.98,K
Sexy Movies/Virgin Hot Polish  fucked hard in apartment.torrent,19.56,K
Sexy Movies/Greek Couple fucking hard on sofa.torrent,19.19,K
Sexy Movies/aaxxo Iranian Fucking his neighbours wife on sofa.torrent,18.99,K
Sexy Movies/aaxxo Very Beautiful british blonde fucked real hard by huge cock.torrent,18.55,K
Sexy Movies/Polish college student fucked by postman.torrent,18.39,K
Sexy Movies/aaxxo Teen amateur Cute american fucked by canadian.torrent,18.21,K
Sexy Movies/Blonde british Secretary fucked by manager on desk.torrent,18.19,K
Sexy Movies/Horney asian Japanese Teen sexy pussy.torrent,17.7,K
Sexy Movies/Italian fuck suck and cum in german teen.torrent,17.29,K
Sexy Movies/Hot young sexy indian fuck Italian in exotic hotel.torrent,17.27,K
Sexy Movies/amateur bulgarian teen student fucked by teacher.torrent,16.99,K
Sexy Movies/Big Breast Italian student Fuck Spanish Guy.torrent,16.88,K
Sexy Movies/Canadian Fuck Blonde Russian teen on Sofa.torrent,16.63,K
Sexy Movies/Young British blonde fucked very hard by huge cock on sofa.torrent,16.15,K
Sexy Movies/Young Canadian fuck amateur Indian Neighbour.torrent,16.13,K
Sexy Movies/Young sexy home alone russian teen fucked.torrent,16.09,K
Sexy Movies/Sexy teen czech model fucked hard by russian.torrent,16.07,K
Sexy Movies/aaxxo Young British teen beauty suck and fucked in rubber.torrent,15.96,K
Sexy Movies/aaxxo Pregnant - Cute russian teen fuck.torrent,15.62,K
Sexy Movies/Young indian amateur fucked by older french guy.torrent,15.59,K
Sexy Movies/Swedish model fucked on sofa by American camera man.torrent,15.55,K
Sexy Movies/Russian sexy ass blonde babe fucked hard.torrent,15.54,K
Sexy Movies/Sexy Breast Brazilian fucked from behind by Swedish.torrent,15.49,K
Sexy Movies/Dutch Blonde fucked hard on counter top by british guy.torrent,15.4,K
Sexy Movies/Swedish Blonde ride big black cock hard in motel.torrent,15.4,K
Sexy Movies/British guys fuck big ass german blonde.torrent,15.39,K
Sexy Movies/Beautiful Intalian Fucked by Turkish riding cock.torrent,15.33,K
Sexy Movies/British fuck young indian amateur in hotel.torrent,15.29,K
Sexy Movies/Big Breast French Teen fucked in bathroom.torrent,15.1,K
Sexy Movies/Turkish teen amateur fuck 2 black guys.torrent,14.85,K
Sexy Movies/aaxxo Wet pussy canadian amateur Big breast.torrent,14.36,K
Sexy Movies/Hot Young skinny Indian fuck and ride spanish cock.torrent,14.27,K
Sexy Movies/Chinese Asian Young teen fuck virgin college guy amateur.torrent,14.11,K
Sexy Movies/Canadian black teen fucked by 2 white guys.torrent,13.72,K
Sexy Movies/British College Teen fucked brutally like a dog at party.torrent,13.46,K
Sexy Movies/Home alone British Teen Fuck 2 american guys.torrent,13,K
Sexy Movies/Soccer star fuck blonde teen after football match.torrent,12.72,K
Sexy Movies/Cocksucking Californian amateur Teen fucked by 2 guys.torrent,12.16,K
Sexy Movies/London blonde teen riding cock hard in motel.torrent,11.94,K
Sexy Movies/Bulgarian amateur fucked hard by husband.torrent,11.76,K
Sexy Movies/aaxxo Russian teen lying on back sexy pussy.torrent,11.13,K
Sexy Movies/Russian teen fucked first time by Spanish traveller.torrent,9.98,K
Sexy Movies/British Indian fucked at tajmahal by 2 guys.torrent,9,K
Sexy Movies/aaxxo Young teen fuck older guys at party.torrent,8.92,K
Sexy Movies/Iranian neda amateur hottie riding cock hard and slow.torrent,8.55,K
Sexy Movies/Russian Teen fucked by french early morning.torrent,8.29,K
Sexy Movies/Spanish fucking Home alone Russian teen amateur.torrent,7.83,K
Sexy Movies/Cock sucking Arab fucked on hotel bed.torrent,7.57,K
Sexy Movies/Canadian Asian Chinese teen amateur Fucked by huge black cock.torrent,7.23,K
Sexy Movies/aaxxo Arab Model fucked hard from behind living room.torrent,4.51,K
Sexy Movies/Iraqi cock sucking party girl amateur sex.torrent,4.29,K
Sexy Movies/Arab greek wifey fucked from behind by stranger.torrent,3.94,K
Sexy Movies/Big breast Saudi amateur wifey fucked riding cock.torrent,3.9,K
Timeless Inspirational Quotes.pdf,530.52,K
2008 Ebays best seller How I made $250 a day riskfree .pdf,182.7,K
Readme.txt,98,B
