User Type,Username,Date,Text
,DannOrly,2010-10-03T20:52Z,"Hmm, says no seeders on here but when I go to download there's 21 seeders and 35 leechers..."
,ekarth22,2010-10-04T11:38Z,DSM means Dirty Sex manual? if yes then I'm downloading!
,johnmcarr,2010-10-04T23:27Z,"@DannOrly:  That's because the Pirate Bay search engine is being weird of late.  Someone should tell the mods that it's taking forever for the seeders and leechers statistics to show up on new torrents.

@ekarth22:  Funny. . .  I could have SWORN the extended form of the name was in the description, but I may just be a dumbass.  *shurgs*  :P"
,analog_voyager,2012-07-01T15:26Z,Thank you! Great collection. Does anybody have DSM-III-R to contribute?
