User Type,Username,Date,Text
,Mandalayz,2009-11-07T14:10Z,"Det er veldig fint at du laster opp filmer med norsk tekst, men all masingen om mangelfull deling begynner å bli ganske irriterende. "
,NiceManiac34,2009-11-07T15:34Z,"det er jo den eneste måtten og få folk til og forstå det =) du må ikke glemme at mange av de norske store opploaderene ikke er her mere....og det er for de det er HIT AND RUN...

Det dere ikke tenker over er at vi bruker jævelig mange timer og penger på at dere SKAL FÅ TING GRATIS........ da synes faktisk jeg at det minste dere kan gjøre er og SEEDE, det er gratis det også.....synes du skal tenke litt på det Mandalayz"
,zest,2009-11-16T13:44Z,Hvorfor kutter filmen så brått??
,lovly,2009-11-20T09:27Z,takker.
,NiceManiac34,2009-11-30T01:36Z,nei si det....er ikke jeg som har tatt tv opptak av den......men jeg vile bare dele den med dere for det.......bedre en ingen ting eller hva?
,gakris,2009-12-18T16:47Z,Takk for mange flotte torrenter forsett det fine arbeidet .Skal hjelpe til å seede 
,hans950,2010-02-11T18:42Z,Takk for fin torrent;) kan dere hjelpe med seeds ? ;)  kommer til og seede en del selv utover ;)
,falchon,2010-12-22T20:27Z,"Seede, please?"
