Filename,Size,Unit
1969/01 I Want You Back.m4a,2.88,M
1969/02 Helplessly Hoping.m4a,2.7,M
1969/03 Natural Mystic.m4a,4.32,M
1969/04 Space Oddity.m4a,5.21,M
1969/05 I Want You (She's So Heavy).m4a,6.37,M
1969/06 Bad Moon Rising.m4a,2.45,M
Demos 2002/06 Story in a Dream.mp3,3.72,M
Drive Thru Records Sampler Summer 2004/09 Wake Your Eyes.mp3,4.82,M
Drive-Thru & Rushmore Sampler 2005/03 Better Love.mp3,3.62,M
For You My Dear/01 Blown Away.mp3,4.42,M
For You My Dear/02 Alley Cat.mp3,4.53,M
For You My Dear/03 Angelica.mp3,4.97,M
For You My Dear/04 W. 12th.mp3,2.21,M
For You My Dear/05 For You My Dear.mp3,4.67,M
For You My Dear/06 Night Falls.mp3,3.92,M
Steel Train/01 Bullet.m4a,8.04,M
Steel Train/02 Turnpike Ghost.m4a,5.39,M
Steel Train/03 You and I Undercover.m4a,8.13,M
Steel Train/04 You are Dangerous.m4a,5.58,M
Steel Train/05 S.O.G Burning in Hell.m4a,7.5,M
Steel Train/06 Touch Me Bad.m4a,6.89,M
Steel Train/07 Behavior.m4a,8.02,M
Steel Train/08 Children of the 90's (I'm Not the Same).m4a,5.91,M
Steel Train/09 Soldier in the Army.m4a,6.56,M
Steel Train/10 Bloody Lips.m4a,5.57,M
Steel Train/11 The Speedway Motor Racers Club.m4a,6.56,M
Steel Train/12 Fall Asleep.m4a,5.85,M
Steel Train is Here/01 You and I undercover.mp3,4.87,M
"Steel Train is Here/03 Dance, Dance, Dance.mp3",3.5,M
Terrible Thrills Vol. 1/01 Bullet (Scarlett Johansson).mp3,4.13,M
Terrible Thrills Vol. 1/02 Turnpike Ghost (Tegan and Sara).mp3,2.87,M
Terrible Thrills Vol. 1/03 You and I Undercover (Holly Miranda).mp3,3.18,M
Terrible Thrills Vol. 1/04 You Are Dangerous (Deradoorian).mp3,3.64,M
Terrible Thrills Vol. 1/05 S.O.G Burning in Hell (Alia Shawkat).mp3,2.67,M
Terrible Thrills Vol. 1/06 Touch Me Bad (Nellie McKay).mp3,3.18,M
Terrible Thrills Vol. 1/07 Behavior (Amanda Palmer).mp3,4.39,M
Terrible Thrills Vol. 1/08 Children of the 90's (Greta Morgan).mp3,1.86,M
Terrible Thrills Vol. 1/09 Soldier in the Army (Rachael Cantu).mp3,2.21,M
Terrible Thrills Vol. 1/10 Bloody Lips (Charlotte & Astrid).mp3,2.66,M
Terrible Thrills Vol. 1/11 The Speedway Motor Racers Club (Anna Waronker).mp3,1.89,M
Terrible Thrills Vol. 1/12 Fall Asleep (Rachel Antonoff).mp3,2.77,M
Trampoline/01 I Feel Weird.mp3,4.61,M
Trampoline/02 Black Eye.mp3,6.75,M
Trampoline/03 Kill Monsters In The Rain.mp3,7.33,M
Trampoline/06 Bad Moon Rising.mp3,3.53,M
Trampoline/09 Leave You Traveling.mp3,3.52,M
Trampoline/12 Women I Belong To.mp3,6.8,M
Trampoline/Alone On The Sea.mp3,4.22,M
Trampoline/Word to My Best Friend.mp3,966,K
Twilight Tales From The Prairies Of The Sun/01 Better Love.mp3,4.15,M
Twilight Tales From The Prairies Of The Sun/02 Road Song.mp3,5.13,M
Twilight Tales From The Prairies Of The Sun/03 Dig.mp3,6.44,M
Twilight Tales From The Prairies Of The Sun/04 The Lee Baby Simms Show Episode 1.mp3,3.21,M
Twilight Tales From The Prairies Of The Sun/05 Wake Your Eyes.mp3,5.59,M
Twilight Tales From The Prairies Of The Sun/06 Two O'Clock.mp3,6.31,M
Twilight Tales From The Prairies Of The Sun/07 Grace.mp3,5.69,M
Twilight Tales From The Prairies Of The Sun/08 Catch You On The Other Side.mp3,5.27,M
Twilight Tales From The Prairies Of The Sun/09 Gypsy Waves.mp3,7.13,M
Twilight Tales From The Prairies Of The Sun/10 Tickle Your Toes.mp3,4.27,M
Twilight Tales From The Prairies Of The Sun/11 The Lee Baby Simms Show Episode 2.mp3,2.52,M
Twilight Tales From The Prairies Of The Sun/12 Blue.mp3,4.39,M
Twilight Tales From The Prairies Of The Sun/13 Cellaphane and Glass.mp3,4.93,M
Twilight Tales From The Prairies Of The Sun/14 14 W. 95 Street High.mp3,5.31,M
Twilight Tales From The Prairies Of The Sun/15 I Will Stay Here.mp3,5.32,M
