User Type,Username,Date,Text
,theresnomorenamesleft05,2010-02-09T18:21Z,No comments yet ?!?!?!?!? C'mon . . . . .  .
,Puma__84,2010-02-10T03:03Z,I must see this movie!!! Seed please ;D
,eater78,2010-06-22T09:57Z,"Thanks, bro. I downloaded it. Great flick!"
,tambam,2010-12-06T14:06Z, love this movie!  Classic!!!! must see.thanks..
,Ellycat,2011-09-02T22:19Z,"Only just heard about this film. Brilliant. Thanks, bro. Any more recommendations of the same genre?"
,Magnum.p.i.,2012-01-09T23:29Z,"can you  make a rip at full resolution? 

576x320 urgh!"
[V],WildcardSearch,2012-03-27T19:30Z,Great movie. Thanks uploader :)
,bugyell,2012-05-01T04:49Z,"Ellycat - I learned about this movie on this thread. You'll find some good stuff there.

http://www.imdb.com/title/tt0424880/board/nest/145208417"
