User Type,Username,Date,Text
,tenenbaum,2010-02-25T17:48Z,Lorelei doesn't do nearly enough sub-ing these days. So this is nice to see. Many thanks. 
[V],merzedes,2010-02-25T18:20Z,Ser det er mange norske som laster ned filmene mine hvorfor ikke takke en Bergenser av og til :-) SkĂĽl 
,dk1854,2010-02-26T02:02Z,Thanks for all your hard work Merzedes.
,gumboy30,2010-02-26T04:02Z,"SkĂĽl og tusen takk,Bergenser:-)
Fortsett med det gode arbeidet,mere InfernalRestraints er hjertelig Ă¸nsket fra meg;-)"
,bakaonna,2010-02-26T11:54Z,Thank you for Lorelei Lee.
