User Type,Username,Date,Text
,Herkimer,2010-01-20T03:03Z,"It's about time those Dubai's over there started having ""REAL SEX"" and not that fake shit!

No wonder they're all so up tight!

Herk"
,Herkimer,2010-01-20T03:04Z,"Oh! And after checking those screens, such pretty thing she is!...
If I was buddy, I'd go back to the ""FAKE SEX"".

Herk"
,slash9dotnet,2010-05-22T18:39Z,That is one UGLY woman.
,RC2314,2010-06-29T08:57Z,And you're probably one ugly dude.
,cq999,2011-03-24T16:46Z,"This woman is not just ugly, but nasty and disgusting as well."
