User Type,Username,Date,Text
,hotrod666,2010-11-03T07:29Z,theatrical or xtended cut???
,hotrod666,2010-11-03T07:31Z,"plz do ramona and beezus, no good x264 small size rips there.."
,sinner77,2010-11-03T09:24Z,thanks.......keep it up
,smasudi,2010-11-03T09:28Z,please do Kiss Kiss Bang bang and Death race in 720p..please
,DSIN,2010-11-03T09:35Z,"it looks far better than the dvdrip i had... 
thanx :D"
,rob_clain13,2010-11-03T11:55Z,hey dude are you working with any tv series???
,rockr191,2010-11-03T17:08Z,"Yeah yify, keep it low..;)"
,kant200r,2010-11-03T18:42Z,"thanx YIFY
u r the great uploader in my experience..
ur stuffs are Awesome untouchable "
,kant200r,2010-11-03T18:49Z,"I was looking 4 The Wrestler almost 6 months
but u made it........... thnx"
,saurabh1992,2010-11-03T19:47Z,"thanx man
u r the best always"
,tylr,2010-11-03T20:03Z,"hey.. could u do Casino (1995) : http://www.imdb.com/title/tt0112641/
in ur usual flavor ~ HDRip ~ 400mb ?!"
,hkoraddi,2010-11-03T20:29Z,good rip do try to write video details if possible especially resolution and bit rate. ty its a good rip.
,4u4u44,2010-12-13T13:41Z,"Thanx 4 the upload.. 
Great quality.."
[V],DeGun,2011-05-18T23:40Z,"##  VIP YIFY at 2010-11-03 13:35 CET:
mzk57, I like to vary my uploads between 720p (~600mb) and DVDRip/HDRips (~350mb) because some people would rather the smaller size over quality. (due to slow/limited internet) """" 

 I Definitly agree , keep on dat very good work indeed .

Jah bless"
,stonner89,2012-03-01T15:46Z,"Do not download this, the movie ends before the running time."
