User Type,Username,Date,Text
[T],FatFreddy69,2010-01-29T20:02Z,"click on my name (mkvonly) and check out my other x264 rips: oldies, comedies, French films, Full HD-s etc..."
[T],FatFreddy69,2010-01-29T20:29Z,"We will very much appreciate it if you would 

edit a subtitle to other language, upload it to a 

subtitle site and give us the link. Thx.

Nous serons très reconnaissants si vous

modifier un sous-titre à une autre langue, 

téléchargez-le à un site sous-titre et nous 

donner le lien. Merci.
(translated by Google lol)."
,Kara-kan,2011-06-29T00:49Z,"Eszméletlen feltöltéseid vannak, főleg filmek.
Kár, hogy nincs róluk gy gyűjtőlista.
Amúgy, itt voltál már?
mozi.freeforums.org/index.php"
,gonflement,2011-09-23T23:37Z,Merci mkvonly pour ce partage.
