User Type,Username,Date,Text
,jthom5150,2009-07-18T03:15Z,Fans of Dallas enjoy!
,naab,2009-12-14T15:05Z,"thanks for dallas season 11.
have you got dallas season 9 and 10 i been looking for ages for them."
,Pretorian123,2009-12-26T20:02Z,"Please seed. I will return the favour with 100 Mbit, thanks."
,Trippel_Ess,2010-03-21T09:55Z,"I can help you with season 9 and 10 naab
I got them on dvd-disks 
With perfect kvalite"
,weaselwood1,2010-04-12T12:12Z,Thank you.
,tonyclem,2012-06-15T15:43Z,"This was upped almost 3 years ago and I see 17 others are attempting to down. I will seed as long as possible, but I am at 3:1 ratio already"
