User Type,Username,Date,Text
[V],merzedes,2009-12-17T18:54Z,I cant upload screens from SAS so you have to find them yourself :-) Go to www Kink.com and to SAS :-) Cheerz 
,wayward12,2009-12-17T20:41Z,"try to help out the best uploader on TPB

http://beta.kink.com/k/model_detail.jsp?c=1&performerId=20123

thanks for all your work merzedes"
,mafiadog,2009-12-17T23:14Z,"Awesome man,thanks and very appreciated"
,tenenbaum,2009-12-18T01:05Z,"This one looks damn hot. It seems like they've spiced up SAS recently. The Upper floor sets have been great.  Many, many thanks man."
,dk1854,2009-12-18T04:02Z,Thanks for all the great work Merzedes.
,dlmax63,2010-05-15T02:33Z,Thanks for the up
