User Type,Username,Date,Text
,Dutchwolves,2010-03-21T22:20Z,"Works Logic 9.1.1, FCP 7.01, Compressor, thanks very much!"
,justindustries,2010-03-21T22:27Z,Works ! Thank you !
,LoadZen,2010-03-23T15:07Z,perfect and simple
,Tucson_Luni520,2010-03-24T23:39Z,Works Great! Much Appreciated!
,alelp69,2010-03-27T09:45Z,"worked great on logic pro
thanks"
,stephenhammy,2010-04-15T03:34Z,"You are a true hero, sir."
,beneaththeseclothes,2010-04-15T05:59Z,"I tried following the instructions, however there is no folder in application support that is called ""proapps.""  what do I need to do to install this? thanks!"
,punksnotddeadd,2010-04-16T00:10Z,@Beneath There definetely should be a folder called pro apps. Look harder
,msuarez20,2010-05-07T22:25Z,"Sweet, it worked, I accidentally updated main stage a while back when the update came out and it didnt work, this fixed it for me. I just had a question. i'm at 9.0.2 Logic studio.. if I update to 9.1.1 it will work right?"
,MOB4LIFE,2010-05-09T11:33Z,the proapps folder can be found in the library in ure  MAC HD  not the users library 4 those who dont know or cant find it its simple u'll find it 
,daafkunt,2010-05-13T15:37Z,seeeeeeeedddddd!!!!!!!!!!!!
,justindustries,2010-10-15T14:56Z,Does this still work on 9.1.2
,smike008,2010-11-07T23:03Z,"I'm having problems with this, how does it work? I added it to that folder and replaced the old ones, but it still says that logic is 9.0.0, it doesn't change to 9.1.1, so do I have to do anything?"
,Shabutie,2011-02-07T02:18Z,"Confirming that this worked for MainStage 2.1.2.
Thanks a lot!"
,ignatius95,2011-02-11T15:09Z,works perfect for me! thanks!
