User Type,Username,Date,Text
,gumdabookie,2010-09-18T05:53Z,If this is legit....Than Fuckin thanks!@!!
,ruudsach,2010-09-18T06:26Z,"I thought this was a sex-tape but it turned to be a C-grade movie.

Sorry guys I was duped and I propagated that lie.

The scene is from some movie The Plotters made in 2001. Check it http://www.imdb.com/title/tt1062167/"
,Goofygopher323,2010-09-19T09:56Z,there all clips!
,msalisi,2010-09-22T07:00Z,but she does have sex tape
,ghostb25,2010-09-25T06:41Z,"SHE DOESN'T HAVE A SEX TAPE! it's a comic demo video she made 10 years a go!! the ""sex scene"" is like 8 seconds..."
,gumdabookie,2010-09-26T14:39Z,I still want to see it really badly...I've seen the image & it's her getting it from behind...I want to see it !!!!!
,nbarra11,2011-04-19T08:38Z,wtf is the real thing so hard to fucking find!!!
,inemanja,2011-07-06T03:59Z,FAKE !!!
,stormium,2012-02-06T03:46Z,"ruudsach, its the thought that counts. thanks."
