User Type,Username,Date,Text
,psychodoctor,2012-05-06T12:13Z,muie ce cacat i liberty parade muie la toti care asculta liberty i de cacat in pula mea si a voastra muie
,psychodoctor,2012-05-06T12:15Z,doar prosti asculta asaceva :)sugeti pula si muie 
,psychodoctor,2012-05-06T12:17Z,bai prostilor ascultati melodia asta de la hardtrance classix 2008 sunt faine Dumonde - See the light (dj jamx mix) asta i gen de muzica adevarata nu cacatu asta de liberty!
,psychodoctor,2012-05-06T12:20Z,"na ma le poti pirata!
http://thepiratebay.se/torrent/3966088/VA-Hardtrance_classix_only_for_djs_vol_1_2008"
