User Type,Username,Date,Text
,nedamgol,2010-10-11T00:47Z,thanx ;)
[V],verovenlo,2010-10-11T00:56Z,tiggz lol who the fuck is he i jjust checked on the box he is still uploading this episode so shut the fuck up u idiots
[V],albiondean,2010-10-11T01:49Z,your the idiot ive just grabbed on to this torrent earlier and got your IP and i shall give it to the admin at the box now who's lmao 
[V],albiondean,2010-10-11T01:58Z,and this one is a scene release by C4TV
,bendaninc,2010-10-11T02:24Z,"*thanks and Happy Thanksgiving from Southern Ontario, where beautiful autumn colours are a-changing on our trees. "
,asighkick,2010-10-11T03:16Z,"Hi verovenlo - any chance that you can kindly reseed just four (4) from Season One of X Factor please?

Need:

X Factor S01E13 Performances
X Factor S01E14 Performances
X Factor S01E16 Final

Plus a fresh upload of X Factor S01E13 Results.

Maybe nedamgol also has the above and may consider reseeding please?

Thanks in advance - so near yet so far from completion."
[V],verovenlo,2010-10-11T08:49Z,hahahaha good luck moron
[V],verovenlo,2010-10-11T09:01Z,and dont forget to kiss the admins ass lol
,thesparky1,2010-10-11T17:07Z,Hey Albiondean get a life this dudes been uploading this prog for years on time and regular without complaint. What have you done knob?piss off and be a dick somewhere else. Vero rules!
,oscox,2010-10-11T20:00Z,thanks from british columbia
,MartZuid,2010-10-12T08:53Z,Sound and Image are not in sync
,MartZuid,2010-10-12T09:03Z,on a Samsung LE32B652 LCD-TV
,staciii,2010-10-17T11:17Z,Thanks so much from New Zealand.  I sadly check the whole day to see if you have uploaded the episodes...but obviously your sleeping.  
,laurafrance,2010-10-17T13:04Z,"Thanks for all the uploads over the years verovenlo, much appreciated! As for this tiggz the box carry on does it really matter people? Nobody can sign up to the box now anyway because it's full, what about all of us on the pirate bay going through serious x factor withdrawal!"
,Dani016,2010-10-18T12:53Z,"Hey VeroVenlo, i was just wondering if you're going to upload xtra factor ep 13.. I can't find the episode anywhere on the net.. So I was just wondering If you please could upoad it.

Thanks in advance!"
,staciii,2010-10-19T11:27Z,"Yay. Thanks heaps.
Is 13 and 14 on the way..?  
......I really gotta get a life :)"
