User Type,Username,Date,Text
,jqnson,2010-03-19T18:16Z,Vær sød og giv + i kvalitet hvis den kan bruges og efter i har brugt den så smid lige en kommentar og sig om alt virker som det skal og nå ja vigtigst af alt SEED! :P
,jessup,2010-03-19T22:19Z,Takker på forhånd kan da kun rose de forrige skiver du har lavet så denne virker da også helt sikkert efter hensigten.
,jqnson,2010-03-19T22:25Z,ja lad os håbe jeg ik har lavet en lille fejl der fucker det hele op der skal jo ik meget til med alle de ændringer jeg har lavet ;P og tak for de fine ord :)
,jessup,2010-03-20T21:34Z,"Hejsa her er lige lidt info, skiven i sig selv fungerer fint nok men Internet Explorer 8
er altså kun Internet Explorer 6, og syntes der mangler lidt under opstart når man booter så får man kun valget at installere eller slette partionen man får ikke valget at formatere først,  så den installerer oven i den gamle uden formatering, den gamle version virker upåklageligt, alligevel takker jeg for uploadet syntes bare du skulle have info om dette manglende."
,jqnson,2010-03-20T23:17Z,hmm internet explorer 8 virker fint når jeg installere skiven virtuelt jeg prøver lige at køre den på min computer og se om det fungerer :) det der med formatering er det samme som den gamle skive tror jeg men ved faktisk ik helt hvorfor det er sån...
,jessup,2010-03-21T00:48Z,"Måske har jeg forklaret mig forkert, men på den gamle skive har du valget som på en alm xp skive at trykke Esc for at installere og f8 samt t og f tror jeg for at formatere, på din kan du kun vælge mellem at slette den gamle partion eller installere oven på den nuværende version altså overskrive derved beholder du jo en del af den gamle installation hvilket ikke er godt da jo bedst med en ren installation, det var ihvertfald hvad der skete her og havde som sagt stadig explorer 6 efter install af din skive ellers er resten som det skal, prøver dog på en anden maskine i nær fremtid og ser om det er samme resultat der, så vender tilbage med info."
,jqnson,2010-03-21T02:50Z,Jeg ved ik præcist hva det er der gør at den ik beder om det men bare tryk slet partition og lav den igen det jo det samme :) og hvis det var efter du havde installeret oveni en anden xp at internet explorer ikke var opdateret ka det godt ha noget med det at gøre jeg har lige kørt en installation uden nogen problemer alt er opdateret :)
,jessup,2010-03-21T10:38Z,"Ja men ok, takker for info, vil så prøve at slette partionen og så håbe at det ikke går ud over den anden partion, vil helst ikke flytte alt hvad jeg har på den anden partion men bliver jo nok nødvendigt.Kan du foresten fortælle mig hvad problemet er siden jeg ikke kan få lov til at installere det activ x fra netbank jeg får hele tiden at vide at siden er blokeret af explorer, lige så snart jeg kommer ind på siden bliver jeg sparket væk til netbanks start side igen."
,jqnson,2010-03-21T20:42Z,Medmindre du sletter den forkerte partition sku der ik være noget problem :P og nej bruger altid firefox men hvis du kun har internet explorer 6 er det ik sikkert din netbank virker der ik mange sider der stadig fungerer med det :/
,jqnson,2010-03-22T12:28Z,"Seedere:   1
Leechere:  0

Den her side er squ ik så god til at updatere de tal :/"
,jessup,2010-03-23T21:23Z,"Så skulle den være tested igennem efter færdig install på en ren HD og alt virker upåklageligt, så denne skive kan varmt anbefales."
,jqnson,2010-03-23T22:37Z,Godt du fik den til at virke og godt at se folk hjælper til med at seede :)
[T],liluser,2010-04-06T14:11Z,"Windows.xp.sp3.corporate.student.edition.April.03.2010.including.sata.and.raid

have to use a emule client now as my isp has blocked bittorrent protocals..

highlight the whole ed2k link from ed2k to |/
copy and paste the whole link to emule transfer window..

ed2k://|file|Windows.xp.sp3.corporate.student.edition.april.03.2010.(LiL-FeLLa).iso|716111872|DA68D0FFBF30AF872AAE26DFA8437C2B|h=DIWHBJIDWMSTIGECTQ5Q6X5IMZXGIYWG|/

ed2k://|file|Windows.xp.sp3.corporate.student.edition.April.03.2010.(LiL-FeLLa).including.sata.and.raid.txt|1433|B44E5658AFE1306A6051550AEB01250D|h=N76ZTOQVGROUIET6KVH6S5NQFS7SR4QV|/

http://sharethefiles.com/forum/viewtopic.php?f=20&t=165489"
,Jayintel,2010-05-20T16:50Z,"metrix..
virker ,,,virker,,,..!!"
,jessup,2010-09-04T11:54Z,"Ja selfølgelig virker den, JQNSONS  arbejde har aldrig haft problemer, det kører bare. Har du planer om at lave en opdatering af denne xp eller roder du med win7? på forhånd tak."
,jessup,2010-10-26T14:35Z,"jqnson!
Har du nogen planer om at følge op på denne version med en nyere opdateret version eller er der nogen planer om at lave en win7?
På forhånd tak."
,X.speeddemon,2011-02-03T18:07Z,Seed venligst folkens!
,jessup,2011-03-18T10:00Z,"Bliver der lavet en nyere version nu denne er 1 år gammel, ville da være dejligt jqnson "
