User Type,Username,Date,Text
[T],nystrand,2010-01-25T20:00Z,is it in english?
[T],nystrand,2010-01-25T20:01Z,seed please stuck at 1.3%
,einarz,2010-01-30T17:59Z,"Nice.

The European tournament is still on.

Playing now Croatia vs. Poland

And before France and Iceland played.

Playing for the gold: France v.s Croatia.
Playing for the bronze: Iceland vs. Poland

Thanx for this game."
,BuCh0,2010-02-05T03:35Z,Which is a key?
,djukela,2010-02-09T21:15Z,"when i start to write serial number , game get crashed, where is the problem, anybody knows?
"
[T],nystrand,2010-06-11T21:38Z,its only in german
