User Type,Username,Date,Text
,Onatopa,2010-01-19T05:29Z,Thanks KK for the up...seeding now!
,OTHELO_CJ,2010-01-19T05:54Z,THANKS
,some-thing-sobrenatural,2010-01-23T14:19Z,love you Kentucky Kid Thanks!!!
,sgriff59,2010-01-29T04:49Z,KK---INstalled program but where do i enter the serial number? It just tells me to go to the website to activate.
,Pirumyan,2010-02-03T01:52Z,"Same problem, i installed it and clicked activate, takes me to a website."
,away1,2010-02-08T19:06Z,Also the same problem. You can't enter the serial(s) provided in the nfo
[V],kentucky-kid,2010-02-10T22:51Z,Fixed here: https://thepiratebay.org/torrent/5352995
