User Type,Username,Date,Text
,vikas_1912,2009-12-02T16:46Z,thanks i ll seed till i bleed.....
,adamspike,2009-12-02T22:42Z,nice thanks 
,3amer999,2009-12-04T01:01Z,i thought he said he is gonna feature lady gaga in one of his tracks :(
[V],bubanee,2009-12-05T23:18Z,she wasn't available she was to busy changin her wigs...
,E_Dagger,2009-12-08T22:38Z,bitrate = 256 VBR = awesome = thanks for the up
[V],bubanee,2009-12-09T03:46Z,"i think i might re-word that, i know your saying an Average of 256 for VBR.. but i will say it's VBRV0
in case some people don't get it.. cheers"
,arthur33,2009-12-09T11:16Z,great cd thanks for the upload
,Gizmo20783,2009-12-24T08:45Z,Mine keeps skippin is that normal?
,Sephirtohsclon,2009-12-27T05:19Z,Timbo`s numbah 1 biaatch!!!
,travel12,2010-02-07T03:55Z,"works great, good download, everything is great. thxs man"
,Dmonslayr,2010-02-12T16:55Z,Thanks for sharing m8 appreciate it.
,bainzy,2010-02-25T17:36Z,hi bubanee ive looked at your absolutely brilliant torrents and i was just wondering wot woz ur 1st torrent?
,Fab04,2010-02-26T12:00Z,Once again - thanks Bubanee :D
,someone13,2010-03-24T13:12Z,thanku very much
,uberglotten,2010-04-22T08:45Z,"Can you or anybody get full discographys that are in good shape and include (ALL solo albums, group albums, Compilations, unreleased, exclusives, Soundtracks, Live, etc.) for Pigeon John, Living Legends, La Symphony, Blueprint, Bone Thugs N Harmony, Fat Joe, Mase, Diddy, Casual, DJ Z Trip, DJ Rectangle, Diddy, Cash Money, Hieroglyphics, guru, Spice 1, B-Legit, RBL Posse, Cali Agents, Funkmaster Flex, B.O.B, Charles Hamilton,Eric B. and Rakim, DJ Clue, Dipset, Big Pun, DITC, Del Tha Funkee Homosapian, Esoteric, DJ Khaled, DJ Kay Slay, Outkast & the Dungeon Family, Outlawz, DJ Green Lantern, Memphis Bleek, Freeway & Jake one, Cee-LO, Danger Mouse, Capone and Noreaga, Dj Drama,E40, C-bo, Tha Dogg Pound, DJ Quik, Goodie Mob, G Dep, Loon, Kwame,Afu-ra, Jeru the Damaja, 8ball and MJG, Eightball, Usher, Rkelly, Chris Brown, Timbaland and Magoo, Lumidee, Flipmode Squad, Shyne, Lighter Shade of Brown All Rocafella, Bow wow, Tyga, 2 live crew and Luke, Too Short, Lil Kim, Nicki Minaj, Foxy Brown, Cuban Links, Terror squad,Gucci Maine, Young Money, Wacka Flocka, OJ da Juiceman, Papoose, quan,  Bones Soundtrack, Gang Related Soundtrack, Boyz N Da HoodCrime MobLil ScrappyPastor TroyPaul WallPliesThree 6 MafiaYing Yang TwinsYoung DroYoung JeezyYoungBloodZYung Joc anything you can do would be great mates"
,angeli0420,2010-06-21T05:42Z,thank you very much :)
,77yakuza77,2011-11-20T13:44Z,tx :)
,boss352,2012-03-04T12:08Z,thanks
