User Type,Username,Date,Text
,jocoka,2009-12-11T22:24Z,"Mivel nncs Koszonom! (ez volt a jelszó)

Nics további feltöltés sem.

Örülök,hogy sikerült letöltened,és talán tovább is 
 adtad,de ez már nem érdekel.

Néha visszanézek ide,hogy van e köszönet nyilvánítás avagy sem.

Azután majd meglátjuk.

Még tudnék mit feltölteni,de már elment a kedvem.

Pá..."
,2pacalypseNow,2009-12-21T00:21Z,"Jocoka,
Annyira meg akarom koszonni hogy ezt a filmet felraktad!! Meg nagyon regen lattam A Fekete Varos-t, amikor 12-eves voltam, es annyira tetszett!! Vegre megint megtalaltam...es annyira orulnek hogyha fel birnad rakni a tobbi reszet!! Kosz"
,jocoka,2009-12-22T00:01Z,"Örülök,ha tetszik a film.

Keresek még feltölteni valót.

Békés Boldog Karácsonyt!"
,Edlynne,2009-12-22T23:46Z,"Nagyon köszönök mindent,kedves Jocó,te egy angyal vagy!!!Kellemes Karácsonyt!"
,robearth,2009-12-23T15:06Z,"Koszonom! Tetszenek a torrentjeid, habar jobban orulnek az .iso formatumnak. (10-es aranyig seed-eltem mind amit letoltottem) Valoszinu tobben koszontek volna meg, ha regisztralas nelkul meg lehetne tenni. Tovabbi jo torrentezest!"
,Fekete2010,2010-02-04T17:54Z,"99,8 %-nál kilépett az egyetlen seeder, 30 peer várakozik, aki tud, szíveskedjen segíteni...

6 MB hiányzik mindössze, de a torrent így is kicsomagolható, ebben esetleg én is tudok segíteni. Az egyik .vob file kicsit hiányos lesz, talán észre sem vehet? ilyen kis hiány, bár én nem láttam, mert az elejét?l kellene majd megnézni."
,varjudomb,2010-10-09T19:02Z,Köszi!
,viking456,2010-12-22T13:20Z,Köszönöm!
,Atko79,2011-03-27T14:50Z,"Köszönjük szépen! Nagyon rendes tőled, hogy megosztod ezeket a műveket."
,Kriszti22,2011-08-09T17:31Z,Köszi!
