User Type,Username,Date,Text
,vespadelus,2011-05-10T14:30Z,"This is the original UK version. Thanks, much appreciated and loved by my boys..."
,thorvaldtv,2011-05-27T15:11Z,Thx from Norway :)
,stone54,2011-09-16T19:40Z,could you re-upload as separate AVI's?
,ozzie79,2012-01-09T04:55Z,"My son will destroy my laptop if I let him watch on there, so I need to burn it to a DVD. I used an AVI to DVD converter, but the file is about 200MB too big to fit on a DVD :(

Does anyone have a tip on other ways to burn this?"
