User Type,Username,Date,Text
,kayleelyn,2009-11-07T01:58Z,"A-8, V-8/9.....Awesome torrent. Thanks"
,yeahm8,2009-12-02T09:53Z,"FAKE!! I could only download 13% of this file before it failed and with what I did manage to download , it was a porn file."
[T],Antje14,2009-12-05T12:50Z,"@yeahm8
Something probably went wrong on your virus infested porn box. Stop visiting those porn sites."
,supaman4592,2009-12-12T19:21Z,yeahm8 yea sry but wen u dont finish a movie and with some cases with movie players it will play a movie u already have on ur computer because it cant recognize that file
