User Type,Username,Date,Text
,jacksean2,2009-09-24T13:50Z,"pure screen u r the man.
One of the greatest uploader of TPB"
,martian_neighbour,2009-09-28T11:23Z,"^^lol extremezone you're jealous!!
No one beats pure_screens in the porn section.
You are maybe in the top 10 in video section but that's it. :-)"
,metzeller,2009-09-28T12:51Z,Anyone know the name of the blonde model?
,gorbach,2009-10-01T15:25Z,who is she???
,osez,2009-11-15T21:51Z,shes beautiful.
,voyger2,2009-11-23T14:16Z,Nice video with good quality. Thanks!
,stjerome,2009-12-20T21:30Z,why is it that i cant see the screenshots   :-/
,primalclaws1974,2010-01-23T19:47Z,This blonde has the absolute perfect body
,boozebelly,2010-02-18T14:21Z,Quality is good :) Only it looks like he is fucking a corpse :S Not my kind of thing...
,PrettyWhiteBoy,2010-03-09T14:00Z,one of the best:)
,rovid,2010-03-28T07:45Z,I think she is Cindy Dollar
,soepvlieg,2011-05-29T16:10Z,"Great UL, been looking long time for International eye candy 1 and 2, any chance you can upload that? THx"
,soepvlieg,2011-05-29T16:17Z,"Great UL,
Been looking fro International eye candy 1 and 2 for a vry long time, think you can ul that?
Thx"
,attilad,2011-08-21T09:18Z,"Has anyone seem that blonde hotness in another movie?

BTW, link for screens wasn't working for me so...
http://i3.imageban.ru/out/2011/08/21/d825ce004339f985a0d5e25a0c5e2c98.jpg"
,dalle7777,2012-02-06T00:46Z,"True she is Cindy Dollar..
Here u go guys:
http://www.eurobabeindex.com/sbandoindex/cindydollar.html"
,AxOpLiX,2012-07-17T12:22Z,One word: thanks!
