User Type,Username,Date,Text
,desenf,2010-11-13T08:01Z,"Hi holy, i was wating for you to release this one, hop it get seeders soon! thanks a lot for the up!"
[V],HolyRoses,2010-11-13T08:54Z,"it of course has seeders.  pay no regard to tpb's tracker, its often broken."
,desenf,2010-11-13T20:34Z,"my bad holyroses! it does have seeders, i just don't know why it showed me like there is no seeders! but thanks!  i will be seeding this for everyone!, thanks again! youre the best! if you don't upload it... I don't download it! cheers!"
,Biison,2010-12-10T15:53Z,Thanks!!!
,94angels,2011-04-03T06:41Z,You should do a 3d version
,Diamondz7,2011-07-19T04:03Z,Thank u soo much hr.. I appreciate it again.!
,ron_i62,2011-10-12T23:26Z,thanks
