User Type,Username,Date,Text
,roquetski,2010-01-12T11:58Z,downloaded but how can I play it on my laptop?
,sitlet,2010-01-25T04:38Z,dude....google it.
,systechsolution,2010-09-28T10:35Z,"Thanks For The Upload...
Will Seed For 1 Month Now...
Can You Put This Movie In Dual Language English - Hindi With English Subs & Same Quality...
Am From India And We People Like Our Regional Language Hindi....
Or Any Trick So I Can Add Hindi Language By Ripping It....
If Possible Then Please Mail Me Back...


Saggi Here...
systechsolution@in.com "
