Filename,Size,Unit
A Santa Cause - It's A Punk Rock Christm/06 Yule Shoot Your Eye Out [Acoustic.mp3,3.37,M
"America's Suitehearts Remixed, Retouched/01 America's Suitehearts (Mark Hoppu.mp3",3.3,M
"America's Suitehearts Remixed, Retouched/02 America's Suitehearts (Acoustic).mp3",3.44,M
"America's Suitehearts Remixed, Retouched/03 Lullabye.mp3",2.11,M
"Bad Scene, Everyone's Fault_ Jawbreaker/11 Save Your Generation.mp3",3.31,M
Believers Never Die Greatest Hits/01 Dead On Arrival.mp3,2.99,M
Believers Never Die Greatest Hits/02 Grand Theft Autumn_Where Is Your.mp3,2.93,M
Believers Never Die Greatest Hits/03 Saturday.mp3,3.33,M
"Believers Never Die Greatest Hits/04 Sugar, We're Goin Down.mp3",3.53,M
"Believers Never Die Greatest Hits/05 Dance, Dance.mp3",2.77,M
"Believers Never Die Greatest Hits/06 A Little Less Sixteen Candles, A.mp3",2.6,M
"Believers Never Die Greatest Hits/07 This Ain't A Scene, It's An Arms.mp3",3.26,M
Believers Never Die Greatest Hits/08 Thnks Fr Th Mmrs.mp3,3.18,M
"Believers Never Die Greatest Hits/09 The Take Over, The Breaks Over.mp3",3.29,M
Believers Never Die Greatest Hits/10 I'm Like A Lawyer With The Way I'.mp3,3.29,M
Believers Never Die Greatest Hits/11 Beat It ft. John Mayer.mp3,3.5,M
Believers Never Die Greatest Hits/12 I Don't Care.mp3,3.34,M
Believers Never Die Greatest Hits/13 America's Suitehearts.mp3,3.37,M
"Believers Never Die Greatest Hits/14 What A Catch, Donnie.mp3",4.54,M
Believers Never Die Greatest Hits/15 Alpha Dog.mp3,3.38,M
Believers Never Die Greatest Hits/16 From Now On We Are Enemies.mp3,3.3,M
Believers Never Die Greatest Hits/17 Yule Shoot Your Eye Out.mp3,3.38,M
Believers Never Die Greatest Hits/18 Growing Up.mp3,2.66,M
"DJ LiL' Cee & Trevor Simpson Present_ Ul/Dance, Dance (Tommie Sunshine Remix).mp3",2.67,M
Fall Out Boy's Evening Out With Your Gir/01 Honerable Mention.mp3,3.14,M
Fall Out Boy's Evening Out With Your Gir/02 Calm Before The Storm.mp3,4.3,M
Fall Out Boy's Evening Out With Your Gir/03 Switchblades And Infidelity.mp3,1.88,M
Fall Out Boy's Evening Out With Your Gir/04 Pretty In Punk.mp3,3.3,M
Fall Out Boy's Evening Out With Your Gir/05 Growing Up.mp3,2.57,M
Fall Out Boy's Evening Out With Your Gir/06 The World's Not Waiting (For Five.mp3,2.43,M
"Fall Out Boy's Evening Out With Your Gir/07 Short, Fast, And Loud.mp3",2.12,M
Fall Out Boy's Evening Out With Your Gir/08 Moving Pictures.mp3,3.19,M
Fall Out Boy's Evening Out With Your Gir/09 Parker Lewis Can't Lose (But I'm.mp3,3.03,M
Folie Ã, Deux/01 Lullabye.mp3,2.19,M
Folie Ã, Deux/02 Disloyal Order Of Water Buffaloes.mp3,4.01,M
Folie Ã, Deux/03 I Don't Care.mp3,3.35,M
Folie Ã, Deux/04 She's My Winona.mp3,3.61,M
Folie Ã, Deux/05 America's Suitehearts.mp3,3.35,M
Folie Ã, Deux/06 Headfirst Slide Into Cooperstown.mp3,3.66,M
Folie Ã, Deux/07 The (Shipped) Gold Standard.mp3,3.11,M
Folie Ã, Deux/08 (Coffee's For Closers).mp3,4.28,M
Folie Ã," Deux/09 What a Catch, Donnie.mp3",4.52,M
Folie Ã, Deux/10 27.mp3,3.01,M
Folie Ã, Deux/11 Tiffany Blews.mp3,3.5,M
Folie Ã, Deux/12 w.a.m.s.mp3,4.32,M
Folie Ã, Deux/13 20 Dollar Nose Bleed.mp3,4.01,M
Folie Ã, Deux/14 West Coast Smoker.mp3,2.61,M
Folie Ã, Deux/15 I Don't Care (Machine Shop Remix).mp3,2.87,M
Folie Ã, Deux/16 America's Suitehearts (South Rakk.mp3,3.37,M
Folie Ã, Deux/17 Pavlove.mp3,3.35,M
Folie Ã, Deux/18 America's Suitehearts (Acoustic).mp3,3.44,M
Folie Ã," Deux/19 What A Catch, Donnie (Acoustic).mp3",3.75,M
Folie Ã, Deux/20 Beat It.mp3,3.63,M
Folie Ã, Deux/21 America's Suitehearts (Suave Suar.mp3,2.9,M
Folie Ã, Deux/22 I Don't Care (Acoustic).mp3,3.51,M
Folie Ã, Deux/23 I Don't Care (Tommie Sunshine & M.mp3,4.92,M
From Under the Cork Tree/01 Our Lawyer Made Us Change the Nam.mp3,2.88,M
From Under the Cork Tree/02 Of All the Gin Joints in All the.mp3,2.92,M
"From Under the Cork Tree/03 Dance, Dance.mp3",2.76,M
"From Under the Cork Tree/04 Sugar, We're Goin Down.mp3",3.5,M
From Under the Cork Tree/05 Nobody Puts Baby in the Corner.mp3,3.06,M
From Under the Cork Tree/06 I've Got a Dark Alley and a Bad I.mp3,2.91,M
From Under the Cork Tree/07 7 Minutes in Heaven (Atavan Halen.mp3,2.79,M
From Under the Cork Tree/08 Sophomore Slump or Comeback of th.mp3,3.11,M
"From Under the Cork Tree/09 Champagne for My Real Friends, Re.mp3",3.11,M
From Under the Cork Tree/10 I Slept with Someone in Fall Out.mp3,3.23,M
"From Under the Cork Tree/11 A Little Less Sixteen Candles, A.mp3",2.58,M
From Under the Cork Tree/12 Get Busy Living or Get Busy Dying.mp3,3.17,M
From Under the Cork Tree/13 Xo.mp3,3.37,M
From Under the Cork Tree/14 Snitches And Talkers Get Stitches.mp3,2.6,M
From Under the Cork Tree/15 The Music Or The Misery.mp3,3.19,M
From Under the Cork Tree/16 My Heart Is The Worst Kind Of Wea.mp3,3.09,M
"From Under the Cork Tree/17 Sugar, We're Goin Down (Patrick S.mp3",3.67,M
"From Under the Cork Tree/18 Dance, Dance (Lindbergh Palace Re.mp3",3.19,M
Infinity On High/1-01 Thriller.mp3,3.26,M
"Infinity On High/1-02 _The Take Over, The Breaks Over.mp3",3.32,M
"Infinity On High/1-03 This Ain't a Scene, It's an Arm.mp3",3.29,M
Infinity On High/1-04 I'm Like A Lawyer With The Way.mp3,3.29,M
Infinity On High/1-05 Hum Hallelujah.mp3,3.57,M
Infinity On High/1-06 Golden.mp3,2.38,M
Infinity On High/1-07 Thnks Fr Th Mmrs.mp3,3.16,M
Infinity On High/1-08 Don't You Know Who I Think I am.mp3,2.68,M
Infinity On High/1-09 The (After) Life Of The Party.mp3,3.13,M
Infinity On High/1-10 The Carpal Tunnel of Love.mp3,3.17,M
Infinity On High/1-11 Bang The Doldrums.mp3,3.28,M
Infinity On High/1-12 Fame _ Infamy.mp3,2.89,M
"Infinity On High/1-13 You're Crashing, But You're No.mp3",3.45,M
Infinity On High/1-14 I've Got All The Ringing In My.mp3,3.82,M
Infinity on High [Deluxe Edition] [Bonus/01 G. I. N. A. S. F. S..mp3,3.03,M
Infinity on High [Deluxe Edition] [Bonus/02 It's Hard to Say _I Do_ When I Do.mp3,3.17,M
"Infinity on High [Deluxe Edition] [Bonus/03 Dance, Dance [Live].mp3",3.02,M
"Infinity on High [Deluxe Edition] [Bonus/04 This Ain't a Scene, It's a Arms R.mp3",3.16,M
Infinity on High [Deluxe Edition] [Bonus/05 Thriller [Live].mp3,3.29,M
Live In Phoenix/01 Thriller.mp3,4.71,M
Live In Phoenix/02 Grand Theft Autumn _ Where is You.mp3,3.04,M
Live In Phoenix/03 Sugar We're Goin Down.mp3,3.37,M
Live In Phoenix/04 Our Lawyer Made Us Change the Nam.mp3,2.83,M
Live In Phoenix/05 Hum Hallelujah.mp3,3.71,M
Live In Phoenix/06 Tell That Mick He Just Made My Li.mp3,3.29,M
"Live In Phoenix/07 I'm Like a Lawyer, the Way I'm Al.mp3",3.27,M
"Live In Phoenix/08 A Little Less Sixteen Candles, a.mp3",2.64,M
Live In Phoenix/09 Beat It.mp3,3.57,M
Live In Phoenix/10 Golden.mp3,2.34,M
"Live In Phoenix/11 This Ain't a Scene, It's an Arms.mp3",3.49,M
Live In Phoenix/12 Thnks Fr Th Mmrs.mp3,3.24,M
"Live In Phoenix/13 _The Take Over, the Breaks Over_.mp3",3.42,M
"Live In Phoenix/14 Dance, Dance.mp3",2.96,M
Live In Phoenix/15 Saturday.mp3,3.62,M
My Heart Will Always Be The B - Side To/01 My Heart Is The Worst Kind Of Wea.mp3,3.09,M
My Heart Will Always Be The B - Side To/02 It's Not A Side Effect Of The Coc.mp3,2,M
My Heart Will Always Be The B - Side To/03 Nobody Puts Baby In The Corner.mp3,3.26,M
My Heart Will Always Be The B - Side To/04 Love Will Tear Us Apart (Joy Divi.mp3,3.09,M
My Heart Will Always Be The B - Side To/05 Where Is Your Boy (Acoustic).mp3,2.94,M
"Myspace Records, Vol. 1/06 Nobody Puts Baby in the Corner [A.mp3",3.22,M
Nightmare Before Christmas 3D Soundtrack/What's This_.mp3,1.37,M
"Q1 Sampler - International 2007/18 This Ain't A Scene, It's An Arms.mp3",3.74,M
Split EP/04 Growing Up.mp3,2.66,M
Split EP/05 Switchblades And Infidelity.mp3,2.95,M
Split EP/06 Moving Pictures.mp3,3.26,M
Take This To Your Grave/01 Tell That Mick He Just Made My Li.mp3,3.22,M
Take This To Your Grave/02 Dead On Arrival.mp3,3,M
Take This To Your Grave/03 Grand Theft Autumn _ Where Is You.mp3,2.91,M
Take This To Your Grave/04 Saturday.mp3,3.31,M
Take This To Your Grave/05 Homesick At Space Camp.mp3,2.87,M
Take This To Your Grave/06 Sending Postcards From A Plane (W.mp3,2.7,M
Take This To Your Grave/07 Chicago Is So Two Years Ago.mp3,3.05,M
Take This To Your Grave/08 The Pros And Cons Of Breathing.mp3,3.08,M
Take This To Your Grave/09 Grenade Jumper.mp3,2.71,M
Take This To Your Grave/1-13 Roxanne.mp3,2.93,M
Take This To Your Grave/1-14 Grand Theft Autumn _ Where Is Y.mp3,3.49,M
Take This To Your Grave/10 Calm Before The Storm.mp3,4.08,M
Take This To Your Grave/12 The Patron Saint of Liars and Fak.mp3,3.05,M
Tony Hawk's American Wasteland Soundtrac/1-10 Start Today.mp3,1.88,M
Unreleased/02 Hand Of God.mp3,3.03,M
Unreleased/04 Hidden Track.mp3,955.31,K
Unreleased/06 Grand Theft Autumn (Marching Band.mp3,2.39,M
