User Type,Username,Date,Text
,TitanusEramius,2010-10-14T07:31Z,Thanks for putting this up in bluray :-)
,Revolver31,2010-10-20T01:54Z,thx for this plz tell me you plan to put up season 2 aswell plz.
[V],reliant1,2010-10-20T08:54Z,"[Revolver31] 
I haven’t decided, yet"
,Keegen,2010-12-09T04:25Z,"Thanks, hoping for season 2 also ;) LOVE that there are subs ;)"
,4ngelus,2011-01-06T13:46Z,"Thanks for this wonderful upload with subtitles! It's really helpful.
I hope you'll decide to upload the second season as well. There aren't a lot of great sources for that season yet. Please consider."
,anseio,2011-05-08T05:17Z,"The audio tracks on episodes 3 and 4 are swapped out with each other. I can correct my own copies, but you may want to repack it if anyone else has this problem."
