User Type,Username,Date,Text
[V],pluto999,2010-03-23T08:27Z,"@ seeders if you guys just download & run away I'm not gonna upload any more. what is the point then? am i uploading these torrents for my sake or for others?

Seed if you want more uploads!"
,alexapirot32,2010-04-05T13:47Z,"It's a god damn 400MB file, is it so hard to seed?"
[V],pluto999,2010-04-09T07:08Z,@alexapirot32: I totally agree with you man!!
,banukaknight,2010-11-18T15:30Z,where the hell are seedres
,rom86,2011-05-29T21:37Z,how can we punish those who does not seed?
