User Type,Username,Date,Text
,wintergre,2010-02-04T17:17Z,Tried with Photoshop CS4 Extended (v.11.0) and works OK.
,jooeClarkk,2010-02-05T00:47Z,"thanks. works good. if anyone is looking for cs4, i got mine from a really nice site at

smartNlol.com/school.php  just delete the ""N""

its where i downloaded my cs4 from like half year ago and works awesome for me :) would recommend to those who looking."
,Muan,2010-02-21T23:14Z,It works. thanks dude ;)
,skiper5,2010-02-23T05:58Z,"if you're worried about the keygen you can find some of the serial keys from this link
sharecash dot org/download.php?file=432259 "
,michael1984uk,2010-03-01T17:45Z,It works for a day but then you have to keep redoing the crack in flash cs4 otherwise the adobe software anti piracy license nagging window will pop up and you will have to crack it over and over again for it to work
,kapil..,2010-04-02T07:08Z,Thanks. Works great with Adobe Dreamweaver CS4 10.0.0.4117
,Ivantav,2010-04-13T22:02Z,Perfect. Thanks!!
[T],iamtroopsaugus,2010-04-15T00:14Z,"great torrent, thank you batman!"
,wvl02,2010-04-26T17:39Z,"Hey man, thanks it works great!"
,zport,2010-12-10T07:08Z,Works awesome! Tested on Win7 64bit. Follow istructions and it will work. Copy appropriate amtlib.dll to the windows x86 folder.
,philsurmac,2010-12-14T11:29Z,"Works perfect with Dreamweaver CS4 ;)
Thanks dude"
