User Type,Username,Date,Text
,OCDme,2010-09-06T02:05Z,"The (Real) entire album can be found at www dot torrentreactor dot net/torrents/5851300/Linkin-Park-A-Thousand-Suns . I tried for at least 1 hour to upload to TPB and it would never take, kept getting file name error."
,Salient1,2010-12-29T21:48Z,"you know what i dont understand?

a while back linkin park had the ""Catalyst"" remix contest....

they said they would include the winning track on this album and it would be distributed to all buyers/listeners.

pretty much, linkin park was going to help promote the winner on their new album by including that remix track.

they said it in video blogs and posted it in the prizes area of the rules.

i still havent found 1 copy of this album with the winning remix track included.

i think linkin park LIED to everybody!!!"
