User Type,Username,Date,Text
,kviende,2009-12-31T10:11Z,tack fĂśr hela serien
,tribaltiger69,2009-12-31T14:20Z,Tack sĂĽ mycket.
,zyckOmarTz,2009-12-31T17:25Z,"Thanks for ul, but R55 is missing..."
,Benson,2010-01-01T10:43Z,"Thanks for the uppload nallefnahsq. If you have the missing file R55 pleace upload it.
Best regards from Benson and Happy New 2010"
,Zynk2,2010-01-01T17:48Z,"Mangler r55 kan su laste opp denne ???

Takker for bra upload"
,nallefnahsq,2010-01-02T02:48Z,"Hi, I'm really really sorry. I didn't check that all files where there before I uploaded. File R55 is missing, and I can't find it.
So I've uploaded another torrent for the 10th Kingdom disc 3
http://thepiratebay.org/torrent/5252097/The.10th.Kingdom.D3.Nordic.pal.DVDR.disk_3_3"
