User Type,Username,Date,Text
[V],.BONE.,2010-01-26T14:43Z,if its as shit as what u say it is y would people wanna watch it there stop fuck off n stop spammin my PAGES!
[V],.BONE.,2010-01-26T14:52Z,people dont wanna fill out your shitty surveys b4 can watch a film that can download from here at better quality
,raiden395,2010-01-26T18:06Z,@.BONE.: Thanks for the upload.  I wish your comments were more coherent though.
,thedevil_69er,2010-01-26T18:26Z,is this the full movie or does it cut out near the end ??
,karan4444,2010-01-26T19:02Z,iden63 good comment man because these people want a bluray after releasing the film it is free so enjoy  dont comment like bad copy or something  good copy of cam
,william999,2010-01-26T19:33Z,"i fucking hate it man when arseholes on here say ""shut up cause its free""--.Just because it's free does it mean that we can't criticise or say the cam's shit or done with a cellphone camera.Of course it's fucking free ,Its a torrent on a freeware site you total fucking wanker's."
,dadyhacks,2010-01-26T20:15Z,lsieygsyeg....>SCREEN-SHOTS are sherlock homes matey ?????? what the bumber rass!!!!? ya certainly aint no sherlock .... ha ha ha ....
,snooze2010,2010-01-26T20:57Z,"tako je,reci ti njima....lware"
,Steffi.H,2010-01-26T21:07Z,"This is a terrible movie. Don't waste your time.
It got *horrendously* bad reviews across the spectrum:
http://www.imdb.com/title/tt1038686/usercomments"
,barry421,2010-01-26T21:20Z,"pretty poor quality,blurry and blocky.thanks anyway bone."
,soryn_66,2010-01-26T21:54Z,bad quality
,otherwize,2010-01-26T21:55Z,some screenshots plz
,pirate_teaddy_bear,2010-01-26T23:42Z,"v7
a7
tank you bone for the up load  im still seeding

i dont have any torent ive bin trying for the last day dint wokr some budy flush me? no help sorry guys have alot of game and movies could up load"
[V],.BONE.,2010-01-27T00:14Z,say what use want 2 about the film aslong as its only about the torrents n not about crap i dont care wat people say freedom of speach u gotta let every1 else no if its good or bad just dnt spam my pages with links trying 2 promote crappy watch online movie sites :)
,pirate_teaddy_bear,2010-01-27T00:14Z,sorry leon but this is a cam not a dvd rip ax and vx is for a cam i cant tell you ive senn worst than that
,pirate_teaddy_bear,2010-01-27T00:17Z,by the way bone is ther any cors 101 on how to up load bit torent bine tring dint work
,thedevil_69er,2010-01-27T00:40Z,"my opinion = for a cam its not bad u can never expect a really GOOD cam version but it does cut out the final battle between micheal n gaberial so since that happened i would have to RATE THIS a -5 yes i said -5 if the battle was in it i would give it bout a ummm.... 7 for cam version !!

DONT WASTE UR TIME DOWNLOADING THIS COPY !!!!"
,thedevil_69er,2010-01-27T00:50Z,"o n also i thought peeps wit sskulls should b able to b trusted wit their content but apparently not this guy, i belive his skull SHOULD B REMOVED !!

N PLEASE STOP SEEDING THIS IF U R SO OTHER PEOPLE DONT WATSE THERE TIME =8-)"
,Spyder_17,2010-01-27T05:42Z,Downloading it. I'll let y'all know. Thanx :)
,Butters420,2010-01-27T06:03Z,ya i agree bone thanx for dl even though shit is missin the end still apprieciate the effort For the one who said he needs the skull taken man fuck off dude no one is perfect and ya you have the right to say what u want but this the only time bone has fucked up no offense bone i dl ur shit a lot
,Vao,2010-01-27T08:28Z,"Execellent movie, wasn't as good as I expected though

V7/A7

100% very watachable.. best quality out there so far."
[V],.BONE.,2010-01-27T11:18Z,i did not make the file IMAGINE did i just uploaded it but the IMAGINE groups normaly realy good and has no problems :)
,p-sub,2010-01-27T15:33Z,English sub: http://subscene.com/english/Legion/subtitle-296431.aspx
,uspamudie,2010-01-28T02:49Z,"If all the lowlife spammers on this torrent died a horible death right now,,I'd laugh my f'n azz off...DO NOT support these scum spammers by clicking links,,you will regret it,,viruses,trojans or bs surveys"
,DeltaP,2010-01-28T04:50Z,I DONT THINK THIS IS IMAGINE!!!???!!! SAME AS GM COPY
,thebear9a,2010-01-28T09:03Z,"thanks for effort uploader. I want to see this movie, but i rate this as V4 A4 - for a cam. Now way does this cam rate 8 or 7 or 6. "
,JoeScar2008,2010-01-28T17:03Z,"thedevil_69er, people work hard to get those skulls and you shouldn't say what you did. Thanks Bone."
,GTNinja,2010-01-28T23:10Z,Sownloading now... Sad to see that it is only DL'ing at 46Kbps. i know that a good DL should run at atleast 500KBPS. I want to see this movie though so i guess i can wait 5 hrs...
,urbandaisy,2010-01-29T04:26Z,"Watchable for sure!
Best out there thus far.

Thanks for yet another great one BONE!

Any chance you might have Extraordinary Measures popping up soon?

TX again!"
,erics600,2010-01-29T07:01Z,Thanks for the up load cant wait for cameras to advance a little more then we will always have great videos 
,eightinch68,2010-01-29T17:56Z,BONE CAN U PLEASE GET A COPY OF BOONDOCK SAINTS 2? I HAVE BEE LOOKING EVERYWHERE. THANKS BRO.
,DADONDUTCH,2010-01-30T06:24Z,IM DOWNLOADING NOW. PRETTY FAST  DOWNLOAD. 1300/KBS WILL RATE AFTER
,DADONDUTCH,2010-01-30T06:27Z,ITS AT A ANGLE. ITS A CAM. HONEST RATING. ILL GIVE IT A FAIR 4/V 4/A ITS GRAINY AND DARK. WOULDNT DOWNLOAD. ITS NOT A VIRUS THO. BUT ITS NOT CLEAR.
,drew4519,2010-01-30T21:16Z,"Thx BONE! woot, been waiting for this movie :) hope its as good as what ppl say, can't expect blu ray quality from a cam , lol i hate ppl that bitch."
,orwellenator,2010-02-01T09:21Z,"I have no idea why this was rated V7 A7 by some folks here.  They must have looked on poor shitty movies all there life.
The video quality is really poor rate V4 at the most. Sound is not that amazing as well about A 5
But if you really like to see it I have not find a better one. If one here has please let us know."
,ChadVader,2010-02-02T03:11Z,"Wow.  Far and away, the absolute WORST quality download I have ever been misfortunate  enough to download.  Utter shyte."
,whitehand,2010-02-05T13:51Z,Unwatcahble release! Dont download this!!
,Silsatykki,2010-02-06T04:28Z,"heh ""CAM XVID"" what you guys waiting for this? pure dvd? even br??  :D
huhuh

thanks .BONE.  "
,DADONDUTCH,2010-02-06T21:15Z,DOWNLOADING NOW WILL GIVE A/V RATING
,jj1957,2010-02-06T23:22Z,"not recommended, poor sound and pic
A:3V:4"
,hrsemn,2010-02-07T04:53Z,"A3
V4
Watchable, like an old 70's 8mm...kinda cool in that respect.  If you are looking for perfection this isn't it...."
,Lucas1233,2010-02-09T01:29Z,"Thanks for this not bad !
@BONE 
Fuck the survey, Virus crap shit !

TY - LUCAS"
,rui_oliveira81,2010-02-09T19:52Z,"i can´t open it. something is missing, it has only one file.....?"
,rui_oliveira81,2010-02-09T21:01Z,"ok my bad, it works. quality is what i expected..sound could be better. 5/10  mor or less..Anyway, thanks .Bone"
,disturbedguy92,2010-02-09T21:26Z,rofl iden63 why you say v8 a8 then like 10 comments down ask if it was missing the fight scene or not shouldent you know the answer if you posted the quality of the film? why fake post watch then post
,brian1399,2010-02-12T07:11Z,this isnt the whole movie its missing like 15 minutes but its still a good movie
,Draxxon,2010-02-19T20:24Z,"Thought this would never happen to me. Today I got a letter in the mail from my IP and they told me all about downloading this movie. Thankfully no one is pressing charges, but I'm not taking anymore chances. I suggest not downloading this torrent. Think im joshin you, send me a note and I will send you a copy of what they sent me!"
,nala1999,2010-03-12T08:24Z,I wish I kneww how to up load the one i found on torrentsearh.com Megaplay is soooooooo nice and guess what no Russian more lika a V-12 a-12 ok only have done this a few times  I am so happppppppyyyy
