User Type,Username,Date,Text
,shallow_,2010-09-02T18:14Z,"Got this from another site a few days ago, seeding now :) thanks a bunch M."
,ChefEm,2010-09-02T22:03Z,"Thaks Merzedes, nice looking girl!"
,pennywinterr,2010-09-02T22:36Z,Thanks for the upload.
,brianxxx,2010-09-02T23:35Z,Thanks for all the great ups and hard work!
,dk1854,2010-09-03T00:44Z,Thanks Merzedes.
,agwywatx,2010-09-03T03:11Z,http://www.sexandsubmission.c***********om/site/shoot/9799-Taboo-Teaching.html
,harrie2002,2010-09-03T16:23Z,"Always love SAS, thanks for the upload merzedes"
