User Type,Username,Date,Text
,kviende,2009-11-05T20:09Z,"discshop säger att det är 4 st skivor.
kommer resten oxå??"
[T],l_c_f_c,2009-11-05T21:06Z,"kviende: Jag tror det här är ""ARN - Internationell version"" delen av dom 4 skivorna. Alltså ""Romansviten om ARN, som tidigare delats upp i två långfilmer, har i den internationella versionen klippts ihop till en."" men jag är inte säker..."
[T],l_c_f_c,2009-11-05T21:10Z,Jepp jag hade rätt. Det är ARN - Internationell version delen av dom 4 skivorna. Dom andra skivorna innehåller ARN - Specialklippt version. Får jag tag på dom så kommer jag ladda upp dom också.
,kviende,2009-11-06T18:38Z,tack för infon
[T],l_c_f_c,2009-11-07T12:29Z,propus: Jag har för mig att dom pratar både svenska och engelska i den. Har inte kvar den så kan inte kolla igen. Den va så tråkig så jag stängde av efter 20minuter...
