User Type,Username,Date,Text
,TheMixfiles,2009-10-12T18:00Z,PLUGINS / FX ARE MISSING. :(
,nikemannen,2009-12-02T10:47Z,TheMixfiles : run as admin :)))) works great...exept the fact that I can?t export filelist :(( It will work in later version 7.4.4 thow
,Mystikz,2009-12-13T08:39Z,"Yep, program works but i the save as function and as export as file function do not work. "
,shadowvex,2010-03-11T09:33Z,umm yeah its NOT CRACKED if you can save your work lol!
,Cfoobs,2011-06-12T21:18Z,"Forgot to read the comments, silly me. Did an hour long mix then realised it refuses to export an MP3. Export to CD works but it insists on doing seperate tracks of course. AiR is still great though."
