User Type,Username,Date,Text
,Geminorum,2010-05-14T20:46Z,"Cary Grant var tydligen v채ldigt spr책kbeg책vad.

Spoken language(s): English, French, Spanish, Italian
I Nanornerna p책 Navarone:
 Pratade han ju tyska -Perfekkt."
,SlavekG,2010-05-15T12:21Z,Is it complete with menu and special features?
,OrpheusDude,2011-02-21T01:13Z,"What a fantastic (and important!) film!  Thanks you so much for the download.

To SlavekG - it is an exact clone of the DVD: it includes menu, choice of spoken languages (English, French, Italian and Spanish) and subtitles (19 different languages).  Unfortunately there are no extras on the DVD except for a few trailers."
