User Type,Username,Date,Text
,ReaL_BadMaN,2010-03-03T00:01Z,OMG
,drakeno21,2010-03-03T00:07Z,Ya I know. :)
,digitalbooty,2010-03-03T00:14Z,Is this really real son?
,john5246,2010-03-03T00:16Z,you guys are more than allstars to me 
,delboy2004,2010-03-03T00:27Z,yes this definitly Real as i have seen it on other websites and Allstar dont release fakes
,juss1,2010-03-03T00:33Z,this is real...:P:P
,delboy2004,2010-03-03T00:34Z,Look This is REAL as i saw it on a private tracker site which do not allow fake shit at all 
,soro22,2010-03-03T00:35Z,fake
,delboy2004,2010-03-03T00:36Z,alrite we will see wont we as i cannot be bothered to get into a fake/real war on ere
,delboy2004,2010-03-03T00:38Z,just one more thing is that on the other site i saw it on its got 59 seeds 
,morbidj,2010-03-03T00:45Z,Dam this is bad ass! I hope its the truth fellow gamers!
,rickyoon,2010-03-03T00:47Z,"oh em gee.
Let's seed this, people!"
,runtimmy,2010-03-03T00:47Z,thanks to from trinidad
,skytwin,2010-03-03T01:01Z,"Its real, but nuked...

check scnsrc.net for details"
,skytwin,2010-03-03T01:01Z," anydvd.curruption.dvd1.and.dvd2 

is the reason anyhow"
,lourock21,2010-03-03T01:33Z,What does nuked mean for us idiots??
,drakeno21,2010-03-03T01:39Z,It means SE put code into the game so that people who download the game will turn their 360 into a Nuke and explode upon playing! Be careful! You might need a hazmat suit to play. 
,kelmers,2010-03-03T02:05Z,very funny...but I mean for real...nuked version means not working version anyway or what?
,drakeno21,2010-03-03T02:07Z,"Yeah, there should be a Proper out"
,skytwin,2010-03-03T02:17Z,"yeah, sorry meant to post more :)

Nuked means there's something wrong with the release.  Sometimes they're nuked because they break the rules (not that p2p has any bloody rules but the scene does).  

In this case, anydvd (which decrypts video on the fly) is screwed.  This potentially could alter game data.

I'm hearing mixed things, some say this release will work, others say not.

I'd wait for a fix or a proper to come out if I were you."
,lourock21,2010-03-03T02:24Z,"I am downloading from Vip-file, All I want to know is if it's playable on a banned xbox 360 I don't give a shit about live. and if it's not is there a way to fix it"
,lourock21,2010-03-03T04:23Z,"Well, I finished downloading disc 1 and patched it using the wave patcher and burned it using imgbrn and I haven't had any crasheds yet"
,agreen1027,2010-03-03T05:53Z,can believe someone has already finished downloading from this torrent. what are you guys' download speeds?
,manowx28,2010-03-03T07:59Z,downloading it with 30 k/b
,Bujaaa,2010-03-03T08:48Z,I downloaded this from a private tracker. Disc 1 works fine so far.
,foxdie_3,2010-03-03T09:35Z,"--------------
What's the difference between :
1) Final.Fantasy.XIII.X360-Allstars 20.26 GiB
and
2) Final.Fantasy.XIII.X360-Allstars [TF] 21.9 GiB
????????????????
----------------
WTF are you doing Allstars ??? you are confusing .... don't you notice that :(
Give us a full description about the torrents you provided earlier .... nuked or corrupted ... you make things even worse ......
----------------"
,tnt3k,2010-03-03T10:12Z,This ff works.  however it has anystyle dvd corruption which will expose you if you have xbox live.  If your console is already banned then no worries.  This will work
,kelmers,2010-03-03T10:15Z,"at last, some great news :)"
,Bujaaa,2010-03-03T11:50Z,"I have 1 question not related to this torrent. I don't play on Xbox Live so my console is not banned. So if i connect to Live only to make dashboard update, can my console get banned? I heard that with banned console you can't install games to your X360 hdd. Is this true?"
,aymanbashir,2010-03-03T12:43Z,can someone plz tell me if this will work on ntsc\j consoles?i really wanna know.
[T],Sunblock.,2010-03-03T12:59Z,"@Bujaaa

It always a risk. But why go online ti update? Use CD/DVD or USB stick."
[T],Sunblock.,2010-03-03T13:08Z,And yes they ban your HD as well. But there is method to unlock it again. :D. But im not going to talk about this here. ;]
,manowx28,2010-03-03T13:25Z,"playing disk 1 right now and have encounter a crash after 10 in the game,  think the crash is random"
,gamergames,2010-03-03T14:17Z,"Thank you for uploading hope its works! its regio free and not ntsc, yess!"
,manowx28,2010-03-03T15:42Z,OMG!!! this games is awsome!!  been playing for 5 hours straight
,railex,2010-03-03T20:30Z,can this be played in asia?i wonder why its only ntcs/u...and not ntsc/j...square.enix is from japan right?anyways stick to first question
,UncleMoe9999,2010-03-04T06:21Z,I thought this was on 4 DVD's for the 360?  Shows only 3 in torrent.
[T],Sunblock.,2010-03-04T12:53Z,4dvd version is the  the collector's edition i think. But i can be wrong. Heard some rumor about it.
,lourock21,2010-03-04T15:10Z,I would like to know who started with the nuked shit??? Because I've been playing this game for hours and not one glitch. There are some goofy names though like lightning hope snow. WTF and I hate the battle system
,outcastded,2010-03-04T19:42Z,"I'm having troubles!!! 
I've been downloading many different games the past two years, and I've gotten used to patching the waves of the games to wave 2. 
That's been working until now! 

Now I've burned out three different copies of disc one, but when I try to start the game, a message states that the game requires an update to my software, and I agree to do that. But then the 360 complains that it cannot read my disc! 

I managed to get my console banned from live some time ago, so I cannot download updates through live. 

Is it possible to update the 360 with some software downloaded from the internet and transferred to the 360 from a memory stick?
Would that solve my problem? 
Why else would the game not work? 
I've been using the same verbatim discs all the time. Burning with imgburn.. "
,Bujaaa,2010-03-04T21:20Z,"@ outcasded
Download the dashboard update if you need it from the internet. just google XBOX360 DASHBOARD UPDATE and then copy it to USB stick (you must format USB in FAT 32 file system).Plug the USB stick in your XBOX and then turn it on. The update should be done automatically. I think. Didn't tried doing it like that yet. :)"
,outcastded,2010-03-04T22:11Z,"Thanks.. 
I already solved the problem though. 
I downloaded the console-update at xbox.com, and that was the whole solution to my problem!"
,russ010,2010-03-05T05:29Z,the game isn't even out yet!!!! so how ez would it be to ban anyone that is playing it? 
[T],Sunblock.,2010-03-05T12:09Z,"@russ010

This game is a mega release/ban magnet. So playing it before it have bean Verified and released in shops makes it very certain ban. But its up to you. :D."
[T],Sunblock.,2010-03-05T12:14Z,I will play it on my banned console. And if ilke it maybe i buy it and playing (LIVE) on my none banned console. ;)-
,Access_Denied,2010-03-05T15:55Z,"Sweet, downloading at 500kb/s"
,jotunhammer,2010-03-05T15:57Z,"im already at the end of 2nd dvd and I got to say im dissapointed, I had hopes for something a little more lasting, like FF series use to be, I remember spending 80 hours total to get to the end but after 20+ hours to get to the end of the 2nd dvd is not promising...."
,victoryami,2010-03-05T17:02Z,Does this version works with an ASIA/NTSC-J console? I saw some REGION FREE links in a couple of places.
,badcopy,2010-03-06T00:34Z,"To all wondering about banning!!

C4eva stated that all firmwares pre i xtreme LT
will show on live and be banned any game not ripped with 0800 (aka 360 drive) or not split vid will show!

ALSO its been put to the test updating while your modded will get you flagged and most likely banned you need to flash back to stock then update then back to flashed... it was confirmed to within a thre month span between 6 xbox 360's updating three of them while modding and putting the other three back to stock pre update... all three that were not put back before update failed!

Again the only confirmed route for online play is split vid games runnning on LT firmware ...

Kreon drive lens cannot read at the same angles the 360 drives can so i personally only trust ripping the game my self and burning that way i know its 100% i just come on here for games i know i wont get on live with..

ive also read using upgraded 250 hdd will get you banned..


another souution is the new team xecuter Xdrive its bassical a connectivity kit and fancy plastic case for a secondary DVD drive to keep one stock and one flashed! allowing you to flick a switch and go back and fourth between drives.

also banned xbox 360 cannot yet be unbanned but you can unban your hdd with a transfer cable and xplorer 360 you just have to delete specific files... 
"
,BlackChocobo,2010-03-06T04:05Z,"Argh! This is painful, I finished playing through the first disc and now I have to wait for the second to finish downloading.

Thanks for the upload."
,abelinken,2010-03-06T05:59Z,"Can any more please help me. i followed all instruction but my modded box say clean dis / dirty disc or restart box . 
what can i do to fix this issue please i took too long to down load this game"
,Sheeps42,2010-03-06T12:07Z,any help would be great played through first disc no problem second disc wouldnt burn correctly finally dled the patch and re burned and now it wont read the disc says clean dvd error code
,AnimeFury,2010-03-06T22:18Z,"Awesome, just finished dling and now im uploading with a constant speed of 2 mb/s xD"
,UncleMoe9999,2010-03-07T00:41Z,"I wouldn't play unless you have a banned system already.

Failed ABGX360 check big time, and the uploader isn't trusted and has only submitted 3 torrents (2 x 360 games just recently, and some shite video)

Fails stealth check, has anydvd padding too.

BEWARE!"
,manowx28,2010-03-07T09:38Z,UncleMoe9999 : there is a fix for that num nuts
,boomergame,2010-03-07T14:13Z,"I have successfully downloaded but am having trouble unzipping the files.  Normally the segments automatically rejoin but here, winrar looks at each archive as it's own individual archive.  Anyone else run into this and find a fix?"
,UncleMoe9999,2010-03-07T18:31Z,manowx28: num nuts?  There's no fix for the stealth.  Enjoy your newly live-banned 360 if you don't believe me.
[T],Sunblock.,2010-03-07T23:07Z,"Like i sade before. abgx360 will fail untill they have a Verified version in database. ppl alwasy think that, When the game is relased so is the Verified database of the game. But it not. It takes time and just go there page and look when its. Very simple :D"
[T],Sunblock.,2010-03-07T23:11Z,http://www.abgx3608.net/verified.php) = abgx360 database.
[T],Sunblock.,2010-03-07T23:12Z,uppss remove the 8 :D
,Sheeps42,2010-03-08T01:41Z,"any help would be great played through first disc no problem second disc wouldnt burn correctly finally dled the patch and re burned and now it wont read the disc says clean dvd error code 



ANYONE SEE THIS TO?"
,manowx28,2010-03-08T12:01Z,"ok well i didn't knew that, anyway thanks for the warning...and forgive me for calling you num nuts UncleMoe :)"
,manowx28,2010-03-08T12:04Z,"anyway final fantasy 13 is kinda dissapoiting

battle system is not that great, they should have sticked with the turn based thing.

and de graphics may be good....there is just no magic in it."
,jotunhammer,2010-03-08T12:44Z,"Im on the 3d dvd after 23 hours, its becoming better and better....although I had hopes for 40-50 hours of gametime...but its epic still"
[T],Sunblock.,2010-03-08T12:53Z,"Well i can agree abit. I have played for 3h and its not the FF i expected. Im a FF fan and so far im very disappointed.  The put the fokus on makeing the video's and gfx at top notch and made a terrible game play. Nothing makes any sense and after 3h i totaly lost the interest for the game.

No world map
No side quests..etc...

VERY disappointed Square Enix.

A scale from 1-5 i give it a 2. Just becuase of the gfx."
,manowx28,2010-03-08T14:21Z,"yes true  i think i'm for like 8 hours in the game  and it's like cut scene's all the way.

it just doesn't live up to the hype, well i have to say when i found out nobuo uematsu was not a part of this game, i was very dissapointed...i mean that guy always been the soul of the franchise.


Final fantasy x had no worldmap but still it had that good old ff feeling..turnbased

Sorry, but if it aint broke don't fix it.

i will finish the game but i doubt i will play it again."
,manowx28,2010-03-08T14:24Z,don't know about you guys but my thumb hurt like hell hahahah  bashing the same button all the time
,soro22,2010-03-08T21:47Z,"totaly agree whit sunblock.
this is even worse than ff x-2"
,outcastded,2010-03-08T22:44Z,"Another problem!! 

I just finished the first disc after about 12 hours of game-play. And so the game tells me to insert to next disc. But when I do that, the message states that it's the wrong disc. WHY?? 

I've done nothing wrong as far as I know. I've patched it from wave four to wave two. I burned it the same way as I burned the first disc. And I used the same Verbatim discs! 
Did all the same way as I did with the first disc. 

Just for fun I burned out the third disc, just to see if the 360 would recognize it at all, but it did not. SAME problem. 

Any suggestions?

Maybe I'll just buy the game tomorrow.. It's the release date after all. "
,xchillin,2010-03-09T01:56Z,If this game is so (relatively) short for an RPG; what is so good about it that it required 20-Gigs and 3-DVD's to code? Are the graphics absolutely mind-blowing? For 3-DVD's I would think it would take at least over a hundred hours to play??? There have been many games released that play over 100 hours and they were contained on a single DVD. So what is exactly that requires so much coded information about this game?
,krysthal,2010-03-09T03:18Z,@xchillin the game has a ton of CGI cut scenes that take up a ton of room.
,soro22,2010-03-09T03:18Z,"well this @stupid@ game. contains noting more than 5min walk. then a small or medium video of talk..

then the gruop act like children and leave eact other. then after 20min whit difrent gruops. they end up back together. also forgot the tons whit small talk. and kinda wierd battle style.

story is squareENIX not squaresoft :(
grapi is more than enough decent.

but still not worth buying. its crap.
but cant complaince since i got it free tough ;)"
,proboarder11,2010-03-09T15:27Z,"@sorro22  You are right. Final Fantasy died when X came out. Once you take out the ability to explore it ceases to be a true final Fantasy game. Hopefully they will go back to their roots for the next game.

   Glad i didn't pay for this. Deleting now :( "
,soro22,2010-03-09T17:48Z,"yea deletet hard time.

R.I.P Squaresoft..

ps: its rumors that saying there wont come more ff games. just google it.
mayby for the best anyway.."
,manowx28,2010-03-10T08:40Z,"on gamespot they give the game a 8.5..i mean wtf

all the other reviews by gamers  is a joke  some give it a 10 for fuck sake"
,Yoni__,2010-03-11T16:14Z,"0,5kb/s...."
,Vikeif,2010-03-11T17:53Z,"I'm using iXtreme 1.61 and it doesn't load for me. It ask for an update at first, and even if I update it says that it can't read the disk.

(I did apply the fix)

Abdx360 says it's uncertain about stealth too."
,egozi44,2010-03-12T02:01Z,"so all the dvds work or not?
 does someone here play all the 3 dvds and burn them with the fix and can tell if its fully work?

i have ixtreme 1.7 so i have no problem with the patchs through i still fix the dvds  
but i still need to know if those dvds worth the download

i not want to wait hours just to see that dvd 2 not work :( so plz reply fast"
,egozi44,2010-03-12T16:01Z,"dvds two and three wroks?
anybody?
someone here try them and can say if they 100% works? case two people reply here that dvd 2 not work for them
however they also say that they change is wave to wave 2 or 3 so that may be the problem

anyway plz answer me :(  plz?"
,laranoye,2010-03-13T14:11Z,"All disks work fine for me , burnt 1st time and all loaded 1st time im on 3rd disk and no issues."
,laranoye,2010-03-13T14:12Z,"Although the game is not at all what i expected dont get me wrong it is good but its just a new game with final fantasy tattoed on it, bit too linear for my liking although the movies and story are excellent but i didnt get it to watch a movie lol."
,egozi44,2010-03-13T16:32Z,"thsnks : )

now all what i need is explntion on how to ""fix"" the game with the allstatrs fix


btw do i really need to fix the game with the allstar fix even through i have ixtreme 1.7 LT ?
case i not have to use normal fixing with the abgx360  case i have ixtreme 1.7 and i not use Live anyway xD"
,Metadeath,2010-03-13T17:20Z,"How is it their is only 8 people seeding and not a damn thing worth of download speed, im not even getting over 60kbs....and yes i have all my ports open for it and everything?"
,Gief_Me,2010-03-13T23:41Z,Where is Resident Evil 5 Gold Edition can someone upload it plz ! ! 
,egozi44,2010-03-14T17:53Z,"did someone here try to fix the game useing abgx360 after he use the allstars fix?

i want to know if its necessary to fix it to be  invisible from the xbox ""net""  so i not get ban 

through i not use the live 
but i just want to make sure.... 
so there is anybody here that try to fix the game after he use the allstars fix and finish the game with all the 3 dvds working? or its make the other 2 dvds to stop workinG? : O"
,razorbubble,2010-03-14T22:33Z,"Anyone tell me how to get this to work?  I've been reading all over the place, and just got that I need to open up my Xbox and flash the drive, and burn the .dvd file to a DVD-R.  But what do with the game .iso?  Any help would be much appreciated."
,militantbystander,2010-03-14T23:03Z,"@razorbubble, before you flash your drive i suggest you learn how to burn an iso. use a program like imgburn, its free and probably the best. downloading this now, ill give a comment in due time. downloading at 5kbs so it might be tomorrow sometime. few hours anyway"
,razorbubble,2010-03-14T23:12Z,"Well, I understand how an iso works.  Just I don't see how is it possible to have the .dvd and the iso image on two seperate discs."
,sinshixxi,2010-03-15T00:23Z,"hi guys I used Allstars FIX ppf to patch both DVD1 and 2. Then, I use ABGX to scan these two iso, and ABGX automatically patched the iso and said ""stealthed OK"" and all verified.

I'm playing DVD1 for 2days and put DVD2 to test, everything seems okay with Live logging in.

Don't take my word for credit, because I still don't know how to play this game safe for unbanned console."
,militantbystander,2010-03-15T01:11Z,"@you again. its straight forward. imgburn will take care of this for you. if you try to burn the wrong one it will correct ti for you, its auto.this is how i burn my games and everything is fine."
,sinshixxi,2010-03-15T02:17Z,"here is ABGX auto patching log for DVD3

http://i40(.)tinypic(.)com/28sq6uo.jpg"
,bigtimewaster,2010-03-15T04:07Z,"2nd disc is corrupt. winrar will not extract it and gives crc error.
total waste of time downloading"
,zeek89,2010-03-15T08:44Z,"I know this probably isn't the best place to ask, but where do I go to figure out how to play downloaded 360 games from TPB. is it possible to do without a modded system? I mean can someone post a link to go to of where i should start?"
,sinshixxi,2010-03-16T00:07Z,"@zeek89 you must mod the DVD drive to play. Only Lite-on 83850Cv2 and 93450C are difficult to mod, because 83850Cv2 requires dvd-key-reader whereas 93450C requires both dvd-key-reader and soldering. The other models are able to mod without any special tools.  xbox-scene forum is your friend to start learning."
,babyboy3901,2010-03-16T01:18Z,yo i did the abdx360 but it will not work on it can some one help me or should i go here and put them on a dics ??? help plazzz
,sembu,2010-03-16T19:49Z,"I'm havin lil problem with this torrent, i think it would work if my console is right modded..
So im asking u that is this using wave3 or 4 and what firmware u have on ur drives?
I patched this with fix and tryed to play this and it still try start game like dvd video -.-
Im using iXtreme 1.41 or 1.51 firmware atm. Thanks for answers, hope i got this solved soon and play this game :)"
,xXMemoXx,2010-03-16T22:37Z,"@sembu
you need a boot dvd and have to boot your xbox with it.then you can play wave 4 games.I'm form germany and i have a german site where you can download the boot dvd.click on WAVE 4 BOOT DVD.download the 2mb file and extract it (extracted its 250mb)then burn it on a double layer dvd.attetion!: it must be a double layer dvd , not a 4,7gb dvd:

http://www.konsolenjuenger.de/2009/wave-4-ixtreme-boot-cd/

hf , and please guy seed *.*



"
,xXMemoXx,2010-03-16T22:39Z,"@sembu
it's important too that you put the boot dvd in your xbox and restart it.then take the boot dvd out and put the game in"
,Archarom,2010-03-17T01:23Z,plz i need help. burned 1 cd all fine and finished but 2 cd cant play.. burned 3 times and allways same error. clean disk or reboot ... some1 help ?
,sembu,2010-03-17T06:39Z,"Thanks xXMemoXx for fast reply :) I actually downloadet that file last night when i found that, il give it a try soon and report back if that worked!
Maybe my 4 more games start to work too after this."
,ratoOr,2010-03-17T12:15Z,plz seed 50k.p
,sembu,2010-03-17T13:14Z,"Im burning now that boot dvd, and wanna ask fast answer for one question.
Imgburn says this:

This image is small enough to fit onto the first layer of the current dics.
Imager are normally burnt with roughly equal amounts of data written to each layer.
Would you prefer i sway from the 'norm' and just stick to using the first layer?

So i choose Yes or No?
Dont wanna fuckup my last dual layer discs :/"
,Archarom,2010-03-17T14:05Z,can any1 help me plz.... i keep geting error in the cd i burn in 2 cd.... it burns fine but when i put on xbox it gives me error... 1 cd was fine but 2 just wont go.. its my 3 cd guys to waste plz help...
,xXMemoXx,2010-03-17T20:31Z,"@sembu
i dont know.. because i burned it with clonecd , and it worked.there was not a message.."
,rhmum,2010-03-17T21:14Z,always use both layers
,sembu,2010-03-17T21:42Z,"rhmum: I read earlier in some site that its meant to burn only one single layer :O
I burned that with both layers and im not sure if it works or not, because my games still wont work -.-

Il look tomorrow is those games burned right and after that i try to burn again with only single layer that boot file.
I have btw Hitachi drive and im not sure what firmware i have in it. Its updated with some iExtreme, cant just remember what version."
,Takwaman,2010-03-18T10:22Z,"anyone can help me.. i have done the download...fix..pathing with patch wave...but why when i want to play it, cant play...xbox notice ""this is out of region"" .... this game if free region right? can anyone help me, how to resolve this problem"
,Archarom,2010-03-19T02:45Z,ty all for help ( irony .....-.-) 2 cd i beat up the dragon with hope and snow and it says loading and nothing more ... 5 cd burned and wasted.. garbage ftw... ty all for ur help
,Miixxd,2010-03-19T21:28Z,"Hi. I have been downloading cd 1, patching with the FIX thing, dashboard updated my xbox @ www.xbox.com and yet when im playing the first cd it only comes up a xbox360 icon with a white bakground. Solution?"
,Darkxshadow,2010-03-20T12:20Z,is this game work on ntsc\j consoles?
,XxchaosgamerzxX,2010-03-20T12:58Z,this is the first time i download a xbox360 game can someone please tell me how to burn this 20.26 GIB on a dvd ?? 
,MrSwe2,2010-03-20T14:02Z,Covers to the game http://deadsmall.com/49F
,Kraiser00,2010-03-21T19:04Z,I just finished disc one and when i put disc 2 in it tells me its the wrong disc... I used the patch too can someone help me with this
,Kraiser00,2010-03-22T00:58Z,Actually i found out why my 2nd disc wasnt working... It seems burning the 1st disc twice by accident doesnt help :D
,Darkxshadow,2010-03-22T13:42Z,can someone plz tell me if this will work on ntsc\j consoles?
,Bananajoe888,2010-03-22T19:37Z,"hey guys, seed pls
i'm downloading with 30kb/s!!!!"
,surjax,2010-03-24T22:25Z,is this one working guys??
,co30op,2010-03-25T01:10Z,"A couple things.

 Sembu if you have a lite on or benq drive upgrade to LT and you won't need the boot disc.  If you have to use a boot disc put on a DL DVD, but use only the first layer with no specified breaks, burning with DVD decrypter or IMG burn.

Secondly, sinshixxi you don't need a usb key reader for Lite on 83's.  You can do them using jungle flasher, with the tray half open, using the LO83 tool.  And for all other lite on models there's no need for soldering just get the key from the R7 point on the dvd's board.

best place to go for any of those mod or boot questions is robinhoodsplayground com video tutorials"
,cwi87,2010-03-25T19:30Z,"Ok its messed up!
I had dl it, used the fix on both DVD's (1st and 2nd)
and try to burn the first one but its stoped on 94% of finallising disc and retried 5 times to finalise!
I thought maybe I use abgx360 and it actualy burn with succes.
Now what... ? 
Im putting the activate ISO (boot disc) into my X reading it - white screen , then jumping in with DVD1 and what a miracle he reads it! 
theres screen to push any button , next the game wants me to select the memory device, im selecting my hard drive and then theres big nothing - black screen for a half hour now! 
What to do please help me... wanna try FFXIII even if its bad."
,Cloneufc,2010-04-01T23:22Z,"WASTE OF TIME, DONT DOWNLOAD! Disc 1 and Disc 2 have corruption errors. Doesnt pass Abgx360. Disc 3 works fine but that doesnt help if disc 1 and 2 are fucked up."
