User Type,Username,Date,Text
,sinshixxi,2010-04-08T02:42Z,"@Cloneufc

there's a fix file release for disc1 and 2.  check the other torrent ""Allstar-FIX"" and you don't need to download the whole disc1 and 2 again."
,Cloneufc,2010-04-13T23:48Z,Thanks the allstar fix works. You just place Disc1 and Disc2 iso's and click on fix. You can get the fix here. http://thepiratebay.org/torrent/5407112/Final.Fantasy.XIII.X360.FIX-Allstars
,Kinslayer120,2010-04-19T00:49Z,"have played the game for about 1 hour.. I watched a movie while i was repatedly pushing (A) I won every fight.. The thing that scares me, is that i'm not kidding=/"
,paulosergio96,2010-04-24T17:23Z,"When i try to use the bat file for the fix it says it doesn't recognize ApplyPPF3 as an internal or external command, operation program or batch file

Any ideas?"
,Termina,2010-04-28T05:38Z,"Kinslayer120,

Yeah, it's really easy at the start. Wait until you get to fight Shiva/Odin.... the difficulty picks up quite a bit. xD"
,sarkissian1,2010-05-13T20:57Z,"Can someone tell how the fix work, with instructions please, i don't want to waste Dl dvd's.
I have downloaded FFX 13 and the fix, what do i do know?"
,m3o,2010-05-21T09:53Z,"hey, just a heads-up - if you are in germany, I got a warning letter from RKA and a fine of 650 euros because of this torrent. So i guess they are monitoring this ...."
,dd32809,2010-05-25T04:42Z,omg. awful. I regret burning one of my Dual Layers for this bullshit. They should have just come out with a fuckin movie. so don't waste your time downloading this bullshit. I'm just glad I burned the first disc to try it out instead of burning all three discs.
,Nimaru,2010-06-07T19:32Z,not being too hasty about stuff but seed please?!
,Zaftikins,2010-06-24T05:07Z,Please do not vote this down before using the FIX found at http://thepiratebay.org/torrent/5407112/Final.Fantasy.XIII.X360.FIX-Allstars  . I'm not sure why the author doesn't include it in the info (unless you can't edit it after posting -- I wouldn't know myself).
,Amorvulnerat,2010-07-04T14:30Z,"Seeeeeeeeeeeed plsssss!!
Downloading with an average of: 36 kb/s
That's just great while downloading a 20gig file.."
,Rcst11686,2010-07-07T02:23Z,"I had issues loading up Disc 2 . Kept saying wrong disc inserted. So here is the trick for everyone having the same issue.

When prompted to insert disc 2.

Remove Disc 1 - Insert the Boot Disc (Activation Disc) .
You will receive the ""incorrect disc message"" 
Remove the boot disc and insert FFXIII Disc 2.

Now you can play the game. 
Repeat for the 3rd disc as well.

ENJOY! Thx for the torrent!"
,hitsugara,2010-08-22T02:26Z,People with NTSC/J consoles... stay away. The NTSC/J version was never released for asian countries. all you will get is a wrong region error when you try playing the game. unless someone found a fix for this... this torrent is useless for us. T_____T i reallly wanted to play this game T____T
,hitsugara,2010-08-22T02:28Z,"oh yeah...
@wuneo can you please specify that its not an NTSC/J release???"
,B2005,2010-11-11T02:54Z,I have a problem. Burned successfully the dvd and when i put it in the console it says that i need to update. I have no idea of what firmware i have but almost positive i've got a lite-on drive. Is it ok to update?
,adelboy,2011-02-19T21:04Z,"seeeeeeeeed for gods sake!!!
plezzzz, i need this game!! its downloading at 20kb speed. at the start it downloaded with 1,6mb/sec speed. pleeeezzzz seeeeeeeeeeeeeeeeeeeeeeeeeed!!!!!!!!!!!!!!!!!!"
,Flong187,2012-02-21T22:35Z,PLEASE SEED PEOPLE!
