User Type,Username,Date,Text
,martian_neighbour,2009-08-10T03:40Z,^^ fuck you! you little japanese nazi..
,thadmacracken,2009-08-12T09:06Z,"Now thats what I'm talken bout ! Nothing better then hot scanks wrist deep in each others cum catchers. I love this. Thanks for the sweet ass torrent.
High five! Deep five any who."
,TheBigHase,2009-08-13T10:51Z,Yep! Best Lez Action I have seen so far! Very hot and nicely filmed! It's a hard-on guarantee unless ur dead lol 
,voothai,2009-09-13T18:17Z,"Keeps skipping the most important part, where they finally manage to slide the hand in.  Terrible."
,voothai,2009-09-13T18:58Z,"Good other than that though.  There's a pair that do both vaginal and anal, and it's disappointing they never did both simultaneously."
,TheBigHase,2009-09-27T10:09Z,Disappointing? WTF - Fistflush is the hottest Lez Action I have ever seen! Almost everything is awesome!
,Nelix192,2012-05-21T21:45Z,Thanx
