User Type,Username,Date,Text
,Franscesca,2009-12-06T00:26Z,Fake
,nikflickz,2010-03-04T15:18Z,"@Franscesca, this isn't fake.. lol.. you just don't know how to play this type of file.."
,appy71,2010-03-13T18:38Z,"Thanx mkvguy, the quality for file size is incredible ! I could probably store 700 of your torrents in my hp laptop alone with no difference in performance. You sir ROCK !"
,appy71,2010-03-13T19:10Z,kmplayer plays these files perfectly
,4u4u44,2010-07-15T06:48Z,Mkv Guy Please SEED nnIm Stuck On 80%nnnnPLZ PLZ
,starzzzz,2010-09-28T14:11Z,"plz guys keep seeding, this torrent is dying.
plz mkvguy help to keep shine and seed this torrent."
,starzzzz,2010-09-28T14:16Z,"plz seed seed seed seed.
the torrent is dead."
,starzzzz,2010-09-28T14:19Z,"if any of u fellas have this movie then seed it.
c'mon"
,bubai999,2011-06-19T18:43Z,No Seeds :/
,nansy12,2011-11-28T00:26Z,the worst file from dvd edition really. I hardly could see something else besides the faces and the worst scene was the one in the cave. if the file is from camera don't be afraid and tell us to know NOT TO DOWNLOAD IT.
