User Type,Username,Date,Text
,hippopotamus23,2010-08-26T21:29Z,thanks for this TVTeam - been checking piratebay daily for this since missing it in local cinema. full faith from past uploads by you that is going to be good quality. nice one 
[V],CanadaJoe,2010-08-27T07:07Z,"@TvTeam
Thanks.. top quality & very funny.  =)"
,torrtruk,2010-08-27T19:23Z,thanks. one of the cool comedy movies! woohoo :)
,bulldho,2010-08-27T22:57Z,t h x 
,inyourfacetoo,2010-08-30T13:27Z,"It's been a long time since I've seen such a funny movie.
Great upload!  Tata mate."
,poada1975,2010-08-31T09:57Z,Absolutely Brilliant. Simples.
,bodierock,2010-08-31T11:51Z,"I dont get this movie . I guess its funny . If I was a terroist . Its sort of like  if the kkk  still
spread fear and then made a funny movie about there dickhead friends. But its worth the watch. "
,RickeeBoy,2010-09-07T02:36Z, The best comedy is the comedy that pushes boundaries and doesn't fear to go where other fear. ( IE Monty Python ) this film is superb with a lightning quick banter between the main characters - which in itself is superb but its also throws in hundreds of visual gags and idiots and stupidity plus there is always the pathos or tugging at your emotions because you can't laugh at bombers - Great film makes you laugh out loud plus think about the horror whats happening. 10/10
,kronik2810,2010-10-26T14:09Z,"cnt wait to watch this,cnt fault a brittish comedy"
,bullyooo,2010-11-11T18:33Z,A10 V10 GREAT DOWNLOAD
