User Type,Username,Date,Text
,Manowar_Kill,2010-08-14T04:04Z,"Spirit.Pirate, muito obrigado por estar postando os DVDR PT-BR aqui no PB.

pois é horrivel ter que baixar nos sites de torrent no brasil, ja que tem o lance de ratio!

Vc vai sempre postar os lançamentos aqui?????

Vc teria o DVDR da Bruxa de Blair 1 ?????

Parabens pelos torrents e abraços!!!!"
[V],Spirit.Pirate,2010-08-14T07:21Z,"@Manowar_Kill  Obrigado pelo reconhecimento, estarei sempre que possível postando os DVDR aki no PB.
Sobre o Filme que vc pediu não tenho, vou tentar upar, se conseguir coloco.


Abraços!"
,Manowar_Kill,2010-08-14T14:23Z,"ok! valeu por tudo !

viu vc faz parte do grupo semlimites.org ???

Lá tem o lance de ratio tambem????

parabens mesmo pelos lançamentos em dvdr !"
[V],Spirit.Pirate,2010-08-16T00:02Z,"No SemLimites.org não tem controle de ratio. É um fórum warez onde vc encontra não só torrent mas também http e ed2k.
"
,Manowar_Kill,2010-08-16T22:07Z,e como eu consigo convite????
