User Type,Username,Date,Text
[V],Mbb15,2010-02-18T20:21Z,teknogods finish the modern warfare 2 loader
,salakutt,2010-02-18T20:29Z,Does it actually work :O?
,rhinowar,2010-02-18T21:29Z,sadly not for me.  I can update prefs but it doesn't help when I log in on the game
,salakutt,2010-02-18T23:13Z,not for me 2... probably need to wait until they let you play it :)
,tehmoshee,2010-02-18T23:24Z,"I think we need a crack for this...

Razor, Reloaded, I'm looking at you ;)"
,salakutt,2010-02-18T23:42Z,"even playing via lan feels cool :P

or single player :P"
,tehmoshee,2010-02-18T23:56Z,"Try as I might, the game always returns ""login information incorrect"" error."
,tehmoshee,2010-02-18T23:58Z,"Alright, it looks like I can log in now (I added ""..\Support\SC2Switcher"" to the firewall exceptions) but now it tells me my account does not have an associated copy of Starcraft II. Looks like we really do need to wait... :("
,zilder,2010-02-19T10:27Z,So? why uppload it if No one can play it!
,BROTHYAM,2010-02-19T11:05Z,"I can not add wow trial!!

Who can help me?"
,BROTHYAM,2010-02-19T11:19Z,"This battlenet account does not include an associated copy of Starcraft II. Please log into Battlenet account management and add the game to you account.
Who can help me?"
,IDDQD-IDKFA,2010-02-19T12:19Z,"lol, u can help u u need to attach UR beta keay to the  its so simple"
,juniorpasini,2010-02-19T16:37Z,"Anyone solve the problem of battlenet account with beta versions?
Heeeeelp!!!!"
,slejeivw,2010-02-20T02:04Z,"This is the beta alright.
Problem is . . . it says something about my account not having an associated copy of Starcraft II or something like that.

Ah, one hour of downloading and ten minutes of installing for nothing. Ah well."
,Mr.Orangeman,2010-03-02T11:12Z,"Setup guide in case you need it:

http://www.setupswarm.com/main/games/installation-guides/starcraft-ii-beta-cracked"
