User Type,Username,Date,Text
,mecyanide,2009-08-20T10:19Z,Legit??
,pseudookno,2009-08-20T22:45Z,none of loaders worked for me. perhaps i'm stupid.. what's the routine? pls help.
,metsfan,2009-08-21T04:14Z,"After trying many others, this one worked for me. Thanks"
,Ssmud,2009-09-14T16:32Z,"Just tried this out on Windows 7 Ultimate 64bit, worked awesome. Thank you."
,knarfmmc,2009-11-27T17:57Z,"This Loader worker on a Toshiba Satellite notebook using option 2, it wouldn't work on a HP 530 notebook using any configuration. Thank for the upload though, the tosh is flying so far."
,carlosbr,2010-01-23T21:13Z,"Muito obrigado, amigo!"
,Kris_aquino,2010-06-17T04:02Z,"THANKS A LOT uploader! For those who doesnt know what they are doing, GO out! !! !!"
,chipset77,2010-08-30T00:52Z,"I installed windows 7 Ultimate 64bit and let the 30 days run out. Got the nag and used this for the loader.. Worked without a problem.
Thanks extreameforums!"
,chipset77,2010-08-30T00:55Z,"I installed windows 7 Ultimate 64bit and let the 30 days run out. Got the nag and used this for the loader.. Worked without a problem.
Thanks extreameforums!


For you all that cant make it happen, be more assertive"
,WillAlvers,2010-12-24T16:23Z,Thank God it WORKED!! *wipes sweat off face*
,WillAlvers,2010-12-25T02:35Z,"well it worked for a few hours, now same thing, copy is not genuine, activation due today...Fuck!"
,rsjc741,2011-01-16T18:41Z,"This should be moved to Applications -> Windows,  with all the other W7 Loaders."
,.Fafuz,2011-01-23T08:18Z,"""metsfan
After trying many others, this one worked for me. Thanks""


@up me too"
,alphaguitar,2011-03-09T06:23Z,"How do I uninstall this loader? My system was working fine but I was trying to find a working loader for a friend and when I ran this on my already authentic copy it messed everything up everything up.

I'd rather not have to completely reinstall everything from my windows disk."
,alphaguitar,2011-03-09T06:25Z,Is it possible to uninstall any changes made by the loader?
,conti22,2011-08-14T17:22Z,"How does this work, plz help me fast"
,umarnawazkhan,2011-10-07T02:39Z,"Orbit never worked for me...only DAZ work's 100% the best. get it from DAZ

windows 7 loader by DAZ.
BIE crack also works if u want 2 know"
,Meckyp,2011-11-23T22:34Z,it doesnt work for me
