Filename,Size,Unit
Disc1/17. Runaway - Salsoul Orchestra.mp3,10.92,M
Disc1/3. Young Hearts Run Free - Candi Staton.mp3,9.56,M
Disc1/12. You Can't Hide From Yourself - Teddy Pendergrass.mp3,9.45,M
Disc1/5. I'm Every Woman - Chaka Khan.mp3,9.36,M
"Disc1/14. Shame, Shame, Shame - Shirley & Company.mp3",9.34,M
Disc1/20. Working My Way Back To You - Detroit Spinners.mp3,9.29,M
Disc1/11. Don't Leave Me This Way - Harold Melvin & The Blue Notes.mp3,8.86,M
Disc1/1. Good Times - Chic.mp3,8.49,M
Disc1/10. Boogie Nights - Heatwave.mp3,8.32,M
Disc1/19. Thunder In My Heart - Leo Sayer.mp3,8.18,M
Disc1/2. Disco Inferno - The Trammps.mp3,8.18,M
Disc1/18. Le Freak - Chic.mp3,8.14,M
Disc1/13. I Love Music - The O'Jays.mp3,8.13,M
Disc1/6. Lost In Music - Sister Sledge.mp3,7.83,M
Disc1/16. (Are You Ready) Do The Bus Stop - The Fatback Band.mp3,7.49,M
Disc1/7. Lady Marmalade - LaBelle.mp3,7.43,M
Disc1/4. That Lady (Part 1) - The Isley Brothers.mp3,7.4,M
Disc1/8. Play That Funky Music - Wild Cherry.mp3,7.31,M
Disc1/9. A Fifth Of Beethoven - Walter Murphy.mp3,7.01,M
Disc1/15. Armed & Extremely Dangerous - First Choice.mp3,6.42,M
Disc2/9. Keep The Fire Burning - Gwen McCrae.mp3,12.78,M
Disc2/12. Let No Man Putasunder - First Choice.mp3,11.13,M
Disc2/15. Haven't You Heard - Patrice Rushen.mp3,10.93,M
Disc2/19. Supernature - Cerrone.mp3,10.07,M
Disc2/16. Street Player - Chicago.mp3,10.06,M
Disc2/14. Let's Love Dance Tonight - Gary's Gang.mp3,9.86,M
Disc2/6. Everybody Dance - Chic.mp3,9.52,M
Disc2/2. Is It Love You're After - Rose Royce.mp3,8.71,M
Disc2/10. Spacer - Sheila.mp3,8.67,M
Disc2/4. Relight My Fire - Dan Hartman.mp3,8.55,M
Disc2/17. Wear It Out - Stargard.mp3,8.54,M
Disc2/20. Got To Be Real - Cheryl Lynn.mp3,8.51,M
Disc2/8. Keep On Jumpin' - Musique.mp3,8.48,M
Disc2/5. Ain't No Stoppin' Us Now - McFadden & Whitehead.mp3,8.34,M
Disc2/13. Strut Your Funky Stuff - Frantique.mp3,8.32,M
"Disc2/3. September - Earth, Wind & Fire.mp3",8.29,M
Disc2/7. He's The Greatest Dancer - Sister Sledge.mp3,8.23,M
Disc2/1. Blame It On The Boogie - The Jacksons.mp3,8.12,M
Disc2/11. Jingo - Candido.mp3,7.69,M
Disc2/18. Let's All Chant - Michael Zager Band.mp3,6.92,M
Disc3/4. Love Sensation - Loleatta Holloway.mp3,12.42,M
Disc3/15. Walking On Sunshine - Rockers Revenge Feat. Donnie Calvin.mp3,10.89,M
Disc3/18. Ain't Nobody - Rufus & Chaka Khan.mp3,10.79,M
Disc3/19. Last Night A DJ Saved My Life - Indeep.mp3,10.28,M
Disc3/16. Change Of Heart - Change.mp3,9.77,M
Disc3/12. Let's Go Round Again - Average White Band.mp3,9.44,M
Disc3/14. Forget Me Nots - Patrice Rushen.mp3,9.24,M
Disc3/10. I Shoulda Loved You - Narada Michael Walden.mp3,9.11,M
Disc3/17. Just An Illusion - Imagination.mp3,9.01,M
Disc3/13. High Energy - Evelyn Thomas.mp3,8.91,M
Disc3/6. Cuba - Gibson Brothers.mp3,8.89,M
Disc3/5. I Love America - Patrick Juvet.mp3,8.76,M
Disc3/8. Gotta Go Home - Boney M..mp3,8.6,M
Disc3/20 - Track 20.mp3,8.57,M
Disc3/3. Give Me The Night - George Benson.mp3,8.53,M
Disc3/1. We Are Family - Sister Sledge.mp3,8.23,M
"Disc3/9. Bourgie', Bourgie' - Gladys Knight & The Pips.mp3",8.1,M
Disc3/7. Jump To The Beat - Stacy Lattisaw.mp3,7.85,M
Disc3/2. Going Back To My Roots - Odyssey.mp3,7.83,M
Disc3/11. Love Come Down - Evelyn Champagne King.mp3,7.58,M
Back Cover.jpg,1.39,M
Disc2 art.jpg,1.17,M
Disc3 art.jpg,1.15,M
Disc1 art.jpg,1.12,M
Front Cover.jpg,927.17,K
