User Type,Username,Date,Text
[V],-jonny-,2009-10-13T17:02Z,"whatever fuckin dick moderator removed dozens of harmless fuckin helpful comments, get fucked - do something productive with your time you cunt."
,Lenny9,2009-10-13T19:04Z,"Yeah, better use your time sorting 100s of wrongfully categorized items on this site..."
[T],insinuendo,2009-10-13T22:41Z,"Love this series!

Any chance at you upping 99 Francs, also with Jean Dujardin? http://www.imdb.com/title/tt0875113/.

Charlie and the Chocolate Factory would also rock...just suggestions. 

I take what I can get.

THX! "
,jacknitro,2010-05-28T16:59Z,No subs.
,jacknitro,2010-05-30T13:47Z,"Nevermind, there are internal subs. I just had to change to a ** rendering mode in MPC."
,highway14,2010-06-01T05:19Z,"If anyone can seed the version of ""OSS 117 Cairo Nest of Spies"" that -jonny- posted a year ago I would be most grateful. Thank you."
