User Type,Username,Date,Text
,konijn1,2010-02-17T15:49Z,Wederom bedankt voor de mooie strips
,roelie126,2010-02-17T15:56Z,"Ik ben zeer gelukkig, Rokie, met Duckjes en de rest!!!!!!!!!!!"
,borrel46,2010-02-17T16:23Z,"Wat een prachtige verzameling weer. Dank je wel. Wat is er toch veel moois! Vooral met de duckies ben ik erg blij.
Van de 2992 uitgekomen bladen heb ik er nu al 2606!"
,SjaakZwart,2010-02-17T16:27Z,Geweldig Stokie! Het is weer super.
,tand29,2010-02-17T19:44Z,"Dank je wel Stokie, wat heerlijk veel DD's."
,goddamnusername,2010-02-17T20:36Z,"ik ben zeer blij guust flater elke week in de lijst te zien staan :)
hartelijk bedankt!"
,GrotePier,2010-02-18T09:47Z,Evel Eikotseikor!
