User Type,Username,Date,Text
,dkhere,2010-10-30T10:18Z,"Only one request. please upload this one first on Fridays, because i have unlimited usage only at nights..."
,nico_0_10,2010-10-30T10:37Z,"another clean and nice quality torrent, thx eztv"
,suepernatural,2010-10-30T11:23Z,"thanks eztv, more than happy with when these are uploaded"
,ShufflEE,2010-10-30T12:19Z,"@dkhere he cant upload it on a friday. because it is aired on a friday in the US at night, he can only upload it the day after airing."
,bham99,2010-10-30T12:48Z,thanks for sharing!
,Jumping_Spine,2010-10-31T02:20Z,"Thanks, keep up the good work:D"
,fallen11,2010-10-31T05:36Z,"thnkx eztv, been downloading your torrents for quite sometime now,your the best man.."
,ZeToni,2010-11-01T03:12Z,"love you eztv, ur the best :)"
,FiXXXeR135,2010-11-01T17:58Z,"U just made my day, eztv!"
,Prwteas,2010-11-04T16:15Z,"Perfect as always.
Thank you."
[V],matimike,2011-02-08T15:19Z,a/v 10 thanks
,FlashEffect,2011-06-11T04:33Z,Awesome!! Thank You dude ... all of you torrents are 10/10 :D Keep Up!! & GL
