User Type,Username,Date,Text
,rach3l420,2010-11-29T03:12Z,"Thank you! The original was sufficient but I really appreciate that you synched this up and re-released. It's kind of a pain having two VLCs open at the same time and having to pause them separately.

=)"
,52btmn,2011-04-13T22:26Z,Windows Media Player and Convert X to DVD do not recognize this file. There is something wrong with the codec. :(
,ronnycordova,2011-05-06T04:18Z,I'm pretty sure I encoded it with xvid so I would make sure you have the right codec installed.
,TrondOSU,2011-07-09T21:59Z,thank u amigo
