User Type,Username,Date,Text
[V],nos1977,2010-08-17T15:01Z,"Sup all, Hope you like this Cd... Detox will be out soon... This is just a few 
trackz for you all... Peace & SEED!!!

---

For Promotional Use Only... Remember to support the artists...
Anyway enjoy the Music,it is free!!!!"
,mozanido,2010-08-17T20:07Z,"first of all thanks man , but what th fuck is up with this detox   thats what im hearing for the last 5 years :its comming man !!!! fuck it .
release or  stop teasing !!!!!!!!!!!!!!!!!!!!!!! it should 
be more than perfected (right dre ????)#@#@%$@#%$#"
,codyzor,2010-08-18T12:44Z,"wow nos, this is incredible. thx for the great upload once again. such anticipation for this album"
