User Type,Username,Date,Text
[T],agentpiratebay,2010-05-18T20:00Z,"subs:
http://subscene.com/331770/subtitle.aspx"
,eddiepop,2010-05-18T21:11Z,real? audio?
,TheRoomy,2010-05-19T10:09Z,"Anyone watched this one yet?  This movie keeps having awful audio rips, which I refuse to watch again with horrible audio.  I don't know why whenever one movie has bad audio rips, every single rip of it always is bad audio even when it's totally different people and totally different dumps.

It used to just be easier to backup and watch my movies from digital copies by downloading the movies I have, but with so many bad uploads and bad rips with people who don't know how to do it right, I should just end up doing it all myself.  Axxo should release a guide to uploaders on how to rip with good audio and how to compress down to 700mb without losing quality.  I see 4 gig copies here with audio like they held a microphone up to their DVD player and hit ""Play""."
,jochec,2010-05-19T10:13Z,"this rip is OK, good audio and video :)"
,gemkeeper,2010-05-19T20:36Z,you know holohoax you could have included a a/v rating with your comment... Anyone know a/v?
,Pendaws,2010-05-20T11:57Z,Thanks for the upload. :)
,iverman,2010-05-21T09:03Z,"Good release . Thanks

V:9
A:8"
,pinpirin,2010-05-21T12:45Z,"Thank you for the upload. Confirming that this is a high quality release, A/V is excellent and audio is perfectly in sync."
,four0deuce,2010-05-22T20:29Z,good quality thanks for the upload
,gurudev1000,2010-05-23T15:29Z,"I don't know what's the 'best copy' out there. But this one is MORE than enough for me. 
WIDTH: 720 px 
HEIGHT: 304 px 
FRAME RATE: 23.9 
DURATION: 2 hr 17 mn

DEFINATELY audio: 10 and video: 10!!"
,stalker2755,2010-05-23T20:31Z,The audio is poor downmixed... the ambient music (LR) should have been a lil bit lower or the voices (Center) should have been a bit louder when transcribed from 5.1 to stereo.
,Robin9876,2010-05-24T16:18Z,"Holohoax, you are a big joke. The holocaust is well documented and you are arguing that? You must been from Germany, pfffff. What a dumbass......"
,maqsmihil,2010-06-05T06:08Z,"History is written by the victor.Holocaust is what they say it is.Had the Germans won they would tamper it to a completely different story.

I've heard that when there were disease outbreaks in concentration camps the SS wiped out barracks to stop it if they only wanted to kill. There methods were unjustifiable but it can be exaggerated ;like these things don't happen now!

Operation Iraqi Freedom: Estimated cost of iraqi lives :-1 million."
,maqsmihil,2010-06-05T06:10Z,"there's a missing part ""Why wouldn't they let the disease take its toll"""
,Donald-X,2010-06-06T06:45Z,"The video quality seems quite good if you are watching the movie in a small screen. 

But the glitches become visible while watching on a big screen.

So A8  V8  Movie9"
,dlarrym,2010-06-12T05:02Z,"@maqsmihil, What the HUGE difference between WWII and the Iraq war(s) of the 90's to present is that even if your 1 million figure is correct, There deaths are very unfortunate and NO ONE wished any civilians to die. In WWII, the Germans raounded up civillians and by trian took them to several death camps and then they were experimented on, they injected gasoline into there veins, they allowed male Chimpanzees to RAPE jewish women to see if a hybrid human/ape would be born... In Iraq, any of the deaths were casualties of war itself, we didn't gather all the civilians and take them to a death camp to be tortured and experimented on. Are you insane!!!! there is ZERO likeness between the two examples you sadly, pathetically made to justify pure EVIL acts and a complete abomination. The Germans were so DUMB, they filmed all of the for mentioned acts. It is WELL documented by the NAZI's themselves... they were proud of it!!! If they didn't why did so many of the leaders at the end of the war, choose to kill themselves. If these High ranking German Military had a case they could win, Why not let the truth set them free. They themselves KNEW they had done Horrible things. NO ONE made them take cyanide, they choose to do this(suicide) of there own free will rather then show the world proof that they did nothing wrong and go to trial. This is because THEY COUKDN""T PROVE THERE INNOCENCE, the idiot German Military documented all of this. They made Lamp shades from human skin of killed Jews, they took the gold out of there bleached skulls teeth!!  Only another STUPID racists would defend those DEMONS on earth. As for racism in the USA< why doesn't the KKK march into HARLEM in New York or into WATTS  in Los Angeles. They don't because like all racist they are PUSSIES at heart and have total FEAR of backing up all there BIG TALK... if I am wrong, just set up a MARCH through  any Ghetto in the USA they want. Like I said, they are just a bunch of SHIT Talking Pussies that are incapable of backing any of that bad ass talk they mouth off to everyone about. maybe 1/100 of 1% of the US believes these views. THEY are the true minority. ALL White Supremacists should DIE and there dead bodies defiled by spraying human feces all over them then deny them proper burial and cut them up and feed them to every one of the Aryan Brotherhood who are in US prison system with out there knowledge until they have been eating there own as there 3 hots and a cot for a year or so, then let them see the the process and how they were prepared to be eaten in the form of Chili meat. As nuts as I may sound, It is a drop in the bucket to what those MONSTERS did in the Holocaust!!!!!!!!!!!!!!!!!!!!! I have only begun my rant on there sorry ass fuckers!!!!!!! "
,dlarrym,2010-06-12T05:13Z,"OH YEAH, @agentpiratebay, MEGA THANKS for this vey decent and above average upload. AS usual, your attention to quality is AWESOME. THANKS again. PS: sorry about my rant on this  guy/gal What ever it is... i do mean IT... No real human can possible believe or condone what the Germans in WWII did to there own citizens. MANY MANY of the jews they killed were German Jews, Members of the german community... IT IS JUST sickening to even think about all those innocent lives lost all because a  (Hitler was born a JEW himself. His real last name is WEISS.... look it up at the Library of Congress. Since the freedom of information act, all those previously sealed documents are now able for anyone to read or look up. SORRY again. THANKS for a great upload!!!!"
