User Type,Username,Date,Text
,koesherbacon,2009-08-02T23:41Z,"Awesome idea, dude.  Maybe once Blackest Night is over, you can put together a pack for those stories as well."
,k3m15a,2009-08-03T05:40Z,".CBR / .CBZ are simply .RAR / .ZIP files with a renamed extension.

Change the extension back to .zip or .rar, extract the files, delete the ads, re-zip/re-rar it then rename the extension to .cbr/.cbz"
,zeus10,2009-08-03T20:14Z,"We need some seeders for this.

Thanks for the upload"
,yergman,2009-08-04T00:16Z,Wow.  This is pretty cool.  Thanks a bunch.
,ThaShizzle,2009-08-05T01:53Z,"ive been tryin to find sumthin like this everywhere, thanks for the upload!"
,Catatonicat,2009-10-24T04:58Z,Just finished The Black Glove hardback and bought Batman R.I.P. deluxe edition hardback and I am very curious how Morrison is going to finalize the Final Crisis :)
,vbot4000,2009-11-08T22:41Z,Thank you so much for this. I've been looking everywhere for something like this. I'm going to be seeding this for a while 
,behaigo,2009-12-30T14:53Z,Is there anywhere I can find a reading order for the entirety of this torrent (and not just the one part)?
,jpc0308,2011-09-01T14:42Z,"Can anyone seed? Hehe, I know it's a little late, but please? :)"
,NuttersaurusRex,2011-12-15T08:02Z,Thanks for this. Will furiously seed.
