User Type,Username,Date,Text
,djvikas,2010-05-11T15:16Z,great upload thanx for shearing ...
,djvikas,2010-05-11T15:17Z,please add some screenshots n info 
[V],Alia_Erenel,2010-05-26T20:50Z,Moved to HD.
,geekie,2010-06-07T09:26Z,The audio track. It's NOT English! :(
,Jyoti21,2010-06-12T02:52Z,It has English and hindi two audios. play it with SM Player and you can select the audio to be played.
,Jyoti21,2010-06-12T02:54Z,VLC Player can also be used for selecting the audio that you want to hear.
,parthp6,2011-07-14T23:53Z,i think you have bsnl broadbandwith 500 combo plan
,parthp6,2011-07-14T23:54Z,Am i wrong??
,qwerty8977,2011-12-05T20:31Z,please seed.........
,qwerty8977,2011-12-05T20:32Z,jyoti21 and all other users please seed.....
