User Type,Username,Date,Text
,jiveclive,2010-05-28T23:29Z,Thank you. Thank you. And thank you. You have the most consistenly interesting uploads. Big props. 
,JayHorror,2010-05-29T21:55Z,"I second that, always providing excellence."
[V],WTC-SWE,2010-06-01T08:30Z,"@ jiveclive

Hi jiveclive.I am really glad that you are satisfied with my work and that you like my uploads.Hopefully you will find more interesting documentaries in the future that i will provide to you all.Let me know if you have any request.
Have a nice day /evening and thank you for your feedback.



@ JayHorror 


Hi my friend,always nice to have some feedback from you.This is what makes it worth the effort to keep uploading , for all you guys.
Take care and enjoy. Cheers :)"
