User Type,Username,Date,Text
,resul27,2010-07-27T22:28Z,is this rip  better then axxo's
,resul27,2010-08-03T07:30Z,wat the hell man  cant 1 person  answer my question
,leechavla,2010-08-14T12:15Z,"please seed anyone,thanks in advance"
,vivatpb5776,2011-06-07T18:58Z,"Video and audio quality on par for a DVDRip. The screen resolution makes it close to impossible to stream to a larger television but viewing on a 22"" monitor is good. Thank uploader.

P.S. @rasul27 - If you want to know, download both of them and compare them your-damn-self."
