User Type,Username,Date,Text
,Danux01,2009-12-12T08:50Z,"Phenomenal!
I've only got a crappy, ancient cassette rip of Rock Ride, had thought it was only released on magnetic tape. Am looking forward hearing a clean copy.
Thanks for taking the time to digitize and share tis."
,Danux01,2009-12-12T18:05Z,"Ah man, Rock Ride isn't actually in this torrent. All the other songs are there, and they're excellent, clean rips. Guess I was right - Rock Ride only came as a bonus track on cassette."
,Danux01,2009-12-12T21:39Z,"I've torrented my copy of Rock Ride, if someone's come looking for it.
http://thepiratebay.org/torrent/5212474"
