User Type,Username,Date,Text
,yorkster111,2010-07-24T21:06Z,does this work?
,Globalcommunity,2010-07-26T23:42Z,"i get ""Failed to load the client DLL""
Please help someone, i really appreciate."
,pirate0096,2010-07-31T21:22Z,"yeah me too, I'm running Windows 7 Home 64 bit

shitty torrent that doesn't work, delete"
,eeepc700x,2010-08-13T00:38Z,"It don't works. Same error.

But there is a working L4D2 no steam at tracker:

http://thepiratebay.org/torrent/5709096/Left_4_Dead_2__V2.0.2.7__Full-Rip___blaze69_

It works ONLINE at cracked servers!"
