User Type,Username,Date,Text
[S],velvet.,2009-07-22T16:05Z,Enjoy your pink skull.
[T],Terror-Freak,2009-07-22T23:28Z,thnx man 
,Riccardo86,2009-07-28T16:34Z,"Na 2u houdt de film op... Oftewel, het einde nog heel graag;D???? Verder goeie ondertitels zoals gewoonlijk:)"
[T],Terror-Freak,2009-07-30T01:30Z,"ik heb van part 2 maar 2 cd's naar dat de dvd klaar was met rippen sorry daar voor

ik heb alvaker gehoord ik heb de dvd nogmaals geript en er kwamen egt 2 cd's uit sorry"
,royalkmaar,2011-01-26T17:47Z,deze is niet compleet inderdaad..
,kubilay7325,2011-11-02T23:47Z,eej broer plz man maak hem compleet namelijk die andere zijn wel goed alleen deze nog man pff
