User Type,Username,Date,Text
,RIggsta,2010-10-24T17:23Z,"Looks stretched as fudge on my psp, makes it look terrible how stretched n tall it makes everything....this is every release I tried for the PSP has been this way, even Vicerocks release was to stretched out"
[T],on.off.on,2010-10-25T02:31Z,@RIggsta maybe i should make one then? 
,francoNY,2010-10-25T19:35Z,Good copy...v9/s10. Thanks a lot.
,majsamcg,2010-10-28T21:33Z,"suggestions....only for psp owners ....good copy but still its a 320*240 screen size
which is hardlyviewable at the actual psp screen size"
,killer-orange,2010-10-31T02:16Z,"looks silly its like the opposite of wide screen. 2wice as tall as the width.

yeah on.off.on you should make 1 ur a pro"
,tavery80,2010-12-14T02:29Z,"Doesn't play on any of my devices properly...extremely slow motion, or it plays about 1 frame per minute."
,MeTrueBlue,2010-12-30T14:23Z,Looks Great and plays great !
