User Type,Username,Date,Text
,kiraburu,2010-03-13T07:29Z,"Wow man, this is THE SHIT...thx to share, i got this but will check the quality...dont you know of remastered version or dts cd of this MONSTER??'"
[T],bobnjeff,2010-03-13T08:26Z,"yes i do but if i or someone i know doesn't own it i can't post it 

B&J"
[T],bobnjeff,2010-03-13T08:29Z,better yet why don't you go out and get it and post it up for the rest of us.
,canadianice,2010-03-13T17:23Z,i have the japanese remaster. 
,A_Bridge_Too_Far,2011-05-03T01:50Z,"My Brother was listening to them when They came out,...Great Tallent,..Brings back memories!!  Thanks!  Great Torrent!!  Bobby Caldwell ROCKED The Skins!!!"
