User Type,Username,Date,Text
,thesmokestack,2010-04-08T17:04Z,"what a BS file format.
upload something useful."
[V],r3dcat,2010-04-08T17:16Z,@thesmokestack: Hmmm for someone that has never uploaded anything themselves and who obviously has no idea about developments in the Wii scene you seem to have some strong opinions!!! :P
,lords,2010-04-08T18:55Z,"this can also be converted back to a iso
with Wii Converter GUI if,
Wii Backup Manager is a pain for you...
thanks uploader...

@thesmokestack...this bs format saves a lot of seed time along with the file size..
most of the games are disk size stock not data size like this..so it is better..."
,Xyeklops79,2012-05-19T00:07Z,"I know this works, I have downloaded it at least 5 times for my kids. Onto different computers..."
