User Type,Username,Date,Text
,motorkent,2009-09-24T17:11Z,norwegian audio?
,systechsolution,2010-09-28T10:55Z,"Thanks For The Upload...
Will Seed For 1 Month Now...
Can You Put This Movie In Dual Language English - Hindi With English Subs & Same Quality...
Am From India And We People Like Our Regional Language Hindi....
Or Any Trick So I Can Add Hindi Language By Ripping It....
If Possible Then Please Mail Me Back...


Saggi Here...
systechsolution@in.com "
,baby-jo,2012-06-20T14:21Z,"Seed please, thanks for sharing!"
