User Type,Username,Date,Text
,xgp_alex28,2009-09-22T10:34Z,subs: http://www.addic7ed.com/serie/House/6/1/Broken
,trollare,2009-09-22T12:22Z,is this a double episode.... or what happened to E1 ?
,InsaneWombat,2009-09-22T13:57Z,"Two hour season premier, mate!"
,hapitots,2009-09-23T16:20Z,"Thanks a bunch to the uploader. I've been waiting for this for how many months now. It truly is an addictive show, just like house. lol!"
,voyeurman,2009-09-26T05:59Z,"trollare,

If you have really read first the title, you would have seen Episode 1 and 2 written on it!!! "
