User Type,Username,Date,Text
,schmierig,2010-03-21T16:12Z,"nice girl, nice song"
,hunnicuddler,2010-05-30T00:22Z,The end of the song is missing lordick!
,BLACKMESALOL,2010-05-30T00:27Z,"Live concert :P 

nice song "
,SyrinXeno,2010-05-30T16:03Z,"Live concert, bad quality, whatever ...

For better quality/single version, download: http://thepiratebay.org/torrent/5586362/Lena_Meyer_Landrut_-_Satellite

Alternatively download it from Eurovision Song Contest Oslo 2010 - Album!"
,nikia00,2010-06-24T13:44Z,"Thanks :) 

BUT THAT IS MP3 FROM EUROVISION!
NOT ALBUM MP3"
