User Type,Username,Date,Text
,DJKler,2010-02-17T17:01Z,"Thanks Amer Rehman  For Downloading my Torrent. It is among my First Torrents.

Best of Luck For ur Program."
,DJKler,2010-02-17T17:06Z,"Amer Rehman Try This out :

http://thepiratebay.org/torrent/5074418/Urdu_Unicode_Solution"
,mohsindilse,2010-03-18T10:20Z,salam bhi jan ager torrent upload kar he diya hia to plz seed karean i am stuck 9.7%
,mohsindilse,2010-03-18T10:21Z,djkler brother plz seed plz i realy want novels 
,mohsindilse,2010-03-19T09:13Z,salam brothers plz seed seed i am at 20%
,DJKler,2010-03-20T06:16Z,"guyz dont worry im gonna upload it upto 100 UL ratio or more if reduired.
i was uploading another torrent.
comment about the torrent stuff.."
,Sarxel,2010-12-13T15:57Z,Nice upload bro i will seed it for next 2 Months :) 
,roshok,2010-12-27T21:26Z,Thanks alot for this nice collection rare to get this beautiful language on internet.
