User Type,Username,Date,Text
[T],mrgspott,2010-03-14T21:05Z,this is my first torrent. hope the speed is fast enough.
,sweetspirit1,2010-03-16T03:57Z,I JUST DL IT IT WAS REAL BUT MY OPINION IT'S PLAYING IN BLACK AND WHITE BUT REAL GOOD EFFORT MRGSPOTT THANKS
,nisgos,2010-03-16T10:25Z,to be honest quality is not good  but  i appreciate your effort at lest your not one of those virus providers   they should f**k off
[T],mrgspott,2010-03-16T14:40Z,thanks for the input. ill be adding more soon. yeah fu*k the guys that repack with viruses
,concord24,2010-03-17T17:58Z,"thanks 
waiting for more new movies with small size between 400 MB  and 600 MB"
[T],mrgspott,2010-03-21T06:22Z,"glad to hear that, ill covert some more on sunday"
