User Type,Username,Date,Text
,cozy8,2011-05-02T06:32Z,Pls seed. Thanks!!
,cozy8,2011-08-04T20:35Z,"johnefp,
Pls reseed this one. THanks! I will do the same."
,cozy8,2011-08-05T03:17Z,"I sent this comment to administration:

The uploader JOHNEFP, is the best. I love the movie classics. NOt only does he have a large selection from which to choose, the quality of the movies are superior. He pays attention to the downloaders, and if asked to reseed, he does so in a timely manner.

Pls compliment him or whatever you do to recognize uploaders like him.

Hope it helps. Thanks for the reseed."
,cozy8,2011-12-04T11:13Z,"John, pls reseed. accidentally deleted it."
