User Type,Username,Date,Text
,blkhu,2010-09-17T16:29Z,pls upload sreens. thx
,devang97,2010-09-18T12:37Z,sample has been provided
,devang97,2010-09-18T12:39Z,are there subs
,devang97,2010-09-21T11:17Z,"are there really subs
someone tell"
,cronicSuperb,2010-09-22T00:57Z,"real, A=6 V=6.....not bad, watchable...pretty decent for a cam...thanks "
,kadeem14,2010-09-24T01:14Z,yea not bad it is watchable but i dont recommend using it for sale
,charles338,2010-09-24T09:23Z,Thank you for the upload.
,les907,2010-09-29T01:11Z,"It's the same CAM version that's up here already. If it's not a DVD rip, I might as well see it in theatres. Thanx anyway"
