User Type,Username,Date,Text
,Skordy,2010-01-28T06:02Z,"Nice Torrent! Virus Scanned with AVG Internet Security 9 and Avast! Anti Virus. Nothing found, also the install was clean and instructions well written, and easy to understand. Download speeds were quick and I fully downloaded in under an hour. 

I do have one question though, TheThingy, it says to turn off auto-updates. Well I opened and checked every APP, none of them have a auto-update box under the General tab. Help?"
[V],thethingy,2010-01-28T06:44Z,"TO TURN OFF AUTO UPDATES = 
Go to help then updates, adobe updater update will run then you will get to the 
preferences window to turn off auto updates."
,Skordy,2010-01-28T09:09Z,Oh ok! Thanks. :)
,babybluelibra,2010-01-28T21:36Z,I'm completely lost and i could use some help... If someone could give me a very slow step by step guide as tp what to do my email adress is babybluelibra10@hotmail.com... Thanks :)
,blindskate,2010-01-30T22:28Z,Can you help me please for adobe after effect. when I open the program they give me the message licence expired.
[V],thethingy,2010-01-30T23:23Z,"read this;
http://thepiratebay.org/torrent/5316905"
,legends2021,2010-01-31T21:04Z,"PLEASE HELP!!! When I try and fix the hosts file in the C:/windows/system3/?drivers/etc folder, it says i do not have permission to save the file?? Please contact admin? There are no run as admin compatibilities?? How do I edit the hosts file?"
[V],thethingy,2010-02-01T07:32Z,"read this;
http://thepiratebay.org/torrent/5323279"
,legends2021,2010-02-02T03:33Z,your amazing man. thx a bunch. Ae rules.
,rovinatissimo,2010-02-02T23:39Z,With windows 7 it doesn't work!when I open the program they give me the message licence expired..but photoshop cs4 work great!what's the problem?help me please!
[V],thethingy,2010-02-03T06:18Z,"read the post in this then download this;
http://thepiratebay.org/torrent/5323279"
,nosc1,2010-02-04T19:31Z,"Hi Guys,iam lookin for some one 2 edit my modern warfare2"
,nosc1,2010-02-04T19:32Z,"Hi Guys,iam lookin for some one 2 edit my modern warfare2 sniper quick scope videos,I just dont have that creative touch....!"
,panaskarpas95,2010-02-07T19:50Z,"DUDE you are awsome!!!!!!!! i only had photoshop cs3 and lighroom and i was thinking that i would be complete with after effects. in my opinion is the best. and i thought that is so diificult... thank you very very much.....
HELLO from CYPRUS"
,Smoozle,2010-02-08T21:59Z,"Hiya, When I go to install this, it comes up with the 'Checking System Profile Box' which gets almost all the way to the end, then just stops. Is there any thing else I can do?"
[V],thethingy,2010-02-08T22:04Z,"read the failure to install in this;
http://thepiratebay.org/torrent/5323279"
,Smoozle,2010-02-08T23:33Z,"I tried that, I'm getting the same problem."
[V],thethingy,2010-02-09T00:01Z,whats your pc specs?
,Smoozle,2010-02-09T00:55Z,"CPU: Intel Core2 Quad 2.33 GHz
Memory: 4 GB RAM
GPU: NVidia GeForece GTS 250
OS: Windows Vista Home Premium"
[V],thethingy,2010-02-09T01:04Z,do the clean install steps in the toolkit you downloaded
,Smoozle,2010-02-09T03:04Z,"I think I may have got it working now, but thanks for your help, and for the great torrent."
,wetWeasel,2010-02-10T11:24Z,"As I've come to expect from thethingy uploads this install is 100% happiness. fast to download, easy to follow instructions, compatible with the other Adobe products and fully functional on 64bit Windows7.

There's a special place in Pirate Heaven for thethingy, and his/her team of crackers."
,blindskate,2010-02-20T00:13Z,"thanks!
Watch this video :
http://www.doritosviralocity.ca/Gallery/VideoDetails.aspx?v=4199"
,JLumpy,2010-02-21T00:54Z,when i start up ae i accept liscense aggrement and then it says : after effects cant continue: unexpected failure during application startup
,thegege,2010-02-21T07:19Z,Worked perfectly. Great torrent.
,skiper5,2010-02-23T05:48Z,"if you're worried about the keygen you can find some of the serial keys from this link
sharecash dot org/download.php?file=432259

"
[V],thethingy,2010-02-24T02:03Z,"skiper5, stop SPAMMING there is no keygen in this"
,rasmus9311,2010-02-24T16:41Z,"Thetingy, if i have photo shop CS4 already installed do i need to uninstall it then?
plz send a mail to zybon_93@yahoo.se with the answer :)"
,paulina922000,2010-03-07T05:11Z,"I torrented PS and AE and for both of them everytime I open the software it asks for the product key again. I type in another one thats on the list everytime but I am running out of them, I can't use the same one twice. Did I do something wrong? Why does it keep asking me for another product code! Help!"
[V],thethingy,2010-03-07T12:58Z,"paulina922000, because you have not set your hosts file, read hosts in this;
http://thepiratebay.org/torrent/5323279"
,rasmus9311,2010-03-07T19:01Z,If i have photo shop CS4 already installed do i need to uninstall it then?
[V],thethingy,2010-03-08T18:01Z,"rasmus9311, no"
,rasmus9311,2010-03-10T14:41Z,"thethingy, thx for the response :)"
,RuupiH,2010-03-19T06:58Z,"What to do as the install crashes 100% of the times in all compatibilities? Vista Home Premium, Dualcore 2.33GHz, Nvidia 9600GT. Shud be enough but why?"
[V],thethingy,2010-03-19T09:51Z,"RuupiH, do the failure to install steps in this;
http://thepiratebay.org/torrent/5323279"
,Bud4Bud,2010-03-21T00:29Z,"It won't let me change the host file even though im in administrator ! It keeps saying ""make sure that the path and file name are the same"" ?? what do i do ?"
,Bud4Bud,2010-03-21T00:56Z,"Ok, i think i did something wrong, im gonna uninstall and try again. "
,Miscym,2010-03-21T15:14Z,"When I try to open the Activation Blocker I get a error message in the CMD saying:
Server Blacklist Added!
Press any key to continue...
Then when I do that it closes.
Any help would be appreciated :p"
,Bud4Bud,2010-03-22T16:35Z,"Ok, i un-installed everything and tried again but now when i finished installing it says done but with errors ?? And then it wont let me install the updates in the folder ? I know it must be something I'm doing wrong as your uploads are the best, please help me The Thingy when you get a chance !"
,something41,2010-03-24T03:14Z,Does anything change for using it with a computer with no internet? Do I still have to crack it the same way?
[V],thethingy,2010-03-24T22:04Z,"Bud4Bud, do the clean install steps in this;
http://thepiratebay.org/torrent/5323279

Miscym, thats what it does, open your hosts file with notepad to check it has edited it

something41, yes"
,rebellionnx,2010-04-01T01:17Z,Download could be faster but im sure its due to the connection I'm on lol. Your uploads havent dissapointed me before so for that THANK YOU! i tried downloading RobbingHoods After Effects torrent and got to many alerts with AVG so i searched and found yours and it was a MAJOR relief to find an uploader i can trust.
,cyberwast,2010-04-15T18:13Z,"I'm about to download this, but I already have downloaded other Adobe products released by you. Thanks for the clean and working releases you've provided us. I'm extremely careful when it comes to viruses, but these releases doesn't have keygens neither nothing suspicious. Despite you've taken the time to explain in detail what we should do in order these apps work well, idiots exist and will exist for ever. If they can't fucking read a word of what you say and their app doesn't work, it's their own problem, but you did your job pretty damn well. Again, thanks for everything!"
,darko999,2010-04-17T23:55Z,"Just wondering, I have the full version of Adobe Creative Suite 4 Design Premium with student licensing. My serial and software is all bought(college). Should I even be attempting to add this to the same computer? I've used many pirated appz in the past including Photoshop, I'm just wondering if this will interfere with my other legit programs."
,enkhuizenddg,2010-04-20T18:55Z,"I have a problem:
I installed CS4, but if I want to open AE, it says it have to be restarted to work, so I restarted my PC, and it came again.
at the bottom it says 'Error: 130:3'
I installed it by following the steps in the Instuctions notepad file.
please help me!"
,tripplesix,2010-04-24T19:02Z,"This was a great torrent.  Installed flawlessly... and opens (although I haven't actually used it yet) on Windows 7 64-bit.

THANKS thethingy!"
,ilovecrack,2010-04-25T11:20Z,"How can i fixed this plss help thethingy 


Licensing for this product has stopped Working

Error:130:3

Pls hellppppP!! Thanks!!"
,ilovecrack,2010-04-25T11:24Z,I've Already restart my pc. But Always show an error .. My os Windows xp plsssss... help help thankx!!
,rastahenk,2010-04-25T23:42Z,"hey when i start the app its says ""error:130:3"" please help me"
,Jedor,2010-04-27T20:06Z,"I installed YOUR Adobe Premiere Pro CS4 and would like to install a couple more of your CS4 programs. I am a bit confused though, in the instructions it says ""If you have ANY of the After Effects CS3/4 apps currently installed then install Windows Cleanup from this folder and use it to remove the old Adobe apps."" Must I do this with your programs aswell? In that case I'll have to install and then install numerous times. Can't I just uncheck the already installed programs (Air, Bridge, Media Encoder etc)?"
,Jedor,2010-04-27T20:08Z,Of course I meant install and UN-install numerous times...
,dark.boob,2010-04-29T17:37Z,"when are you doing adobe cs5 master collection?? 
(big fan)"
,Benfield87,2010-04-30T13:05Z,"I kee getting Error 130:3 so i did (this*) and i still get it (ERROR 130:3*) = 
Caused by;
A. hosts file not being set.
B, Corrupt installation.
C, Conflicting Adobe apps or patches.
Solution; 
1. Try the steps in Adobe Licence Recovery folder.
2. if that fails go to the Licence Method 1 folder and follow the instructions 
   there.
3. if that fails go to Clean Install & Uninstall folder and follow the steps 
   there.
Im on windows 7 and I guess im not to good at this please help asap."
,Benfield87,2010-04-30T13:06Z,My Hosts file doesnt save over the original it asks me to save it in my documents......
,Benfield87,2010-05-01T00:11Z,My e-mail is William_Benfield@yahoo.com if anyone can help
,vKoteng,2010-05-01T18:44Z,"Hey :)
very good torrent.
everything works for me.
one little thing tho, its written that i need to ""UNCHECK AUTO UPDATE"". I go in EDIT,PREFRENCES,GENERAL, but i can't find the box. Is it very important that i uncheck it? Please give me an answear :) Thanks."
,Benfield87,2010-05-02T07:08Z,I uninstalled it to start clean but when i tried to reinstall it i get an error message that says= setup has encounterd an error. cantact coustomer services for suport.... and help?
,Benfield87,2010-05-02T07:15Z,ok i lied i didnt uninstall it so i tried and of course i got an error that says= some problems occoured while compoets were being removed.... i feel so fucking stupid right now can u help?
,usair,2010-05-07T23:02Z,"Thanks, great torrent. "
,romanul70,2010-05-08T11:35Z,"how can I bypass the system checking?...reply plz , thx."
[V],thethingy,2010-05-15T18:50Z,"romanul70, what?"
,cojo45,2010-05-15T19:38Z,"I usually do not comment unless their is a serious problem.

Or that I find your download to be completely awesome.

Thank you very much man. 
Keep safe dawg."
,wanni_ae,2010-05-16T03:19Z,"Does anyone have a solution for this?  ""After Effects error: crash occurred while invoking rendering plug-in ""advanced 3D""""  It was working fine the first day I installed in but now every 5 minutes it crashes.  Please help...  Btw im not using any 3D plug-in or effects."
,hallasume,2010-05-20T06:41Z,"@wanni_ae

It seems that you have a problemwith your License"
[V],thethingy,2010-05-27T06:40Z,"wanni_ae, check your hosts file and start the application as admin to register all processes"
,Mahoraba3,2010-06-01T04:05Z,"So, I installed this earlier and I ended up failing and in-correctly following one of the instructions.. anyway! It ended me in a perma Licensing error.

I got frustrated with it and just uninstalled it for now, I plan to reinstall this later but my question is, if I use the Windows Cleanup provided in this Torrent is it going to erase Adobe Photoshop things as well or just the After Effect install I did?"
,Mahoraba3,2010-06-03T01:19Z,"No Answer?

Just wanting to know if I use the Window Cleaner provided in this torrent if its going to mess up my Photoshop Install as well."
,XLScar,2010-06-04T19:31Z,"thethingy, you are sexy and i love you. keep it up bud you made my day."
,Mahoraba3,2010-06-08T09:25Z,"Still no answer on if the Windows cleaner provided in this torrent will wipe the Photoshop install I have as well or just the After Effects installs.

WTB Answer."
,SNiiP3RXo,2010-06-13T23:36Z,It says licencing for this product has expired? Any help?
,dmjrtdwp,2010-06-18T08:05Z,"thethingy, i have photoshop cs5 currently installed into my pc. i was going to install adobe after effects cs5, but the i do not certain requirements (64bit OS). so i was wondering if installing adobe after effects cs4 will effects my photoshop cs5. it says that this torrent brings adobe bridge cs4, but i currently have adobe bridge cs5. please help. thanks in advance. "
,overkilled1,2010-06-19T16:28Z,"Hey. When i install it, an icon dosnt get installed on my computer ""that i can find"" I have tryed re-installing and same thing. I am running vista, help?"
,overkilled1,2010-06-20T15:22Z,"O i fixed my last proble,m but now im getting two errors. Ones 1603 and the other is a number adn it talks about the key and makin sure im authorizedd to use the key,.... any helpp?"
,Gavin_D3str0y3r,2010-06-21T03:30Z,"Good Torrent, thethingy, excellent! I installed it and was very happy with the performance it gave me, turns out that I can be good at AE if I give it a shot! Keep being awesome! :D"
,dmjrtdwp,2010-06-22T23:40Z,"thethingy, i have photoshop cs5 currently installed into my pc. i was going to install adobe after effects cs5, but the i do not certain requirements (64bit OS). so i was wondering if installing adobe after effects cs4 will effects my photoshop cs5. it says that this torrent brings adobe bridge cs4, but i currently have adobe bridge cs5. please help. thanks in advance."
,Mattias0954,2010-06-26T22:48Z,"hey thingy, i need help, ive been trying to fix this for like ten hours -.- i do everything exactly as the readme says.. and yet, when i start after effects it says ""Licensing for this product has expired"". And i've downloaded the CLean install and error tool and ive tried the LicenseRecover tool but it doesnt work.. What should i do ? :P"
,SiGDiGS,2010-07-10T04:37Z,"Hey...i followed the steps exactly and when i run AE it says : \""The procedure entry point (LONGSTRING) could not be located in the dynamic link library dvzcore.dll\"" and once i press \""OK\"" it goes to this message box:rn\""After effects could not start because a required component could not be found\""...so i try to re-install and the installer now crashes mid-install.....any ideas? thx"
,SiGDiGS,2010-07-10T04:39Z,oops i meant dvacore.dll
,Beepboxx,2010-07-11T14:17Z,Another amazing install!rnThanks again
,FlossLikeABoss,2010-07-12T06:12Z,"I need help Im getting an error message when start up After Effects, it reads: after effects has crashed, (0:42). I followed all the steps"
,shahzebamin,2010-07-16T18:25Z,"Hello, I download Adobe After Effects using torrent(i dont remember which one) and used it and then i stopped using it for some time then when i started it it said there was a licence problem i uninstalled it and installed this torrent but when i tried to install it it says that the installation failed to download some applications but adobe after effects is there then when i opened the folder there was no file named \""hosts\"" i am confused!"
,moon_mistress001,2010-07-19T23:52Z,"I just installed Adobe Master Collection CS5 but have not included After Effects and Premier Pro because my laptop did not meet the display and graphic card requirements. All the other CS5 software are working though. Here's the thing, After Effects CS4 comes with Air, Bridge CS4, Device Central CS4, Media Encoder CS4, Pixel Bender Toolkit, Extended Script Toolkit, Pixel Bender Toolkit, and Mocha For After Effects CS4... Can I download After Effects CS4 without affecting my other CS5 software? Is it possible to just download After Effects CS4 alone w/o its components since I already have the CS5 components? "
,Bapman,2010-07-21T10:03Z,"I start setup.exe... near the end of ""checking system profile"" it gives this mesage. ""setup has encountered an error and cannot continue"". So now what !? B4 sum1 starts... yes I hav uninstalled... using the software given... and I have COMPLETELY cleaned my registry of any installtions with registry cleaner... etc.
Still no dice !
Any help?"
,mrstoffel,2010-07-23T21:58Z,"Thanks for the upload, like always works as a charm thnx . "
,0000179005,2010-08-13T04:59Z,"this is virus free, and really good.  Just make sure you read the instructions about turning off the internet, and changing the host files."
,cakers10,2010-08-18T17:11Z,"Without a doubt this is the most complex installation ive ever had to do :o took some time installin, uninstallin, reinstallin, using the repair kit and other .dll file issues, but i finally got it :D So nice torrent and to those still trying to install it.. dont give up :P"
,ryanmv800,2010-08-23T01:09Z,Does this work for 32 - Bit (x86)? Please Reply. I love torrents from thethingy because they are reliable.
,Grimm858,2010-08-28T09:38Z,"I just downloaded this and I used the clean install but It keeps saying checking system profile and then it says setup has encountered a problem and cannot continue.
Could really use some help"
,anonomoly,2010-09-04T09:30Z,"Hey thingy,

torrent was working great up until the fifth step where I tried changing the host file only to get teh following message: ""Cannot create the c:/windows/System32/drivers/etc/hosts file. Make sure the path & file name are correct"". How do I fix this?"
,anonomoly,2010-09-04T10:58Z,NVM I figured it out. Thanks for the awesome torrent :D
,puregaga,2010-09-04T23:26Z,this tutorial is crap by the way dont bother wasting your life with it
,crueshopofhorrors,2010-09-06T18:39Z,"hey thingy! this IS a great torrent, despite what some people keep trying to say. however, this is my second day with it, and when i open it, it says that the licensing for this product has stopped working, error:130:3. could you or anyone else help me fix this? i really need this program!!! thanks!"
,Rwebster001,2010-09-20T00:48Z,"Getting no luck with this.

Good download, ran the first installer to unpack the adobe installer and it stops with error almost immediately.

Maybe I need to run a fix first? Any advice anyone please?!"
,Drift240,2010-09-20T21:55Z,@thethingy. I really must know if this can be UPDATED? Pease lemme know. thanks in advance.
,anonomoly,2010-09-22T01:13Z,"Anyone know if you still need to run the cleaner if you have CS4 apps from his CS4 photoshop torrent? I mean they come with the same exact apps, and it would be nice to not have to remove and reinstall...."
,RayAP18,2010-09-22T15:58Z,"Hey thethingy, I think I messed up. I had a version of AE on my computer already and I used the Windows Cleanup to delete it, but I thought I was supposed to delete ALL the Adobe products. Now that I did that, it won't let me install this program. It says ""One or more required components of Adobe After Effects CS4 failed to install correctly.""

Help? How do I get those components back?

Thanks"
,headster86,2010-09-26T17:04Z,when i try to download it turns on curse client.. sup with that i hear lot of goods things about your stuff hope i can get help on this 
,saskimodo,2010-10-02T18:30Z,is this ok 4 32bit
,X757iNfaMouZzX,2010-10-14T02:56Z,"I need some help, I downloaded it but my computer just freezes when I try to run it..."
,Willium_Bob_Cole,2010-11-01T13:13Z,"brilliant torrent, thank you so much! I was put off of RobbingHood's version as people had doubts about whether or not it was clean, reports of trojans and key loggers etc, etc. I dont usually post comments for torrents because they're usually sub standard or literally install and it works, but it's clear you've really taken the time to make it foolproof (if anyones having difficulties, literally just follow the instructions. its REALLY easy. If not, you're either a fool, hence fool proof, or there really is a problem in which case, post here, everyone seems friendly enough here =D )

only thing concerning me now is that none of the adobe apps installed from this torrent show an option to turn auto updates on or off, not even in after effects itself... will I be okay to stay online in that case, or do I need to do something else? thanks again

 -WBC"
,GrawCube,2010-11-07T09:56Z,"What is this thing that my AVG finds from

""Adobe After Effects CS4\ACS4MC- Keygen\Extra keygen\ACS4MC-Keygen.EXE""

it says ""Runtime packed upack""..."
,dusty_ol_boy,2010-11-08T07:53Z,"Thingy im having the problem with saving the changes to the host file. Ive read previous comments and tried to follow the link you gave to help, but it says it cant find the torrent link. If you could send me an e-mail nailoassassin@hotmail.com Id greatly appreciate it"
,44cal,2010-11-11T18:15Z,"Hey thethingy, thanks for the great upload. Like the person who commented before me, I am also having a hard time saving the changes to the host file, and the link can't before to remedy this issue. Any advice? Thanks!"
,XENTIYON,2010-12-01T19:03Z,"@thethingy

Hey man, could you please update the links you gave before?
they're 404 now.
thanks"
,MCFLUFFY65,2010-12-17T18:33Z,I get error 130:3
,shahzebamin,2010-12-30T21:00Z,"I downloaded this torrent before and it's working. But then I had a problem saying that it the license is not valid. So I tought I would just reintall it. I deleted the file manually from the Program Files\Adobe folder. And now I downloaded this torrent again. But after extracting when I click on the Setup it says ""Setup has encoutered a problem. Please contact Adobe customer service."" Please help."
,SEC902,2011-01-02T13:52Z,It says license has expired.. Please Help Me
,myared,2011-01-29T14:10Z,WORKS FINE!!!!
,FlyDuc,2011-01-31T19:16Z,"Hi! : D
Everything works fine and nice, until i turned my computer off. Then when i open After effect i got the 130:3 error, I uninstalled it. It worked again... but the same happen again when I turned the computer off...

Well the host file didn't work... so i just copied yours and yeah... maybe that's the problem? and I couldn't find where to turn off the auto update. I tried ""Help"" and ""Preference, tools etc.. "
,ivanovitj,2011-02-12T04:35Z,"Hi thethingy,

Another Gr8 torrent! Everything work 100% thanks to very good ""how to do, step by step""! 

Only thing that I cannot find is to turn off aouto updates. Cannot find that place in ""Preferences"" or in ""Help"".  But no big thing. 

Thanks again! "
,ivanovitj,2011-02-12T04:36Z,"Hi thethingy,

Another Gr8 torrent! Everything work 100% thanks to very good ""how to do, step by step""! 

Only thing that I cannot find is to turn off auto updates. Cannot find that place in ""Preferences"" or in ""Help"".  But no big thing. 

Thanks again! "
,abeilly,2011-02-18T06:21Z,can u plz help after installation I get error 130:3 
,nukemed,2011-02-25T14:53Z,"can you please help me? I already followed all the steps but my laptop says serial # expired. help pls

Thanks! "
,lef60,2011-03-03T11:59Z,"Hi thethingy, Thanks for download ""After Effects cs4"" but in the istructions 4, STEP 4
1) Run the Activation Blocker (as admin vista/7) from this folder. I did this and got the message ""not autherised"" but I am signed in as admistrator? can you help? cheers"
,reezy52,2011-03-10T04:56Z,probably the hardest torrent i have done but i figured it out on my own... and it works 100%... 
,dansir05,2011-03-25T00:31Z,"Hello...I am stuck on Step 6 (Copy the AdobeLM.dll file from this folder.)

The file won't open. I get an error saying the file has been damaged. Can you help me? thx"
,psykoengine,2011-03-27T11:20Z,Thanks for this upload bro.. works fine with me on XP pro ... to the ones who are having trouble installing it ...LEARN HOW TO FOLLOW INSTRUCTIONS >>>
,cookrooch1234,2011-03-31T10:42Z,he thethingy i have a question.. if u dont turn off your auto updates and you restart your computer why'll the internet is on you get the error 130:3?
,Average_Joe1,2011-04-03T16:25Z,"Add it to your HOSTS file

C:\Windows\System32\Drivers\etc\hosts
Open with notepad

and add 
127.0.0.1       update.adobe.com
and
127.0.0.1       activate.adobe.com

Should be fine then ^^"
,Average_Joe1,2011-04-04T02:27Z,"Awwwe that's kinda lame. I've done all that needed to be done, and it turns out i get the
130:3 error... [non-legit licseanse key error] Do I have to re-install the bloody thing or not"
,Cyborg123,2011-05-02T18:04Z,Is this 32 bit version?
,Smokeybandit78,2011-05-17T19:30Z,Works perfectly.... I'm confused about the negative comments. 
,piratatuga,2011-05-22T22:56Z,"Hi, im trying to get After Effects to work, I installed it fine the first day, then in the other day wasnt working anymore, i got the 130:3 error, uninstalled it and installed it again, same error. I saw here that a few people had the same problem, could you help me pls?

Thank you in advanced."
,rigelglen,2011-05-26T18:17Z,How the Hell Do you pay for all this. Are you a Multi-Billionare
