User Type,Username,Date,Text
[T],Sunblock.,2010-09-25T01:58Z,Languages : GER IT HU  Only!
,Bojane,2010-09-25T07:37Z,"Winrar says corrupt volume, cannot extract the iso file..."
,Bojane,2010-09-25T08:41Z,"My bad, I just extracted the ISO file, something was wrong the first time but works now, have not yet tried the game, will do it later don't have time now"
,mennoknevel,2010-09-25T10:50Z,Which languages????? English?
,dre72,2010-09-25T12:11Z,winzip dont recognise the file. please help
[T],Sunblock.,2010-09-25T13:54Z,Winrar
,gumgum38,2010-09-26T16:03Z,"just downloaded this, I don't seem to have any rar files to extract to get an iso.  Can anyone help pls?"
,eriklarsson87,2010-09-30T21:30Z,"for english check out btjunkie.

went really fast aswell"
,Rahman18386,2011-03-08T22:31Z,hw do u dwnload the gme
