User Type,Username,Date,Text
,pigsikk,2010-01-28T10:01Z,please please put dvdrip up...
,quakerray,2010-01-28T14:32Z,"thanks for this,been looking and waiting for months for this"
,Legion1994,2010-01-28T16:59Z,"no please DONT! BDrips are superior to DVDrips, since it is ripped from blueray source, I hope I never see a dvdrip again, thanks! very nice rip!"
,pigsikk,2010-01-28T17:10Z,legion1994  dont think the tv team are selfish twats like you.. getta life ya moron..
,kabalizo,2010-02-13T07:28Z,thanks m8
