User Type,Username,Date,Text
,overcrop,2010-11-11T11:36Z,Care to give us a...hint?
,caelm,2010-11-11T11:55Z,"Oooh a gigabyte of rar - I can hear the seeds calling already!!!

:-S"
,133313,2010-11-11T11:58Z,"just a test, will be deleted as soon as possible"
,gazza2009,2010-11-11T14:16Z,Virus...maybe....?
,00gab00ga,2010-11-11T18:58Z,I accidentally a 1.13GiB RAR file. Is this bad?
,dobiebarns,2010-11-12T00:38Z,Could it be yvm?  Right size!
,schmooze,2010-11-12T03:37Z,what's a YVM? a virus?
,dobiebarns,2010-11-12T05:39Z,"No, YVM is delectable creature."
