User Type,Username,Date,Text
,de_spijker,2010-04-18T20:08Z,bedankt.
,hipermark,2010-04-22T15:06Z,croatian or serbian  sub please!
,Robertissimo,2010-04-25T20:51Z,"Sadly, it's widescreen picture inside 4:3 format. :("
,master_b415,2010-06-08T22:17Z,"@Robertissimo, tnx appreciate the heads up - just saved me D/L time and bandwidth usage, cheers."
[T],Miauwrits,2010-06-29T09:28Z,"It is widescreen in 4 : 3, so what.
This torrent gives you an opportunity to watch an awesome movie, so thanks for the upload."
,AnnaGreece,2010-08-27T12:37Z,"thanks for GREEK subtitles !!!

upload more movies with greek subs :)"
,ime021,2010-12-06T13:35Z,"...thanks man...4:3 version...Quality isn't that great, but thats how it was these days. Cant watch it like this-reencoding and cropping it with handbrake, and will watch it in few hours...once again thanks man...great upload "
,sats1969,2011-11-03T16:38Z,"seed guys,i'm stuck at 93,4%,a little more and i'm done,seed!!!"
