User Type,Username,Date,Text
,ninjanutta,2009-09-27T02:01Z,"Man,i hope this is real,ive got a feeling its fake as its on no other trackers yet ,i hope im wrong though"
,ninjanutta,2009-09-27T02:33Z,"another thing is the demo is 546 mb in size so it dont look good but as i said before i really hope im wrong,been waiting a long time for this game."
,ninjanutta,2009-09-27T03:42Z,"hell yeah!!! its not fake,its the real deal and im happy as a pig in shit!! nice up mate your the man!"
,knighthawk3759,2009-09-27T03:50Z,regrettably it doesnt seem to work on 64 bit systems.... so vista 64 users ...like me....are S.O.L
,Pillerking,2009-09-27T03:51Z,i am using win7 x64 and it works. not even using comp. mode.
,knighthawk3759,2009-09-27T03:59Z,well i try to install and it gives me the error box stating this version isnt compatible with the version of vista your using...and i tried to disable UAC and still the same thing..and i ran as administrator any help?
,knighthawk3759,2009-09-27T05:58Z,well ive dld it 3 times now and same thing no dice on the install
,cholostic,2009-10-13T02:31Z,"works awesome on my machine try to installed it on other two machines but it could't install thanks 
thanks man love the game "
,dboyd,2009-10-17T18:03Z,Thxs dude.
,daftpunk27,2010-03-24T21:03Z,this torrent fails at 24.6% any help?
,keshabgurung,2012-02-19T03:19Z,i install it but when i wanna play and click on desktop icon but is shows a massage this application has failed to start cause d3dx9_27.dll was not found. pls help me
