User Type,Username,Date,Text
,voicu_n,2009-10-24T03:22Z,Do you have by any chance the Russian audio companion ? Thanks a lot !
,chard0919,2009-10-24T17:03Z,tnx for the up!!!
,xxx-yyy-zzz,2009-11-05T21:50Z,"Have been looking for it long

Cheers mate"
,xXSTR8FSXx,2009-12-31T10:17Z,"Nice download speed, averaging about 450 kbps.
The torrent link in the description isn't downloading for me though."
,woodsyzacko,2010-10-10T05:19Z,ありがとございます！！ THANKS SOOO MUCHHH
,tre.fire,2011-08-25T04:39Z,"I speak a few languages, never learned with a language program, though I've seen the Rosetta stone format in a few different editions. the one for Japanese seems exceptionally difficult, even the basics like ""The man is eating"" or ""The boy is drinking juice"" are crazy hard if you don't know the hirigana. I'm hoping these audio recordings will help with that. Thanks."
,PandoraDay,2012-07-03T14:42Z,"Preety Awesome dude! Thank you! Seeding right now :P

Greetings from Ecuador, and please, everyone: Seed. ^^"
