User Type,Username,Date,Text
,palbryn,2010-05-16T17:18Z,"Someone who has
Garmin Bluechart G2 Vision VEU705L or VEU706L ?
Thanks"
,trowell4356,2011-06-15T22:04Z,Anyone please seed EU706L 
,dawsurf,2011-06-26T10:07Z,"bonjour , j'ai téléchargé cette carte mais elle est verrouillé sur mon gps et il ne peut pas l'ouvrir , pouvez - vous m'aider s'il vous plait."
,dawsurf,2011-06-26T10:07Z,"Hello, I downloaded the map but it is locked on my gps and it can not open it, can - you help me please."
