User Type,Username,Date,Text
,k-line,2010-09-26T08:47Z,what's up with all those ppl voting this torrent down?
[V],MAFIAA.,2010-09-26T10:14Z,it's called jealousy :)
,pforzheimer,2010-09-27T05:34Z,"VIRUS WARNING!

 VIRUS WARNING!

  VIRUS WARNING! 

there is a trojan in the Keymaker"
[V],MAFIAA.,2010-09-27T15:33Z,"@pforzheimer stop trolling please its keymaker DUH!, false/positive ignore the warning!"
,brianxxx,2010-09-27T20:42Z,"It is fine! Tested, checked and proven under my clean and existing VMWARE test bed. 

Get used to it NOOBs....keygens and many cracks are going to give false positives. Roll up your sleeves, run them under a Vmware environment and see for yourselves."
,memphist,2010-10-24T03:16Z,"Clean, fast and works well.  Thanks Stun "
,lov123,2010-11-16T03:22Z,How do I use this?
,dkman888,2010-11-18T10:50Z,put all the .rar into one folder and click anyone to complete the extraction process
,lov123,2010-11-25T05:35Z,This is new to me never done this i still don't understand dkman
