User Type,Username,Date,Text
,jandor09,2009-10-11T19:40Z,"There may be disruption of energy here, remain connected.

Pode haver interrupĂ§ĂŁo de energia aqui, fique conectado."
,jandor09,2009-10-11T23:02Z,"Normalized now. Thanks!
Normalizado agora. Obrigado!"
,kmell1,2009-10-14T07:12Z,"Thanks for upping this series.
Please give us more :)"
,Xerok80,2009-10-27T05:30Z,"This is excellent - the quality of these files is awesome! PLEASE keep them coming - I'll collect and help SEED them all. Thanks again, Jandor09!"
,jandor09,2009-10-27T14:17Z,"Thanks! Xerok80. The quality is the same for everyone. Wait, has more. 
Thank you for the Seed."
,jandor09,2009-10-27T17:43Z,"Please, Xerok80. Sign up for forum: http://forum.suprbay.org/private.php?"
