User Type,Username,Date,Text
[V],merzedes,2010-03-20T13:09Z,Hello people i will be away for a small week from wedensday. I travel too Nigeria and doing some work so iwill upload some big files before i leave and hope the pc is up and running all the time im away. But i will take care of the upload too tuesday----  :-)  Cheers
,agwywatx,2010-03-20T13:30Z,thx
,shaso,2010-03-20T14:11Z,"Good luck, Merzedes."
,dagcaiman,2010-03-20T14:34Z,"Ty merzedes for those greats uploads, good trip to nigeria!!"
,grifter3125,2010-03-20T17:43Z,Thanks Merzedes!  Hope the trip goes well!
,paulpot89,2010-03-20T18:55Z,Nigeria? Be Safe mate ;)
,ChefEm,2010-03-21T01:12Z,Have a good trip Merzedes
,LordTantalus,2010-03-21T02:21Z,Thanx Merzedes and be safe!
,implaca1,2010-03-21T22:35Z,"Thank you for all your magnificent uploads merzedes, have fun in Nigeria.

Cheers,"
,mafiadog,2010-03-22T23:07Z,Thanks so much.
,wayward12,2010-03-24T09:52Z,"thanks merzedes, have a safe trip."
,SirSwed,2010-04-01T01:30Z,"Many thanks, and have a nice trip!"
