User Type,Username,Date,Text
,shallow_,2010-10-09T14:21Z,"Thanks man, weekend starting great as usual :)"
,ChefEm,2010-10-09T22:16Z,"Thanks Merzedes! Its an ""above average"" weekend in my books"
,shallow_,2010-10-10T01:05Z,"@haydn70ab: eh, you're in here browsing for porn yourself, or are you just 'looking' ? "
,nightprowler.,2010-10-10T03:35Z,"Ya really though, kinda hard to stumble across this, can't call someone out in a forum like this.  Get off your soapbox haydn70ab."
,bakaonna,2010-10-10T12:54Z,Thanks.
,mafiadog,2010-10-12T14:06Z,Thanks very appreciated.
