User Type,Username,Date,Text
,konejo7,2010-08-21T08:04Z,also G1 PSP etc.
,athiest09,2010-08-21T13:22Z,screenshot's pls!
,penguin45,2010-10-26T18:49Z,Good torrent. Works fine with Quicktime. Don't try on Windows Media Player. Didn't try on my ipod yet. 
,IMMG,2010-11-09T17:39Z,"I have 2 requests, can you upload The 10th inning by Ken Burns & Superman/Shazam!: The Return of Black Adam... for iPod Thanx man"
,Amea81,2010-12-08T03:32Z,That went fast! Tx
,josil,2011-01-15T23:47Z,this work on iphone??
,rahkmo,2011-05-19T01:05Z,thanx konejo!!
