User Type,Username,Date,Text
,xgp_alex28,2009-10-13T14:19Z,subs: http://www.addic7ed.com/serie/Gossip_Girl/3/5/Rufus_Getting_Married
,isisx3,2009-11-29T15:31Z,"You guys are welcome to comment, really, I won't mind :)

Podem deixar comentĂĄrios, nao vai incomodar :)"
,23patD,2010-04-02T18:25Z,"If anyone wants the 6th, 7th, 8th or 9th episodes google it !

Google ""Gossip Girl S03 E06(/07/08/09)"" and open the site ""Torrentz""

ItÂ´s just that easy ! :p"
,23patD,2010-04-02T18:26Z,"isisx3 are you portuguese ?? I am too !!


acabei de comentar xD"
