User Type,Username,Date,Text
,user2101,2010-03-18T13:52Z,Excellent game!!! Thanks ;)
,limp_jeric,2010-08-18T05:46Z,im surprise that this game is addictive... gamefaqs rate it very low but still i found it a very good game... i will seed for 1 month...
,adighraiz,2011-12-04T03:53Z,"i play Dark Illusion 1+2+3 in ps1 for more than 900 hours :P
i knew about Trapt by accident,cause i think the series end in Deception 3
its been 6 years since the game release and now i knew about it what a shame
Big_dude you give me more enjoy full time
thanks dude or Big-dude :)"
,misaelk,2012-06-15T00:56Z,Works fine in PCSX2 0.9.8.
