User Type,Username,Date,Text
[V],Kefissos,2009-08-13T17:15Z,"Hvis I syntes det er nogle lortefilm jeg uploader må I gerne brokke jer.
Kefissos"
,DM(DK),2009-08-13T17:20Z,"Klart jeg hellere så de nyeste film og med dk sub :)

men bare det du stadig gider uppe for os, er for mig det vigtigste.

btw tak for din kæmpe indsats"
[V],Kefissos,2009-08-13T17:30Z,"DM! 
Det er ikke altid der er subs til danske film. Hvis der er er det en længere proces jeg skal kaste mig ud i, hvilket jeg ikke altid gider. Men jeg gør så godt som jeg kan.
Ellers må I komme med bud, hvad jeg skal uploade af nye film, det er ikke altid jeg følger med af nye udgivelser.
Kefissos"
,WatermanInk,2010-04-23T15:57Z,"Ingen som seeder?  Er flere som er stuck på 89,7%"
,sinnios,2011-12-12T04:16Z,kan du uploade guldhornene? :)
