User Type,Username,Date,Text
[V],bubanee,2010-01-07T10:48Z,"yes i did... been a bit busy doin' other things...

just to let everyone know.... song 9.. i left the letter L out so soz for that.. 'dipLomat'"
[V],bubanee,2010-01-07T13:37Z,"the others i tried to delete, my brother got on while i took off one day... this is the only one i have done myself! bubs"
,DTHSTR09,2010-01-07T20:29Z,"i really gotta ask, how did you get the cd? or are the songs from vampireweekend.com? (are avalible from there in lower q)"
[V],bubanee,2010-01-07T21:15Z,"no it's a CDRip not .com....
how i got it... can't tell ya that, soz"
,metroretro,2010-01-08T09:19Z,tnx!!!! 
,crl2,2010-01-08T12:24Z,"thanks mate , domino22"
,lovetheherb,2010-01-08T18:19Z,"Nice1 dude , do u know where i might get the bonus tracks from this album ??"
[V],bubanee,2010-01-08T21:30Z,"i worded the wrong Housezz... soz

ITS A CDRip... anything i write the words CDRip [Cov+CD] is a proper Rip by me... sorry for the confussion.....  "
[V],bubanee,2010-01-09T14:00Z,"@ lovetheherb

bonus tracks are available i hear at itunes.. not 100% sure i've never used or seen itunes site before"
,lovetheherb,2010-01-14T01:52Z,"Nice1 man ill check it out , keep up the good work :D"
,bigrich2007,2010-01-26T17:19Z,"Another GR8T upload, thanks Bubanee"
,Ghostmb76,2010-01-28T03:07Z,Thanks Man!
,mudgirl15,2010-03-06T21:15Z,Fast download - thanks!
,xxxflossyxxx,2010-04-22T08:30Z,thank you uploader!!!!!!!!!! xxx.
,seiriol1,2010-05-08T21:54Z,cheers for a great upload!
,daprunus,2010-08-05T20:37Z,Thanx
,shasham,2010-09-18T11:28Z,Thanks a lot. :)
[V],FerraBit,2010-12-19T16:18Z,"Heard of this for the first time today - article in the NYT.
Thanks for the up.

Peace Pirates
https://thepiratebay.org/user/FerraBit/"
