Filename,Size,Unit
All Fired Up/Fastway-If You Could See.mp3,6.34,M
All Fired Up/Fastway-Hurtin' Me.mp3,6.31,M
All Fired Up/Fastway-Telephone.mp3,5.98,M
All Fired Up/Fastway-Stranger.mp3,5.84,M
All Fired Up/Fastway-Non Stop Love.mp3,5.4,M
All Fired Up/Fastway-Tell Me.mp3,5.32,M
All Fired Up/Fastway-Steal the Show.mp3,5.04,M
All Fired Up/Fastway-Hung Up on Love.mp3,4.8,M
All Fired Up/Fastway-Misunderstood.mp3,4.71,M
All Fired Up/Fastway-Station.mp3,4.09,M
All Fired Up/Fastway-All Fired Up.mp3,3.76,M
"Bad Bad Girls/Fastway-Big Beat, No Heart.mp3",6.72,M
Bad Bad Girls/Fastway-Death of Me.mp3,6.11,M
Bad Bad Girls/Fastway-Miles Away.mp3,5.75,M
Bad Bad Girls/Fastway-Bad Bad Girls.mp3,5.67,M
Bad Bad Girls/Fastway-Cut Loose.mp3,5.65,M
Bad Bad Girls/Fastway-I've Had Enough.mp3,5.62,M
Bad Bad Girls/Fastway-All Shook Up.mp3,5.57,M
Bad Bad Girls/Fastway-Lucky to Lose.mp3,5.51,M
Bad Bad Girls/Fastway-Body Rock.mp3,5.31,M
Bad Bad Girls/Fastway-She Won't Rock.mp3,5.24,M
Bad Bad Girls/Fastway-No Repair.mp3,5.11,M
Fastway/Fastway-Heft!.mp3,7.76,M
Fastway/Fastway-Far Far from Home.mp3,7.57,M
Fastway/Fastway-Another Day.mp3,6.46,M
Fastway/Fastway-Give It Some Action.mp3,5.77,M
Fastway/Fastway-We Become One.mp3,5.48,M
"Fastway/Fastway-Feel Me, Touch Me (Do Anything You Want).mp3",4.77,M
Fastway/Fastway-Say What You Will.mp3,4.6,M
Fastway/Fastway-You Got Me Runnin'.mp3,4.23,M
Fastway/Fastway-Give It All You Got.mp3,4.16,M
Fastway/Fastway-Easy Living.mp3,3.84,M
Fastway/Fastway-All I Need Is Your Love.mp3,3.51,M
Trick or Treat/Fastway-Heft.mp3,7.32,M
Trick or Treat/Fastway-If You Could See.mp3,6.33,M
Trick or Treat/Fastway-Don't Stop the Fight.mp3,5.98,M
Trick or Treat/Fastway-Stand Up.mp3,5.6,M
Trick or Treat/Fastway-After Midnight.mp3,5.02,M
Trick or Treat/Fastway-Get Tough.mp3,4.82,M
Trick or Treat/Fastway-Hold on the Night.mp3,4.64,M
Trick or Treat/Fastway-Trick or Treat.mp3,3.83,M
Trick or Treat/Fastway-Tear Down the Walls.mp3,2.93,M
Waiting for the Roar/Fastway-The World Waits for You.mp3,8.86,M
Waiting for the Roar/Fastway-Little by Little.mp3,7.98,M
Waiting for the Roar/Fastway-Change.mp3,6.76,M
Waiting for the Roar/Fastway-Kill Me with Your Heart.mp3,6.69,M
Waiting for the Roar/Fastway-Girl.mp3,5.68,M
Waiting for the Roar/Fastway-Move Over.mp3,5.64,M
Waiting for the Roar/Fastway-Tired of Your Love.mp3,5.54,M
Waiting for the Roar/Fastway-Waiting for the Roar.mp3,5.52,M
Waiting for the Roar/Fastway-Rock On.mp3,4.64,M
Waiting for the Roar/Fastway-Back Door Man.mp3,4.57,M
