User Type,Username,Date,Text
,DJTY392,2010-11-28T23:09Z,Oh my god! I've been waiting for this for days! =] Will seed once it finishes! Thanks!
,DJTY392,2010-11-28T23:10Z,Seed please! =]
[V],Horrorspoke,2010-11-29T08:59Z,"http://thepiratebay.org/torrent/5995809/Olly_Murs_-_Olly_Murs_%282010%29___320kbps


This one is being seeded lol!"
,karaparrot,2010-11-29T11:48Z,Hopefully this one is also seeding?
[V],Horrorspoke,2010-11-29T16:43Z,Yeah it is now - it wasn't being when i put that message up lol!
