User Type,Username,Date,Text
,pollard19,2010-02-24T02:45Z,alll shit...i just got home and what do i see...12 spice 1 albums...like i said befor your the fucking man NOVA...yo ppl we gotta go har on this one I wanna here JAYO i'm to sexy for my mothfucking low rider!!!
[T],Dailynova,2010-03-10T09:30Z,"i seeded this to 100 GB, on yall now sould go strong"
[T],Sackilla666,2012-03-13T08:09Z,"Yo Dailynova I don't think you have this one homie
http://thepiratebay.se/torrent/7098159/Criminalz_-_Criminal_Activity_(2001)(Spice_1_and_Celly_Cel)

Add that to your collection.  Enjoy."
