User Type,Username,Date,Text
,mirlo3,2010-08-30T11:41Z,"thank you for the wonderful download with 90% of the songs from the movie! i have, however, been trying now for DAYS on end to download your stuff and, for some reason, the download stops at 46.1% and never moves beyond that. would you please be so kind as to double check the issue that may be causing this?? i'm aching for the jessie j song ""who you are"" --- you are the only one who has this. your time and efforts are much appreciated. THANK YOU! :-D"
,turck_132,2010-09-01T04:09Z,"you r much welcomed my man 
and am going to re seed this torrent for you peace out......"
,kate0rama,2010-09-09T05:07Z,plllease seed! I will seed forever if i could just download this album! thank yoU!!!!!
,kamer4udon,2010-09-18T23:39Z,Someone please SEED!!!!
,scott5212,2011-06-17T08:36Z,MĂĄs seeds porfavor este es el nico soundtrack que e podido encontrar bien. Les devolverĂŠ el favor con otros seeds. 
,scott5212,2011-06-17T08:37Z,Please can someone seed. Ill give back the favor with other seeds.
