User Type,Username,Date,Text
,satai,2010-03-06T21:34Z,Deze  torrent is dood gebruik deze  http://file.sh/download/na/navteq-VDO-2009-2010.2791091.html voor volledige download.
,Destralak,2010-03-14T23:22Z,Bedankt/Thanks!
,-BeSerK-,2010-05-24T14:27Z,"ik ben het aan het downloaden maar icoontje in torrent is rood, gaat wel 1.5mb snelheid. Waarom is dat rood ? Hen alles geselecteerd"
,nigedvd,2010-06-22T14:19Z,NO TMC! otherwise works just fine. Many thanks
,jveld,2011-01-02T08:49Z,Thanks ik ga het uit proberen
,jveld,2011-01-02T21:27Z,Hallo heb je ook de alpen 2009 2010?????
,hellybabe,2011-02-01T10:24Z,Misschien een beetje dom maar Winzip pakt alleen BNL file uit! Wat doe ik fout?
,K1ck1,2011-06-05T14:57Z,"Could you write in English please, how do I get this working? Do I have to download the whole cd or can I just pick the map I need ?

Thanks."
,.hmagnee,2011-08-05T20:40Z,burn for every counrty 1 cd .it works for me in my bmw.
,ximxxx,2011-10-29T19:56Z,What is Oost Europa 2009-2010 .iso file name on that torrent?
