User Type,Username,Date,Text
,Rubyee4u,2010-02-21T06:45Z,"Plz tell me if the software is not working....
Or there's ne problem with it....
If it works plz seed..."
,Bjellesau,2010-02-21T21:50Z,"Please seed this.

The other one mentioned above (http://thepiratebay.org/torrent/5113335/Radar_10_-_Homeopathic_Software) is just fake. I have tested it. It was 1.8GB of Zeroes!!!
This one is NOT, so please seed this completely. "
,Rubyee4u,2010-02-22T05:15Z,"Hi!! Bjellesau I always seed it during Ni8...
And evening... So u'll get atleast 1 seed then...."
,ella250,2011-09-23T03:03Z,"Can you seed some more? Hoping to download, thanks..."
