User Type,Username,Date,Text
,Da_ud001,2010-06-04T18:48Z,"Hi buddy,

First of all i must say, good job,

second, when can we expect to see seasons 7-10

Thanks"
,nemus84,2010-09-19T14:05Z,awesome quality thanks for the work!
,S0N1C_zzz,2010-10-12T18:50Z,poor quality :(
[V],meech,2010-10-16T05:14Z,"SONIC_zzz:
Just curious why you say ""poor quality"".  What are you specifically referring to?  I've read many comments on all of the torrents and 99% have been positive regarding the quality.  Maybe it is the player you are using?  Not sure what else I could do to improve these rips (the quality options were turned way up).  But if there is something that can be improved upon, let me know for future rips."
,CakeMonster,2010-11-01T20:08Z,"Mr meech if you could please upload season 2 of atlantis with commentaries it would make my day

There is a big torrent of season 1-5 of “good quality” of atlantis but in that torrent only season 3-5 works and there are no directors commentaries

So please upload atlantis and especially season 2 with commentaries please :)"
,Xlemonad,2011-03-09T14:22Z,"Quality is excellent, thanks a lot for all of your uploads meech!"
,Modibo,2011-03-15T19:47Z,"Hi
I have a problem with the Sound here also
The speaking is not loud at all, I can't hear the talks
Can you help me ?
ThX "
,FavouriteX,2011-10-15T11:03Z,Try use VLC. Thanks uploader. Best quality.
,ATK250R,2012-06-27T17:39Z,"Season 4 & 5 Have duplicate episode 2s. 

""the other side"" Is the 2nd ep in S4 and S5. What is the real EP2?"
