User Type,Username,Date,Text
,hi11i3r,2010-09-12T04:24Z,"Great music, good action, great girls, albeit with big hair. it was the mid-nineties afterall :)"
,misiek.bogiem,2010-10-10T20:47Z,"Jeżeli nadal jesteś w posiadaniu płyt z muzyką, mógłbyś/mogłabyś zamieścić je w formie bezstratnej (FLAC, Monkey's, a w ostateczności PCM wave). Plix?"
,grzyweczka,2011-01-25T08:47Z,"Nie posiadam już płyt, ani perspektyw na ich posiadanie."
,alicedowntherabbithole,2011-06-17T00:25Z,Thank you very much
,grzyweczka,2011-08-08T20:20Z,You welcome..:)
,desertshaman,2011-12-30T19:47Z,Great torrent. Thank you for pulling it and posting it. Gracias!
