User Type,Username,Date,Text
[V],nos1977,2010-01-29T04:19Z,HOT HOT HOT CD!!!
,Eclipse69,2010-01-29T05:29Z,word... nice release NOS!
[V],nos1977,2010-01-29T14:21Z,"@ Housezz... ill re-seed this for the day for you bro... 

Peace & SEED!!!"
,capnpat,2010-02-02T22:48Z,mucho thx nos1977...had an earlier mix of his stuff that didn't include all these tracks so this is kewl. :) appreciated.  seeding now.
,ntong27,2010-02-02T23:07Z,Thanks for the upload
,Craig_123,2010-03-17T23:10Z,Thanks :)
,fritzfreeling,2010-05-11T13:53Z,"Cheers for this one, Nofs stuff is the bomb"
