User Type,Username,Date,Text
,aashu0409,2010-11-26T08:26Z,Now how come axxo started giving screenshots???
,cartman19987,2010-11-26T17:57Z,Thanks for this!
,Lemonzinger,2010-11-30T03:59Z,"@aashu0409  ummm, this is probably not a real aXXo rip... it's not uploaded by aXXo.. AND this uploader has a bunch of recent 'aXXo' uploades in the past few days... suspicious.."
,iden63,2010-11-30T16:40Z,http://torrentfreak.com/fake-axxo-lures-users-to-private-torrent-site-090608/
,1criminal,2010-12-01T10:41Z,Not gonna get a letter from ISP am i mate?
,bonzai37,2010-12-14T01:42Z,Thanks!!! Someone explain to these people how file sharing works!!! This is Axxo's torrent. It's been ULed by Sceneline. 
,bonzai37,2010-12-14T01:44Z,If you're worried about getting a warning letter then go to the cinema and PAY.
,exquseme,2011-06-01T08:00Z,one of the best sci- fi movies. i really love it
