User Type,Username,Date,Text
,WagTheDog,2010-10-19T11:05Z,Thanks!!
,moe883,2010-10-19T11:40Z,"6700 seeders and no comments,, :S
thx a lot EZTV made my day :)"
,lobo345,2010-10-19T14:28Z,"Excellent single file release as usual.
Thanks ez!"
,hypergnome,2010-10-19T14:39Z,"Great as always, thanks eztv."
,pt2d,2010-10-19T18:58Z,thanks eztv
,johnstar,2010-10-19T19:03Z,eztv magic!
,Waves20,2010-10-19T22:30Z,Can someone seed? it wont start downloading...
,iChinese,2010-10-20T00:24Z,Much love for uploading this torrent at this time 
,nhso,2010-10-20T05:55Z,"eztv is THE BEST EVER EVER EVER

we can see that in the HUGE number of seeders compared to the other files of the same episode.

to waves20: what do you mean by can someone seed? 5500 seeders are not enough?"
,capo_soprano2,2010-10-21T03:55Z,awesome! 
,lithiuhm,2010-10-28T16:43Z,"awesome eztv !!
When will ya release next episode, E06 ?

thx, eztv real sh*t !"
,screamthecore,2010-11-08T16:18Z,"I mean, this was funny, but why is it so insanely popular compared to the other episodes? "
