User Type,Username,Date,Text
,saada245,2009-10-04T21:50Z,This game looks like a game for only black people.
,dubman252,2009-10-05T05:57Z,"us non black people can enjoy this too, saada . anyways im downloading this for the black cheerleaders in the game doing their ghetto dance during the  halftime show. "
,brian0423,2009-10-06T23:49Z,lol thats what madden is too lol
,Vader--,2009-10-07T16:57Z,pathetic....all 3 of you!!!
,yungfury,2009-10-10T17:54Z,"don't know yet, it's coming sooo slow! I'll let you know if its just you or if it's the game!"
