User Type,Username,Date,Text
,Nigsy,2010-08-11T10:29Z,"Bag of shit only 1,2 the rest are empty files."
[T],superDUQA,2010-08-11T13:51Z,"@ Nigsy there are no empty files , if you have any  other problems please ask nicely and i will help you with your problem.
"
,joethehoe,2010-08-15T17:57Z,are they all unrated?
,ttaisii,2010-10-27T13:10Z,"Woow, tnx. :)"
,pearljamaussie,2010-11-25T04:59Z,"Im with Nigsy, i just downloaded American Pie 3 and cant get it to play with vlc and cant get convertx to convert it and i never have problems with legit files so this is garbage. Maybe 1 and 2 are fine like Nigsy said but im pretty sure we're bot right on this one. ill get it off someone else then."
