User Type,Username,Date,Text
,ultamanl,2010-11-22T22:27Z,"Just downloaded, and it seems it doesnt work on my ps3.. which its weird as normally 3Li movies works on consoles... :("
,oakmario,2010-11-27T21:33Z,"Same here. Plays perfectly fine on my PC (in fact, it looks great!), but it will not play on my PS3. It shows as ""corrupted data"" in the list under Video.

I'm not sure what's wrong with it as I was trying to find conversion software (free) that would make it compatible with the PS3 without losing too much quality, but couldn't find anything. Tried Red Kawa PS3 Video 9 but it couldn't even open the file.

Tried 4Media PS3 Converter 6 and it seems like it may do the job but the trial only converts 3 minutes and quits (unless you pay the $30 or so for it).

Looked at Handbrake and it seems to read the file but I don't know if it will convert it properly. Started the encoding process and it says it will take 7 hours!!! Forget that noise...going to download a lower quality file from TPB that hopefully works.

I hate this damn file incompatibility crap."
,LanMax,2010-12-05T23:18Z,Thanks. Great HD!
,est1987,2010-12-06T16:38Z,Thanks for the upload!
,[SeriousDesert],2011-01-09T20:45Z,"good torrent, i see no problems with it on a 22"" LCD

A:10
V:10"
,Galactigus,2011-01-31T23:59Z,"A:10|V:10
Pros: Best rip in the past month. Fast download, Small file size, great resolution I hate the really wide rips but this take up almost my entire screen, sound is also amazing. The movie is great best movie I've seen in a while and believe me I've seen a lot this is funny as F**k.
Con: 0 "
,bullish1644,2011-03-24T21:14Z,"i got an infringment letter from downloading this particulate torrent.  Knight And Day 2010 BRRip 720p H264-3Li
this torrent is being tracked by the copyright owners."
,bullish1644,2011-03-24T21:15Z,"i got an infringment letter from downloading this particulate torrent.  Knight And Day 2010 BRRip 720p H264-3Li
this torrent is being tracked by the copyright owners.
good quality, ps3 compatable."
,bullish1644,2011-03-24T21:15Z,"i got an infringment letter from downloading this particulate torrent.  Knight And Day 2010 BRRip 720p H264-3Li
this torrent is being tracked by the copyright owners.
good quality"
,bullish1644,2011-03-24T21:16Z,"i got an infringment letter from downloading this particulate torrent.  Knight And Day 2010 BRRip 720p H264-3Li
this torrent is being tracked by the copyright owners.
good quality, audio/video good"
,greghusk09,2011-05-31T00:27Z,i am a newb at this how do you get these movies i download to dvd+r
,scrpzking,2011-06-03T02:36Z,"V 10
A 10"
