User Type,Username,Date,Text
,piracy-is-communism,2010-04-25T17:25Z,my first torrent shiznizz bitchez
,piracy-is-communism,2010-04-25T18:27Z,"The fomat is MP4 btw, so it works on your ipod."
,piracy-is-communism,2010-04-27T14:59Z,"no feedback?

the silent, consents."
,eSSduBBz,2010-04-30T02:34Z,"Wuz looking for JMT Amber Probe EP, but this works too! Cheers my doode."
,piracy-is-communism,2010-05-08T05:51Z,"nice bruh! i think i actually have that somewhere. if u havent found it yet, perhaps i could look into it."
