User Type,Username,Date,Text
,NSRacer,2010-10-21T13:51Z,can someone post the frickin password. fuck you with your stupid survey...asshole
,smith231,2010-10-21T14:47Z,"damn it, for the first time, Skidrow has failed to deliver a proper package (the Skidrow version, now deleted, was exactly the same as this torrent)"
,jjjhonson,2010-10-21T21:57Z,"don't make us jump thru hoops 

password is steampunk"
,smith231,2010-10-24T23:09Z,"if the crack isnt in this release, download: http://www#easy-share#com/1912695914/RailWorks.2.Crack.Only-SKIDROW.rar

replace # with ."
,Acrose12,2010-12-29T17:05Z,Smith 231..Your Link is broken ive tried on 6 different browsers and 3 different computers and yes for the first time ever SKIDROW has failed to create a good package :(
,Cruzu,2011-02-11T17:39Z,Why in spanish! Anyway where is the crack?!
