User Type,Username,Date,Text
,Xo66um,2010-02-08T22:55Z,"what are these .par2 files? what do i do with them? i used quickpar to extract something, but i didnt see any changes in the movie file. how do i get subtitles?"
,Xo66um,2010-02-15T23:09Z,"Ok, i thought someone would answer me, but noone did. so, for everyone who is willing to download this release:
-there are no english subtitles attached, only some .par2 files suitable only for deletion.
But as long as there is google- there is a solution and after a dozen of tries:
HERE ARE THE SUBTITLES FOR THIS RELEASE

http://subscene.com/english/Ponyo-on-the-Cliff-by-the-Sea-Gake-no-ue-no-Ponyo/subtitle-240067.aspx"
,Xo66um,2010-02-15T23:11Z,Just rename it like the video file and voilĂ !
,Xo66um,2010-02-15T23:13Z,"Oh, by the way, the quality is excellent:
V=10
A=10"
,Xo66um,2010-06-10T14:32Z,"Actually, when i wrote about quality i just browsed through te film, and when i watched it, i turned out japanese sound is goes mute in several moments."
