User Type,Username,Date,Text
,Piraterealm,2010-04-29T21:01Z,"This is PAL, so NOT NTSC

I found this info in the .NFO included in the torrent"
,jbscythe,2010-10-15T03:31Z,anybody out there looking for Star Wars - Force Commander pc game? here it is full and no install or crack needed. just extract and play. http://thepiratebay.org/torrent/5887563/Star_Wars_-_Force_Commander.rar
,auszombie,2011-01-04T15:59Z,"Thanks for the great release!
It also works with HDL."
,afrokid96,2012-03-10T18:28Z,currently downloading. thanks in advance. :)
,ytq,2012-05-31T18:43Z,"No this NTSC version.

It does not run on PAL."
