User Type,Username,Date,Text
[V],furtaperas,2010-07-28T20:08Z,"Exclusiva: Sara Carbonero, estilo y belleza en sus id?licas vacaciones junto a ?ker Casillas
 Pen?lope Cruz con ropa c?moda y holgada, primeros d?as de casada en Hawai con Javier Bardem
 Borja Thyssen cumple treinta a?os a punto de ser padre por segunda vez: 'Mi madre me ha felicitado. Me ha llamado por tel?fono'
 Mar?a Jos? Su?rez: 'Con Sebasti?n he recuperado la ilusi?n'
 Entrevista con Luis Medina, aristocrata y empresario: 'La princesa Magdalena es una chica divertida, con gracia y personalidad' "
