User Type,Username,Date,Text
[V],nos1977,2010-09-23T16:16Z,"The Appeal: Georgia's Most Wanted is the upcoming third studio album by American 
rapper Gucci Mane. The album will be released September 28, 2010 on 1017 Brick Squad Records,
Warner Bros. Records and Asylum Records. The album will follow-up last year's The State vs. Radric Davis, 
released just after the Atlanta rapper's incarceration.

---

For Promotional Use Only... Remember to support the artists...
Anyway enjoy the Music,it is free!!!!"
,pizzahut123,2010-09-23T20:21Z,"I LOVE  YOU MAN GOD BLESS U =)

I LOVE THE GUCCI MANE!!!!!!!!!!!!!"
,Alpinstng,2010-09-26T04:20Z,Thanks!!
,Danejris,2010-09-28T10:27Z,"Always can rely on you guys. Thanks so much. Dont forget guys to buy his shit too bcoz hes not with ""the others"" so he needs all the money he can get"
,NachoSupreme,2010-09-29T22:13Z,"""Just to show off I put my wrist out the window"" "
,petonebronx,2010-12-01T06:24Z,"SIEGest to the FKN HEILest

MONGREL MOB
PETONE

SHAUNFKNDOG"
,bot337,2011-02-09T20:57Z,"good

thanks"
,halieymarieh,2011-03-29T02:30Z,Do you take requests ?
,Mr_Duck,2012-01-06T08:12Z,LOL Danejris is referring to the Illuminati
