User Type,Username,Date,Text
,lazyazz,2010-02-28T21:29Z,"Not sure if it's just me but there are some issues with artifacting during playback.  Other 1080p movies play fine, though I don't have any others that are IMAX versions.  

Would be glad to hear back from others whether it's the release or just me that has these issues."
,lazyazz,2010-03-05T08:09Z,"Retract my previous comment about the artifacting.  For some reason, MPC actually blurs at times while MP12 doesn't.  Odd."
,leomahesh,2010-03-12T12:47Z,"Hey video is untouched right (bd-remux??)?????

What was the original size of BD ??

BTW ,thanks 4 the up :)"
,filmmaker007,2010-04-25T08:35Z,"looking forward to the huge size, thanks !"
[V],Cyberpiraten,2010-05-06T21:40Z,"wow.. 17GB ? :s 
What's the difference between IMAX and a regular Blu-ray rip ? "
,kritigr,2010-05-15T13:08Z,the subs is hardcode?
[V],Cyberpiraten,2010-05-24T06:24Z,IMAX is the same as a Cinema Movie :) 
,stixdogg,2010-06-04T08:47Z,"Thanks!  I can't help but wonder if this was closer to 12 GB if i could even tell the difference.  :D ....  @lazyazz .. if you look under the options for MPC I have got a lot better performance (slow pc causing trouble?) if i set it (under options > playback > output) to ""use texture surfaces and render in 3D"" ...  my old computer had trouble keeping up w/ 1080p movies due to my CPU.. when you set it this way it allows your GPU to do more of the work... or something lol"
,sudhan,2010-06-06T20:14Z,Does IMAX means 3D!
,sudhan,2010-06-20T04:14Z,Seed Please!
,Xaboteur,2010-07-25T23:41Z,"Does this one have black bars on top and bottom of screen?

Can someone upload screen pics?"
,Ibuxx,2010-08-12T15:49Z,what are these PAR2 files??
,elcash,2010-08-31T01:28Z,"Finally downloaded, but no subs are available in the .mkv, and no subs among the files. Are there no english subs for this movie, despite the info? Or am I missing something?"
,ayush95,2010-09-02T19:25Z,taking too much time about 4 days for 512kbps users..
,leafs1399,2011-02-09T07:17Z,"Amazing quality! I'm stunned.
I´ve downloaded many 1080p movies and this is the one I choose when my friends wanna see what HD is all about. If someone knows any other movie as good as this one please let me know. Thanks for ul!"
,Blade220,2011-04-23T15:52Z,"No Screenshot of the pictire is uploaded...
Could anybody upload the screenshot if they have downloaded it...pls"
,thepirate95,2011-04-25T04:02Z,"really good quality but the movie gets a little bit stucked in a part can this issue be prevented ?
thanks for the contribution :)"
,goku786,2011-05-07T18:48Z,"I have many movies which you upload like dark knight ,inception etd....... and your uploads ...awesome .....but please keep sample file also... I feel sample file is a trailer .......thank you very much for your upload"
,kendrypire,2011-06-28T01:32Z,"I have one question, why the uploader ""sadbawang"" dont upload the BlueRay Untoched.. of 37.5Gb, becouse when they compressed the Full HD quality to 17.82Gb, the quality its lose. And we dont see really HD."
,goku786,2011-06-28T06:46Z,please seed ................I commented on this before DOWNLOADING..because I trust the upload.... so please seed  and help me to download ....I will seed after downloading.......
,goku786,2011-06-30T10:55Z,please come on seed .............my average speed is 19kB/s...it should be 100kB/s
,goku786,2011-06-30T11:00Z,I'll seed after I download...........please seed
,jack0007,2011-07-11T06:24Z,i am currently downloading at 100 kb/s and uploading at 80 kb/s!! C'MON PEOPLE SEED!!!!
,jack0007,2011-07-11T06:25Z,"And I will seed @ 100 kb/s when im done for 20 GB
because I'm such a nice person :)"
,tukuu,2011-07-29T00:11Z,"Big big thanks to sadbawang for uploading this, and for those who seeded. Everyone should definitely watch this on TV or video projector to really see the difference between this and those 8Gb bluray rips. I will seed this til 1:1"
,alphaecho,2011-08-21T10:08Z,"10GB with full 1080p would make it epic. eg. Avatar 1080p for reference if anyone has the a proper 16:9 copy not some run off the mill 800p version.

Does anyone know if this is 1080p or 800p+280p worth of black lines? I'm a bit suspicious since I haven't come across one transformers movie in constant 16:9 ratio yet."
,kimcaine100,2011-09-06T19:06Z,seed plz :)
,soberstud1120,2011-09-24T00:44Z,"When r u gonna upload a blu-ray of transformers: Dark of the Moon
"
,gorang,2011-09-28T22:49Z,"alphaecho
Its are 800p+280p black bars one whis, also the quality was lite strange, with much color bandings and artefact, where are better copies! and also in smaller sitze with better qualitys i download whis coz of the IMAX and seams not to be IMAX

Unsure if the pic problems is coz my codec, but bout using MPC HC and Splach pro movie is looking the same"
