User Type,Username,Date,Text
,saurabh1992,2010-11-09T09:06Z,somebody comment on quality!!!
,sameersbn,2010-11-09T20:53Z,dude! how did you manage to get a 21 minute video in 65.7 MB and this great quality. Please share.
[V],jainmehul,2010-11-13T11:10Z,"Thanks... 
keep em cumin"
,SterLuMan,2010-11-17T12:06Z,"Awesome dude... If you're planing to keep uploading BoB rips, you have my support... Just make sure you do Family Guy... =) "
,solly69er,2011-01-01T16:51Z,Dude could ya plz upload the first few epz of season 6 love the compression saves me a load on bandwidth thnx. . .
