Filename,Size,Unit
The Rush Limbaugh Show Hr 1 09-Sep-10 CF.mp3,35.64,M
The Rush Limbaugh Show Hr 2 09-Sep-10 CF.mp3,35.62,M
The Rush Limbaugh Show Hr 3 09-Sep-10 CF.mp3,33.92,M
"Time Magazine_ Listen Up, Dummies! O.mp3",6.6,M
New Cartel Threat_ U.S. Energy Suppl.mp3,5.29,M
Same Old Game  9.8.10.mp3,5.12,M
What Mayor Daley Leaves Behind   9.8.mp3,4.98,M
Rahm's Chicago Way    9.8.10.mp3,4.45,M
Check's In The Mail  9.8.10.mp3,3.74,M
Rush Limbaugh Morning Update 09-Sep-10.mp3,2.54,M
Torrent downloaded from Demonoid.com.txt,47,B
