User Type,Username,Date,Text
,pasetes,2009-11-12T20:33Z,Another RAR SHIT !
[T],l_c_f_c,2009-11-12T22:54Z,pasetes: You really are pathetic...
,olis11,2009-11-13T12:16Z,tusen tack.keep it up.
,olis11,2009-11-13T12:19Z,Tackar även för annat som jag glömt att tacka för. Undrar även om du kan få tag på Night at the museum 2 som full dvd med både engelskt och svenskt tal. Skulle då jubla.
[T],l_c_f_c,2009-11-13T13:32Z,"olis11: https://thepiratebay.org/torrent/5160568/Night.At.The.Museum.Battle.Of.The.Smithsonian.2009.DK.NO.FI.SE.P

Jag tror den är tvåan?"
,olis11,2009-11-14T19:15Z,Ja det är det.Tusen tack.
,WoWx3,2009-11-20T14:44Z,"pasetes - Såna som du borde få en egen värld, endast för släktet puckioter. Såna där vadderade stolpar och tvinga er att använda mupp hjälmar :D

l_c_f_c - Tack! "
,WoWx3,2009-11-20T14:46Z,Vänta vänta vänta nu.... när jag nu ser mig omkring så förstår jag att jag är i puckioternas värld. Hur fan kom jag hit? whoa hjäääälp ET phone home :}
,WoWx3,2009-11-20T14:47Z,"l_c_f_c - Ännu ett tack! ^^
Speciellt tack för kvalitén!"
,WoWx3,2009-11-20T14:47Z,+1
,sublimemaco,2009-12-02T02:48Z,va e det f?r tr?ngsynta m?nnsikor som h?nger p? piratebay. Alla kan inte allt... Mer synd om er som h?nar n?gon som inte kan...
,xgoxdiexxx,2009-12-14T03:32Z,does this have the extras?
,devil556,2009-12-29T17:47Z,Was there any extras like the commentary track on this copy?
,kpg1970,2010-01-22T10:04Z,"anyone else have an issue with this having ""squares"" all over the screen? I've burnt it twice now, it plays, it is black and white and is all pixelated with squares..help?"
