User Type,Username,Date,Text
,wimjr,2010-06-06T21:45Z,Bedankt voor weer een mooie verzameling strips!
,GrotePier,2010-06-06T22:04Z,Thanx!!!
,mhvu,2010-06-06T22:44Z,"wow rokie, wat een hoeveelheid!
kan iemand overigens zeggen hoe je op de nieuwsgroepen de uploads van hagenees vindt. Wil, nu micro11 gestopt lijkt, ook uploads van hagenees van nieuwsgroepen zelf gaan downloaden. Vooral naamgeving van Hagenees is een genot: alle files zo helder genoemd!"
,rokiestokie,2010-06-06T23:42Z,http://www.binsearch.info/?server=2&max=250&g=alt.binaries.pictures.comic-strips&a=Don%27t%40think.so+%28Haags+Neesje%29
,SjaakZwart,2010-06-06T23:54Z,"Bedankt, Stokie!!"
,borrel46,2010-06-08T15:49Z,"Inmiddels heb ik al aardige beeldscherm-ogen gekregen van al dat moois. Dank je wel.
Mag ik ook een heel speciaal verzoekje doen?"
