User Type,Username,Date,Text
,Lion7718,2010-06-18T02:58Z,"Easter Egg: A secret performance of ""Bring Me to Life"" in Las Vegas, Nevada can be found on the DVD's main menu by moving the cursor to the largest thorn on the left-hand side of the screen. The band symbol then becomes visible. When selected, this will take you to the hidden footage."
,punisher_latin,2010-06-18T07:26Z,Lion7718: by all means friend!
,pxndxcarlos,2010-08-01T19:39Z,THNKS..MAN GOOD JOB .. I LOVE THIS BAND... SEED MORE....
,punisher_latin,2010-08-03T20:20Z,pxndxcarlos thanks to you !!!! 
,pxndxcarlos,2010-08-25T19:39Z,"Hey man.. please... suba el concierto de la PANDA(pxndx).. SINFONIA SOLEDAD.. FULL DVD.. CREO ..iso no se.. DVD5 files.. por favor chiko suba... y divulgue.. and seed
GRACIAS... VIVA LATIN AMERICA...
BRAZIL..."
,pxndxcarlos,2010-08-25T19:41Z,"PLEASE MAN.. SUBA EL CONCIERTO ""SINFONIA SOLEDAD""......DE PANDA... GRACIAS.."
