User Type,Username,Date,Text
,Disturbed[]ne,2010-12-03T08:21Z,113 seeds and no comments? 
,phoenixstar101,2011-01-03T14:26Z,ikr Disturbed[]ne? i'm suspicious.....
,killthrill88,2011-01-20T07:41Z,I'm gonna try dl and see...
,gallett,2011-03-31T03:14Z,Is Candlejack hidden in this torr
,kumquats,2011-05-16T22:25Z,you said candlejack? why did you say th
,klankpulse,2011-06-05T01:33Z,"seriously, what the fuck is up with the candlej"
,kodialask,2011-06-27T04:15Z,who the hell is this candleja
,SadDino,2011-08-02T07:54Z,"@Klankpulse & Kodialask
You fags got it wrong, you can't use candlejack to end the sentence bec"
,CVezery,2011-08-28T02:11Z,who the fuck is this candlejack fag? fucking newfa-
,p00nh0und,2011-12-08T09:00Z,"You guys this torrent is pretty great. I've downloaded at least a few portions of it and it seems to be on the up and up. As for this Candlejack fellow you speak of, I have no idea what you are talking about. I'm just trying to figure out what keeps stopping you in mid- sente"
,adidlucu,2012-03-29T03:08Z,thank you so much! :)
,VaderforprezAZ09,2012-05-27T23:21Z,These comments... This may be the best thing I've seen since people trying to pirate Team Fortress 2.
