User Type,Username,Date,Text
[V],secret_myth,2010-01-22T13:42Z,"dont forget to say thanks and keep seeding after download finish.
Will play in any PS3 or Xbox !
Enjoy!

Recommend playing h264 mp4s with KMPlayer or VLC Player.

Play on TV with PS3, XBox (2ch), WD HD TV, or Popcorn Hour."
,TommyBlade2018,2010-01-22T14:10Z,Thank You Secret
,nakedeye,2010-01-22T14:13Z,ty so much secretmyth! i am your die hard fan.. keep goin!! you are insane.. :)
,luftnaveen,2010-01-22T14:24Z,"Secret, my Guru, thanks again and again."
,ryouka19,2010-01-22T14:40Z,thanks alot. :)
,GeorgePBurdell,2010-01-22T15:13Z,Thanks! Any idea what rips are coming up?
,TommyBlade2018,2010-01-22T15:57Z,"I'm Guessin Next Is
Coco Avant Chanel 2009 BDRip H264 AAC-SecretMyth (Kingdom-Release) 
The Box 2009 BDRip H264 AAC-SecretMyth (Kingdom-Release)
The Time Travelers Wife 2009 BRRip H264 AAC-SecretMyth(Kingdom-Release) 

Already Gave Us So Much, Don't Know How Secret Does It
Monster For Real
Keep Killin It Secret, Keep Rippin The Streets"
[V],secret_myth,2010-01-22T18:09Z,"NEXT:
The Book Of Eli 2010 TELESYNC H264 AAC-SecretMyth (Kingdom-Release)"
,jjooeer,2010-01-22T20:07Z,keep it up! you are the man
,31Romulus,2010-01-22T21:14Z,Thank you!
,Mr.Dockz,2010-01-22T23:16Z,Can any body let me know how can i convert mp4 to avi or mpg with 6channels audio................please help me.
,Mr.Dockz,2010-01-22T23:17Z,"Can any body let me know how can i convert mp4 to avi or mpg with 6channels audio................

please help me."
,misiek.bogiem,2010-01-23T00:20Z,"Man, you're my favourite Pirate. Would you consider uploading your example encoding workflow? I have qiute a collection of movies (both DVDs and BRDs) I'd like to compress and store them on a hard drive. It would be great, if you wrote some kind of tutorial for all of us."
,Gangchester,2010-01-23T06:05Z,wow..Ya Tha BeSt M8.. if u can get Superbad..
[V],secret_myth,2010-01-23T08:13Z,"For all ppl who want to know fallow:

The Box is already  out (Russian Blu-ray Disc with russian audio----> no eng audio,only crap LINE)

The Time Travelers Wife no 1080p out :(

Couples Retreat no 1080p out :(

A serious man no 1080p out :(

all u know SM want the best for the best.
So be patience please ...
Cheers! :D"
,VIVALARAZA7,2010-01-23T12:21Z,"
Thanks A Lot Secretmyth."
,mfreak22,2010-01-23T14:57Z,"hey SM, i'm a new fan of yours, but one thing i can from what i've seen - you are gonna be the greatest in the business man!!! "
,Zeroknivez,2010-01-24T05:27Z,Thank u SM :)
,gustavo44,2010-01-26T00:20Z,TNX !!!!!!!!!!!!!!
,jessreyn,2010-02-05T07:37Z,Thanks man!:):):)
,lmathew,2010-02-07T05:40Z,Thank You for your dedication to Quality..  
,venom8343,2010-02-09T04:23Z,It is bad out of sync. Never had this problem with Secret Myth but hey everybody makes mistakes. Your appreciated SM!!
,DinkeyToy,2010-02-15T21:52Z,Badly out of sync indeed. Thanks for the effort though.
,Ruthly,2010-05-16T00:46Z,gracias desde Chile
,bujashaka,2010-08-10T05:06Z,Audio is not in sync.
,bujashaka,2010-08-10T05:18Z,Audio is not in sync with video. I'm using classic media player.
,InstantStarFan7,2010-09-25T22:53Z,Thank you Secret_Myth! You're my favorite!! Always great uploads! Thank you SO MUCH! Great quality. :)
