User Type,Username,Date,Text
,tMule,2010-04-23T13:26Z,Thank very much! Great job like allways! Nothing new from Howard Tv?
,hummarstra,2010-04-25T09:25Z,Thanks. I've wondering the same thing. Why no more Howard TV?
,hploc,2010-04-26T06:30Z,"Hey wush, I hope you see this or someone passes this on, I had an account in your site but was removed for some readson. I noticed on your twitter you were haveing site problems. Just wondering if your gonna open registration again? Either way,,, thanx for all your hard work. I don't have to listen to my co workers for 5 hours a day :P"
[T],2007prt1,2010-04-28T02:50Z,"WDM - UPs HAVE BEEN BAN EVERYWHERE!

his hate is CraZy !!

WE R STILL THE BEST !!!!!!!! #! Stern UPLOADER'S 

ALL the JUNK like WDM is on TPB......Enjoy."
