User Type,Username,Date,Text
,ashlord,2009-09-25T18:44Z,"Hi ! Love your torrents pure_screens.

Unfortunately this one doesn't seem to have any seeders right now. I really like Mason Moore, she's hot. Stuck at 89,3 %

Someone pls seed this so that ppl can finnish their downloads and continue to seed for everyone else.

Have a nice day/night everyone."
,IceIceTommaY,2009-10-08T05:36Z,we're stuck... we just need one seeder lol
,Tiger_Uppercuts,2009-10-08T22:31Z,I'm at 90.8 % only need 45mb's come on maaaaaan
