User Type,Username,Date,Text
[V],room101bellboy,2010-04-27T22:22Z,"Subtitles in several languages available on the Internet. 

Search for the source: The fall 2006 720p bluray x264-sinners

Rename the subtitle file (.srt) to the same name as the MP4 file and place it in the same folder. The subtitles will then load onto your media player.  "
,baazook,2010-06-29T07:39Z,"Whats with all the negative ratings? 
is A/V hella bad?"
,Illu5S5,2010-10-30T13:12Z,"Awesome speed..

A10
V10

Great story-telling. Don't know why it got so few votes on IMDB??

Anywayz..Thanx a lot uploader !!"
