User Type,Username,Date,Text
,hielo999,2010-01-22T20:37Z,Toilet paper printable?
,sistromo,2010-01-22T21:13Z,Noble? What's noble about it? 
,dummabuffe,2010-01-22T21:13Z,Noble Quran? It was written by the asshole that invented the gay anal sex. What's noble about that?
,hielo999,2010-01-22T21:42Z,"I love the part of islam where they cut off little childrens heads, because their fucked up god told them to.

Complete and utter crazy people.  It really is us versus them.  Better find that out soon and get a few before they get you."
,torrentengr,2010-01-24T04:03Z,"MY DEAR Ones 
Before u give any comments Read THE NOBLE QURAN Scripture then give any comments.I will just give u an example.If u say to Some one """"""EAT THE MEAL with BAD face """" HAVE A MEAL with Smiling Face
MEAL is the same but presentation make a difference.SO Please have a READ OUT Session of THE NOBLE QURAN then Comments."
,hamsata,2010-03-25T01:45Z,DONT SAY ANYTHING ABOUT ISLAM BEFORE U READ THE NOBLE QURAN PLEASE.
