User Type,Username,Date,Text
,michaelkbh,2010-02-07T06:31Z,Pro patch works fine. The version is 8.0.1 Build 08.17.2006.3
,cheatsforme,2010-05-29T06:10Z,"IT IS VIRUS FREE
And it may work on previous version of windows but unfortunately not on W764"
,kaushalmania,2010-06-14T16:22Z,HEUR: TROJAN FOUND.....on Kaspersky....do not download
,Maharaja-Krishna,2010-11-26T08:51Z,Virus Total online scanner states 50% positive for the setup.exe (not the crack) so you'd better forget about this shit right away!!
,babyfabiola,2011-11-24T09:21Z,VIRUS FOUND BY Kaspersky and Avast
[T],EvilCraze,2012-06-12T09:51Z,https://www.virustotal.com/file/081057f9bc1595cfb7f6edf81446aa016b0598b83db945f4bcba31e58f8a3c29/analysis/
