User Type,Username,Date,Text
,INDYMAN99,2010-05-25T00:21Z,Someone help me ima total newbie but i downloaded the torrent but everytime i try to activate the .exe it freezes up any advice? (My computer can handle the game i used to have wow but i lost it please help)
,lucky787,2010-06-27T06:38Z,What are the computer requirements for this?
,diablo411,2010-07-04T21:09Z,Is this EU version?
,StrlekBan,2010-07-11T14:11Z,Can I play other private servers or just Dark Psyon server on this pack? Please reply so that I know will I download this torrent.
,khapya,2010-07-19T22:42Z,ITS it Engb or enus
,khapya,2010-07-19T22:46Z,is it Working?... Fully...Would this game work on MagicWow..And with the 3.3.5a Patch!...And also are the quest helpers Upto date??..Plz tell ..i know iam curious...but 16 gigs of downloading would be frustrating if it dosent work
,elderRPG,2010-08-06T03:36Z,lets seed :P i'm on 33kb/s D:
