User Type,Username,Date,Text
,peek3354,2010-07-13T16:55Z,This is a great movie. Thanks
,Firedog747,2010-07-13T21:13Z,Audio is out of sync.
,LAMBORGHINI38,2010-09-21T08:54Z,"prefer multi audio [including russian]and multi subs including greek,and  HDMA"
[V],phatwarez,2011-01-22T05:33Z,Just watched. Outstanding quality. Thanks
,Oblivion_4,2011-05-24T20:32Z,"A 10
V 10
It was not out of sync for me and the video quality can be described as amazingly good"
,redeyesangel,2011-09-11T11:55Z,"Ik heb een vraag over MKV ik kan deze alleen op men pc afspelen hoe kan ik die branden op een schijfje ofzo? download normaal alleen video TS of AVI, alvast bedankt!"
