User Type,Username,Date,Text
,Speed86,2009-10-12T01:18Z,What is the password?
,mrle264,2009-10-12T23:35Z,why do we need a password to extract the iso and dvd? what's the password?
,ToY-Line,2009-10-13T14:00Z,What is the Password?
,ToY-Line,2009-10-13T14:53Z,"Wow, smart smart smart hehe .. The Password is: 2008-2009 X360SOS.COM"
,ToY-Line,2009-10-13T15:22Z,"Hmm nope, it unrared but said Wrong password after, empty folfer was created =// Anyone?"
,ToY-Line,2009-10-15T01:50Z,"Got RAR unlocker, but it says trial only, so it only cracks the 3 first letters in the password, cant get it to work =//
Downloading another version here on TPB instead .."
,kakan22,2009-10-15T19:51Z,"www.X360SOS.com

Ăr det fungerande passwordet.

www.X360SOS.com

Is the correct password"
