User Type,Username,Date,Text
,psychoticcherry,2009-07-30T04:13Z,"Thanks for the up, had some stuff I've missed out on being from the US."
,socialoutcry69,2010-02-09T09:06Z,"Great upload! Greatest and Blackest band EVER!! your missin Gods Speed on the Devil's Thunder tho. Still great job, I saw thses guys live it blew my fucking mind!"
,Damned.In.Black,2010-05-24T03:42Z,thanks this is my favorite band 
,ronzmicz,2011-04-28T07:29Z,Please SEED
,fredfles,2011-08-02T18:11Z,"awesome dude, brings back memories... "
