User Type,Username,Date,Text
,kukrunk,2010-06-28T04:54Z,Fucking communist movie. Based upon a book by an insane marxist.
,svidrigailovjones,2010-07-03T04:22Z,I could not get the subtitles to work on vlc media player or windows media player.
,bychance,2010-11-10T04:25Z,"If your going to tell us that there's texted language, could you please show us it in
a screen shot, or better still, in a sample. thanks a lot anyway."
,AKD73,2011-02-26T05:51Z,"The subtitles don't work.
If you open them you see they aren't subtitles, but timestamps and then other files are computer codes.
Go here for subs that work, just rename them with the same name of CD1 and CD 2"
,AKD73,2011-02-26T05:51Z,"Oops... forgot link...
http://subscene.com/english/The-Girl-with-the-Dragon-Tattoo/subtitle-389090.aspx"
,kvakaNA,2011-05-16T08:42Z,thenks
