User Type,Username,Date,Text
,boakey,2010-04-25T21:05Z,Batman The Animated Series  ???
,boakey,2010-04-25T21:06Z,This torrent is virus !!!
,boakey,2010-04-25T21:08Z,"Excuse me, torrents are not viruses! Download videos are very interesting! Seampon thanks!"
,boakey,2010-04-25T21:11Z,"Seanpaul best singer, no shampoo"
,boakey,2010-04-25T21:16Z,Thanks for the TV Series!
,Seanalin,2010-04-25T21:32Z,Please Stay & Seed after you Download This!I will do my best to Upload more quality files!
,MSFMX,2010-08-26T07:50Z,"AWESOME!! PLEASE more uploads of these, Can't Find them anywhere! 

Best Batman Series Ever made!!"
,losangelesking,2010-09-28T11:04Z,i have a better quality one with ALL bonus features if anyone wants it.
