User Type,Username,Date,Text
,Yrathir,2009-12-15T02:01Z,It works!
,Yrathir,2009-12-15T02:01Z,Works :)
,miknos,2009-12-15T07:51Z,"Looks like the first stage of Spore.

I checked the trailer os Osmos and look cool :)


Thanks for sharing!"
,sniffer3434,2009-12-15T12:55Z,"Thanks, I was looking for it!!!"
,BoxMac,2010-04-06T04:15Z,"Works perfectly!

Why can't ALL TPB apps be this simple to run ....

Thank you, kind Sir!"
,5orless,2010-04-29T10:07Z,game is awesome and works perfect
,killshay,2010-06-02T09:59Z,Works great on my 10.4.11. Now if only I could figure out how to sync my game saves between all my computers
,gsam101,2010-06-27T10:52Z,"As it's an independent video game, and as it's absolutely AWESOME (and only 10$) you should REALLY buy this game :)"
