User Type,Username,Date,Text
,chewythedog,2009-10-29T17:10Z,"is this the real deal or what?  I have had a lot of bad experiences when there are no comments, no offence to the uploader!"
,chewythedog,2009-11-08T20:01Z,"The sound is MILES out, dammit why is it whenever I download wrestling of TPB it always ends up fooked?"
,Orion_Me,2009-11-21T07:01Z,yeah no offense to the uploader but it doesn't look like the sound is out of sync wid d no. of ppl seeding
,sheenar,2009-12-09T20:15Z,"thankyou very much uploader. i had no problems-
a/v 10/10."
,LAMBORGHINI38,2011-04-01T08:29Z,thanks a lot
