User Type,Username,Date,Text
[V],HMVinyl,2010-01-08T17:31Z,"sweet, thanks!"
,Eternalstream,2010-01-08T17:52Z,"This did not work for me.. it siad that the /main folder missed the IWD files.. 

If anyone could tell me what to do or get me the files id be thankful!"
[V],Mbb15,2010-01-08T17:59Z,"mayby a reinstall from MW2 help, and then copy the cracked files in the main folder then copy all the files from C:\Program Files\Activision\Modern Warfare 2 in C:\Program Files\Steam\steamapps\common\zero gear\Server"
,Eternalstream,2010-01-08T18:09Z,"Can u please just upload those file's so that I can download?

I know alot of people need them so :D"
[V],Mbb15,2010-01-08T18:17Z,the files that you needed are very big (6-7GB) just reinstall the game that is faster
,Eternalstream,2010-01-08T18:34Z,"Ok, are you sure that the files will be there?"
[V],Mbb15,2010-01-08T18:37Z,yes
,njord777,2010-01-08T19:28Z,"I did not get it..Is this the Parovoz verson?
Because i already have it..If not,whats the difference of this verson and the Parovoz?"
,Eternalstream,2010-01-08T20:01Z,"""Error during initialization:
No IWD files found in /main""

Thats the error i get.. I already re-installed it and such"
,yuna27,2010-01-08T20:20Z,"The multiplayer works, but I can't play the special ops coop mode which has to be started with the single player file.

Anyone has a fix for that? I really wanna play in coop with a friend online."
,mrman54,2010-01-08T20:50Z,multiplayer works again!
,cirios83,2010-01-09T11:53Z,Works for me v1.0.172without kick after 2 minutes.Thank you ''Mbb15'' .
,bassam1337,2010-01-09T12:36Z,"Hi all this works only for 2 minuts. When i want to start zero gear via steam it just starts zero gear. can some one help me plz? my xfire= Bassam16
please help :D:DD: thanks all i will seed this for  months "
,jordijor,2010-01-09T12:55Z,"i get lost connect to steam about 2 min

help me plz"
,bassam1337,2010-01-09T13:11Z,"HI jodior. Same problem to me aswell. You must start it from steam zero gear. But when i do that, it launch zero gear.. And not COD MW2 :( need help!"
[T],liluser,2010-01-09T16:43Z,"mw2 updated now to 1.0.174
so need new multiplayer crack.."
[V],Mbb15,2010-01-09T21:53Z,its in progress 1.0.174 crack
[T],liluser,2010-01-14T19:32Z,"mw2 updated now to 1.0.175
so need newer multiplayer crack.. "
,tsimicx,2010-01-14T22:46Z,this doesent work any more
,aliendydo,2010-01-15T14:34Z,Doesn't work anymore... It doesn't find any rooms.
