User Type,Username,Date,Text
[V],Murlok,2009-10-09T03:28Z,Thanks if you help me seeding :) Amd all get it faster.
,amfan56,2009-10-09T04:52Z,"Thanks for the Proper, I'll help out."
[V],Murlok,2009-10-09T05:13Z,amfan56  thanks! O du frånSverige som ligger bäst till hjälp mig seeda nu går jag o lägger mig :)
[V],Murlok,2009-10-09T18:22Z,Thanks for help me seeding I will give you more DVDR if you like :)
,amfan56,2009-10-10T01:14Z,"We'd love more DVDR's... and in NTSC--there aren't enough uploaders who do that here.  Thanks--great quality, BTW!"
[V],Murlok,2009-10-10T17:57Z,You on you own so help each other seed a new dvdr  coming up :)
[V],Murlok,2009-10-10T23:27Z,If problem I reseed for you but for now you better share! you friend and uploader.
