User Type,Username,Date,Text
[T],Askeen.,2010-01-25T13:33Z,"sorry mate, fake :/"
,hammertm,2010-01-25T13:44Z,Sorry Ask3n - but your wrong - it's not a fake and you're a cock! Its only been seeding 15 mins - give it a chance.your supposed o be a Helper not a hinderer!
,hammertm,2010-01-25T18:52Z,yet another cockish statement by simon200. All he seems to do is dis others uploads. Not fake only been seeding for a few hours so he wouldn't know jack!
,hammertm,2010-01-25T18:58Z,simon200 hasn't even uploaded anything - tit!
,hammertm,2010-01-25T22:39Z,simon200 you are really beginning to piss me off! there is no need to dis geniune uploads!
,BobDylansGhost,2010-01-26T04:33Z,Don't bother it's a fake.  Fuckin waste of time! These fakers are sooo lame.
,hammertm,2010-01-26T09:41Z,"BobDylansGhost please explain how you have determined its fake,when it quite cearly isn't, It takes about 24 hours to get properly seeded (Depending on Bandwidth). But you wouldn't know that as like simon200 you haven't uploaded anything!"
