User Type,Username,Date,Text
,prank0007,2010-09-06T08:35Z,"A precious movie...not to be missed
Keep it up friend!!!"
,monty1331,2010-09-06T10:14Z,"thanx a lot bro for uploading it in hq
it is a must watch movie
you rock friend!!!!!!"
,dr_pritam2006,2010-09-06T12:56Z,"dear 3385VKSH [The best uploader of HD Desi Rockers]

KINDLY UPLOAD ""PRINCE OR PERSIA"" IN 720p AROUND 1.6gb

pls consider the karate kid also around 1.5gb whenever its avaliable

the rips by boniin and djvikas are too large for a 2 hour movie

eagrely wating for ur upload 

thanks in advance"
,kuttunni,2010-09-06T13:53Z,"yaa i agree with ""dr_pritam2006""..upload movies
with size less than 1.5gb "
,gauvi149,2010-09-10T10:46Z,kaya print hai yaar
[T],3385VKSH,2010-09-13T20:09Z,coming up Next is Ironman 2 in HD BRip hindi Eng Dual audio 6 channels.............
,starex_adp,2012-01-16T09:30Z,"Guys I'm stuck at 93.6% (1.90 GB) please somebody seed for me..!!

This is my one of the most favorite movie...!! along with minority report, Italian job and Gladiator"
,starex_adp,2012-01-16T18:03Z,Guys from last three days I'm trying to complete last few MB's of this.... still stuck there only...... please help....
