User Type,Username,Date,Text
[V],thethingy,2010-11-30T13:32Z,wonder what the pass rate on this is?
,RubberBullet10,2010-12-03T20:36Z,"Keeps saying that the software ""seems to be counterfeit"" . What should I do ? Im using Daemon Tools pro and everything."
,RubberBullet10,2010-12-03T21:04Z,Scrap that - never turned on the emulators in Daemon Tools. Cheers
,DeepDarkerSpace,2010-12-18T18:52Z,"Really good torrent it actually works.
Thanks Kastrosama."
,jonasnic,2010-12-25T05:22Z,"hmm. im am downloading now, but have any1 testet it yet? the Daemon tool part"
,leachyboy77,2011-01-15T05:20Z,"ANY WINDOWS 7 USERS
this program does not work on Windows 7. this edition is apparently not compatible with this OS"
,shredz10,2011-02-19T00:49Z,"RubberBullet10 which 4 emulators did you leave on to make it work, I'm almost out of disks
I keep getting a warning message saying this might be a copy...
Then it wont play"
,bhaylabhayla,2011-04-24T23:08Z,"""Counterfeit or Virtual Disk"""
,brianboru16,2012-01-30T11:07Z,The new driver theory test is online - http://www.quizglobal.com/ViewQuizByID.aspx?QuizID=161
,brianboru16,2012-01-30T11:08Z,The new driver theory test is online - Quiz Global . COM
,brianboru16,2012-01-30T11:10Z,test
,grakk,2012-04-20T00:13Z,5th Edition (2011) now available here: http://thepiratebay.se/torrent/7184278/Irish_Driver_Theory_Test_5th_Edition_2011_with_Bus__amp_amp__Truck_f
