User Type,Username,Date,Text
,De-Railed,2009-12-12T14:48Z,"Great, absolutly sensless movie! Invite your friends, get some beer and enjoy! Dont use your brain and you have lots of fun."
,ex_pat3,2010-01-01T10:53Z,"Hey Blitz,

You have a very interesting movie collection. Not all to my taste, but at least not clones of the same thing over and over.

Thanks for sharing!"
,MDeity,2010-05-06T02:17Z,"This is, in my opinion, one of the best space/sci-fi movies created.

The movie quality is quite good both audio and video.
"
,lavaboydk,2010-12-06T23:21Z,"i cant find subtitles that fit. please help, this is one of my favourite sci-fi i would really like it in my collection. But w/o sub i cant use it for bedtime movie  :("
,usr098,2011-08-09T00:52Z,Anyone find subtitles for this?
,usr098,2011-08-10T11:58Z,found them http://subscene.com/english/wing-commander/subtitle-405658.aspx
,_Yvy_,2011-11-10T23:17Z,"MDeity you're absolutely right! This is a SF movie as  should be. And Saffron Burrows ;-)  I love her !
Discovered her in the old Stargate Movie just recently.

Thanks Blitzer for UL and thanks 098 for the subs. May the Pilgrims never die !"
