User Type,Username,Date,Text
,djmit,2010-11-15T11:05Z,"XRG is best. After Mohabbatein , one great torrent by XRG. Thanks...."
,djmit,2010-11-15T13:37Z,"XRG ki ek khaas baat hain woh achi movie to download karte hi hain jo badiya quality ki hoti hain, lakin woh apne fans ki demand ka bhi khayal rakte hain.

Sir, XRG can I pls ask you one question ?


Apne ye xRG naam kaise pasand kiya.


If u dont mind, can u pls send your life story to my e-mail address. Main ek book likh raha hoon jisme duniya ke best uploader jaise ki axxo,secret_myth,fxg, ki biography include hain aur woh log kaise eis field main aaye.

Ek dum short main point likh kar bhej do to bhi chalega. My e-mail id is yashpatel09@gmail.com"
,yesbos,2010-11-15T16:32Z,"Nice one djmit,
When u done ur book, pls share it too, its a great idea and super.
Every one have no equal choices, but some have same interest.!
:)"
,siddhart,2010-11-21T18:00Z,"@djmit
how  will u get info about axxo man....???
its really tough  2 tell his  history......
but if u get it plz do  upload a pdf on tpb 
thanx cheers:)"
,siddhart,2010-11-21T18:02Z,"@djmit 
i think xrg got inspired by sm:)"
,scrpzking,2010-11-30T14:35Z,great rip as always V10 A10
,Akumaaa,2010-12-02T06:35Z,thanks team xRG you rock
,vicky89,2010-12-06T01:08Z,seed pls...
,dilbarzani,2010-12-20T18:09Z,"@scrpzking
Downloading it and hope I can be agree with u in quality. have a doubt bcoz og size and AC3 audio. should have been 4.47GB and DTS. "
,kares.m,2011-03-05T22:46Z,Rab ne bana di jodi Blu ray Please!!
,Wazankash,2011-08-26T13:22Z,I made me cry..:C
,suneel007,2012-04-01T22:15Z,"thanks....
please upload SAMAY movie please..."
,hppcrw,2012-06-08T19:15Z,"Malgré la présence d'un fichier .SRT dans ce torrent, les sous-titres anglais sont en fait incrustés sur la vidéo. Donc, ce torrent est à éviter si vous ne voulez que la vidéo originale."
