User Type,Username,Date,Text
,j0e_hill,2010-05-01T15:31Z,"Why are people releasing this as 16:9 aspect?? It is _NOT_ a 16:9 movie, no theatrical release is. Please PLEASE leave it as it IS and release it in its original aspect.

This is SHIT."
[V],neon,2010-05-01T15:40Z,"Well thank you  j0e_hill,why dont you upload something yourself... you fucking douch "
,Voiceman1,2010-05-01T18:35Z,"Great Picture. 

Thanks for your effort."
[V],neon,2010-05-01T19:35Z,thanks kash and voiceman
[T],480v,2010-05-09T08:09Z,"Correct me if I'm wrong but I thought 1.78:1 ""was"" 16/9 aspect ratio. Just checked Amazon and both bluray & DVDs say ""Aspect Ratio: 1.78:1"". 

@ J0e_hill
I feel your pain...it's a shame piratebay doesn't allow comment deletions...

@neonrainbow
Thanks especially for including subs  "
[V],neon,2010-05-10T23:16Z,your welcome 480v
,hellspawn51,2010-06-30T19:30Z,"i gotta ask, is this 480p or 720p?? the source is 1080p but there's no info about this file..."
