User Type,Username,Date,Text
[V],-jonny-,2010-11-25T23:17Z,Better quality than HDTV but the bluray is out in a coupla months
[V],aoloffline,2010-11-26T00:20Z,"Too bad there isn't much interest,the quality is very good.
About the bluray...someone has to ul it ...Deadwood for ex is out and is not here..


There was a problem with the subs and now i can't uplaod them ..i'll post a valid link to them once i find a place to ul.."
[V],aoloffline,2010-11-26T01:16Z,"Can't post link here ,just search for Justified.S01.720p.WEB-DL.DD5.1.h.264-EbP  at allsubs dot org and you'll find english subs"
,petergriffin325,2011-03-25T04:59Z,I got about halfway through downloading and decided to try a few episodes out in VLC and every single one of them crashed. 
