User Type,Username,Date,Text
,xantiamann,2009-11-29T15:57Z,"Hey Guys.
Anyone seeding?????"
,Madsine,2009-11-29T18:18Z,"Har litt datatrøbbel for tiden.
Håper å få det opp så snart som mulig "
,gakris,2009-12-01T13:37Z,Tusen takk for en topp torrent.Forsett å legge ut fine torrenter så skal jeg hjelpe til å seede
,mr_daff,2009-12-02T21:14Z,hallo tusen takk for filmen. det er godt at det er norske som legger ut:):)
,bpedersen,2009-12-06T11:42Z,Hvorfor får jeg kun engelsk tale når jeg har brent denne?? I VLC på PC får jeg valgt norsk språk...... 
,Madsine,2009-12-06T21:45Z,Hei bpedersen. Bruk aoudioknappen på fjernkontrollen for å bytte mellom norsk og engelsk tale. Samme med undertekster.
,stigzy,2009-12-07T15:01Z,Har det samme problemet som bpedersen. Å selvfølgelig så har jeg prøvd å trykke på lyd og tekst knappene på kontrollen:P Kanskje brenne på en annen måte? 
,Erikseff,2009-12-07T22:28Z,"Jeg bruker VLC, der trykket jeg bare på
Audio -> Audio Track -> Track 2.
Så fikk jeg norsk tale. "
