User Type,Username,Date,Text
[T],NiceNorsk,2010-03-23T21:12Z,"Ingen kommentar her heller;)
Er egentlig litt syn.

Men vet du om noe program som ripper srt fra dvd. har prøvd subrip men er det andre?"
,NiceManiac34,2010-03-24T05:30Z,nei dårlig det med kommentarer jo til tross hvor mange som har lastet den ned NiceNorsk..... kan ikke akurat si at det er motiverende til og fortsette med og legge opp ting her NiceNorsk.....mister mere og mere lysta til og legge opp ting her på TPB.....så bare en dag så er det pofffff så er jeg borte i allefall jeg vet ikke hvordan det er med deg jeg NiceNorsk?
[T],NiceNorsk,2010-03-24T07:39Z,"Foreløbig gjør jeg det bare for å finne ut hvor mange downloads jeg får på hver film, og hvor god kvalitet jeg får. Men er ikke hyggelig å legge opp filmer og ikke få noe tilbake."
,ronning75,2010-03-24T08:25Z,"Hei Nicemaniac
Jeg er helt ny her så du må unnskylde meg når jeg spør hva i alleste dager seede er. Jeg har lastet ned mange av dine filmer her inne, og vil gjerne bidra med noe tilbake.  Men aner ikke hva eller hvordan jeg skal gjøre det. kunne du ha forklarte det på en grei måte?"
,alfiboy83,2010-03-24T12:00Z,"hei ronning75 du bare lar det du lastter ned stå der på torrent-programmet ditt...

la det stå der leeeeeeeeenge så hjelper du og nicemaniac34 og seede alså dele filmen med andre og, og da går det fortere for andre og få den ned og da kommer det forhåpentligvis mere seedere,

si du lastter opp på max det du kan med nettett ditt......................................................................................................................................

denne hadde eg tenkt og lastte opp nice, men siden du la den opp nå får eg heller komme med noe anant, hehehe....

mvh: mvh din venn alfiboy83"
,mradsr,2010-03-24T20:35Z,"flott men folk som legger ut filmer med norsk tekst !! knall bra !! setter pris på at du legger ut barne filmer med norsk tale !! eller det vil si at min datter gjør det :-) !!

stå på"
,anma04,2010-03-24T22:19Z,Tusen takk for denne filmen. Gleder meg masse til å se den. :)
,Kjellz82,2010-03-25T21:21Z,"Skal nok seede en stund jeg å. Er ny her også, men tror jeg har fatta d nå :P GLEDER meg til å se denne filmen! Takk NiceManiac34"
,NiceManiac34,2010-03-27T12:53Z,"bare hyggelig folkens....det anbefales og se første filmen før man ser denne for dere som ikke har sett den....
"
,Rep333,2010-03-27T15:18Z,"Canon bra torrent :)
Brukte ca 16 min å laste denne ned meget bra.

Skal seede denne med ca 1mb/s til jeg når minimum et forhold på 1.1.

Meget bra arbeid NiceManiac34.
Keep on rocking :)"
,kvaksinj,2010-03-29T18:11Z,"Takker igjen! 
Keep up the good work NiceManiac :)
Storfornøyd med alt du legger ut."
,NiceManiac34,2010-03-31T18:08Z,Takker for det folkens.... =P
,Kjellz82,2010-04-07T08:43Z,Takk NiceManiac34 !! :)  Helt grei bildekvalitet. Skal nok seede denne en stund.
,Kjellz82,2010-04-11T19:49Z,"Hvordan fikser du undertekster til .AVI ?? Hvilket program å så vidare.. Har forøkt å finne løsninger nette, men alle veier får jeg forklart at jeg må bruke 3-4 forskjellige program, og for å være ærlig så fatter jeg d bare rett å slett ikke.. Det må da finnes 1 enklelt program som kan fikse en .srt til en .avi film?"
,til-henger96,2010-06-28T22:56Z,"hei kan dere seede jeg skal på premieren og lurte på om jeg kunne få sett denne også jeg har ikke fått knotet meg til å få laste denne ned, men jeg skal seede en stund framover hvis jeg får tak i den før den 30. kl 00.00 nå er det nesten ikke noe down speed"
,Eliaspotter,2011-09-08T10:30Z,Bra ! Tusen Takk :D :D :D Jeg elsker at folk legger ut filmer med Norsk tekst !! STÅ PÅ !!
