User Type,Username,Date,Text
[V],verovenlo,2009-12-14T06:43Z,soon Britain?s Got Talent 2010 will start i will upload the whole season also so maybe see u all soon again
,aaa6011,2009-12-14T07:13Z,That's good news - thanks in advance!!!
,delighted,2009-12-14T07:25Z,Thank you VeroVenlo for giving us all a great treat!
,lindadushe,2009-12-14T11:11Z,thank you very much for x and xtra factor uploads :)) when does britain`s got talent start?
,sOmrs,2009-12-14T17:40Z,thanks for your great contribution verovenlo!
,peacejoy,2009-12-14T23:46Z,VeroVenlo Thank you so much for your X Factor and Xtra Factor uploads. I've enjoyed all of the episodes tremendously. Much love and appreciation for your uploads. 
,thesparky1,2009-12-14T23:52Z,Thanks for this whole series now I dont know what to watch in Hungary. Do you have any suggestions?
,pattycica,2009-12-15T07:59Z,"to thesparky1: csillag szuletik/megasztar :P sorry, bad joke :)"
,nedamgol,2009-12-16T12:33Z,"thanx again for everything ;)
can't wait for BGT to start!"
