User Type,Username,Date,Text
[V],djDEVASTATE2009,2009-08-16T04:16Z,"@tall2daworld
you dont piss me off kid you make me laugh with your little mindless comments go back to the porn section knobhead"
[V],djDEVASTATE2009,2009-08-16T04:16Z,its a shame i couldnt meet you id love to rip your head off slowly
[V],djDEVASTATE2009,2009-08-16T04:21Z,and wtf tall2daworld youre the one living in yer moms basement cus u got no friends and have to hide away cus you were fucked up in yer facial features at birth and sorry for pimping yer mom but she ad to pay yer internet bill so u could amuse me with yer banter BIATCH
[V],djDEVASTATE2009,2009-08-16T04:25Z,Y DONT YOU UPLOAD SOMETHING LIKE THEM PORN FILMS OF YOUR MOMMA EARNING MONEY FOR YOUR INTERNET BILL wank2daworld
,Tehmulletman,2009-08-16T04:40Z," someone got bored hahaha
thanks devastate!"
,Tehmulletman,2009-08-16T07:48Z,"cool little game reminds me of half-life heh 
works 100% from what i've played "
[V],djDEVASTATE2009,2009-08-17T00:24Z,"@Tehmulletman
no thank you mate"
,HawkElite,2009-08-17T21:16Z,"thanks again, love these star trek games"
,LordReserei,2009-09-24T09:01Z,"Can't go wrong with djDEVASTATE2009, downloaded a few games/movies from this guy and I've never been disappointed.

Works perfectly, downloaded at an average speed of 176Kb/s in 3hrs or so which I aint complaining since I have an abundant supply of patience. ^.^

All in all, thanks for the great upload! =)"
,GhostGMX,2009-10-09T12:03Z,"I need to know what version this game is....

Everytime I d/l a djDEVESTATE game I cannot patch it because it is a rip. "
,gregcrous,2010-01-27T00:58Z,"don;t let these assholes piss you off ,,,djDEVASTATE2009...."
,dielie,2010-08-28T22:11Z,cool game works perfect after unzipping and seed it to. thanks
,lukiecool123,2011-04-23T11:36Z,hope this works
,Dahmastah,2011-07-08T20:23Z,Stop rage and please seed?
