User Type,Username,Date,Text
,admrilvoro,2010-06-03T05:23Z,how the fuck do i get the installer 
,wytch_lord,2010-06-14T04:05Z,"im goin to download this, ill let yall know if it works"
,minalear,2010-06-17T08:02Z,"This upload sucks, but thanks for the patches and making them separate."
,Eneru112,2010-09-19T00:44Z,I'm just here for the patch. works pretty well.
,BuzzGamer,2010-09-21T05:07Z,"dont work it says "" please insert the correct CD-ROM, select ok and restard application """
,donttryifyoucantdoit,2010-11-23T02:22Z, buzz....-.- did you try switching the crack with the .exe
,oksick,2011-01-24T00:02Z,"Thank's!!!
works greate!!!!
no lags
no bags
no troyans"
,ChainsawMonkey,2011-02-05T02:09Z,I installed it for the patches and crakc but i cant play imperial campaign? i click on it once and it comes p with the usual and as you press play it just goes back to the menu..
,TPBGreece,2012-04-21T22:41Z,"Hey bro can you tell me if the patches that you give us are cracked?

I got the full game from another torrent from The Pirate Bay.It was at version 1.0,i found from the internet version 1.1 cracked and i want to update to 1.3 and finally to 1.5 to play at multiplayer.So all i want are the cracked patches!"
,DrAmoveo,2012-05-30T23:18Z,"use this one for the actual game

http://thepiratebay.se/torrent/3721885/Rome_Total_War

then use the patch from here. works fine"
