Filename,Size,Unit
The Dennis Prager Show Hr 3 02-Aug-10 CF.mp3,33.5,M
The Dennis Prager Show Hr 2 02-Aug-10 CF.mp3,32.85,M
The Dennis Prager Show Hr 1 02-Aug-10 CF.mp3,32.51,M
"Snooki Gate, Jesus Stops Crime, Arizona Immigration Update and More!.mp3",22.28,M
"Not Evil Just Wrong, Boys Should be Boys, Climate Evangelisim and Newt Gingrich.mp3",11.09,M
Voters Want Super-sized Government t.mp3,5.35,M
More Freedom Is a Safe Bet  7.30.10.mp3,5.19,M
Climate Profiteers   7.30.10.mp3,5.11,M
Blow WikiLeaks Off The Internet   7..mp3,4.83,M
Slow Poison   7.30.10.mp3,4.45,M
The Chinese Century_    7.30.10.mp3,3.62,M
Rush Limbaugh Morning Update 02-Aug-10.mp3,1.42,M
