User Type,Username,Date,Text
[V],smbdownload,2010-01-19T02:17Z,"*** PLEASE NOTE - I CAN ONLY SEED OVERNIGHT (USA EASTERN TIME - AFTER MIDNIGHT) - REGARDLESS OF WHAT TIME I UP'D THE TORRENT - PLEASE BE PATIENT - I WILL ALWAYS SEED UNTIL COMPLETED BY 25-50 PEOPLE ***

I have alot of files I would like to share so...I'll seed this one initially until 25-50 people have downloaded - that's it [usually 24 hours], then it's up to you to continue to seed...so, please continue to seed this as long as you can (try to be at least a day or two or longer if possible) to keep these going so as many people as possible can enjoy this great music for a long time to come - thanks and enjoy !

*** PLEASE NOTE - I CAN ONLY SEED OVERNIGHT (USA EASTERN TIME - AFTER MIDNIGHT) - REGARDLESS OF WHAT TIME I UP'D THE TORRENT - PLEASE BE PATIENT - I WILL ALWAYS SEED UNTIL COMPLETED BY 25-50 PEOPLE ***"
,chibby71,2011-04-09T05:12Z,"Sweet brother... you should download Jerry Garcia Acoustic if you have it .... Let it rock!
Thanks for everything you have uploaded for us 
Cheers and thx again maan"
,Gimiesome,2012-05-10T01:08Z,That is some download.....Thanks  Very Nice
