User Type,Username,Date,Text
,AllTheFun,2010-02-26T21:55Z,you're missing Tha Scene Mixtape
,Faabjuh,2010-03-05T08:12Z,"Sorry i forgot to add that in the description, it is IN the Torrent actually"
,short_dood191,2010-04-22T22:56Z,"for some reason tracks 8-11 on ""im not a fan..."" wont go into itunes"
,Faabjuh,2010-05-16T17:36Z,"I've got 'em all in my iTunes, so I think it has something to do with your pc m8."
,Cody_Watson,2010-06-24T19:01Z,"Ah, thank you very much, will seed for 5-6 days, on and off.  Much appreicated"
