User Type,Username,Date,Text
[T],NLUPPER,2010-04-11T14:18Z,IMDB TOPPER:    http://www.imdb.com/title/tt0866442/
,SAABrules,2010-04-11T16:38Z,"Hi, does Nordic subs mean all 4 languages ? (Norwegian, Swedish, Dannish, Finland) "
,de_spijker,2010-04-11T18:09Z,bedankt.
,hipermark,2010-04-22T15:27Z,thanks for croatian sub
,famemon78,2010-08-19T18:29Z,WOOOW this is brilliant DVD-R's for this great series! 10/10
[T],Little_Devil,2012-04-09T09:36Z,"Thank you for this one! 
and for all those that wonder yes its nordic subs in this torrent!"
