User Type,Username,Date,Text
[T],ctang,2010-06-02T00:05Z,"Upload List: Layer Cake, Boondock Saints, Batman Begins, The Waiting, The Green Mile ..........."
[T],mikemelo1369,2010-06-02T08:14Z,@Tater44 - I will also do the same. I just am newly found to your torrents. Didn't know you were around:D Love your uploads so far. My g/f is a big fan of horror so she loves your uploads.
,hyster13,2010-06-02T08:48Z,"You guys are excellent. And thanks ctang. Another request of mine has been granted :)

Keep up the great work!!!"
,hyster13,2010-06-02T08:49Z,"I also know my requests for movies are coming but I have another request.

Team America: World Police

Thanks :)"
[T],ctang,2010-06-02T22:51Z,@hyster13: your welcome bud!!! unfortunately i dont have team america...i wish i would have got it from my friend from school but i didnt sorry
,hyster13,2010-06-03T06:56Z,"Hey man, that's alright. Just keep up the great uploads, my man :)"
,maxicastro,2011-01-23T14:36Z,"Hello and thanks :)

Could anyone seed, please? No seeders anymore :("
