User Type,Username,Date,Text
,georgem1,2009-11-06T12:01Z,Thank you Sheila6
,fadzil,2010-05-21T08:40Z,can someone seed pls..
,redched,2010-09-04T00:34Z,"There's something wrong with volume 6. Part 4 (the pelvis) skips after a minute and then goes on to part 3 (the reproductive system). Also there's a bit missing at the end of part 2 (the abdomen).
Volumes 1-5 are fine though, thanks for the upload!!"
,blinkomatic,2010-09-15T01:07Z,miss your excellent posts Sheila6 - your the best !
,JustDownloader,2011-02-26T07:30Z,"Sheila you truly RULE, always when something is spare and I need it you have uploaded that something. I didn't learn your name by trying but by seeing it after hours of searching the web each time."
,Lezduur,2011-09-17T17:53Z,"a bit missing from dvd 1 [upper limb], towards the end...and the sound is off synced with the video almost throughout..
in between describing extensor pollicus brevis and longus it breaks off into the radial nerve. all the short muscles of the hand are missing."
,ferkov,2011-11-28T10:52Z,"I'm downloading this with 5,3Mb/s. You people rock!!"
,firaskalam,2012-05-20T13:16Z,"actaully i miss abit diffenrent part ,tape 1 5 6 radial eye and urinary.."
