User Type,Username,Date,Text
,OSAMA700,2010-08-19T04:09Z,"Thank you very very very much (raymondhome)

The best thing you did was you took a snapshot screen by the Windows Media Player Classic ,  multiple images.

Please get all the threads the next multi-photos .."
,arunlatvia,2010-08-19T05:14Z,hey raymond... thx for your awesome works. could u pls upload Someone behind you
,arunlatvia,2010-08-19T05:17Z,http://www.imdb.com/title/tt1213856/
,heavydiamond,2010-08-19T08:12Z,anychance of a film called frozen thank you
,Metatron3,2011-07-18T19:27Z,Thanks! So glad there are people who post more obscure movies. I have a huge list here to look for. :)
,johnsontiffany83,2011-08-12T11:54Z,Thank you for this!
