User Type,Username,Date,Text
,JoiresWay-II,2009-08-28T03:40Z,Hey i think you need to add dem-o-noid as your default tracker.
[V],bubanee,2009-08-28T08:43Z,can i use it without joining?
[V],bubanee,2009-08-28T08:48Z,"No it doesn't work no rego..

http://www.genesis-sp.org:2710/announce
http://tracker.openbittorrent.com/announce

These two do.."
,JoiresWay-II,2009-08-28T10:12Z,u jus need to register in that site and upld it there. can i invite you...??
[V],bubanee,2009-08-29T04:54Z,"thanks anyway joiresWay.. :)
i just read your message now..
i'm rego there now"
