User Type,Username,Date,Text
,rbourke1,2010-07-28T01:57Z,"Could You Kindly Seed This File Called 

Bushwackers Mix 

Thanks "
,rbourke1,2010-12-09T13:10Z,Change From Mp3 To M4a Ipod Format Thanks?
,minkeymonkeys,2011-03-12T13:22Z,"""Change From Mp3 To M4a Ipod Format Thanks?""

How about you do it your fucking self. While you're at it, learn to be grateful.

Thanks for this Uploader."
,gaaraisgod,2011-04-19T07:17Z,"Nah, don't learn to be grateful just because. Demand more xD; Greed is Good ^_^"
,TheOneWithThePlan,2012-03-14T05:38Z,notice how bourke never said the magic word either :O! shocking this day and age...NOT :P TYVM piratetorrent :D Discography uploaders are always appreciated :)
