User Type,Username,Date,Text
,RedHatcc,2010-06-04T03:42Z,"Thank you seeders, this makes uploading and making torrents like this worth my time. I will continue to package and upload on a regular basis."
,FEARLESS1964,2010-06-06T05:15Z,where are the commview drivers?
[V],Cyberpiraten,2010-06-09T05:09Z,"looks awesome, could you be able to upload some FUD binders/crypt's ? Gonna hack my sister (6) 
Seeding now."
,svenommel,2010-06-11T14:58Z,"the info.txt only contained rev 687
Sat Sep 08 14:15:00 BST 2007


where are the tutorials?"
,E2DUBS,2010-06-15T04:18Z,@RedHatcc Thanks for the ul!
[T],RedHatcc,2010-06-23T18:49Z,"@E2 thanks man saw you on the site :P

@Seeders - Thank you tons!"
,Trialv,2010-06-29T13:56Z,Great u'load. was wondering if there is any software to boost wireless signal strength?? if so please let me....
,thesoul1987,2010-07-05T12:15Z,thanx man seed seed pls
,beastboy1,2010-07-07T10:20Z,itz jst nt workin.......after extraction.....nothn happens wen i click on da exe filezz......!!!
[T],RedHatcc,2010-07-14T02:15Z,@trialv - its called a cantenna :D some members on our forums can make them from scratch. Its basically and external wireless card + pringles can with tin foil in it. You point it in the direction you are getting your WiFi from and boom beautiful WiFi reception.
,saoula93,2010-07-22T18:29Z,"gck,n "
,piracyrulz,2010-08-22T14:53Z,is this thing working???????
,fhaffar,2010-08-30T18:43Z,"@ RedHatcc
Thnx maan, after one hour trial it really does work I was able to crack my neighbour's Netgear using Win XP on my laptop with Atheros wifi card....WPA is much more difficult....still working on it"
,yelloo,2010-09-15T12:42Z,Thanks RedHatcc.
,redtrex,2010-09-28T01:02Z,"hi RedHatcc..can you please post the words or the commands that you've been used in cracking those wireless""command prompt""...thank you so much!!! :)"
,sneaker72,2010-10-27T19:29Z,"Does this work on Windows 7?
Funkar det h채r till windows 7?"
,svenvv,2010-11-28T18:31Z,"@sneaker72
2 words:
Get linux!

backtrack4 will get you much more ;)"
,crac187,2010-12-01T18:34Z,"i hope it helps me. i wanna steal a signal, because i dont have fucking money to pay a service. 
well, i used the wifiway 1.0 but i cannot understand it.
thank you for your upload, redhatcc. 
i,ve score..."
,poisonnikk,2010-12-14T17:37Z,oh! there you go yifi thanks...
,DarkLord93bobo,2011-01-09T04:15Z,thank you so much man!!! great upload!!!
,godblessshare,2011-01-16T00:54Z,"does this work on vista 32 and or win 7 64-bit
i have built-in wifi on both laptops atheros AR5007EG wireless network adapter and dell wireless 1390 wlan mini-card if it does please help i have tried and tried anybody knows"
,Woodstuc,2011-03-29T07:59Z,do i need drivers for this torrent. or does opening it auto activate?
,Anonym099,2011-04-19T16:23Z,Downloads fast!
,imconvinced40,2011-09-29T13:18Z,IT WORKS!! AND IM A NEWBIE LOL THANKS!!!
,sexy_sam,2012-02-07T09:56Z,"Let me try it first...I've a few WPA to crack...if it works, I'll come back to comment further..."
,icyazzam,2012-04-05T11:11Z,whats the website he goes to in the tutorial video????
[T],n2kmaster,2012-04-17T22:17Z,"Pringles can and tinfoil LOL! I almost pee'd a little laughing at that... man if it works by all means go with it, we made our own speakers in the day with tinfoil and pringles can lolol. Thanks to the uploader and props to RedHatcc giving me a geeky giggle."
,Jaffa1978,2012-05-14T22:02Z,"cheerz dude,will try this out tonight,niece has a laptop but no longer has internet provider,so see if i can hack a neighbours for her ;)"
,kamo11kamo,2012-05-20T20:07Z,"Hello People...
Who wants to hack WPA and WPA2, do not look for anything to do that because that is really will not work, you need wordlist or dictionary to hack WPAWPA2.... so it is something like IMPOSSIBLE. do not look for that...."
