User Type,Username,Date,Text
[T],memitoxxx,2010-06-22T06:29Z,"amigos trato de subir los mejores torrents y calidad pero si ustedes no me ayudan a compartir no sera posible subir mas torrents .. la verdad si les pido que compartan no es para mi es para ustedes. ahorita ya terminaron de bajar 3 personas y no estan compartiendo asi que ustedes sabran si comparten o se quedan colgados

les pido a una persona que sepa ingles y espanol que me tradusca esto gracias

COMPARTANNNNN POR FAVOR

los invito a que escuchen nuestro radio http://mxcomparte.com:8000/index.html tocamos musica mexicana y americana

****************************************

Friends, i try to upload the best torrents with the best quality, but if you don't help me to share i wont be able to upload more more torrents... the truth is that if i ask you to share is not for me, is for you, right now 3 people finished downloading and they are not sharing, you will know if you share or keep on hold. 

SEEEEEEDDDDD PLISSSS"
[T],memitoxxx,2010-06-22T07:41Z,"hola amigo trin02 claro que si lo pongo de hecho dice (ingles - latno) pero para mirar mas informacion puedes mirar las imagenes que seria mas facil ahi estan la imagene de los idiomas y sub y imagenes del dvd original 

gracias por tu bajada y espero que compartas para seguir subiendo mas extrenos "
[T],memitoxxx,2010-06-26T05:28Z,TIENEN TODA LA RAZON EL AUDIO ES EN INGLES CON SUBTITULO EN ESPA훯혩OL..훯혩ES PIDO UNA DISCULPA POR MI EQUIVOCACION TRATARE EN TENER MAS CUIDADO
