User Type,Username,Date,Text
,teddybear064,2010-03-03T02:13Z,Can you please seed this there are 48 people at 98%
,teddybear064,2010-03-03T02:13Z,Thanks
,iveleftthebuilding,2010-06-21T02:49Z,Hey...still stuck on Roots of Rockabilly at 98%. Can you please seed again? Like all the other stuff you have up too. Thanks!
,dmich12,2010-07-17T22:42Z,"I\'m having the same problem as other people on this torrent, stuck at 98.80%. It\'s only three tracks missing but I\'m a completist! Any chance you could seed?"
,jonah111,2010-07-31T23:26Z,I REALLY DON'T KNOW WHAT THE PROBLEM IS BUT I'VE TRIED TO RESEED I HOPE IT WORKS
