Filename,Size,Unit
This Darkened Heart/05 Focus Shall Not Fail.mp3,14.48,M
This Darkened Heart/01 And Death In My Arms.mp3,10.92,M
This Darkened Heart/06 Regret Not.mp3,10.2,M
This Darkened Heart/09 Tattered On My Sleeve.mp3,10.03,M
This Darkened Heart/03 Vicious Betrayal.mp3,9.93,M
This Darkened Heart/08 For Salvation.mp3,8.88,M
This Darkened Heart/07 Passion.mp3,8.53,M
This Darkened Heart/04 I Die In Degrees.mp3,8.07,M
This Darkened Heart/10 This Darkened Heart.mp3,7.43,M
This Darkened Heart/02 The Deepest Gray.mp3,7.26,M
The Fall Of Ideals/06 The Weak Willed.mp3,9.54,M
The Fall Of Ideals/04 We Stand.mp3,8.83,M
The Fall Of Ideals/11 Indictment.mp3,8.57,M
The Fall Of Ideals/05 Whispers (I Hear You).mp3,8.55,M
The Fall Of Ideals/01 This Calling.mp3,8.5,M
The Fall Of Ideals/09 The Air That I Breathe.mp3,8.35,M
The Fall Of Ideals/10 Empty Inside.mp3,7.89,M
The Fall Of Ideals/07 Six.mp3,7.89,M
The Fall Of Ideals/02 Not Alone.mp3,7.87,M
The Fall Of Ideals/03 It Dwells In Me.mp3,7.58,M
The Fall Of Ideals/08 Become The Catalyst.mp3,7.29,M
The Fall Of Ideals/ZuneAlbumArt.jpg,28.92,K
Overcome/05 Chiron.mp3,10.29,M
Overcome/11 Believe in nothing.mp3,10.08,M
Overcome/02 Two weeks.mp3,9.85,M
Overcome/07 A song for the hopeless.mp3,9.77,M
Overcome/04 Forever in your hands.mp3,8.29,M
Overcome/03 Undone.mp3,7.37,M
Overcome/08 Do not obey.mp3,7.35,M
Overcome/06 Days without.mp3,7.31,M
Overcome/01 Before The Damned.mp3,6.68,M
Overcome/09 Relinquish.mp3,6.62,M
Overcome/10 Overcome.mp3,6.09,M
Behind Silence and Solitude/07 Home To Me.mp3,15.7,M
Behind Silence and Solitude/04 Clarity.mp3,12.96,M
Behind Silence and Solitude/03 Follow.mp3,11.52,M
Behind Silence and Solitude/05 Erase.mp3,11.22,M
Behind Silence and Solitude/02 From These Wounds.mp3,10.48,M
Behind Silence and Solitude/08 One Belief.mp3,10.4,M
Behind Silence and Solitude/01 Behind Silence and Solitude.mp3,10,M
Behind Silence and Solitude/06 Shading.mp3,9.02,M
For We Are Many/12 The Waiting One.mp3,11.08,M
For We Are Many/05 Won't Go Quietly.mp3,9.25,M
For We Are Many/03 The Last Time.mp3,9.17,M
For We Are Many/06 Aggressive Opposition.mp3,8.69,M
For We Are Many/09 Faithless.mp3,8.27,M
For We Are Many/07 From The Outside.mp3,8.26,M
For We Are Many/04 Some of the People_ All of the Time.mp3,7.79,M
For We Are Many/11 Keepers of Fellow Man.mp3,7.36,M
For We Are Many/08 Dead Wrong.mp3,7.22,M
For We Are Many/02 For We Are Many.mp3,6.93,M
For We Are Many/10 Hold On.mp3,6.84,M
For We Are Many/01 Now Let Them Tremble.mp3,3.25,M
