User Type,Username,Date,Text
,prynx,2010-03-22T15:38Z,ban this piece of shit
,AJtmmed,2010-03-22T15:48Z,Banhammer! >.
,Jayless,2010-03-22T16:02Z,ambalamps hope you get stabbed with a rusty screwdriver
,cirios83,2010-03-22T16:09Z,haha    lol         crack.jpg
,cristianis15,2010-03-22T16:16Z,I ask you : HOW DID YOU DO IT ????? I mean how did you fuck your filthy bastard moron large huge delirious fuckin' smelling hole of yor mother ?????????????
,evuleyez,2010-03-22T16:29Z,AmbaLamps... You're a COCK! A small one.
,Torx8,2010-03-22T16:49Z,"cocks are big, penises are small =P so he got a penis, not a cock =P he is also an assmuncher.."
,h3ll4b0y,2010-03-22T17:22Z,fuck u and ur whole family ambalamps
,ownage9999,2010-03-22T17:35Z,"Lol, how many more of these are we gonna get?.."
,iwilleatu,2010-03-22T17:50Z,"lol how many more of these are you gonna try to dl? WAIT! if it's coming then it'll be here, if it's not we'll all be the first to know, damn guys, you know who to get it from anyways, why fuck with a nobody cuz i wouldn't dl from myself if i didn't have a skull, smarten up, skulls only, unless of course, well......"
,iNffRaSoNiC,2010-03-22T18:16Z,IS there any chance that this game and this DRM never to be cracked ? Maybe RELOADED SKIDROW and RAZOR 1911 gave up ? And this is THE END of PC gaming at all ??? 
,tagoria,2010-03-22T18:28Z,lol a .jpg crack
,klossen,2010-03-22T18:39Z,well assasins creed 1 took a month.
,The.Genius.of.the.Hole,2010-03-22T18:53Z,OMFG RUSSIAN ROLLED
,iNffRaSoNiC,2010-03-22T18:53Z,"klossen at 2010-03-22 18:39 CET:
well assasins creed 1 took a month.

10x man i diddnt know that :) Maybe in a week or two we will win,because Tom Clancy Splinter Cell Conviction is comming and again is UBISHIT :)"
,AmbaLamps,2010-03-22T18:54Z,TROLOLOLOLOLOLOLO
,cristianis15,2010-03-22T20:51Z,"for titikab ; moron is the sun of yor fucking mother , you little prick  !!! less you are ubishit lover ???"
,steve30x,2010-03-22T21:05Z,It never ceases to amaze me how rude so many people can be on this website. Just because this is fake doesnt mean that you have an obligation to be rude and obnoxious.
,iwilleatu,2010-03-22T21:17Z,why is this torrent still here? the other one is gone so how about this bs too?
,cristianis15,2010-03-22T21:26Z,"for steve30x : sorry , are you somehow a curch boy and we didn't  know , angel ? If you don't want so badly this game what the fuck (ooops , sorry for my language -wtf ) are you looking on TPB ?"
,steve30x,2010-03-23T00:24Z,Nope. I dont believe in religion but I dont think there is any need to be so foul. Maybe you foul mouthed guys should either grow up or get a life.
,steve30x,2010-03-23T01:27Z,"I will hang out where ever I want. Yes I do have the cheek to tell them to get a life because people with a life arent so foul mouthed and those who are grown up dont have such foulness either. Its alright to be agitated but what I see on here is uncalled for 90% of the time. 

Just because this is a fake crack doesnt give anybody the right to call the uploader a cocksucker or to be saying such bad things about his mother. If this was most other sites those people would have been banned long time ago. 

I dont know why such foulness is allowed to go on here. Its pure childish behaviour of people with no life. Its guaranteed if you saw most of these foul mouthed people on the street they wouldnt open their mouth to you."
,AmbaLamps,2010-03-23T01:28Z,why so mad guise
,steve30x,2010-03-23T01:45Z,you know too well why they are so mad. you should remove this torrent.
,iwilleatu,2010-03-23T03:26Z,i agree
,genraltx,2010-03-23T05:32Z,"I mean honestly

You really think we will fall for this?

I didnt for 2 reasons

1) i dont like ac anyway

2)its 56 kb

LOL!"
,Lone_Foxx,2010-03-23T06:57Z,"Hey steve30x,

Would you kindly go fuck yourself? 

And while your at it, go fuck the uploader. He's obviously trying to fuck everyone here while you defend his right to do so...and yet you would complain about other people and how they choose to speak. Its called free speech and I'm sick of little shits like you trying to force your sense of morality on the world."
,cristianis15,2010-03-23T07:21Z,"@steve30xxx : I have one word for you , no no two words : fucking moron !"
,acesuk,2010-03-23T14:54Z,"been playing it on the xbox 360 , two thirds through it and bored lol . "
,steve30x,2010-03-23T15:40Z,"Is that your pathetic attempt of instulting me Lone Fox and cristianis15. Jesus Ive heard worse insulst from my four year old nephew and no I wasnt defending what the uploader done here. If you even tried reading my previous post I told him to remove this torrent but instead you make a pathetic attempt of trying to insult me. 

Jesus you would think that this joke of a torrent was the end of the world for some of you guys the way you think its clever to try and be insulting. This game isnt life support you know. Get over it that this a fake crack and move along."
,iwilleatu,2010-03-23T19:01Z,"i knew this game was gonna suck, jc2 woohoo! fuck ac2, i wouldn't buy it for a console now that ubisoft pulled this shit with the pc version, fuck this game and fuck ubisoft, there will be alot of disappointed people when this game finally does get cracked, all this crying and bitching and the game's gonna suck haha move on"
,djnforce9,2010-03-28T05:29Z,It's just as the video depicts: Troll-lolololol
,Manzit,2010-05-16T13:08Z,Hey guys Fuck this torrent!! Go for Offline server patch. It worked for me and fully completed this game. It's fuckin' Awesome!!
,Manzit,2010-05-16T13:11Z,"for offline server patch check out:
http://thepiratebay.org/torrent/5490537/Assassins_Creed_2_The_Final_Offline_Server_Crack_100_"
,DaumosSS,2010-06-01T09:20Z,JPG =/ WTF!
,lucasje20,2011-10-12T19:12Z,are u mad??
