Filename,Size,Unit
The Dennis Prager Show Hr 3 06-Sep-10 CF.mp3,33.55,M
The Dennis Prager Show Hr 1 06-Sep-10 CF.mp3,33.53,M
The Dennis Prager Show Hr 2 06-Sep-10 CF.mp3,32.71,M
The Higher Education Bubble_ Ready t.mp3,5.45,M
Our Not Enough Labor Day     9.3.10.mp3,5.32,M
Why We Blink In Face Of Eco-Terror.mp3,4.79,M
Choices Ahead for Today's Unions   9.mp3,4.67,M
The Stimulus Kicks In_ Higher Unempl.mp3,4.24,M
Recovery Autumn_    9.3.10.mp3,4.13,M
Paralysis By Taxation   9.3.10.mp3,4.04,M
Rush Limbaugh Morning Update 06-Sep-10.mp3,1.42,M
Torrent downloaded from Demonoid.com.txt,47,B
