User Type,Username,Date,Text
,seedammit,2010-07-09T20:53Z,"Dude, why?nnThe movies are the best partnnNowadays the memory sticks are so cheap the size is not an issue anymore"
,hubeb,2010-07-12T05:59Z,srry bro i dont feel like slowing down my comp by haveing 8GB of 6PSP games on it so i rip them if u want ill add the full iso compressed into a cso tomarrow july  12 ok
,hubeb,2010-07-13T20:18Z,here seedammit here is the full iso compressed to a cso nnhttp://thepiratebay.org/torrent/5689928/Daxter-%5Bfull_ISO-_compressed_to_a_CSO%5D-By_HUBEB.cso
,hubeb,2010-07-13T20:19Z,sorry about that link it doesnt work this one doesnnhttp://thepiratebay.org/torrent/5689928/Daxter-%5Bfull_ISO-_compressed_to_a_CSO%5D-By_HUBEB.cso
,hubeb,2010-07-13T20:19Z,http://thepiratebay.org/torrent/5689928/Daxter-%5Bfull_ISO-_compressed_to_a_CSO%5D-By_HUBEB.cso
