User Type,Username,Date,Text
,simco18,2009-08-08T21:38Z,Esti un dobitoc. Nu este original.Serialul este de doi ani pe lista microsoft.
,tunu,2009-08-28T21:07Z,sa fut in gura toti fraieri astia care pun aici si nu stiu ce pun
,GTAmodfan,2009-10-13T16:26Z,Does it Have The activation Already cracked?
,erikblazer,2009-12-15T05:49Z,"dude i hope this works i found several others who work, but when i went to install my wirless software on my laptop it would install but it couldnt find my router or anthig so i hope this works"
,Glass_Of_Wine,2011-01-29T23:50Z,"this is a great OS, i'm using it and i can  tell that works perfect, indeed it's a original one..but that cd-key honestly i'm not using it, just because was posted here and i'm sure that's already blacklisted, i'm using another key that works...anyway good work and thanks :)"
,621jae,2011-03-29T08:44Z,"thought  this  was  xp  home  but  is  xp  pro  program,  needed  original  copy  for  older  laptop  i,m  fixing-up , downloaded  great  burnt  with  power iso  and  installed  at  boot  per  instructioned  used  used  cd-key  provided  worked great , thanks  newbee  to  comments   great  upload "
,621jae,2011-04-02T22:30Z,"aram89up,  as i said it  worked great , used the cd-key no#  the key worked , then windows  update installed a bunch of updates when i was shutting down the laptop then the next time i was on the laptop m/s update tryied to installed the WGAN UPDATE which i canceled (kb905474) does that mean that m/s scanned this copy and  knows its  not genuine  if so will this upload fix this (make windows genuine in 5 seconds no more wga cracks.)  what do you think ? and will i  still able to update afterwards  or  diable  the  updates .  thanks  for  the  great upload ,  i lost the password to laptop then had to remove cmos  battery & main battery to clear  password then had to reinstall o/s but couldnt find the orginal disc  so thats  how i got to this point ,  any  ideas  thanks  "
