User Type,Username,Date,Text
,fiete5401,2010-05-25T15:12Z,HighRes - Movies would be the correct category.
,moerte,2010-05-25T17:39Z,"fixed, thanks"
,April.Swift,2010-05-28T15:26Z,"Warning: Digital Playground movies, this means most girls have Miami Tits. Miami Tits are embarrassing plastic tits gone wrong."
,April.Swift,2010-05-28T15:27Z,"The title is misleading typical of Digital playground production. All these girls have done at least 20 other movies prior to this one.

This is not their first porn."
,April.Swift,2010-05-28T15:28Z,Finally this is not even BLUE RAY it is just SD.
,pibay2009,2010-05-29T04:42Z,"On the positive side, though, Stoya is fucking hot."
