User Type,Username,Date,Text
,elmojr,2010-07-30T21:39Z,"All of these files are inside one huge 16GB RAR file, making it impossible to download only the desired files.

Please separate these files and reupload them. Thanks."
,stokerve,2010-07-31T20:47Z,"SORRY THIS WAS A MISTAKE...

THIS IS THE FIRST TIME I UPLOAD A TORRENT AND I DID'NT IN THE RIGHT WAY

I JUST UPLOADED THE GOOD ONE AND NAMED: ""THE BEST ANTHONY ROBBINS COLLECTION - THIS IS THE REAL THING""

GO FOR IT AND I APOLOGIZE AGAIN.

I DON KNOW HOW ERASE THE WRONG ONE


--------------

LO SIENTO, ESTO FUE UN ERROR...

ESTA ES LA PRIMERA VEZ QUE SUBO UN TORRENT Y NO LO HICE ADECUADAMENETE

RECI?N ACABO DE SUBIR EL TORRENT DE MODO CORRECTO Y LO HE TITULADO: """"THE BEST ANTHONY ROBBINS COLLECTION - THIS IS THE REAL THING""

VAYAN A POR ?L Y OFREZCO NUEVAMENTE MIS DISCULPAS.

NO S? C?MO BORRAR EL TORRENT CON EL ERROR."
