User Type,Username,Date,Text
,ZenRhino,2009-10-24T03:31Z,"thanks... love Trent's music, esp the Downward Spiral!!!"
,ZenRhino,2009-10-24T03:32Z,"that's kinda messed up - 593 seeders, 2131 leechers, and I was the first to offer thanks for the up - WTF people??"
,puntzak,2009-10-24T10:55Z,thanks for the up :)
,BatKnight,2009-10-24T14:52Z,"The video is 29.970 fps, so I guess it's considered NTSC"
,trepkos_,2009-10-25T02:50Z,yeah its ntsc
,BatKnight,2009-10-27T22:26Z,"To who may interest, I've just uploaded the HD 720p version of this same show at http://thepiratebay.org/torrent/5138278/Nine_Inch_Nails_-_The_Downward_Spiral___Live_%5BHD_720p_m4v%5D"
,kalhan,2010-01-11T21:16Z,audio? lossy/lossless?
,squall134,2010-01-17T10:24Z,"Gracias mi amigo, will seed!"
