User Type,Username,Date,Text
,Phaux_The_Fox,2010-11-10T10:58Z,"THANK YOU SO MUCH!
Do you happen to have the DVD?"
,Phaux_The_Fox,2010-11-10T11:11Z,Also I will be seeding this for a very long time once its done
,marku592,2010-12-07T23:01Z,"I'm really sorry but I don't have the DVD :( I'll share it if I can get my hands on it, though."
,fn00dle,2011-02-15T22:15Z,"*commences downloading
Thnx. :) Wasn't able to find a good download anywhere but here. :D"
,kvman,2011-04-09T23:00Z,yo thanks man realy thanks.
