User Type,Username,Date,Text
,Angel7782,2010-04-05T12:03Z,i gona seed wen i download
,Godslayer187,2010-06-15T01:35Z,"5.41gb????? ROFL what the fuck, here is a link to a properly ripped Rise Of Nations Gold that is 100% fully playable online! and it only 1.02gb not a retarded 5.41gb.

http://thepiratebay.org/torrent/5625865/Rise_Of_Nations_Gold_%28_Playable_online__%29


It is 100% I use it daily to play on gamespy."
,Godslayer187,2010-06-18T17:51Z,"Thats crazy though, 5.41gb, even the ratail CD itself with exp pack isn't that big, whats with the extra 4g of data would be my question."
