User Type,Username,Date,Text
,rosie1966,2011-01-23T14:38Z,"Many, many thanks for this.

Hope you can find something of worth in my humble uploads.

Will seed for a month.

Take care xx"
,Ponyoo,2011-02-03T07:34Z,"Thank you so much.

By the way,  people who has Season2 720p
http://thepiratebay.org/torrent/5542256/The.Tudors.S02.720p.BluRay.DTS.x264

Pease, seed for us, we are sooo struck for days.."
,AmsterGay,2011-02-07T07:56Z,"Anyone got Dutch sus for this?
Heeft iemand NL subs?"
,johnabdala,2012-01-16T19:14Z,please upload the other three seasons
