User Type,Username,Date,Text
,collapsd,2010-01-13T00:13Z,"what is this poo??
get it out the HD section!"
,yadam2001,2010-01-13T01:26Z,this is shit and don't belong here
[V],HMVinyl,2010-01-13T09:03Z,"true, theres no such thing as 720p ts, the numbers don't say so either :("
,cashiku,2010-01-14T02:38Z,there is such thing as HD camera
,leech_mofo,2010-01-16T16:39Z,"ofcourse there is such thing as HD camera......
Once again what is this junk doing in the HD section?????"
,S3nd41,2010-01-18T00:25Z,Praise Mother Russia!
,orwellenator,2010-01-18T14:06Z,mingorin don't send your fuckn SPAM here idiot!
,rozalin,2010-01-18T18:11Z,"Great quality!Great movie!!!!thank you very much!!!i download this torrent after try 2 other,and this one really good and clear.
Do not understand people do bad comments,even not try to watch before.Spasibo ogromnoe za film.;-)"
,codyisme,2010-01-20T04:03Z,does anyone know how to play the english version?
,cashiku,2010-01-26T10:53Z,switch to another audio track
,yg101,2010-01-28T04:35Z,"Peace of crap. NOT HD at all!! I downloaded it and its a cam pointed at a screen. Watched for 10seconds then deleted it. 
****NOT HD quality!!****"
,call_me_nobody,2010-01-29T15:36Z,"1 thing...

this is the best speed i have had in a long time on movie download:D instant 1.3 mbs down:D:D:D"
,jran0880,2010-01-30T17:44Z,sample looks good and has 2 audio tracks. Hopefully 1 is english. Will let everyone know.
,jran0880,2010-02-03T01:30Z,Track 2 is english. Cant get subs to work tho. Fairly good video. Dubbing is on and off. Gave it a plus however.
,russiya,2010-02-27T19:16Z,"??? ?? HD 720p !!!!!!!!!!!!!!!!!!!!!!!!!!!!!!!!!!
This is not HD 720p !!!!!!!!!!!!!!!!!!!!!!!!!!!!!
?? ????? ?????? ?????!"
,call_me_nobody,2010-04-03T00:57Z,"EVERY1 JUST DONT BOTHER TO DOWNLOAD THIS MOVIE WITH A CRAPPY QUALITY

THIS GOT THE BEST QUALITY AND ITS EVEN BETTER THAN PROPER'S VERSION :D:D:D

http://thepiratebay.org/torrent/5417633/Avatar_-_EXCELLENT_QUALITY_-_DVD_Ready_to_burn_-_ISO_-_unidogma"
