User Type,Username,Date,Text
,Jakal_X,2009-07-17T16:04Z,Is this file legit? It requires a password that you have to find. Two thumbs down.
,mattcart,2009-07-17T20:57Z,"It's legit, but the dickwad has it passworded.. Yay for fake emails.

The password is gamer

The password is gamer

The password is gamer

The password is gamer"
,Gu357,2009-07-21T20:45Z,Also it's 128 kb/s not 192 on the file I checked: track 8
,0_1,2009-12-03T08:05Z,don't use this one it's a scam.  use this one: http://thepiratebay.org/torrent/5044600/Modest_Mouse_%5B2009%5D_No_One_s_first...._%5BCov_CD%5D%5BBubanee%5D
,K_Dub_711,2009-12-28T11:20Z,thanks for the pass code!!!! you probly saved me hours
