User Type,Username,Date,Text
,MR.SQUISH,2010-01-18T05:05Z,Can someone please shoot this asshole
,Pagnus,2010-01-18T11:54Z,"MR.SQUISH
If you listen to this book and then come back with a comment.
But i guess you neither listen to or read books.
Your comment here indicate that you get your ""facts"" from tv-crap like Jerry Springer and Inglorius Basterds. You probably think that Steven Spielberg, Springer and Tarantino are impartial historians."
,DrDDuke,2011-03-26T22:43Z,"http://thepiratebay.org/torrent/6255455/David_Duke_-_My_Awakening__Audio_Book_2011_--_Latest

Thanks for the Great Work!

But please delete this torrent and seed the 

updated My Awakening Audio Book 2011 Latest

Better audio quality, music and much new and and updated material.

Thanks

http://thepiratebay.org/torrent/6255455"
