User Type,Username,Date,Text
,zato1,2009-07-21T16:48Z,"Cool up. I love Primus, but 7.9 gigs will take me like two weeks. I live on an island and have the best connection possible-but it still sucks!!! Any chance of shrinking this to an AVI or MP4??? Thanks either way."
,The_Spiral,2009-07-22T00:16Z,"Sure thing, zato1. I'll get that up in a few hours. =]"
,zato1,2009-07-22T05:05Z,Wow! Thanks Dude. It's been years since I've seen them live. Truly one of the best bands ever!
,The_Spiral,2009-07-22T08:39Z,Here is the link to the AVI version: http://thepiratebay.org/torrent/5016618
,kroadie76,2009-11-20T05:05Z,thanks to post it !!!!!!!!!!!
