User Type,Username,Date,Text
[T],suavecito195782,2010-01-03T19:06Z,Next movie will be x files part 2 screen shots http://img52.imageshack.us/img52/7096/xfiles1.png http://img526.imageshack.us/img526/3163/xfiles2.png http://img52.imageshack.us/img52/9166/xfiles3.png
,maxirocker,2010-01-03T23:59Z,can you make constantine?
[T],suavecito195782,2010-01-04T02:27Z,do they have that movie on blu ray i'll look into if any of the other ps3 team members has done that movie 
,Ramsgate69,2010-01-20T12:44Z,Cheers mate 
,belzebuthus,2010-06-12T14:16Z,thank you! great quality
,Dimmis80,2011-08-09T20:05Z,"Thanks mate,nice quality to.:-)"
