User Type,Username,Date,Text
,Sulrise,2010-02-04T21:47Z,This is my first seed. In my network it works. But if you can't download than tell me.
,Lochan,2010-02-20T01:30Z,thanks!!
,Sulrise,2010-02-25T22:53Z,glad to help
,alvarito4,2010-05-22T13:55Z,Thanks! :)
,thebatmansanus,2010-06-20T17:32Z,Excellent torrent. Thanks a lot.
,heavierthanfred,2011-01-27T00:38Z,"What have we come to as a society when we start pirating indie music?

not to give ya to much crap cause I am downloading this... only because I have only heard one song before, and think I like them.

If I do, I will definitely buy this, and I encourage you all to do the same... if everyone pirates there debut album how are they going to make another?"
,jimbob22,2011-03-10T06:18Z,"anybody know if thier version of gillian welch's miss ohio is on an album?  great version. this album is awesome as well. if u like these guys check out gillian welch and her husband

thx for the up dude
cheers"
,samf28,2011-09-03T03:01Z,"Quick download, great torrent. Thanks!"
