User Type,Username,Date,Text
,moviz247,2010-11-12T20:19Z,I am seeding .......
,qysan,2010-11-24T08:49Z,Please re-seed
,moviz247,2010-11-25T22:11Z,"I am doing my best ...
Season 3 is coming soon ....."
,dkhere,2011-01-29T03:23Z,"Completed downloading the season 1...
Now gonna put this one in my torrent list..."
,razorraj,2011-02-23T19:54Z,thanx man.....
,RipOrDie999,2011-02-28T06:43Z,"Come on guys, some comments/ratings on quality would be great. "
,RipOrDie999,2011-03-18T20:45Z,"Excellent quality for the small size.

I will seed well. "
,RipOrDie999,2011-04-29T00:49Z,Great quality for the size. 
,MrTPB,2011-11-06T14:23Z,"hey bro What is this season?  one or two ? Description says season 1 but torrent title says season 2 
O_o"
,yasin2143,2012-01-18T14:29Z,which season is this...season 1 or 2???
,yasin2143,2012-01-18T19:06Z,pls pls pls pls pls pls pls SEEEEEED!!!!
,kenguru21,2012-06-20T12:14Z,http://thepiratebay.se/torrent/7369202/Smallville_Season_5__2_57gb.
