User Type,Username,Date,Text
,vdcosma,2009-11-15T10:34Z,nice! but where are the seeders? :)
,macrossroads,2009-11-16T00:27Z,Is this going to be seeded?
,drwvb,2009-11-17T22:38Z,"well done pal! But also checkout my torrent here:

http://thepiratebay.org/torrent/5163965

that's 6.900 classic games in one pack :)))"
,macrossroads,2009-11-20T05:27Z,This is abandontorrent.
,macrossroads,2009-11-25T03:24Z,Hey Jackasso - thanks for nuthin?
,Ouffer,2009-12-02T21:04Z,"cant you fix worms armgeddon for mac??=)
i reeeally miss that game"
,rusty-koathanger,2009-12-07T18:13Z,doesn't this n00b know you have to actually seed the torrent?
