User Type,Username,Date,Text
[V],sonilem,2010-11-19T14:15Z,A truly awesome mag.
[V],malestrom_HH,2010-11-19T15:39Z,http://thepiratebay.org/torrent/5966635/The_Economist_-_20-26th_November_2010_(Malestrom)
[V],malestrom_HH,2010-11-19T15:44Z,http://thepiratebay.org/torrent/5966635/The_Economist_-_20-26th_November_2010_(Malestrom)
[V],sonilem,2010-11-20T08:57Z,"What you trying to say dude!
Anybody would think you was miffed. LMAO.
I respect you a lot so dont lets be childish.
You upload things after i have but i dont do this to you. I mean, WTF."
