User Type,Username,Date,Text
,Drexhy2,2009-08-31T23:24Z,why dha fudge is it labeled 2009 ?
,XoLWoX,2009-09-01T00:43Z,maybe because i ripped the dvd in the year of 2009
,Drexhy2,2009-09-01T01:24Z,still seems incorect ... but i´s u´r torrent 
,XoLWoX,2009-09-01T01:56Z,"File Name    : Resident Evil Extinction[2009]DvDrip-LW
Release Date : 2007"
,Foursticks,2009-09-01T09:30Z,The end of this movie led the viewer to believe there would be a R E 4... It's not over yet... I hope M J does another one... 4s..
,Nicklesbe,2009-09-29T00:31Z,"Hey XoLWoX, please don't take any offense to this, simply trying to help you out. Im not sure what you did wrong on your rips but they do not work on playstation 3. Many others like myself use it as a main viewing source for videos since it has such high quality. Anyways I was hoping you could figure out what was wrong and fix it for your future rips. I think your doing a great job just cant watch any of your movies which is a shame. Anyways thanks for your time and understanding and gl with all your future rips and thank you for all your current ones."
,Wizeon,2009-10-22T23:13Z,"Was
Dawn Of The Dead (1978) Directors Cut - (AC-3) [akhiugo]
ripped in 1978 then? From a DVD? I don't think so... Nobody cares when you ripped the thing, you're supposed to label the year when the movie was made.."
,anahka23,2009-10-29T22:21Z,This ass should not have Trusted status. 
