User Type,Username,Date,Text
,jsjoholm2,2010-06-22T21:39Z,"The files works great, and the download was fast. 

Thank You - I have been looking for these ever since the original broadcast. "
,gwrgwir,2010-07-04T04:24Z,"bloody amazing.  like jsjoholm2, I've been looking for this as well for quite a while.  

thanks muchly for the upload m8."
,Hiflyboi3000,2010-11-22T23:28Z,This is the best day since the yesterday. thank you many much Cherry3z! God Bless.
,wrath_jason,2010-11-26T02:03Z,please please seed!!!!! 
