User Type,Username,Date,Text
,anoniem1234,2010-01-16T16:02Z,"Heel erg bedankt!!
Heeft iemand toevallig al de DVD van Seizoen 3?
Wil diegene dan de laatste disc (met de laatste 2 afleveringen en extra's) uploaden?
En wil iemand de dvd's van seizoen 2 uploaden van af disc 2?
Iemand deed het al, maar nu is hij blijkbaar gestopt ofzo.

Als je dvd's van seizoen 1 wil, moet je in het zoekvan voetbal vrouwen intikken (met spatie ertussen)."
,deansde,2010-01-16T18:49Z,"Willen er nog seeden aub!! 

Thx mounir voor deze downloads!"
,kimjurgen,2010-01-17T12:02Z,"bedankt he , ik ben een trouwe fan !!! "
,MichelV5,2010-01-17T13:26Z,"BEdankt weer mounir:D
Ik ben ook een trouwe fan, can je misschien de volgende keer de cover erbij uploaden?"
,anoniem1234,2010-01-18T23:10Z,"op mininova staat de torrent van voetbalvrouwen seizoen 2 dvd 2, alleen daarvan krijg ik de laatste 20 mb telkens niet gedownload.
als iemand die wel heeft, wil die dan nog even seeden? Dan kan ik hem wel uploaden als ik hem compleet heb. nu gaat dat dus niet.
of wil iemand gewoon dvd 2 hierzo uploaden?"
,gangste85,2010-01-20T16:52Z,"Aflevering 12 beschikbaar...

http://thepiratebay.org/torrent/5294349"
,gangste85,2010-01-21T09:23Z,"Aflevering 13 geupload op

http://thepiratebay.org/torrent/5296081"
