User Type,Username,Date,Text
,Dragonforce79,2009-10-27T11:38Z,"No screenshots for you ;-)

oh well, try this:
http://genki-genki.com/themes/genki_white/images/site/pake/alltm/tm_gen002.jpg"
,zhukovalexey,2009-10-27T12:20Z,"?????? ??? ????, ?????, ????????? ? ??? ?? ????"
,zhukovalexey,2009-10-27T12:20Z,super
,Cadinot,2009-10-27T12:28Z,Just when I think I've seen it all. Talk about smelling like fish....
,Dragonforce79,2009-10-27T12:37Z,"Haha, well... if you guys like it in any way, let me know and I'll upload more from Genki-Genki, I bought a few movies from them ;)

... yeah I know, I'm sick and perverted lol"
,Dragonforce79,2009-10-27T15:26Z,"5 hours after initial seeding, there's 500 peers...
Now don't say people aren't interested in this
kind of entertainment ;p

Anyway, I'm off, seeded like 10 GB.
Be fair and keep seeding for a while after you downloaded it."
,xbillx,2009-10-27T16:03Z,Question: After they shoot the movie do the ells go back on sale at the market? Ugh!
,Dragonforce79,2009-10-27T16:04Z,I'm pretty sure that they get used again for the next movie ;)
,Dragonforce79,2009-10-27T17:39Z,1500 peers now... I wouldn't have imagined that theres that many people downloading this :D
,treewizard00,2009-10-27T22:05Z,"For those of you wondering about the eels and such after the shoots, I believe they cooked and ate them. Thanks for the torrent, Dragonforce79. I for one am very interested in the other films you have, if you would be so kind as to upload them."
,Dragonforce79,2009-10-28T04:49Z,"You're welcome ;)
What would you like to see ?
More eels ? Frogs ? Roaches ? Worms ? Octopus ? ;p"
,Galland69,2009-12-09T14:55Z,"love eels thanks, have anything with furry animals?"
,Dragonforce79,2009-12-16T04:03Z,"Sorry, no furry animals ^.-"
,Dragonforce79,2009-12-18T09:07Z,"Actually, DGEN001 (dog) is now live, please check my other uploads."
,Andromeda5656,2010-02-26T04:45Z,"Thanks, great video !!!"
,Stiff_123,2011-04-17T22:31Z,"Hey Dragonforce79 Great Freaky Sh!t...
I'm wondering if ya might have some good alien/tentacle 3d porn CG stuff
I have Svarog's stuff but looking for newer Sh!t.
Just a thought! "
,legal_pirate,2011-08-16T07:07Z,Damn why is this censored? 
,MousE0910,2012-04-28T19:09Z,"Wow, thanks for all the great stuff. I know all your torrents are old and you're probably not even looking at the comments but just in case - could you please upload MOAR if you have any? Anything from genki-genki com is great!

Thanks a lot!"
