User Type,Username,Date,Text
,1000V,2009-11-12T18:53Z,mis versioon?
,Tranceworm,2009-11-12T22:00Z,Imelik et unustasin... ->2009.1.3 
,Tranceworm,2009-11-12T22:28Z,"Juba päris mõned kodanikud lõpetanud laadimise, oleks kena kui jätaksite komentaari :)"
,1000V,2009-11-12T23:08Z,"Mida siin selle vana versiooni juures ikka kommenteerida?

Ja sellest 2G kaarti soovitusest ei oska ka aru saada:) vahet pole ju, mis suurusega mälukaart on. Eeldusel, et kaart peale mahub 128K-32G, vahet pole."
,km_1234,2009-11-13T16:20Z,"kui midagi ülas panna siis ikka midagi aktuaaalset, näiteks 2009.14 
mis see siis nüüd uuem on, kas 2009.13 või 23.50beta? viimane oli vist 20/04/09"
,km_1234,2009-11-19T22:32Z,http://files.series60.ru/users/vitaliy/maps/Eesti_TOPO_1.4.zip
,km_1234,2009-11-20T11:46Z,"tõmbasin selle eomap 1.4 testimiseks alla ja veendusin, et teedel navigeerimiseks on ikka Regio oma tunduvalt etem. maastikul ehk see eomap võib isegi end õigustada aga min jätkan siiski regioga. kui aega saan siis lähen piritalt läbi ja uuendan versiooni ära. neil on hiljuti ver.1.6 välja tulnud"
,greedy63,2009-12-22T21:05Z,Kas Topo MapID kah liikvel on?
,propeller999,2009-12-30T08:00Z,Keegi Regio 1.6 kaardi on endale saanud? Kuidas on? Ehk jagab keegi?
,raunz,2009-12-31T12:41Z,"Huvitav, kas mõni Eestis või baltikumis toodetud kaart ühesuunalisi tänavaid ka hakkab kunagi  mõistma. Metsas on küll tore, aga teede peal on endiselt keerulilleline.

Autoga liiklemiseks ei ole ma ühtegi pädevat kaarti peale CityNavigatorEurope kohanud. Täpsus on küll kordades kehvem, kuid GPS suunab ikka mööda sõidetavat teed.
Regio Baltic kaart suunas mind Riias kaks korda ""keelumärgiga"" tänavale. :) Tase ;)"
,mkhi,2010-01-06T20:53Z,"Panen peale ära siis seada ütleb ""ei Lae kaarte"". Milles asi võib olla?"
,tony1001,2010-01-19T21:37Z,"Tere! Küsimus järgmine: kas esimene kood mida ülemine generate nupp tekitab on seoses alusmise koodi genereerimisel? Äkki keegi seletaks lahti...
Tänud ette!

Probleem muidu selles et seade näitab kaarti korraks ja siis lükkab end citynavigatori peale. Milles võiks olla probleem?"
,hobune82,2010-03-29T20:36Z,privetik.laadisin peale ja töötab suurepäraselt.telf on samsung i8910
,jyrka20,2010-05-11T20:16Z,"EOMAP Eesti Teejuht 2010.1.2
Kust seda laadida saaks?"
,rosekas8,2010-05-27T22:42Z,"Mul sama teema, et garmin kirjutab "" ei saa avada kaarte"". Mis viga võib olla??????
APPPIIIII"
,erkis12,2010-06-21T19:46Z,"to rosekas8

niipalju kui üritatada viitsisin ei õnnestunud saada käima kui oli teine pira map seadmes...käivitada õnnestus kui ülejäänud gmapsupp failid ära kustutada. NB:probleemi ei lahendanud ka mälukaardi kasutamine"
,tom10000000000,2010-07-04T17:50Z,mul sihuke mure et...telefon on nokia 5800XM...aga ma ei saa aru kust ma selle ID saan:D
,erkis12,2010-09-01T09:35Z,Nüüd kasutanud seda mõned kuud ja puhkuse ajal sai selle kaardi najal Põhja-Eestis ringi rännatud. Arvamus-saast. Tihtipeale üritas mind kuskile olematutele metsateedele suunata ja läbi eramaade sõidutada. See kaart sobib võibolla tõesti ainult offroadiks ATV'de või enduro tsiklitega
,pyromaan11,2010-09-05T18:40Z,"Garmin Nüvi peal töötab suurepäraselt!
Suurimad tänud!"
,Truvativ,2012-01-06T19:40Z,"Selline küsimus, et kui mul on 1.5 verisoon gmapsupp.img failist, siis kuidas saaksin selle käima oma Garminis?
Peab selle ""5120"" asemel midagi muud kirjutama või midagi muud?
Ette tänades"
