User Type,Username,Date,Text
,punisher_latin,2010-10-04T05:05Z,muy buen aporte! Colega.
,Rexuxann,2010-10-04T05:18Z,"Gracias por esta esperada película, manuvoulquin. Un favor, si pudieras poner más detalles: bitrate promedio, numero de pasadas (si lo convertiste con el CCE), que se ha removido.... haría tu subida mucho mejor. Gracias, amigo.

@punisher_latin: saludos, tus aportes son inmensos, sobre todo en DVD9.

Gracias a los dos."
,manuvoulquin,2010-10-04T13:54Z,"OK, lo tendremos en cuenta la proxima vez, Saludos!!! Gracias por los comentarios!!"
,heavydiamond,2010-10-05T00:27Z,works fine 4 me try the magnet link instead
,VJMARCC,2010-10-05T01:05Z,please seed
,sulphamicdemon,2010-10-05T02:56Z,worked fine for me
,mam12006,2010-10-05T14:52Z,"No seeds????
I'm stucked at 21%"
,mam12006,2010-10-05T14:53Z,No seeds???? I'm stucked at 21%
,amargator,2010-10-05T23:32Z,"Manuvolquin please seed, esto esta atorado no hay seeders. Grazie mille"
,amargator,2010-10-05T23:36Z,Puedes extraer el video con el audio latino para que no este tan grande. Ya que no hay seeders.
[T],[jcgoku21],2010-10-06T06:44Z,"How To Train Your Dragon DVDRip Audio Latino 700MB 

La subire mañana si ebay me lo permite esta dando problemas con las cargas.
"
,manuvoulquin,2010-10-06T21:52Z,"Hey! Im seeding all the time!! La razon por la que subo DVDR es porque es muy dificil encontrar DVD Full con español latino, en cambio es mas sencillo encontrar DVDRip. Saludos!!!"
,Kawamito,2010-10-10T20:07Z,"estoy  atorado al 98% todos los pares que recoge mi utorren estan tambien al 98% y no hay ningun seed que lo tenga al 100% mantenlo un rato colgado para que vario terminemos de descargar por favor :)

por cierto, tendras por ahi Toy Story 3 Version DVD Retail con el audio latino en DVDR? o unrip de bluray a DVDR ?

gracias... "
,manuvoulquin,2010-10-10T22:03Z,"Soy nuevo en esto, sepan disculpar ya ire solucionando los problemas, saludos!!!
Kawamito: no tengo lo que necesitas, saludos!!!"
,manuvoulquin,2010-10-11T04:14Z,"POr favor avisen si la pudieron bajar, y si la bajó sin errores!!!! Gracias a todos!!"
,vinegar15,2010-11-10T19:18Z,manuvoulquin thanks a bunch i'm there downloading...... everyone please just keep seeding even if u finished ur download so we all can enjoy this great movie. thanks again
,sdam87,2011-01-18T07:32Z,seed please :D
