User Type,Username,Date,Text
[V],dias_vld,2010-07-02T15:03Z,"MAn, this looks really good, but there´s no seeds!! I will try to find this elsewhere...thanks for the tip!! :))"
[V],brego45,2010-07-20T05:55Z,just downloaded it.... me gonna use it now henceforth
[V],brego45,2010-07-20T13:02Z,great software... using it now
,piyalsilva,2010-10-08T15:50Z,Ekarth: Can you seed this torrent again please. It ll be very important for me.
,demon_89,2011-01-08T11:29Z,i`m goin 2 use it 4ever...its easy and takes just a sec...i really used 2 waste ma time makin screen shots...ur tool is fuckin awesom man...
,TorrentsTPB,2011-02-11T07:26Z,"i will try this out, thanks"
[T],StePa644,2011-06-22T13:14Z,"many thank for this useful tool, works really fast!"
