User Type,Username,Date,Text
,prank0007,2010-10-24T19:43Z,"suddenly eng movie by ddr
nor to dubbed in hindi
just shocked!!!"
,parm.cool,2010-11-08T09:11Z,Hindi main b movies dub krte ho kya bro tel.u r g8 upload of blueray hindi movies bt size yar 2gb main ho to maza a jaye
,ozc,2010-12-01T16:21Z,Why do we need english subtitles on an english language movie?
,ozc,2010-12-03T04:58Z,"Oh great. You have to have subtitles on the entire time to understand the parts spoken in spanish or turn them off and not understand any of the spanish parts...

W T F !

Look for another rip to download."
