User Type,Username,Date,Text
[V],mirrormaster82,2010-06-28T14:37Z,"You can't go wrong with a name like this for a movie...By the way ''thelad53'' you're quickly becoming one of my favorite uploaders...oh,and tell me will there be more of Batman-black and white motion comics 'cause there are a lot of episodes missing?"
[T],thelad53,2010-06-28T21:24Z,"Thanks mate, as for anymore batman  im not sure but i'll look around for you and see what comes up."
,Torpor,2010-07-01T21:18Z,"Is this: La bimba di Satana (1982) http://www.imdb.com/title/tt0080438/   ?  Btw... Great uploads, thnx!!!"
,willywonka111111,2010-07-09T06:40Z,yes thelad you are uploading a load of great old movies! cheers - I love horror !!!
,whazzup3929,2011-05-08T16:40Z,kudos to you thelad!
,LiveInABox,2011-11-23T13:59Z,seeeeeeeeeeeeeeeeeeeed plz
