User Type,Username,Date,Text
[T],sk4nz,2010-04-13T15:18Z,"Juste un petite information : sur les forums depuis quelques temps apparaissent des post où le crack d'après les auteurs est considéré comme un faux positif par une partie des antivirus. J'ai moi même eu l'erreur ""The application was unable to start correctly (0xc0000018). Click OK to close the application."" Le crack était bloqué par mon antivirus, malgrès le fait qu'il l'ai décrété sain. J'ai donc crée une exclusion de l'analyse en temps réel de mon antivirus et depuis, tout baigne !"
,wrexhamafc,2010-04-13T16:59Z,don't touch trojan trojan
[T],sk4nz,2010-04-13T19:30Z,"Comment highly constructed... Trojan or not trojan, tha's the question Wrexhamafc !"
,wrexhamafc,2010-04-14T20:35Z,my comp keept on shutting down because of that trojan
,agicapr0,2010-07-31T01:59Z,thanks mann for gamee .... but i need the registration code for CNC4 .. i cant acces the gamee .. i dont noww ehyy .... ii need the answerrr plss ?? 
,Christophezas,2011-05-17T17:58Z,"Salut St4nz et merci !!

J'ai un souci avec avec CC4, le jeu ne se lance pas, quand tu parle de "" bloquer les connections provenant de CC4.exe en direction d'un hote distant mais SURTOUT PAS les
connections locales (127.0.0.1 et 0.0.0.0).""

Comment tu sais si (fait pour) les connections sont bloquées ou autorisées.

Merci encore"
,damnnator,2011-10-29T10:54Z,can somebody help me! how i can get that registration code for this game? i NEED IT! HELP!
