User Type,Username,Date,Text
[T],renman,2010-02-23T02:44Z,Nice up Blacktroy Cheers
[V],BLACKTROY,2010-02-23T03:18Z, renman --- I LIKE PEOPLE LIKE YOU WHO APPRECIATE
,jersson,2010-02-23T05:10Z,"Yepp, great software man, thank's"
,LLite,2010-02-24T20:43Z,Thanks BLACKTROY :)
,zigzag77,2010-02-27T01:28Z,Good torrent. Thanks and respect
,Phyltre,2010-03-01T17:24Z,"Thanks, spasiba, takk, domo arrigato ;)"
[V],nightissuchproximity,2010-03-09T08:07Z,Yep.   Without any doubt.   Good up.   Thanks for this.
,sabian.ro,2010-03-21T22:36Z,Tnx!
