User Type,Username,Date,Text
,Cristo,2010-03-01T04:40Z,@iesnes Not all anonymous uploaders are bad/ granted others use this as an avenue to ruin it for other people that want to use the option. Please comment carefully as your starting to look like spam.
,Enso95,2010-03-01T15:16Z,"What the fuck means: ... for dvd???
Strange, I don't trust this shit..."
,onlyjim,2010-03-01T17:42Z,can't download without seeders anyway.
,slits,2010-03-02T01:33Z,eh yeah I'm new that's why in my first upload I asked for opinions because these are my first 2 uploaded torrents so I wasn't sure what I was doing.
,slits,2010-03-02T01:35Z,so if you would like to help IM me on slit@aim.com
