User Type,Username,Date,Text
,Diamondsami,2010-05-06T00:00Z,"this didn't worked for me, it gave me authentication error please log in blizzard.com and download it again"
,Diamondsami,2010-05-06T00:02Z,my bad it loaded in my torrent client downloading it now tnx I've been waiting for this for a long time
,cosmicsha,2010-05-06T03:30Z,anybody get this working? i got the same error as camberol.
,cjlethal,2010-05-06T05:35Z,does not work
,ionlyknow,2010-05-06T15:49Z,"Nope does not work... 
Thanks for the upload anyway!"
,beamto,2010-05-07T00:31Z,"Here is the torrent for the DMG file :

http://thepiratebay.org/torrent/5540015/

:-)"
