User Type,Username,Date,Text
,bobshade,2009-12-31T20:34Z,does this have decent audio? the last 3 i tried had english audio recorded in a theater complete with spanish speaking audience complaining about the popcorn loudly 
,RIggsta,2009-12-31T21:08Z,"audio isnt that great, thanks anyways tho!"
,madtown4,2009-12-31T22:51Z,its the same audio as the rest . It says so in the notes !! I hope somebody gets good audio for this movie. Well it start on jan 1 2010 in the usa. so maybe we will get direct audio soon. good try to the uploader
,bobshade,2009-12-31T23:28Z,yes it has the same bad soundtrack. don't waste you time and bandwidth
,jafr,2010-01-01T10:20Z,"bedankt, en een happy 2010
gr. jafr"
,bos01471,2010-01-03T11:53Z,"beeld is goed , maar het geluid is een drama !!
hoe dan ook thx Uploader."
