User Type,Username,Date,Text
,hobowithashotgun,2010-06-23T01:01Z,Sorry for the slow dl times normally I will upload 2mb/s but my connection is incredibly fickle it seems. Either way enjoy the movie.
,westomopresto,2010-07-15T01:27Z,Thanks so much. I\'m downloading at 4 Kb/s.nWhich is terrible. Seed please people!
,hobowithashotgun,2010-07-24T04:44Z,"My new router is here so I can upload much better speeds, thanks for your patience enjoy."
,hobowithashotgun,2011-02-27T19:09Z,Since so many people have helped keep this alive I will put it on my permanent seed list so it will never die.(especially since this is the only dub rip on the website even perfect blues dub dissapeared.)
,ratwolf,2012-06-12T01:52Z,Thank you for uploding these weird move the torent is working great fast download and good quality also :)
