User Type,Username,Date,Text
,TommyBlade2018,2009-11-23T23:37Z,Thanks King
,salmannsu,2009-11-24T01:24Z,Great works. Please seed
,oldSMfan,2009-11-29T00:14Z,"Once again you've outdone yrself SM!!

Thnx! Thnx 4 all the movies, mate!
Incredible!!
Excellent quality, small size: Just Perfect!
Thnx for taking yr valuable time to do this!

:O)

PS: For those who do not know A = 10 V = 10. DL sample and you'll see it i the best quality around!"
,anyeuha_80,2009-11-30T15:31Z,Thanks so much! U're good guy!
,quenne14,2009-12-18T13:02Z,thank you so much!!! mmmmmwwwwwahhhhh!
,Perryy,2010-03-13T16:33Z,Thanks! A:10 V:10
,samik1989,2010-07-25T23:48Z,"hi secret-myth....i am big fan of your high quality rips....i have a request,can u pls rip & upload the movie ""in the mood for love""...bcoz the other releases(of this movie) here are quite grainy...hope u will upload one"
