User Type,Username,Date,Text
,conch2002,2009-12-28T16:49Z,Big thanks for this one.
,colourme,2009-12-29T09:29Z,"Thanks bunches. Quality is top notch! Took some time, but not complaining. Seeding now!"
,Skriknaton,2009-12-29T15:00Z,Thank you for this! I never thought I'd actually find it.
,Clurichaun,2009-12-31T03:31Z,"Thanks for this, my DVD recorder messed up and I missed it. "
,andie90,2010-01-03T16:12Z,"thanks for this, was halfway through it when it expired on bbc iplayer lol "
,Phaegian,2010-01-03T19:19Z,"Ugh, two separate files?  Really?"
,bretski666,2010-01-05T22:04Z,Ta!!!!
,yellowtreats,2010-01-06T19:47Z,is this the one with David Tennant?
,tilki,2010-01-07T04:37Z,Could someone tell me how to watch this? I just have to separate files full of .rar files and have no idea what to do...
,Har1equin,2010-04-18T09:11Z,"I use arc_convert.exe to create ZIP files and then extract those.

Downloading now as I need to review this before I have an Englishh class tomorrow (with a bunch of Spanish kids) that want to hear ""To be or not to be"" from an English speaker.

Oh Joy...!"
,shdwfire,2010-06-10T17:04Z,folks for series of rars like this the best thing to do is grab a copy of 7zip (if you don't have a copy of WinRAR)
,ElderBerryInk,2011-06-12T10:41Z,"@yellowtreats Yes, it's the one with David Tennant ^_^"
