User Type,Username,Date,Text
,LeoA,2009-12-08T13:51Z,sorry for anyone trying to seed this now...uni internet is having a mare...should be sorted within the hour.
,Durial,2009-12-09T17:17Z,thanks brah 
,ChronicalReece,2009-12-14T01:06Z,"Very fast DL
Amazing album, didn't expect less from Original Sin though..
Nice Up Leo, Ill keep seeding"
,SpitvenoM,2010-05-11T12:26Z,Thanks for the up man a friend at work told me to check the tunes out :D 
,richhie,2010-06-13T20:56Z,This is not the complete EP you're missing 1-2 songs
