User Type,Username,Date,Text
,westernfan,2009-10-08T14:43Z,Thank you.
,Xerok80,2009-10-27T05:21Z,Thanks again and thanks very much!!!!
,jandor09,2009-10-27T14:34Z,"Thanks! Xerok80. The quality is the same for everyone. Wait, has more. 
Thank you for the Seed."
,jandor09,2009-10-27T17:40Z,"Please, Xerok80. Sign up for forum: http://forum.suprbay.org/private.php?"
,cz48b1,2011-09-03T12:13Z,"Thank you *SO* much, Jandor. GREAT JOB!!! I saw this when I was a kid (30 years ago?). Good to see it again. Thanks for sharing. Seeding as long as I can."
,cz48b1,2011-09-03T15:05Z,"Thank you so much, Jandor. GREAT JOB!!! I saw this when I was a kid (lonnnnng time ago). Good to see it again. Thanks for sharing. Seeding as long as I can."
