User Type,Username,Date,Text
,themainegame,2009-10-24T15:13Z,Christmas has come early!! Thank you so much!!Please more pantyhose!!
,FAKMAN,2009-10-25T11:45Z,"THANKS A LOT MAN!!!!REALY LOVE PANTYHOSE AND OTHER LINGERIE VIDEOS!!!!!!!!!!!!
CHRISTMAS DID COME FROM OCTOBER THIS YEAR!!!!!
JUST CHECK THE LEECHERS........IT IS OBVIOUS THAT PH LOVERS ARE MORE THAN ENOUGH TO KEEP YOU GOING!!!!!!!!!
KEEP THOSE VIDEOS COMING!!!!!!!
EXCELLENT JOB!!!!!!!!!!!!!!!!!!!!!!!!!!!!!!!!!!!!!!!
"
,phoseluvr,2009-10-30T00:41Z,"Sorry Leechers, I seem to be having some technical difficulties with this upload. Everytime I try to start it UTorrent tells me that it is finished and the DHT and peer discovery are not working. please be patient while I try to work these issues out. If anyone has some insight or suggestions, please feel free to comment here. Thank you"
,phoseluvr,2009-11-06T02:11Z,"FAKEMAN and other interested parties....
I have just uploaded the remainder of my JBV POV FooJobs Collection. Check it out and enjoy!"
,Dhamatrix,2009-11-18T11:28Z,"What a collection!
Thank you again,again and again!!!
Can't wait for see more....."
