User Type,Username,Date,Text
,rpan79,2010-11-11T20:26Z,"Hallo everybody!!!

This is my first uploaded torrent, I hope you like it!!!

I need some backup from you, happy boys & girls :
Share with me this goooood music, and you wan't regret it! :)))"
,rpan79,2010-11-11T20:28Z,"And just more thing :

PLEASE SEEEEED !!!


Thanx :)))"
,CPT2000,2010-11-12T00:55Z,"Thanks for this great CD!
I am seeding this definitely."
,rpan79,2010-11-12T11:36Z,"Thanks CTP2000 for support! :)))

And bring some friends over here too! :)))"
,rpan79,2010-11-19T09:34Z,please seed...
