User Type,Username,Date,Text
[T],Quazza,2009-10-19T22:33Z,"Thanks for the comment! I'll trade you Glenn for Rush, sound like a fair deal? Haha

Thanks for the dedication to your uploads that you have had so far!"
,tym12001,2009-10-19T23:55Z,"mega conservative dittos to both of you, thanks"
,AladinSane1984,2009-10-20T00:11Z,"Komrades!  Fellow Politburo members - Komrade JWorbachev and Komrade Qruschev.
The download and seeding of Commissars Limaughsky and Beckputin will be followed in the current 5 year plan.  Long Live the Revolution!
The traitors trickdoodskyev, sitrometroff and other reactionary dogs will be charged, tried and sentenced to the gulag at Airo Aericanish.

Komrade Aladinoff Saneskyev
party member since 1989
Saint Petersburg - Soviet Republic of Florida"
