User Type,Username,Date,Text
,NitrogenUA,2010-11-04T21:59Z,"One cheap race, but gives you some taste of the game. Check it out."
,Jx9inc,2010-11-05T05:04Z,Will try it out once thanks for the upload!
,qzpogi16,2010-11-15T13:45Z,"Hey Nitrogen, i just heard that this game rocks! so pls upload the full version of this plssssss. btw(if you can do it now, that would be better.)hehehe"
,NitrogenUA,2010-11-17T10:13Z,Full version here: http://thepiratebay.org/torrent/5958517
,redfury91,2012-05-01T00:19Z,"do not download the demo unless you dont care about the settings. if thats the case, then go nuts. 
this game looks like it might be fun if it were possible to adjust the resolution and details. "
