User Type,Username,Date,Text
[V],Nepotu,2010-05-05T14:06Z,It's the last day of my seeding if no one else is interested in it. Sorry!
[V],Nepotu,2010-05-07T22:11Z,If anyone wish to download this and it doesn't find any seeder please write me a comment and I will see what I can do! 
,hary_fcb,2011-03-02T17:15Z,I would like to download...please tell me how to seed...thnx
,mescht01,2012-01-30T10:59Z,"Hey nepotu!!!

I would like to seed this one... because its just worth it! So maybe you just let me download it, then i will seed!

Cheers "
