User Type,Username,Date,Text
,skav18,2010-04-23T10:27Z,Can i get Just get Everready?
,cena1991,2010-04-30T13:27Z,"oh yeah...for sure...download torrent...and when you open it,just tick everready to download it...and untick everything else..."
,zerotone,2010-08-07T07:03Z,Awesome!!
,undead17,2010-09-01T20:40Z,Tech Tech Tech N9ne!!! Thanks for the download.
,cena1991,2010-09-02T12:48Z,"no problem,man! :D"
,aaront2013420,2010-10-10T20:26Z,"what is the best album :D 
heard alot bout them never listened tho"
,BigBoiG,2010-10-11T23:52Z,"@aaron lyrically? tech has always been a beast. Rhymes+Beats? 2006 - K.O.D, Everready, Sickology 101, killer Misery Loves Kompany. Ollie Gates is the new one -- its more industry though
"
,Childosun,2010-10-22T12:03Z,great download. love Strange Music. thnx
,imapiratetoo,2010-11-01T22:04Z,"holy shit thats a lot of tech n9ne songs!
thanks man"
,cena1991,2010-12-23T20:51Z,No problems mayne...as long as you listen to tech...i will not stop seeding
,bigboss22,2011-01-27T10:23Z,Yea cheers mate
,studio2420,2011-04-05T02:53Z,"missing some tracks. some albums are two discs, but only one is included. otherwise, great download."
,cena1991,2011-05-09T16:26Z,guys...when the new album comes out...i will update discography and post a link here in comments
,BigNicLRN,2011-06-18T12:54Z,"from what i see, you are just missing seepage torrent is legit though!"
,killthestate,2011-06-21T15:25Z,THANK YOU!!! Great up bro
,De_W_eY,2011-07-24T20:50Z,"@skav18

Hell naw you can't get just Eveready nikka! you act like you got something better to do, sit back, smoke a phatty boom batty, and let the flavor or T. NiNas take over your senses."
,Technician92,2011-08-31T00:06Z,Can someone seed plz?
,atakofdaviet,2011-10-23T22:05Z,Thanks a lot bro awesome upload . 
,Godsninja,2012-01-26T05:40Z,"Some songs skip on an ipod. I know for a fact that the song Jellysickle does at 42 seconds. Plays fine on my pc using wmp and even itunes, reset my ipod and still skips. I've heard a couple other songs skip too. Anyone else have the same problem ?"
,Godsninja,2012-02-09T05:15Z,a quarter of the songs are corrupt and skip on an ipod...
