User Type,Username,Date,Text
,suppurate,2010-11-27T02:22Z,v1.9.5 worked on Win7 Ultimate x64
,doncpierce,2010-11-27T03:55Z,Thx!!
,bithink,2010-12-20T09:05Z,thx..
,meroonberet,2010-12-26T21:03Z,"use chew-wga 0.9 or chew-wga 1.1. 7loader, windows7activator and ramoveWAT not support now. Windows 7 already get us and show us ""this copy of windows is not genuine"". I solved this problem with chew-wga 0.9"
,prius4845,2011-01-17T20:13Z,haven't used it yet but thankee anyway!
,hahalolfailmupp,2011-02-03T13:38Z,"@meroonberet , this works fine, installed it it a few days ago and still shows activated."
