User Type,Username,Date,Text
,jopie_venom,2010-05-02T11:30Z,seed please!
,AnubysTheGod,2010-05-02T13:37Z,Thanks man! You are a hero!   :)
,jopie_venom,2010-05-02T14:09Z,I was looking for the pal versions of monkey island for a while now......THX man
,mhvu,2010-05-02T16:30Z,Super!
,supagusti,2010-05-02T19:10Z,seeed !!!
,bwoy,2010-05-03T18:25Z,"Probably a great torrent but I think the uploader should activate superseed, initial seeding, or whatever. I know his uplink is capped but by now shit should've started to get a move on. Thanks tho!"
,Paratron,2010-05-05T10:23Z,"Hey, try this one to burn the wad files as iso:

http://code.google.com/p/3isosstudio/"
,enrque,2010-05-08T17:47Z,"excelente aporte, colega. de lo mejor desde hace tiempo.
gracias , gracias"
,wellithinkitsbooty,2010-05-11T15:08Z,Fantastic! Thank you very much.
,illiggall,2010-05-31T14:29Z,"i cant find these games:

super meat boy.wad
balloonfight.wad"
,illiggall,2010-05-31T20:42Z,"i did find out, that baloon fight dont exist, still looking for ""super meat boy"" you should check out a trailer of it"
,Zambini845,2010-08-06T10:03Z,"any chance any of these will work on NTSC?
I just unpacked my Wii after keeping it in it's box for half a year since moving so I've been out of the loop for a while"
,POLICEX,2010-08-18T20:33Z,you sir are a fucking star well done have a drink on me cheers ☺☻☺☻
,lzfilipe,2011-06-08T00:49Z,"Someone kiss that guy!!!!!! I said guy, not gay!!!!!!"
,bh0226,2011-07-16T04:16Z,Seed please :D
,leeflooper,2012-02-15T19:22Z,"I've not installed any wiiware on HBC before, will the channels be installed on the NAND? or will they act as forwarders to a root on SD/USB? or will need emuNAND?"
