User Type,Username,Date,Text
,annabelle31,2010-07-11T17:06Z,Thanks for sharing. As always you deliver excellent quality.
,annabelle31,2010-07-11T17:17Z,"Oops, turns out to be a DJVU file. Too bad, can\'t read that on my e-book reader!nnNow I\'m very sad... :-(n"
[V],malestrom_HH,2010-07-11T17:44Z,Sorry I didn\'t mention it on the title....:(
,annabelle31,2010-07-11T18:05Z,"Don\'t worry about it, seems I did not read the summary well enough (where you did mention it).nnYou are by far the most excellent uploader in the ebook section. If it was up to me you would have ten skulls already!"
,ivesper,2012-03-16T15:22Z,Thank you.
,maxjasper,2012-07-12T19:36Z,Thanks a lot bro
