User Type,Username,Date,Text
,darksider27,2010-05-14T03:11Z,pc pc version
,sunbleached,2010-05-14T18:17Z,"I really regretted d/L and wasting a disk on this game. Completely unoriginal, boring, and repetitive. Just fast driving punctuated by cutscenes of big explosions. And to top it off, if you or any other car gets destroyed, they respawn inexplicably and keep racing. Stupid...."
,xtracrossxx,2010-05-15T15:16Z,umm wers da pc version??:S:S
,hovo27,2010-05-24T09:40Z,Thanx very much Morck22 for your time to upload all this games. And please whoever dosen't like the games please keep it too your self Morck22 is not forcing you to download the games to be thankful that he is uploading the games for us. Once again thank you Morck22.
,Neuro_Belmont,2010-05-30T07:41Z,Thanks a bunch Morck! You the best.
,GodzEnemy,2011-07-01T14:44Z,Working?
,GodzEnemy,2011-07-03T18:54Z,Working? Doesnt work for me get error at 83% when burning
