User Type,Username,Date,Text
,jafr,2010-11-29T19:01Z,"hartstikke bedankt  voor alle moeite
"
,Realmovieman,2010-11-29T22:03Z,"Dit is de verkeerde Cornered,
Na het dowloaden krijg je de film uit 2008."
,MarkSpoelwaard,2010-11-30T03:59Z,"Petje af voor een retailversie van een film die op IMDB ""Not yet released"" meekrijgt. Beetje overwerkt zeker, vriend Hond?"
,Realmovieman,2010-11-30T07:06Z,@MarkSpoelwaard ik schrijf toch ook dat het de film betreft uit 2008 Cornered!
,gerardpipi,2010-11-30T13:39Z,volgens mij staat er toch echt 2010... maarja zal wel
,RastaPatje,2010-11-30T17:47Z,Luiehond werkt zich steeds uit de naad om ons gratis goeie films te bezorgen (waarvoor hartelijk dank!!!) Dan kan hem enig foutje wel vergeven worden he?
,Realmovieman,2010-11-30T18:56Z,@RastaPatje Ik geef hem geen commentaar ik wijs hem er alleen op deat het een andere film betreft die uit 2008
