User Type,Username,Date,Text
,tobbe333,2010-06-16T10:50Z,"WOW!
It work 100%
SHARK SPEED!!!"
,tobbe333,2010-06-16T10:53Z,"no virus !!!!!!!
SERBIA ROXX!!!!!
I WILL SEED!"
,muskinja1407,2010-06-21T17:24Z,"jebem ja tebi mater tebi i tvom kanter strajku 

Fuck This "
,baryaly,2010-06-24T16:08Z,Not Working :-(
,Dantes64,2010-06-26T18:56Z,"why conflicting comments? jooiiee3 pl clear up the confusion here. am downloading it anyway, and thanks"
,olmenvk,2010-07-20T15:32Z,"blows, IRAN-torrent has a far more awesome one, bet you just copied it of them.."
,Supafly12,2010-08-13T14:56Z,my avg free says its a trojan and deletes it on site.....
,isavatpb,2010-08-23T16:11Z,"It works on my Microsoft Windows 7 Ultimate 64bit edition, both in singleplayer with bots,  and on online  servers with protocol 47. You can find cool servers on this adress: http://www.gametracker.com/search/cs/
Don't forget to merge (double-click) ""CD-Key"" registration file in the installation directory in order to play!"
,TheFrix8,2010-09-06T18:31Z,Im downloading it.....ill comment later if it actually works!
,Flames_To_Hell,2010-10-03T12:11Z,I started downloading and it downloads 250kb/s. I hope its true it hasnt got a virus. I will say if it works fine.
,Flames_To_Hell,2010-10-03T12:19Z,"My AVG is not working, but i trust you."
,ACTAsucks,2010-10-31T15:50Z,Torrent downloaded  took about 5 minutes to download. I extracted and opened the file. Avg has detected virus. This has a trojan.
,prokay99613,2010-12-16T17:00Z,"yep, when i installed, my computer detected 6 trojans with spywares and keyloggers. it took me a few hours to reformat and write this comment"
,r1chee,2011-02-05T08:47Z,FAG!!!!!!
,1389,2011-05-02T13:17Z,Tooo CARE BRAVO super je!!! pozdrav...
,SPELES,2011-07-05T21:31Z,"Come in my server please 46.109.108.6:12345
This works perfect"
,Freyner,2011-08-04T12:49Z,"many viruses, i scanned with malwarebytes, Dont download.. http://thepiratebay.org/torrent/3825488/Counter_strike_1.6

better version"
,usama_khan1234,2011-08-05T16:55Z,"what's the CD key ?
and why does it force closes on windows 7"
,AidenHall1999,2011-10-20T17:15Z,"ty 4 this torrent, dowloaded quickly, much appreciated"
