User Type,Username,Date,Text
,klesus,2009-08-03T03:21Z,"2 episodes of naruto only 79.5 megs???
Yeah right!"
,msaadn,2009-08-03T19:48Z,"You Guyz always have a tough time looking at new things. Get over it! This is the real thing. 

People please become kind by writing a comment on the torrent you download so that others can see the Truth.

From now on you will always see a 40 MB normal episode and a 80 MB special episode. By Yours Truly. I do it myself and I do it right."
,NOSferatuu,2009-08-07T11:35Z,"msaadn...i've downloaded it and i liked it ...please keep up the good work...
and    klesus    shut your mouth when you have no ideea of what is this all about....
to all who are naruto fans, you should download this torrent ... because it's a good one with a nice quality"
,msaadn,2009-08-07T17:20Z,"I appreciate your comment NOSferatuu. Thank you. I'll keep doing it alright. 

It seems Taka has delayed their release for the next episode so until its released I can't do anything."
,Asiss,2009-08-08T17:22Z,"thanx a lot gr8 one  ...good quality in small size thanx a lot!!
"
,purva,2009-08-19T17:00Z,thanx man!!!!!!! u rock!!!!!!! gr8 quality........!!!!!!!! keep uploadin da gud stuff!!!!!!! mwah...
