User Type,Username,Date,Text
,m0rph3us2009,2010-01-12T18:11Z,"Sorry for the slow speeds, my connection is throttled to 100KB/s up :( I'll seed and seed and seed tho :)"
,Pizzabboy,2010-01-16T12:19Z,I'll be seeding this for while when i got it.
,Pizzabboy,2010-01-19T22:20Z,"Quality 10/10
Audio 9/10

Thanks for sharing"
,madsenwi,2010-02-11T20:15Z,And the 10th episode is in Italian!
[T],MrLore,2010-03-17T03:55Z,"Skip episode 10, it's in Italian with no English audio stream nor subtitles. Other than that annoyance, not bad."
,mrrmrr,2010-03-24T06:47Z,"Here is the episode 10 in the same size/quality as first 9 here (1.09 GiB):
http://thepiratebay.org/torrent/5189521/FlashForward.S01E10.720p.HDTV.x264-BiA.mkv"
,thegreatoneis,2010-04-02T22:20Z,Sort out title. This season is not complete. Show has not finished... Shame it wont be back for second season.
,1730DTLA,2010-04-08T03:52Z,"I was just about to pitch one over the fact that the last episode (s01e10) is in Italian and then I realized it'd been said before.

So now I'm not going to pitch one over the fact that the last episode (s01e10) is in Italian."
,boredfist,2010-04-13T19:24Z,"Good package, except that this is not the complete season 1. The season isn't finished yet and will have total of 22 episodes."
,blackbooster72,2010-05-31T07:56Z,please seed. it will take me ages to download this one.
,Whane,2010-06-12T19:01Z,"This is not the complete first season, there are 22 episodes in all, E11 and E12 aired all at once. E11 through E22 can be found here: http://thepiratebay.org/torrent/5623364/Flash_Forward_Season_1_E11-E22_(English)

I just posted the torrent."
,s20dan,2010-06-15T18:25Z,is this series any good? I read it was shit
