User Type,Username,Date,Text
,wastedbrat,2010-01-04T18:07Z,"to anyone who can please help me.

when i download torrents some of them are just 1 file for example a family guy file is 173MB, those i can download and play with VLC player.

But it happens a lot that the torrent is devided in 15 little file of each 19,0MB, and those i can download but I can't ever watch them after.

can someone please help me?
thx"
,cleanuploads,2010-01-04T20:01Z,I'm assuming you mean when there files like .r001? you just unzip the first file either something like .0001 or it will just be .rar/.7z etc. using something such as 7zip
