User Type,Username,Date,Text
,bruce356,2009-11-28T05:24Z,"Thanks very much ocw, you went to much trouble to reduce this to a 2m download. It worked perfectly for me - thanks again"
,ocw,2009-11-28T06:36Z,"I'm glad you like it. Do help to seed whenever you can, since it is just 2MB. :)"
,jorgen213,2009-12-11T17:11Z,Thank you!! You saved my day! :D
,ocw,2009-12-14T13:00Z,"Thank you, jorgen213. Please help to seed whenever u can. :)"
,billiongate,2009-12-16T07:29Z,Thank you very much.  No Virus.  You are amazing.
,ocw,2010-01-07T05:21Z,Thank you for your endorsement. Do continue to help seeding this if you can. :)
,riley94,2010-01-22T02:50Z,trend micro warns Dialer_Playgames  spyware??
,ocw,2010-01-31T12:51Z,"Ok, it seems that this ISO image file does not work with the latest WinTV version 1.3.

Those of you still seeding this, you may stop seeding already while I try to come up with another concise image for version 1.3.

Thanks for all your seeding efforts so far."
,ocw,2010-02-05T08:55Z,"For installing WinTV version 1.3, please use the ISO file here:
http://thepiratebay.org/torrent/5337198"
,anybody2k,2010-04-28T15:16Z,Thank you very much! This saved me hours of digging for the CD in the house & basement!
,midurix,2010-08-12T15:31Z,"version 6 for my old pvr-250 wouldn't work with this version, but it does work with your new torrent so many many many thanks! "
,chriszuma,2011-01-09T00:19Z,"This doesn't work with the newest version of WinTV 7. It says ""incomplete disc.""

I guess they are onto your game."
,apzoeiruty,2011-01-26T20:27Z,"Thanks !
Monted it on letter BEFORE H.
Installed WinTV v6
Installed 
http://hauppauge.lightpath.net/software/install_cd/wintv6_cd_4.6b.exe
for my old PVR 150.

Worked like a charm !
Thank you releaser !"
,crimson85067,2011-09-11T23:41Z,Missing dll not working
,donteddy,2011-10-26T03:30Z,ty
