Filename,Size,Unit
"/Living For Death, Destroying The Rest/01 Nothing Defeats the Skull.mp3",9.67,M
"/Living For Death, Destroying The Rest/02 Graveyard Vandalization.mp3",6.7,M
"/Living For Death, Destroying The Rest/03 Brainwasher C.1655.mp3",8.62,M
"/Living For Death, Destroying The Rest/04 Fiends in the Mountain, Ghouls in the Valley.mp3",8.34,M
"/Living For Death, Destroying The Rest/05 Spyborg.mp3",11.11,M
"/Living For Death, Destroying The Rest/06 Traitor's Blood.mp3",10.85,M
"/Living For Death, Destroying The Rest/07 Beware the Thrash Brigade.mp3",7.16,M
"/Living For Death, Destroying The Rest/08 Sewers of Doom (Dethroning the Tyrant Part 1).mp3",10.51,M
"/Living For Death, Destroying The Rest/09 Darkness Never Ending (Dethroning the Tyrant Part 2).mp3",12.93,M
"/Living For Death, Destroying The Rest/10 Revolution of Underground Legions (Dethroning the Tyrant Part 3).mp3",14.13,M
