User Type,Username,Date,Text
,tordajav,2010-02-22T03:05Z,Like always THANKS FOR THE NEW RELEASES!
,onlyfred,2010-02-22T18:48Z,Thanks for being consistent and very very prompt
,a_ross84,2010-02-22T20:29Z,Cheers mate. always reliable.
,CudBeShudBe,2010-02-25T11:51Z,cheers dude ;)
,mu57i11,2010-02-26T01:19Z,"These might all have been converted to 320, but I dred to think what they were before the convertion. Also, they could have done with a bit of normalisation as far as the volume goes. -1."
,Bebras2,2010-03-05T02:50Z,damn thanks
