User Type,Username,Date,Text
,prtscrn,2010-05-11T11:24Z,Virus! Don't leech!
,astuz,2010-05-11T11:36Z,OMG are you serious... its a god damn keygen it means any virus program would detect it even my AVG did you dumb fuck. go back to picking your zit face... and stay the fuck away from a computer because obviously you do NOT know WTF your doing.
,snapshot88,2010-09-15T20:15Z,Yeah what he said!
,Kamrawintje,2011-01-26T11:09Z,Is an older version from Xilisoft but works fine for me...
,chrismaybury,2011-03-01T14:07Z,"Worked absolutely fine for me, prtscrn does not have a clue what he is talking about!"
,r4t,2011-09-30T16:13Z,Thanks Astuz got it registered dont listen to this morons all the idiots come to TPB it worked great dont worry about the moron Thumbs up no viruses with eset nod32
,Agent666,2012-06-09T18:10Z,"Thanks for the application astuz!

Worked perfectly.
There is NO virus.

When using the Keygen make sure you have selected AVI to DVD Converter in the popup!"
