User Type,Username,Date,Text
,dangerous-rico,2010-02-22T12:08Z,can you play it offline and is it ntsc or pal
,oneill5054,2010-07-30T10:01Z,anyone else having trouble with this one? tried burning it with DVD-Decrypter but my chipped ps2 couldn't read... so any suggestions?
,mrkiwibro,2011-02-19T16:22Z,"For anyone wondering, yes, the game can be played offline.

I've tested the game using ESR and it works fine."
,Overgad,2011-08-02T14:39Z,Speed plz
,Winterwisp,2011-08-25T02:50Z,Seed please.
