User Type,Username,Date,Text
,scurvypirate1234,2010-11-29T06:05Z,Why is the file size so small?
,kopadopa,2010-11-29T15:38Z,"Great quality 
A - 10 
V-10"
,tfmoffat,2010-12-01T16:18Z,All works just way you said thanks for download good work
,altern8,2010-12-02T00:23Z,"This is an ISO file that doesn't open with MagicIsomaker. 

So i wasted a disc and direct burned it, then it's a shitty m2ts file, they always convert skippy.

It's a big waste of time and effort unless you're looking for a m2ts file."
,altern8,2010-12-02T00:24Z,"But I will say the quality of the m2ts file was perfect
A10/V10"
[T],HD-R-US,2010-12-02T01:39Z,"@altern8 

Please stop misleading other community members because of your own ignorance, and unwillingness to read.

""This is an ISO file that doesn't open with MagicIsomaker."" - already stated in the torrent's release notes, AND the reason why.

""It's a big waste of time and effort unless you're looking for a m2ts file."" - All Blu-ray, HD-DVD, AVCHD, MKV video files are .m2ts. They are just in different containers or file/folder structures, so they are either all ""skippy"" as you put it, or none are."
,Ckouna,2010-12-02T22:17Z,"Thanks a lot for all the nice HD rips !
Quality's perfect !"
,JohnnyGhost,2010-12-17T04:22Z,Cinavia - this no worky on PS3 and Bluray Players. Somebody please Hack Cinavia ASAP. Sony needs to know that spending a fortune on a team to come up with this crap is Futile. sooner the better
,almundo,2010-12-17T13:40Z,"Great movie!

Great Rip!

Great quality!

Great AWESOME!!!!! And for anyone who wants to open the .iso, you can download PowerISO, which extracted it perfectly
Just search the site for the app and crack!

::DDDDD"
,Yomanii,2010-12-19T11:44Z,How do i add subtitles on this? my movie just stop playing when i drag my subtitles on it. Using VLC media player. 
,Sebianoti,2010-12-19T13:34Z,"What the hell, i spent a week downloading this, this stole my bandwidth so i had internet speeds of 0.30 out of 25, and all this pain for what? an empty iso file?"
,Sebianoti,2010-12-19T13:36Z,Or ignore my comment... and use Daemon tools 
,torres1111,2010-12-19T14:12Z,"Thanks for this! For me it's the right format so couldn't be better. Looking forward to see if the quality lives up to my expectations, but I think it does."
,florin1987,2011-01-02T03:43Z,the rip is great and for those who havent been in the pirating bussines for a long time dont burn the iso mount it with deamon tools or magic iso virtual cd dvd manager google it its free 
,Dicky20v,2011-01-09T04:52Z,THX For your great post... ;)
,Dicky20v,2011-01-09T04:54Z,THX for your great post... ;)
,gecina,2011-01-21T12:43Z,"Hmmmmm.....dobio sam ono sranje od upozorenja.... cinavia je stavila neku zaštitu i zato se zvuk izgubi, a u donjem dijelu ekrana se vidi neko upozorenje o toj zastiti....... googlam, ali izgleda da nema pomoci.....pokusao sam mijenjati postavke zvuka na konzoli, ali nekima pali...a nekima (meni) ne......."
,gecina,2011-01-21T13:56Z,"a, vidim da vas ljudi vec ubijaju s pitanjima o ovoj zastiti........nista momci......ako nesto izgooglam, javit cu, valjda ce se to rijesit nekako...."
,inyualex123,2011-01-30T23:42Z,SEED please comeon its going 20kbps
,lxuethc,2011-02-01T14:42Z,Use daemon tools to load iso
,tyrabit,2011-02-14T17:13Z,"just downloaded the latest version of daemon tools lite and nothing, this iso cannot be opened on my comp. so, in a nutshell, don't bother downloading this, there's proper releases of this movie all around tpb."
,nnizmoog,2011-02-28T02:17Z,"Audio mutes part way through on PS3 (v3.50).  Only time I've ever had any issue HD-R-US' torrents.

I have never been able to open these files with Daemen tool lite.

That said, I will still look for HD-R-US' work first!
.. quality is just that good."
,taniak9,2011-03-08T23:19Z,Audio mutes in this movie because it have Cinavia protection on the audio.
,Nunogod,2011-04-23T00:01Z,"Stop complaining about .m2ts files.
They have it's bugs, ofcourse. I can't add Subs in VLC to these videos but It sure is a hell of an HD MOVIE! GZ on uploading"
,FlawlesSin,2012-02-07T07:09Z,Can I Watch this on VLC>
