User Type,Username,Date,Text
,unknown49000,2010-04-23T04:48Z,"thanks eztv, way better than sum dick that wasted our time wit a fake torrent. "
,FieroGT,2010-04-23T04:55Z,"uhh, is it me or is the audio WAY outta sync ?...\
tried it on 2 diff systems.."
,FieroGT,2010-04-23T04:56Z,hmm looks like that was the other 1.. this 1 is ok.
,sgt_slaughter,2010-04-23T09:19Z,"the whole episode is out of sync, not good!!"
,honeybunny28,2010-04-23T09:20Z,subs: http://www.addic7ed.com/serie/The_Vampire_Diaries/1/19/Miss_Mystic_Falls
,vampire22,2010-04-23T09:49Z,yeah.. it's out of sync.. 
,saielkhan,2010-04-23T09:56Z,i wana download this but whats da audio like
,KNFr,2010-04-23T12:28Z,This one is good! thanks eztv
,sammygirl24,2010-04-23T13:21Z,Thanks eztv you are the best
,charlton2142,2010-04-23T17:53Z,Still outta sync for me :( I guess ill stream it
,Gailamir,2010-04-23T22:35Z,Worked for me. Big thanks.
,cdawg323,2010-04-24T01:08Z,"Just use VLC to watch it and if its out of sync just sync it yourself, takes 2 seconds to adjust it within VLC"
,cdawg323,2010-04-24T01:09Z,"Just watch it in VLC and if its out of sync then sync it yourself while watchin it, it takes 2 seconds"
,polinaaa,2010-04-24T05:23Z,:)  thank you so much
,chrisar,2010-04-24T11:34Z,really out of sync
,TexasChainsawMassacre,2010-04-27T21:56Z,"I have started a swedish The Vampire Diaries forum! :) 

http://www.punbb-hosting.com/forums/TheVampireDiaries

All of the people who understands or know swedish can join!"
,deceptions82,2010-04-28T08:26Z,"Good reload. Other one audio is out of sync, this is great :o) Thanks for seeding!"
,searcherno,2010-06-17T19:07Z,"Thanks, your effort is appreciated."
,swimzy,2012-01-04T19:11Z,thanx:)
