User Type,Username,Date,Text
,Blademaster7,2010-03-11T18:18Z,"WHAT THE FUCK HAPPENT grrrrrrrrrrrrrrrrrrrrrrrr SHIT CONECTION it stops at 99,4% and nothing................."
,aimaviruspro,2010-05-12T14:06Z,man this really is a deception!
,Maiko22,2010-08-02T23:39Z,"Den stannar inte, 100% Nice"
,jkbulan,2010-09-16T17:22Z,how do you put a picture in your torrent?
,mike1247,2010-10-19T16:04Z,is this working ???guys!!
,ihsrahammishra,2010-12-27T10:33Z,fake torrent(sucks)
,scorpioney,2011-03-30T11:58Z,"dude, when i RW it to a DVD it dusnt show anything now what?"
,pianicata4,2012-05-06T10:49Z,you will have to run dolhpin first and set its configuration to make this work you will need high pc
