User Type,Username,Date,Text
[V],DieselHopper,2009-08-11T21:39Z,Moved to Audio > Music
,outlawguy89,2009-08-13T13:35Z,"LOL, half a million dollars? That's hilarious.  Poor sucker."
,DaddyBerg,2009-08-13T13:37Z,"Nice, hehehe."
,Jasper100,2009-08-13T13:41Z,"i'm already seeding i've heard of it from p2pnet.net he mad this didn't he!

fuck riaa
yeah we're free remember !!!!!"
,braesideboozas,2009-08-13T13:42Z,"shame mate...you got FUCKED...he he he
sorry"
,ddlover,2009-08-13T13:50Z,"Who gets the money?? 
The poor rock stars
Well it looks like some of them havent eaten for a long time!! haha"
,delpieric,2009-08-13T14:06Z,I'll download it in spite of there being three or four listenable tracks in there.
,prtscrn,2009-08-13T14:13Z,"Cool, will grab this to.

Thank you RIAA!"
,prink10,2009-08-13T14:50Z,looks good - gotta d/l this now
,countersweet,2009-08-13T14:52Z,fuck mafiaa and rock on\m/
,megazed,2009-08-13T15:09Z,shitty music
,blessphemy,2009-08-13T15:12Z,dumb
,shaique2,2009-08-13T15:12Z,awesome man I'm also downloading this stuff...!!!
,rattman012,2009-08-13T15:29Z,I hate the RIAA. They can rot. The artists dont get any of that money that joel is paying the RIAA so to hell with them. I buy cds but at 9~13 dollars and rising I just cant afford to buy many anymore.
,esparhawk,2009-08-13T15:31Z,as someone who doesn't currently have a job :( i cant afford to by my games or music so thank god for tpb :P
,JonWitham,2009-08-13T15:33Z,I too downloaded them! Seeding Forever :P FUCK YOU RIAA
,g4bb3r,2009-08-13T15:41Z,"@ rattman012 >> I buy cds but at 9~13 dollars and rising I just cant afford to buy many anymore. 

no shit and u get em cheap .. over here they,re charged 28.80 $ per cd."
,vike,2009-08-13T15:46Z,riaa rhymes gnaa
,kaysindre,2009-08-13T15:50Z,"And Here is the playlist =)

http://www.yourspotify.com/all-playlist/joel-tenenbaum-track-list-hugs-to-the-riaa-dj-joel-the-675-000-mixtape"
,irregular07,2009-08-13T15:58Z,"Downloading and seeding just for the pleasure to... F**K RIAA
I don't even like this music!

...just for the pleasure."
,kaysindre,2009-08-13T16:21Z,"Spread the Spotify list to 3 other sites...

Now to torrent it anyway =)"
,ReasonsUnknown,2009-08-13T16:25Z,Suck it RIAA.
,jadotben,2009-08-13T16:31Z,"WTF ?!?
475000 ? for 30 songs !
I believe many of us would have to pay billions if those *#%*`§ of RIAA would get us !"
,jadotben,2009-08-13T16:32Z,475000 Euros ?!?! Unbelievable !
,La tierra de los Muertos,2009-08-13T16:37Z,crap music
,bluleprechaun,2009-08-13T16:44Z,"Guys its $675,000... thats enough money for 6 months supply of champagne!!
...
RIAA kiss my big plompers"
,bluleprechaun,2009-08-13T16:46Z,Joel ain't got a taste for good music!
,lostinamsterdam71,2009-08-13T16:51Z,I'll download to show my support to Joel
,Beastilio,2009-08-13T16:52Z,Fuck em
,Sundive101,2009-08-13T16:58Z,I hate all the bands listed.  But I'll download for support.
,kamahl90,2009-08-13T17:06Z,"lol, I don't like the music, but this torrent is hillarious :D"
,GanDeeva,2009-08-13T17:11Z,"Crappy music, but I shall download this out of principle.
Lets make those songs the most pirated on the internet :)"
,kcowbubo,2009-08-13T17:18Z,"How about the bands which are listed here? How about these punkrock bands is it fucked in the ass by RIAA too? Don't they have any control on this case, and how can it support this idiocracy?"
,budum,2009-08-13T17:20Z,thank's awsome band's dude \m/
,reverse_engineer,2009-08-13T17:23Z,I too downloaded them!
,polarbear6,2009-08-13T17:25Z,well it aint showtek and tatanka but i will download it for you joel 
,ShineEyes,2009-08-13T17:31Z,Does this mean Pirate Bay isn't selling out after all? Are they actually fighting back!? :D
,e3poso,2009-08-13T17:36Z,Death to the RIAA! Free music!
[V],lan3y,2009-08-13T17:47Z,"im richer than bill gates right now :P

lan3y"
,thunderknuckle,2009-08-13T17:50Z,"$22,500 per song?!? Suck my balls, RIAA! Come get me."
,atleast,2009-08-13T17:51Z,"FUCK RIAA!

WE'RE WITH JOEL!"
,tpb_mvp,2009-08-13T17:56Z,lol. the MPAA & RIAA would sentence me to death if they were to go through my hard drives! ;)
,tvdw,2009-08-13T18:28Z,"Will not just download, will seed too"
,jcs_one,2009-08-13T18:41Z,"with all the music i bought thru out the years i probably put 2 or 3 of they rich ass riaa kids thru school and by the way i go to a lot of shows so i do support the artists 
money is the root of all evil
download on my people"
,jamestaylor,2009-08-13T18:43Z,Suck on this RIAA
,kcowbubo,2009-08-13T18:45Z,"Heh, my mistake, not much of punk rock here...."
,peter805,2009-08-13T18:46Z,Fuck RIAA!
,Plenoxia,2009-08-13T18:46Z,"Why would RIAA put such bad music? killing me softly by fugee? Ready or Not by them is definitely where it's at

@cornel21x3
seriously? that is ridiculous.. artist should be getting much closer to majority of profit"
,dmov287,2009-08-13T18:55Z,"FUCK YOU RIAA
see, i'm downloading them right now xD
btw, tennenbaum's really got a bad taste of music :-(

the dinosaurs couldn't adapt, so they got extinct. the same destiny will come to the content industry's dinosaurs, and we're all looking forward to that day =)"
,wisol,2009-08-13T19:02Z,Really bad music but im downloading and seeding to just to put a finger up to those bastards at the RIAA
,abrahammo58,2009-08-13T19:12Z,"These tracks really sucks imo, but i'm downloading and seeding them anyway just because... well, because."
,mytton123,2009-08-13T19:29Z,No thanks..
,wtfseed,2009-08-13T19:30Z,wow for only 30 tracks? dude if they get me I'm fucked...
,gonzoboezinge,2009-08-13T19:35Z,They can send me a bill for a couple of billion...for me to poop on.
,OnnCo,2009-08-13T19:57Z,"LOOK at me I am downloading...mhmmmm feels good to download...!


!Fuck you RIAA!

"
,badenser,2009-08-13T20:02Z,"I too downloaded them!

BREAKING THE LAW -never been so easy"
,cassgreen,2009-08-13T20:07Z,"FUCK RIAA!!!!!!!!!!
AS IF THE PRICE OF CD'S WILL GO DOWN...
HELL YEA I'M DOWNLOADING ALL DAY EVERY G*DDAMN DAY!!!!!!!!!
I DON'T FEEL LIKE BUYING EXPENSIVE CD'S MAKING OTHER PEOPLE BUT ME RICH... FUCK THAT!!!
THE NETHERLANDS, AND THERE ARE A LOT MORE LIKE ME, TRUST ME!!!!"
,2hot1Btru,2009-08-13T20:11Z,"Wow a lot of hostility going on here. Just to let the RIAA know i have downloaded this and i am seeding. Come hit me up for a half Mil bitches.

Fuck the RIAA. Dirty assholes "
,tjerge,2009-08-13T20:12Z,I too downloaded them!
,liseldisel,2009-08-13T20:13Z,"""I too downloaded them!"" :+)

$675,000 -
"
,lamerfor,2009-08-13T20:28Z,"I will just download it for support.

HAIL TEH PIRACY!"
[S],B.S.O.D,2009-08-13T20:30Z,"lol, usa laws are sad"
,wardjj,2009-08-13T20:32Z,"Very good initiative! I'm gonna download it!

Thank you RIAA, may I pay you too $675,000? Please? "
,HawkElite,2009-08-13T20:35Z,"crap songs, but downloading to show support"
,baba_novac,2009-08-13T20:35Z,"I too downloaded them!

music should be free !!!11"
,nimbus123,2009-08-13T20:35Z,"I guess I just HAVE to d/l this to show some support =)
Done!"
,nimbus123,2009-08-13T20:37Z,"BTW, I thought of never buying any of the songs on the list. Then I thought wait, the artists will be suffering.
Then I thought.. hehe, well maybe they will put pressure on the RIAA then.... just maybe"
,DSpider,2009-08-13T20:46Z,"This reminds me of that font pack costing over $55000 because some of them were $10-15 a pop and there were a lot included... That was probably the most expensive thing I've ever downloaded.

You're telling me this is worth even more ? I highly doubt it. They're such old tracks... Beastie Boys ? Come on..."
,gustabr,2009-08-13T20:47Z,"F
U
C
K
Y
O
U RIAA =D
I'm downloading it too!!!"
,Yoshimo,2009-08-13T21:00Z,"I, too, downloaded them!

And I will seed them for a while. ^^

But it is bad music, except ""Californication""."
,new_punk,2009-08-13T21:00Z,"Hahahaha, take that RIAA.  

You make an example of 1 person and everyone gives you the finger.  

How's suing people working out for ya, you bunch of jerkoffs @ the RIAA?"
,jaketm54,2009-08-13T21:01Z,"d/l im still amased the ""industry"" hasnt seen the full makerketing potential free downloading has."
,jaketm54,2009-08-13T21:02Z,err= marketing ;)
,Seetherfanv1,2009-08-13T21:04Z,"Shit Tracks, but fuck it ill download just to support it, FUCK YOU RIAA!!!"
,soadstas,2009-08-13T21:05Z,i am trying to post this on my facebook account but those motherfuckers have blocked the pirate bay posts....stupid facebook
,hydrodynamic_ot,2009-08-13T21:09Z,I'm rich!
,soadstas,2009-08-13T21:09Z,very nice seeding guys!!! i dl it in only 3 minutes..everybody is seeding if they have a cause.keep on guys you are great!!!
,cuntsauce,2009-08-13T21:13Z,"This kind of music is not my taste. I'm rather sure that most of the music that people download is not good and will be deleted.
 But this is political and we have to help to keep the flame flaming hot !

I found another music which is good, soo good that I want to buy it, real version. But not possible to find on internet except for a strange site called ""CDON. se"" where they want 100$US for a 2 CD box !!
The Boxes are ""Ambient Lounge"" 1-12.  (except for the last one (30$US) I want the complete series of 12x 2CD's = >1000$US... (max 300$US for complete set, 12 albums) Forget that!  Music industri is strange."
,trainwreck73,2009-08-13T21:23Z,"I'm now $675,000 richer.
What if they spent this much energy and money on doing this world a favor instead of raping individuals?"
,Agarock,2009-08-13T21:23Z,"jävla (RIAA) , btw i love This Song Aerosmith Got A Gun !"
,frankeeboy,2009-08-13T21:26Z,UUUUUUUUUUPS .. i downloaded theese as well now .. guess ill have to seed .. FOREVER !
,fang_x,2009-08-13T21:27Z,"I too downloaded this!

Have alot of these songs already though.
"
,thehillproductions,2009-08-13T21:33Z,I'm downloading like there's no tomorrow!
,Itanium2,2009-08-13T21:38Z,"I, too, downloaded them!

fuck those assholes !"
,joia007,2009-08-13T21:41Z,"Fantastic idea, TheSaint!!! I have d/l it and will seed it for a long while!! F*** the RIAA"
,Milosh21,2009-08-13T21:51Z,"hahaha, I even dont like tracks that much but i will download this and seeeeeeed!!!! I'll be billioner!!! 8-)
LONG LIVE PIRACY!!!!! 
LONG LIVE PIRACY!!!!! 
LONG LIVE PIRACY!!!!! 
LONG LIVE PIRACY!!!!! 
LONG LIVE PIRACY!!!!! 
LONG LIVE PIRACY!!!!! "
,DeepSpaceFreelancer,2009-08-13T22:12Z,"Personally I think this is a shameless self promotion form Joel.
He will not be amended, but in the mean time he will spread his shit.
The songs are not bad, but currently I do not need this music..."
,PingPang,2009-08-13T22:13Z,add me to the criminals....
,thewallis1992,2009-08-13T22:14Z,"I hate the majority of this music, but I am seeding FOREVER. :)"
,kimlukas,2009-08-13T22:14Z,"i registered so i can write a comment in support of all this, not only downloading and seeding, i am burning copies on cdrs and will give them free to people around me.

DEATH TO THE RIAA "
,SearinoxNavras,2009-08-13T22:30Z,"You can't act so low under the public attention and not expect retribution. For Joel, for net neutrality and for the 'rights' to share cultural content as freely as was left by nature."
,Poodrdt,2009-08-13T22:33Z,"Most of this is imo crap, nevertheless I download it for no reason. Send regards to Riaa)))"
,gregersamsa,2009-08-13T22:33Z,"I don't like his music taste. I can't even begin to understand how the US turned from a country built on freedom has turned into a small police state that actually has allowed the music mafia to persecute ordinary people like this, that is beyond my comprehension."
,KOF[FST],2009-08-13T22:38Z,"I already have most of these tracks here, but just to support it I will download, fuck you RIAA just like some people here said, you make an example of one and every one gives you the finger... terrorist from 9/11 should just have attacked the riaa and mpaa buildings hahahaha bunch of jerk offs idiots..."
,govnar,2009-08-13T22:42Z,"I already have all Nirvana albums and some of NI?. But other bands from this list sucks, so I won't download it. I don't know who Joel is, but I think he is not a wise man listening to all these crap like Eminem or Blink."
[T],insinuendo,2009-08-13T22:58Z,"when did wisdom begin having anything to do with the music you listened to?

oh, right, WISE people listen only to Shostakovich or Handel.

excuse me for being different!"
,overbyte,2009-08-13T23:23Z,"just finished dl'n + will seed forever woo!

@kimlukas that's exactly what i had on my mind."
,partyhero,2009-08-13T23:35Z,AND NOW THE SEED GATES WILL OPEN! AHHHHHHH!!!
,tixan,2009-08-13T23:36Z,"Downloading/seeding to support, not exactly a fan of outkast xD"
,mrlyons007,2009-08-13T23:42Z,A wise man once said...  TRANCE 4 LIFE
,hsas122,2009-08-13T23:45Z,"YEAH !
great music, i love ur taste...gotta love some Nirvana music..

but u should have put the album art pic, so it would look more official...but hey, all tracks r tagged perfectly...

pissing the RIAA forever !!!!

oh btw, u r my hero !

FUCK OFF RIAA, UR THE DEVIL !!!!

seriously, i've download this torrent twice, and im seeding right now...good luck, we're all with u.."
,irishbill,2009-08-13T23:49Z,Bunch of RIAA fuck-bags. I'm on disability and paying near £15 for a cd is a fuckin joke! Downloadin AND seedin ya bunch of fuckin big girls blouses!
,baotica,2009-08-13T23:54Z,"Those fucking americans, they are a modern Romans, and contrary to the the general opinion today, but for the people who were not Romans back then they were bunch of assholes who plundered and killed other people for gold and to enslave.
Made them self rich on other people misery.Today in america any idiot can made a fortune with a single song, not fair, in other countries you can be as good as Rolling Stones and play for 30 years, and still in all that time you can not make tiny part of the money let's say Britney fucking Spears made by one fucking single.
I say, let the musicians earn most of thair money on concerts and live performing, selling rights to play their music to tv stations,radio stations,restaurants etc...
Anyway, I say this, music,movies,games, should be free for private and personal use after certain period of time after industry and creators has made a bulk of the profits, lets say 6 months to a year.
Music,games,movies and like, are not like cars, houses, or other material things for which you must use raw materials that are not in limitless supply, and therefore you can not make them free after period of time.But copyrights on intellectual property should be made void after the certain period of time.At least for private people.
For example, if pharmaceutical firm invented some drug, they can have exclusive rights on selling and making only for couple of years, after that, everybody else can make their version of the drug, of course that version all being the same thing even if named differently, so why would entertainment industry be any different."
,flashswiss,2009-08-14T00:05Z,"@baotica got the same opinion as you.

I am so proud that I never ever bought a Music CD in my life! And know everyone can see why...

already uploaded 2500mb :-D

some RIAA math:
2500mb / 177mb = 14
14 x 675000$ = 9450000$ 
the RIAA have to pay me nearly 10mio $, because I distributed their crappy music all over the world;-)"
,iTPB,2009-08-14T00:29Z,"FUCK OFF RIAA

We share asking nothing in return. We make sure people who can't afford things can have entertainment to. We buy things when we are able, and we support those worth supporting. 

I REALLY think the government in ALL countries and the RIAA should REALLY consider what they are doing. There are millions of people who whole heartedly believe in file sharing. Putting innocent people behind bars and trying to get money from people who have none to start with is going to cause one helluva revolution. 

Look how many people came to the aid of one SINGLE person like Kevin Mitnick for being thrown in jail. When you try to take the entertainment from millions... picture that. I for sure stand tall head held high and will be one of the people who are willing to take you guys on. I have nothing for you to take but I damn well will stand up for everyone. Feel free to fine me or toss me in jail I'll go proudly head held high. What we do is NOT stealing. Sharing asking nothing in return is innocent and kind. Charging people 20+ dollars for a disc of plastic that someone is going to watch once is criminal. Not even to bring up the fact that a LOT of us if we've downloaded something and like it save to buy it for the ridiculous sum you ask. 

RIAA claims billions of dollars loss with digital entertainment. Wanna know why I don't believe a fucking thing you say? EVER SEEN MTV CRIBS? Our musical artists and actors still have 10+ cars and 3 pools and movie theaters in their homes. Don't tell me shit about how we are thieves hurting people. "
,iTPB,2009-08-14T00:34Z,P.S. RIAA - MAKE AN EXAMPLE OUT OF ONE OF US AND HURT SOMEONE AND THERE FAMILY ... HERE IS US MAKING AN EXAMPLE OUT OF YOU. TRUST ME THERE ARE FARRRRRRRRR MORE OF US. AS FAR AS I'M CONCERNED THIS MEANS WAR! 
,OttoBismark,2009-08-14T00:35Z,"same as most people commenting, wish I didn't have to have limp bizkit in my computer, but out of principal, thanks @TheSaint"
,soggyorigami,2009-08-14T00:50Z,"What I find funny is when the RIAA cries about loosing billions, when the people who download the songs would most likely have never bought the CDs in the first place. There's absolutely no money lost.  The figures are based solely on a theory that they could have made that much more money if the people had actually purchased the CDs. Not to mention that most of the people who pirate (In America at least) are from the poor blue collar working class. People who can't afford to spend money frivolously on things past bills and necessities. If you can broadcast a song on a free for the public medium like radio, then those people should be allowed to record and own it for themselves."
,jerka_1991,2009-08-14T00:50Z,"folks im upploading on dreamhack! 40gigabit^^
i will seed to the end!!!
RIAA suck me!"
,warbug1,2009-08-14T01:01Z,"I already have most of these tracks here, but just to support it I will download, fuck you RIAA - you guys suck to the core. Whore!!! you should be fuckin ashamed of your existence RIAA"
,Geodinos,2009-08-14T01:04Z,"Nice, download speed of almost 3Mb/s xD If all those people would seed not only today, but on every torrent they download, torrents would be a lot more fun. Btw, if RIAA would search my HDD i would be f*cked for like a billion dollars :') RIAA and BREIN can suck my balls... Do they watch Cribs? No!? I do. They certainly don't need my money. "
,upwithevil,2009-08-14T01:07Z,Here's a big middle finger to the RIAA as I download music I either have already or aren't interested in.  It'll go on my zillion dollar hard drive!
,TheDarkBird,2009-08-14T01:17Z,"jamem, lad os da bare fuck de der riaa bønder up, længe leve piraten aaaahhhh"
,finny6,2009-08-14T01:22Z,riaa can suck my fucking balls
,haohmaru12,2009-08-14T01:30Z,"this music sucks bad , only idiots can listen to this crap ...listen clubbing music you fucking idiots , i don't know how ppl can like this kind of shit , anyway ...i am downloading this too for support ...for everyone who wants good music get your asses on soulseek and share all your music HD "
,pettson93,2009-08-14T01:32Z,"Oh i think im going to sell my hard drive it most be worth more than the US goverment, also...

Dear RIAA,

Fuck you.

Best regards
Me 
???????????????
???????????????
?????????????????
?????????????????
??????????????????
??????????????? "
,dimmortal,2009-08-14T01:36Z,"""To report suspected music piracy, please contact the RIAA at 1.800.BAD.BEAT or by email to badbeat@riaa.com."" (from riaa website)
 haha... plz anyone who wants to spam this address DO IT.. death threats are nice too!!!"
,irregular07,2009-08-14T01:47Z,"Has anyone ever thought about this?
RIAA has management, but also has secretaries to maintain and others.
They are all people. People tend to have children (or so I've been told).
Those children eventually become teens and get all stupid about what is ""their music"".
So... RIAA people most probable are parents and most probably have downloaded illegal songs themselves. 

RIAA people, go home, check your own damn computers, I bet your children just hate you far too much anyways! :P"
[T],SOADSN,2009-08-14T01:49Z,Music sucked...so did RIAA!
,macss,2009-08-14T02:11Z,"the guy deserves the fine, not for downloading this music, but for listening to it.

Fuck man! One of the worst playlist EVER!

When you hate a friend, you just send it :)"
,Ardroth,2009-08-14T02:16Z,"Whoa, this dude goes to my school (Boston University).  I already have most of these songs, but I'll download the torrent anyway!  JOEL FIGHTS BACK MOTHERFUCKER!"
,DiscoPirate,2009-08-14T02:17Z,Fuck the RIAA!! 
,DiscoPirate,2009-08-14T02:20Z,Oh yeah and Fuck the so called justice system. Communist motherfucking obama bitch
,sbl03,2009-08-14T02:27Z,Downloading this torrent and seeding it for at least 5GB.
,lamerfor,2009-08-14T02:52Z,"Again I AM PROUD TO SAY THAT I WILL UPLOAD IT.

Dear RIAA,

Fuck you."
,rickmansworth,2009-08-14T03:11Z,he deserved to get busted... has a shitty taste in music
,Candy_Man,2009-08-14T03:27Z,"I'm not gunna download this because I have all the good songs. But if you think about it he should sue the RIAA back for a cruel and unusual punishment. You could buy all the songs below for 99 cents but instead they are going to charge him over 20,000 dollars each. 
If I stole a pack of gum from my local 7-11 I wouldn't be fined over 20 grand. I'd probably  have to pay them back for around a dollar and maybe get a stern talking too. 
Doesn't that make sense you learn your lesson you have to pay for your crimes. Do they really think Joel will ever be able to pay over half a million dollars if he makes 50'000 a year. That's a pretty good job. And if he lives in the cheapest of houses and spends almost no money he'll probably be able to pay 25,000 a year. That is extremely low living standards. At that rate it would take him 26 years to pay it all back. thats until he's in his late 40's. Everyone of the artists live rich lives and the RIAA are being assholes and think that charging this guy 675000 dollars will fix anything. They need to realize that they will never stop piracy. I think the best way to slow it would be to charge people like 2 dollars a song because it's reasonable and it's not a life ruiner. What about the mom who was ordered to pay like 1.5 million dollars. I can tell you right now that she will never pay that back and her kids lives will not be good. She might even have to give them up. Talk about life ruining. Even if many people were losing job's at the RIAA because of piracy( They don't) I still wouldn't care. The people who lose their jobs would have a tough spot in life. The people they help prosecute have their lives ruined. So all in all the RIAA is a bunch of selfish assholes. I'm not hurting an artist by downloading their songs because I never would have bought them in the first place.

R.I.A.A. the Retarded Idiot Assholes of America"
,Midas210,2009-08-14T03:34Z,"everyone's all like... 
omg... $675,000!
and
Holy sh*t $22,500/song!
He could have been fined up to $150,000/song.
& these were a ""representative sample"" of the thousands of songs he had downloaded.
read on it, its interesting."
,mr_pappy,2009-08-14T03:57Z,"haohmaru12, we listen too this music because we like it.
Or has the clubbing music you listen too pounded a few IQ points out of your head :P
Nah, just kidding, but RHCP and RATM are both great bands. Green Day not so much... The old stuffs good though!"
[T],TheSaint,2009-08-14T03:59Z,"Guys, 1000 thx for the support. Special thx to the tpg guys, you rock. 
Just keep seedin&sharin.

For news of the campaign or for contact info, go to iTooDownloadedThem - blogspot - com"
,True-Haven,2009-08-14T03:59Z,Our hero? Or the fodder to our cause?
,ADeliciousCheeseburger,2009-08-14T04:10Z,"Its too bad your being sued for downloading a bunch of bad songs. But I do hope that things work out for you in the end pal. 

Also get a better taste in music"
,haohmaru12,2009-08-14T04:15Z,the reason why he listens to such a crap music it's cuz he is fucking retarded and he didn't listen any music in his entire life ...if he would listen 100.000 mp3s without paying for them a penny like i did ...he will have better taste in music and yea i  am into clubbing music i never listen to this shit  
,Taku51,2009-08-14T04:26Z,The pirate bay's last stand against the injustice the RIAA is...
,moire_thepiratebay,2009-08-14T04:26Z,Shame not a single song is worth listening to.
,drcheney,2009-08-14T04:54Z,"for those interested in the court case:

http://en.wikipedia.org/wiki/RIAA_v._Tenenbaum"
,gisw21,2009-08-14T05:07Z,"Gotttt it... TPB kicks ass cuz they got balls! They proud of their balls too. Come get the ""$675,000 Mixtape"" for free. ha ha"
,Ohmvajra,2009-08-14T05:37Z,pretty shitty music
,idsoftware,2009-08-14T05:58Z,"another seed.........

RIIA sucks..........

we need a free world.!!! "
,Kona_,2009-08-14T06:02Z,"The songs are all pretty gay...
but its a cool idea, so i seed"
[T],nigeldpablo,2009-08-14T06:06Z,"sweet 'ill seed this for awhile , but the songs do suck . DOWNLOAD some good music well you are at it . "
