User Type,Username,Date,Text
,sh3l1,2009-08-15T19:36Z,"The RIAA was pleased with the verdict. ""We are grateful for the jury?s service and their recognition of the impact of illegal downloading on the music community,"" the RIAA said in a statement. ""We appreciate that Mr. Tenenbaum finally acknowledged that artists and music companies deserve to be paid for their work. From the beginning that?s what this case has been about. We only wish he had done so sooner rather than lie about his illegal behavior.""

This quote makes me want to buy a gun...

Last December, the labels announced that they were no longer initiating new cases against individual peer-to-peer users. However, they said they would see through to the end those cases already in the litigation pipeline. According to the labels? attorneys, there remain about 100 cases pending where the defendant has filed an answer, about a dozen of which are being actively litigated in the discovery stage."
,Kagome07,2009-08-15T19:38Z,I downloaded and I'm seeding to show support :D
,Mr_L_,2009-08-15T19:50Z,"We'll I'll seed this..

I have ? 125,527,500 worth of music..
Rip off people"
,masami_eiri,2009-08-15T20:38Z,facebook blocked the link to the torrent.
,pajoo85,2009-08-15T20:40Z,Great. Listen direct online on facebook here apps.facebook com /tictacritamljeta /users /49359 (add application and click on number 5). It will start to play automaticly
,pajoo85,2009-08-15T20:44Z,Great. Listen direct online on facebook here:  apps.facebook  com /tictacritamljeta/users /49359 (add application and click on number 5). It will start to play automaticly 
,pajoo85,2009-08-15T20:48Z,Great. Listen direct online on facebook here apps.facebook com /tictacritamljeta /users /49359 (add application and click on number 5). It will start to play automaticly 
,OCbeta,2009-08-15T21:10Z,"I have 47,833 tracks in my iTunes.
Not one single track was paid for.

If I bought each track legally from iTunes for 99c(EUR)
It would cost me ?47,354.67

If I was to be sued for each song and they sued me for ?2,500 per song I would be ?119,582,500.09 out of pocket.


P I R A C Y   W I L L   N E V E R   D I E
"
,OCbeta,2009-08-15T21:11Z,*The above (?) are euro symbols but don't work.
,div2div,2009-08-15T21:40Z,"wow, then we, russians, are virtual super-multi-millioneers thanks to RIAA.

:) to say nothing about every Russian CD&DVD store and outlet filled with $675,000 worth MP3-CDs and MP3-DVDs from top to bottom (guess if they are pirate or not 

LOL

Really high time to arrange a competition for the first 100 places in the Forbes or Guinness list of MP3-multimillineers. Why not????????

And no wonder if those will be the children of the Russian Antipirate Committee Members or Computer crime department squads (they are soooo keen on keeping the confiscated CD and DVD stuff for their families' entertainment).
"
,rockon46,2009-08-15T22:01Z,"Fuck you RIAA! This is the beginning of the end for you...every day this torrent grows...

Let's make this torrent EPIC!

FUCK YOU RIAA I WON'T STAND FOR THIS ABUSE...you've been fuckin people's lives up for far too long..."
,jrrrpat,2009-08-15T22:15Z,Support the new wave of shared public information and culture.  Download and seed away maties! What the corporations don't like is that the control of the media is being taken from them and put into the hands of the people.  Long live TPB!  
,MOstlingX,2009-08-15T22:19Z,I Too Downloaded Them! 1340 peeps currently downloading these songs for a total worth of 904500000$ (904 Billion Dollars)
,hugolovepole,2009-08-15T22:48Z,shame they're all shit...
,Noppersz,2009-08-15T22:53Z,I swear these are exactly the kind of songs I downloaded when I first got Kazaa back when I was 12 or something. I'm getting so nostalgic :P
,lightekk,2009-08-15T23:01Z,"not all is shit, some of them are prety good hits :) :P

so I downloaded them too : ) , for the second time now ,, ma HDD is sure worthy now :D"
,pickboy87,2009-08-15T23:05Z,"Nice try, that's $904 million. Irregardless, that's still a fucking ridiculous amount of ""lost profit"". Fuck the RIAA!"
,klunden,2009-08-15T23:59Z,"The easiest way to share on facebook is to take the exact same link, but replace http at the start of the link with https - that way it will not be blocked, and will not be a suspect shortlink."
,klunden,2009-08-16T00:00Z,"...or, of course, surf TPB with https in the first place... :)"
,antiterrorstyrkan,2009-08-16T00:02Z,"""Nice try, that's $904 million.""

well, in the US a billion is a bit less, so who knows.. and even if it wasn't a good lawyer could still make the case it was so if someone felt that way about it.

oh, and in Soviet Russia, the songs download you."
,Bornhigh,2009-08-16T00:04Z,Gr8 work 
,fonix79,2009-08-16T00:21Z,"Good lord, for half a million bucks he could have at least downloaded a halfway respectable mix. Beck is good. B Boys are good. The rest is junk. "
,Ohmvajra,2009-08-16T00:22Z,thats some of the shittiest music ive ever seen on the internet
,tikkig0d,2009-08-16T00:26Z,people keep telling me that some company paid for tpb and not 2 use it ne more but cant find shit about it.. online rumor?
,hbmaennchen,2009-08-16T00:27Z,"some facts in german language about ""the case"":
http://board.gulli.com/thread/1419276-riaa-vs-joel-tenenbaum-schuldig---675000-us-dollar-schadensersatz/"
,cr391n,2009-08-16T01:24Z,"some people here said they have to pay the high price of $9.-$13. for a music CD.
you know how much for a music CD in trinidad?
$130. to $150.
DVDs are $200.
needless to say we have a very healthy and prominent bootleg industry!

that's why i love the bay!
and that's why i'm supporting and seeding this torrent!"
,Dadutta,2009-08-16T01:47Z,WE SUPPORT JOEL
,Kaldun,2009-08-16T02:10Z,"Yeaaaah! Here we go!

If RIAA ever checks this torrents then: RIAA EAT MY SHIT.

Poor guy. Millions and millions, from age 7 to 80, in all countries in all cultures ppl download music. And this guy has to pay for SUCH crap. WHY?! It's the same if you would pay for licking dogpoo...and guess how much the artists are going to get of that money...probably none."
,kimlukas,2009-08-16T09:50Z,"Leave it on the main page Please.

We must do as much damage to the RIAA as possible. They should learn the lesson."
,DSpider,2009-08-16T17:07Z,"""Nirvana - Heart-shaped box"" was a very weak track. No offense to die-hard Nirvana fans. I like *some* of their work but this one's just... I don't know. NOT my taste. My ears started to hurt.

""Incubus - New Skins"" was better.

""Incubus - Pardon Me"" skips twords the end. Or is it just me ? Using iPod touch 2G OS 3.0."
,haohmaru12,2009-08-17T00:19Z,"get your spotify account now , this music sucks bad , i am glad he got caught cuz he has a bad taste in music , fuck rock music ...eminem another piece of shit artist , it's a shame to be sued for such music  , fuck this "
,unclemanti,2009-08-17T17:22Z,"I have been Force Seeding this since August 15, 2009 at 12:36Pm ET and so far my share ratio is only at 67% percent. This sucks! Come on people. We have the seeders, now LEECH!"
,gendoikari1,2009-08-17T20:33Z,"He doesn't have much musical taste (WTF is Linkin Park doing there?), but I think I'd give this one a try."
,szegecs,2009-08-17T22:34Z,"In my country the downloads (except non-free, aka. ""you must to pay for use"" programs) are _absolutely_legal_ for personal use.
Btw.: listening this ""Mixtape"", the Amarok player program's lyrics handler plugin says: ""Unfortunately, due to licensing restrictions from some of the major music publishers we can no longer return lyrics through the LyricWiki API (where this application gets some or all of its lyrics)."" Megarofl"
,triskuit,2009-08-18T03:49Z,"This music is hideous, but I'll download just to get my 675,000$ worth."
,tsasvari,2009-08-18T10:29Z,:(
,08millerj,2009-08-18T21:21Z,i rich bitch!!
,jelomulawin,2009-08-20T11:59Z,"If you would like to message RIAA, send it here:
https://www.riaa.com/reportpiracy.php
:))"
,jelomulawin,2009-08-20T12:01Z,"just don't provide your private information, LOL
Still fuck them RIAA, motherfucking money-hungry ignorants!!!"
,paulkunal,2009-08-23T09:53Z,"""I too downloaded them!"""
,lg1991,2009-09-05T02:21Z,"$22,500 dollars a song? 
Wow, i have 2500 songs i dled from TPB on my hardrive, so, RIAA math, 22,500*2500=56,250,000
So my hardrive is worth $56,250,000. 
Um, got to go, if anyone needs me, you will find me on Amazon......"
,lg1991,2009-09-05T02:22Z,"One last thing, the RIAA should be paying Joel $675,000 for advertising shit music that would never have got near this much attention without him. "
,rapsakulasoor,2009-09-12T18:46Z,Thank you TheSaint. Will seed forever and probably longer!
,sambaman009,2009-10-24T16:54Z,soz man that must suk. im seeding this for 6 weeks lol. TPB FTW!!!!
,sambaman009,2009-10-24T16:57Z,"lol the RIAA think if they charge one guy we will all be scared shitless lolololololol
BTW u should start a donation thing and try to get it put on TPB homepage. id bet from around the world we could donate 675000"
,OscarAlhoII,2010-01-02T00:55Z,I too downloaded them!
,blue_sours,2010-02-14T03:05Z,I downloaded too.
