User Type,Username,Date,Text
[T],TheSaint,2009-08-14T06:17Z,"Just 'cause everybody complaining about the shitty music:

Ask yourself: from all the musics you ever downloaded, are there 30 pieces that suck big time? For me, there are much more than 30. You know the routine: you search for your favorite one, you find it in a ""Best 1000 songs of something"" torrent, you DL the whole and then you realize 995 out of it are just bad. 

My best bet that Joel downloaded and shared many other songs, only the RIAA wasn't interested in those...

Hell, I'm the uploader of this torrent and even I didn't listen any of the tracks. As far as I'm concerned, it doesn't matter what kind of songs are they, now does it?

Happy seeding, 
iTooDownloadedThem - blogspot - com"
,ektakrome,2009-08-14T06:41Z,I honestly can't say that I like any of those songs.
,Narghaash,2009-08-14T06:47Z,"I'd download this, but I wouldn't listen to any of these. I might listen to the RHCP songs but I already have them.

I support Joel, but I'm not going to download this."
,wontgetfooledagain1,2009-08-14T07:21Z,"The people who are complaining about how ""ZOMG SO SHITTY"" these songs are are totally missing the point...-_-"
,steveturner,2009-08-14T07:40Z,"In my opinion, it's not that these songs are bad, it's just that they're outdated is all.

If you don't think Nirvana shaped rock, you don't know your music, most 'popular' bands of today grew up listening to them."
,forgetclosure,2009-08-14T07:52Z,"THANK YOU steveturner, you seem to be one of the only intelligent people commenting on this torrent."
,JuicEmatic,2009-08-14T08:05Z,"""you seem to be one of the only intelligent people commenting on this torrent""

how the fuck do you draw parallels between intelligence and music preference? 

ITT: dumb shits who think their music preference matters over someone elses. "
,forsak3np0et,2009-08-14T08:36Z,"The reason this playlist sucks so bad is because this case is 6 years old! 

Jesus. I was listening to Eminem 6 years ago and so were you. "
,brian2177,2009-08-14T08:39Z,I enjoy the musical stylings of Liberace. I still downloaded this torrent. 
,SilasMo,2009-08-14T08:42Z,"I'll agree that most of the songs on here blow.  But those of you saying that every one of them does are messed up in the head.

I will download that Ramones song, the Aerosmith songs and the Beastie Boys.  That's only $90,000, but I'm on a budget."
,Kaolccips,2009-08-14T09:30Z,I already have 61mil....
,Prettyboi,2009-08-14T09:48Z,Downloading and seeding just to spite the RIAA. 
,trollare,2009-08-14T10:04Z,you just have to collect em all =) 
,tribeboybena,2009-08-14T10:17Z,"30 songs is worth 675000$!?!
WOW, I HAVE OVER 15000mp3's at the moment. damn i must be WAAAAAAAAAAAAAAAY rich!"
,dude5892,2009-08-14T10:30Z,"IP was an artificial BUSINESS construct conceieved late in human history to encourage creative efforts.  Taking away human rights (ex. invading peoples privacy, extorting money, suing for ungodly sums, disconnecting internet connections ...) debases humanity. reducing us to pawns of business.  I have an IQ of 150 and all my peers STRONGLY DISLIKE punishing individuals for downloading/sharing without monetary gain.  CHOOSE HUMANITY OVER GREED!"
,paolo93,2009-08-14T10:47Z,i'm downloading xD
,davidboon,2009-08-14T10:51Z,Now RIAA can suck my balls !
[V],harry711,2009-08-14T11:02Z,Awesome bro. Will seed.
,abcd-she,2009-08-14T11:09Z,"RIAA MAFIAA will NEVER win the FIGHT of INFORMATION - fUCK you rIAA !!!
"
,abcd-she,2009-08-14T11:16Z,"FREE SONGS for personal use and fun :DDD

FREE AS BEER!!!!!!!!!!!!!!

http://kahvi.org/
http://www.archive.org/details/netlabels

http://www.jamendo.com/en/
http://torrents.jamendo.com/en/mp3/
http://torrents.jamendo.com/en/ogg/
http://en.wikipedia.org/wiki/Jamendo

http://magnatune.com/

FUCK RIAA BULLSHiT."
,abcd-she,2009-08-14T11:29Z,"This is NOT spam!

Free World... Free Zeitgeist.

http://thepiratebay.org/torrent/4439229/Zeitgeist.Addendum.DVDRip.XviD"
,matteo39,2009-08-14T11:41Z,"Addio TPB... 
tutto finisce, prima o poi e voi, tpb, siete finiti... addio"
,heine83,2009-08-14T12:01Z,Nice.
,DirtyFinger,2009-08-14T12:11Z,"Joel will be fine in a few years.

By that time the Dollar will have crashed and we can surely spare the 675? needed to bail him out."
,notascold,2009-08-14T12:36Z,"iek!  I have 28700 songs right now, that means I have to pay $645 750 000.... (half a bilion euro's :P)"
,borovnica,2009-08-14T13:42Z,"pha, this guy's small fish compared to this (this article is from wikipedia)

On December 21, 2006, the RIAA filed a lawsuit against Russian owned and operated website AllOfMP3.com in the amount of $1.65 trillion ($1,650,000,000,000). This number was derived from multiplying 11 million songs with statutory damages of $150,000 per song. The Moscow court ruled in favor of AllOfMP3.com.[33]"
,ipa2007,2009-08-14T13:43Z,Fuck RIAA! I downloaded this torrent twice! Maybe I will download it 3 times of 4 times! Fuck you RIAA! I will fill my hdd with this music!
,Mr_Elusive,2009-08-14T13:50Z,"Fuck RIAA. I too download them, come get me!"
,tbmale,2009-08-14T13:57Z,There is law and there is mass movement...
,Zatla,2009-08-14T14:16Z,"I downloaded them too. Fuck off RIAA, we don't need people like you in our world. Sharing is caring. The real artists know this, those who doesn't are not worth paying money to.
Forgot the old art? You got famous AFTER you died. Now they want fame and money and bitches all over the place from day one.

We are with you in the crime Joel."
,krzysieks194,2009-08-14T14:28Z,Whether this is legal and Licensing Organization RIAA?
,Cyber-Geek,2009-08-14T14:38Z,Now am happy ;)
,MiniPig,2009-08-14T14:57Z,"Nice up, come get us too RIAA.. "
,Callmege,2009-08-14T14:59Z,"If the RIAA only targetted major illegal sharers, the sort of people that upload album after album after album days after their release, and actually saught damages that weren't so fucking OTT that it makes Germanys last eastern excursion look like a fucking summer picnic, then maybe there wouldn't be this sort of backlash.

Still. I don't mind handing the RIAA another shovel with which to dig their grave. I don't even like most of these songs but is that gonna stop me downloading and seeding them? Fuck no.

Heil Joel!"
,Shritesh,2009-08-14T15:02Z,"A BIG
...................../´¯/)
...................,/¯../
................../..../
............./´¯/'...'/´¯¯`·¸
........../'/.../..../......./¨¯\
........('(...´...´.... ¯~/'...')
.........\.................'...../
..........''...\.......... _.·´
............\..............(
..............\.............\... 
FUCK YOU TO RIAA
LONG LIVE THE PIRATES
SHARING IS CARING
FUCK THE RULES"
,lol_davve,2009-08-14T15:52Z,"OMG, fuck RIAA!!!"
,paolo93,2009-08-14T16:20Z,"fill your harddisk?! oh mine is one terabyte wish me luck xD 
iTooDownloadedThem haha
i don't like most of the music :P
i download everything even virusses :D i dont care
you must be sick to if you ask (or pay) soo much money i think $675 is also too much xD"
,danibo,2009-08-14T16:21Z,"The record companies should have acted out much earlier. They are still stuck in the 60s...

The digital age has come a long time ago, and they fail to realize it, OVER and OVER again..

Free the music!!"
,haohmaru12,2009-08-14T16:56Z,"someone should kick this guy ass for his bad taste in music , what he listens is the worst play list i ever saw in my entire life , being sued for such music ...this is so fucking shameful you retarded son of a bitch , yea lemme download this too...FUCK YOU RIAA"
,jerka_1991,2009-08-14T16:59Z,"ma raion is 80 so thats meens that i have upploaded! 13gig

675.000*80=54000000 dollar^^
and i love it!
free musicsoundsbetter"
,ankie,2009-08-14T17:01Z,Long live the sharing
,potatos6,2009-08-14T17:01Z," ________________________________
 /  lol, this guy had good taste in songs \
|  To the piratebay creator:                  |
|                       I love your tracker!     |
|_____________________:D_________|"
,haohmaru12,2009-08-14T17:06Z,"to all mother fuckers complaining about music taste , i tell you ...americans don't know nothing about music , rock hip-hop ,R&B ...sucks bad ...europeans teenagers listens alot to clubbing music and fuck trance by the way "
,bentam1993,2009-08-14T17:07Z,"I'm downloading this, Good luck fining all of us RIAA
RaN-DoM sends his greetingz!"
,graassdfslkj,2009-08-14T17:55Z,"What the record companies do is ripping of the artists, they literally get nothing from the record sales. 

Artists get their money from live concerts, if there good. 

Stupid casted groups don't, because they suck live. 

And here on TPB I listen to wich concert I should go ...

Thanks TPB and go Sweden go ;-)"
,figment12,2009-08-14T18:45Z,"I find it funny that they want ridiculous amounts of money. If I stole that music from a retail store I would probably not even get fined more than $200

RIAA can burn in hell"
,WormSlayer,2009-08-14T19:01Z,"I wouldn't listen to this shit if you paid me :)

I will however download and seed this torrent!

FUCK THE RIAA!"
,S3nd41,2009-08-14T19:02Z,Save for some exceptions I wouldn't pay even a fuckin' cent for some of those crappy musics.
,Shikigami_SuMO,2009-08-14T19:10Z,"@haohmaru12: ""Don't know nothing"" is a double negative, you juse said americans know about music.

The guy has good taste in music, pretty old school stuff though."
,Phillip1,2009-08-14T19:21Z,"Hi, 

this torrent must be the most downloaded, this way we will show them that all the world is going a change and they must adapt, not we to them, but they to the future.

Is like the car industry, old,big poluting and 100 of liters /km instead of electric/bio fuel cars.

Welcome to the future morons.

Joel be strong !





"
,PoopinOnDaRIAA,2009-08-14T19:42Z,"Let's keep this torrent going strong! The music doesn't matter...IT'S THE PRINCIPLE


FUCK THE RIAA"
,man1811,2009-08-14T19:45Z,"I download it in order to support Joel!


man1811, from France."
,jelomulawin,2009-08-14T19:48Z,"FUCK RIAA!!! The fine's only supposed to be $30 dollars if u say each mp3 is 1 buck! But fuck, $650,000? Fuck, that's just some motherfucking money-hungry corporation!!!! 

Music Industry lost money,  fuck off, a CD's usually 5 bucks, even I buy CD's, AND IT'S JUST TOO MUCH FOR HIM!!! FUCK MUSIC INDUSTRY, WHY THEY DON'T JUST STICK TO PRODUCE ARTISTS WORTH LISTENING IN CONCERTS!!!! "
,anon52392,2009-08-14T19:54Z,"I would download this, but my mom would kill me if the Nazies from the RIAA stole our home, cars, and life for downloading these harmless MP3's...

The case actually did make the news though. I live in Massachusetts, and was surprised to see a lot of interest in the case in the local media, especially since I'd assume the average person reading a story with the headline ""Man to pay $675,000 for downloading 30 MP3's"" would probably disapprove of such a ludicrous lawsuit."
,Fritz182,2009-08-14T19:56Z,"Downloading :D
Fuck RIAA"
,coolzero1989,2009-08-14T20:53Z,"i think its stupid to pay $675,000 for 30 song i don't even like.

so to support him i download it and i tell all my friends to download this torrent.

fuck the RIAA"
,D3LinQuENT,2009-08-14T21:49Z,"Stoping by just to say:

FUCK YOU RIAA

Will seed this!"
,yoyo1989,2009-08-14T22:39Z,"I'll probably like everything in this, but wether I do or not, I will seed this until they pry my computer from my cold, jailed hands."
,haohmaru12,2009-08-14T22:50Z,"fuck you joel , shame on you ...this is a shitty play list , getting sued for such a playlist is fucking retarded ...shame on you , some people here say that your play list is outdated but i don't think so ...it sucked then and it sucks now more , i would gladly take RIAA on court with all my 100.000 mp3s , lol"
,kamutef,2009-08-14T22:51Z,"not exactly my current taste, although they are some nice tracks here,  but I've got to support the cause
Ahoy me hearties...!"
[T],lowiekuipers,2009-08-14T22:55Z,I too downloaded them!
,haohmaru12,2009-08-14T22:58Z,"and fuck all artists who gets rich from day one , WTF artists thinks that they are God , let's everyone start being artists , why artists want a good life without doing nothing ? work mother fuckers work , being a sexy no voice artist and with RIAA backing you up it's easy to get rich these days ...in my country they are artists that they play on instruments and they are awesome doing that but poor them cuz they get for a living ...not like fucking britney spears or whomever american fucking artists that are manipulated , if you a girl you need to get naked on your videos and if you a guy you need to be half gay or with crazy hairstyle , fuck you american artists you don't desirve the money we give you ...hope with the internet people realise that we pay artists more then they worth it on a piece of plastic shit "
,haohmaru12,2009-08-14T23:06Z,"and think about ipods , they are 30 gigs to fill it with what ? with itunes music ? if you pay for every song you are bankrupt from the start.
I have an idea , every artist should make their own site with high quality downloads and if their music worth it we might click on donate button , they should get free dinner from us but not 10 cars and 3 pools and bitches "
,haohmaru12,2009-08-14T23:14Z,"well fuck you , i am in CHINA "
,haohmaru12,2009-08-14T23:18Z,"someone ban that ID , fuck you US Dept Justice ...we are in charge of the internet we the users do what we like ,charge us if we steal your plastic shit , but don't come in my house and charge me for what's in my HD cuz that HD will die in the end and it's not High Quality as CD's , fuck you ...you want revolution ? this means war ...WAAAAAAAAAAAAAAR"
,haohmaru12,2009-08-14T23:22Z,"yea that , Sugi Pula lol ...fuck you RIAA "
,0p3y,2009-08-14T23:26Z,Feels good to make a dent. 
,T3h_J,2009-08-14T23:27Z,"Everybody hates the RIAA, and so do I!

Downloading (it's legal in the Netherlands, even if one cocksucking Tim Kuik thinks otherwise)"
,andy72184,2009-08-15T00:24Z,Someone needs to kill the RIAA
,lordspanky,2009-08-15T00:34Z,"haha i downloaded this at 3,8 mb second =)

in like 1 minut :)

people downlaod from me =9 i got 100mbits upload speed

haha i feel so rich :D"
,z3000,2009-08-15T00:34Z,"I'm loving this. Basically, fuck RIAA. You are a dying breed. Evolution is ongoing and you outdated dinosaurs will fucking die!!!"
,BEHEMOTH_MARKUS,2009-08-15T00:41Z,Even though I only like a few of these songs Im gonna dowload it just to show my support!
,Masterx00,2009-08-15T00:54Z,"I downloaded them too ! Never download music from torrent before but I did it now !
Come and sue me now RIAA woohoooooooooooooooooo"
[T],TheSaint,2009-08-15T00:56Z,"The torrent info has been updated two times, don't forget to read it."
,walkingcontradiction,2009-08-15T00:59Z,"haha
i too downloaded it"
,333def,2009-08-15T01:04Z,"you know why i hate the riaa and record labels?  because the artists don't even get the money?  it all goes to execs and other white collar douche bags who already have gobs of money.  even touring the artists get robbed, as the labels send people out on tour with them, and the band foots the bill for EVERYTHING.
I don't really like the posies, but i heard this interview on npr recently and one of the bandmembers was talking about this, and how he and th band are in debt alnmost 2 decades later, paying for these record labels bills (recording expenses, hotels, food, ad nauseum).  and so many other similar stories.  so the artists are in debt for becoming mega stars, while rotten crotch record label execs and the infected absessed anal glands known as the riaa profit endlessly.

fuck all those white collar creeps.

whose got a torrent that tells me how to steal millions from wall street fuckos?"
,-sublime-,2009-08-15T01:38Z,"The RIAA are going to fuck every one that downloaded this torrent

good day."
,tjerge,2009-08-15T01:46Z,Still seeding and just shared via Facebook!
,haohmaru12,2009-08-15T01:53Z,"if you are a constructions worker and you build something you get payed for but not millions of dollars , if you a artist and you sing why should we all pay you millions of dollar ...oh yea i got it , cuz we are stupid mother fuckers and we need to pay even for the air we breath , i started recording music from radio back in the 90s cuz there was so much music i want and as a kid i couldn't afford even 1 % of the music i want ...now as a DJ i look at all the artists who manipulate the big crowd to get their 25 $ cd and that's a rip off ...imagine 1 million ppl whom all pay for the cd , that's 25.000.000 $ , OMG that's a sum ...for few stupid songs that are very easy to remember ""cheesy tracks"" whom in general attack for the big crowed of kids and yea ...that's not only 1 million per album there are dvd's too , they are lots of accesories that you can purchase  , i say fuck this ...artists should get money from first 3 months from the release and they should open their own site and offer high quality mp3's and a donate button , i am sure this system would work ...we don't need your music after we listen to it few times so 25 $ it's a rip off ...as a DJ i am researching alot trough artists and guess what , there are artists that  you didn't heard in your entire life with very good music ...fuck over promoted music , fuck rock band , fuck this system ...i say freedom is the FUTURE "
,KTTdestroyer,2009-08-15T02:08Z,"Well, i like the music, he got good taste."
,pratstercs,2009-08-15T02:20Z,"The artists have already been paid, all the money goes to the record label after the song is released......so FUCK YOU RIAA!"
[T],budakrist,2009-08-15T02:23Z,Nothing motivates like a lawsuit
,ZERO_BS,2009-08-15T02:25Z,"Lol, this is excellent...

RIAA, feel free to tug on my dick."
,K2Fer,2009-08-15T02:41Z,"Lets end this insanity, fuck you RIAA"
,toofan,2009-08-15T03:21Z,count me in :)
,ddrsensation,2009-08-15T03:40Z,RIAA can give me a blowjob now thanks.
,cnote678,2009-08-15T04:00Z,FUCK YOU RIAA.
,DarkMoonn,2009-08-15T04:46Z,Yeah! Stick it to the dinosaur-style way of parasitically making money off of starving artists! I will share this even though 90% of these songs suck and the bands are mostly sell out corporate garbage. I don't even want these songs. I just want the RIAA to suffer.
[T],vexfoo,2009-08-15T05:06Z,"By the way, if this torrent grows into the 10,000+ seeders and growing (and perhaps orders of magnitude beyond that are possible too) then it could take on a cult following. In that sense the songs would take on new meaning, and be rediscovered, even if they're considered junk (poor taste) now.

For example, the demo scene could tear apart and reconstruct each track down to their constitute elements. Or think about the well known drum and bass loop that is used in so much music. That can be torn down again, more intricately than say a cthugha type audio visualization because each beat or sound would be synthesized from scratch.

Just tossing some ideas out there. I know it's a lot of work. I also suggest it because at that point it would truly be a derivative work and I don't think the original authors deserve anything at that point, aside from a reference or acknowledgment. Not sure how you would word that in actual legalese, maybe someone could correct me.

"
,JohnDaniels,2009-08-15T06:22Z,"...The dinosaurs will slowly die
And I do believe no one will cry
I'm just fucking glad I'm gonna be
There to watch the fall...

Dinosaurs Will Die - NOFX"
,netfire_,2009-08-15T06:33Z,"I was about to skip this cause allot of these songs do suck, but then I thought the hell with it. I raise my middle finger to the R.I.A.A. any way I can, any chance I get. Fuck you R.I.A.A., Fuck you right up your ass."
,Sghost467,2009-08-15T06:42Z,"this torrent serves two purposes:
1. it may figuratively fuck the RIAA 
2. use them to torture your enemies with these aural monstrosities "
,beundertaker,2009-08-15T06:45Z,What a travesty....the RIAA Is a fucking joke
,cat_fish_1,2009-08-15T08:34Z,to bad he had shitty music taste
,cat_fish_1,2009-08-15T08:45Z,You guys have to give RIAA credit thogh for the worst and shittiest website in all the world :P
,H0bbes99,2009-08-15T08:52Z,Currently connected via It's Hidden ;-)
,hn_rene,2009-08-15T10:50Z,I was here.
,Tidus_330,2009-08-15T10:56Z,love this
,burnerX,2009-08-15T11:06Z,"   I did a little math and I discovered a track is worth 22.500 $. I gone even further and man, I am way too rich to talk to you, or even post a comment: I got 1.845.000.000 $, so WTF?! I think I will go today to Dubai an buy half of it, but I still have second thoughts about buying the Moon. Btw, is the Moon also owned by RIAA?! Peace!"
,Volinthius,2009-08-15T11:28Z,"Although I support him all the way, I still find the music much too dissapointing to even bother an hour of my internet to show my support. Thinking like that, I am actually wondering who was bothered. I dont think that many. Although lots were bothered to leave behind a comment. I support you DJ JOEL!"
,18_widda_bullit,2009-08-15T11:33Z,"Hate the music, but looooove the idea. I'm in :)"
,lightekk,2009-08-15T12:24Z,got it :)
,evildax,2009-08-15T13:20Z,"The music sucks, but seeding it anyways :-D"
,zehnerson,2009-08-15T13:52Z,"Huh, I never had listen this, but I try!"
,tongant,2009-08-15T13:52Z,"I don't download music normally, but im in too!"
,hobbypunk,2009-08-15T14:19Z," |¯¯¯¯|`·.¯¯/|  '|¯¯¯¯| '|¯¯¯¯|     '/¯¯¯¯/`·.¯¯/|  |¯¯¯¯|  '|¯¯¯¯|'?
 |       |:::'\/::|  '|       | '|       |    /       /:'|:::\/:'|° |       | '/       /| 
 |____|.·´||::/ ? '|____| '|____|   '|____|:'/`·.:|:'/   |____|/____/:'| 
 |¯¯¯¯|`·.||/?    '|¯¯¯¯| '|¯¯¯¯|   '|¯¯¯¯|/    '\|/'    |¯¯¯¯|\¯¯¯¯\:/'?
 |       |:::|'      '|       | '|       |   |\       \     '/\   ' |       |:'\       \? 
 |____|`·.|'      |\____\/____/|'  |:'\____\.·´__\   |____|::'|____|'?
 |:::::::|   °      |'|:::::::|:::::::'|'|?  '\:'|:::::::|:::::::|'  |:::::::|\:'|:::::::|'?
 |:::::::|°         \|:::::::|:::::::'|/'?    \|:::::::|:::::::|'  |:::::::| '\|:::::::|°
  ¯¯¯¯?            ¯¯¯¯ ¯¯¯¯         ¯¯¯¯ ¯¯¯¯?   ¯¯¯¯    ¯¯¯¯? 

 |¯¯¯¯|\¯¯¯¯\'  |¯¯¯¯|    /¯¯¯¯/\¯¯¯¯\        /¯¯¯¯/\¯¯¯¯\    
 |       | |       |  |       |  '/       /:|:\       \?    '/       /:|:\       \?  
 |____|/____/|? |____| /____/::/\::\____\  /____/::/\::\____\ 
 |¯¯¯¯|\¯¯¯¯\|? |¯¯¯¯| |¯¯¯¯|¯¯¯¯|¯¯¯¯|  |¯¯¯¯|¯¯¯¯|¯¯¯¯| 
 |       |:|       |  |       | |       |____|       |  |       |____|       | 
 |____|\|____|  |____| |____|:::::::|____|  |____|:::::::|____| 
 |:::::::| |:::::::|  |:::::::| |:::::::|:::::::|:::::::|  |:::::::|:::::::|:::::::| 
 |:::::::| |:::::::|  |:::::::| |:::::::|¯¯¯¯|:::::::|  |:::::::|¯¯¯¯|:::::::| 
  ¯¯¯¯  ¯¯¯¯    ¯¯¯¯'  ¯¯¯¯         ¯¯¯¯   ¯¯¯¯         ¯¯¯¯ "
,Magicalmuslim,2009-08-15T14:55Z,Rot in hell RIAA.
,mrinal_kanti,2009-08-15T15:08Z,"Come on guys, grow up!

It may seem pretty bad that Joel is the one who is asked to cough up that amount. But look where you put the blame! I would have cursed the lawyers and and the faulty loopholes in the system rather than RIAA.

RIAA (or whatever it is) is there to ensure that artists (and their sponsors) get paid genuinely for their talent and resources. It is us hackers (sick) who are asking for a free ride and are therefore responsible for the pitiable lifestyles of the artists. The sponsors and distributors are already too scared of us (pirates). This is just their retaliation by holding one of us accountable.

If you want a free ride, go have it, but don't blame the ticket collector. He is just there to ensure that those 
- who are selling their talent are not denied justice
- who have bought the tickets are getting their moneys worth."
,netfire_,2009-08-15T15:11Z,You clearly do not understand the system you defend mrinal kanti. Fuck the R.I.A.A.
,SultanSS,2009-08-15T15:14Z,"Ito chto za dj ?
Tipa piar ?"
,blessphemy,2009-08-15T15:33Z,"whats worse than a hippie at a jam fest?

a kid behind his computer thinking the RIAA gives a flying fuck"
,blessphemy,2009-08-15T15:34Z,"p.s. none of these bands have ""talent"" except for RHCP but only the half that play in The Mars Volta"
,s1r1,2009-08-15T15:42Z,"Took 3 min to download it :) 
Won't play it cause the music sucks (he deserves a fine for his taste) but i'll seed forever :D"
,cthulusmerc,2009-08-15T16:17Z,"i dislike almost every track on this but
for 675gs worth of spite

i would torrent anything"
,Billy416,2009-08-15T17:46Z,"two hours with nothing 
its awful :]->"
,myke1997,2009-08-15T17:47Z,"I own some of these CDs.  Good luck Joel!

Songs costing $22,500 and SMS TEXT Messages are 15 cents. Both are a corporate rip off."
,john111111111111111111111,2009-08-15T18:12Z,"We're with u Joel.

My MP3 collection is worth $50m - cool!"
,unclemanti,2009-08-15T18:44Z,No chance really of any of us getting caught. They really only monitor the torrent title and not the contents. I am downloading and will be seeding just as support though!! 
,lardigfildela,2009-08-15T18:59Z,It's funny because it's true!
,sejose24,2009-08-15T19:00Z,Crazy... Most Fellow Pirateers are now worth millions... Lets find a way to convert that net worth into liquid funds...
