User Type,Username,Date,Text
,razamaza,2010-07-12T14:31Z,Same problem with the rest of the torrents.nTilt at westwind woods.nso don\'t bother to load till a crack or keygen is out. nn
,kycklingkrydda,2010-07-17T14:34Z,There is a crack included in this torrent
,coldheartzero,2010-10-10T02:22Z,"The crack doesn't work. Game just crashes when you try to start it. You get the opening screen, chose your language etc, but the game just crashes and gives you an unhandled exception. "
,boots420,2010-11-20T18:22Z,"STFU coldheart it works fine. I will buy this now cause I got to try it out, thanks for the upload."
,Eiyer,2010-12-16T01:23Z,"Does anyone know a Serial number that will work for this game? You can play the game without a crack, but when you get past the first spot the guy will ask you to buy the game to continue. With or without the crack he'll ask it."
,Eiyer,2010-12-16T01:29Z,"This game doesn't come with a serial for some reason, and you can't get very far without it."
,Xirad,2011-11-21T03:43Z,"It works fine. Just copy the crack over and then make sure the program is run as administrator.

Works for me like that."
