User Type,Username,Date,Text
[V],kentucky-kid,2009-07-23T08:22Z,"note, please be informed that there is someone who have been copying my uploads.

his profile is here:
http://thepiratebay.org/user/daffyg/

please, boycutt him"
,grizzmo,2009-07-23T12:56Z,He is trusted.
,karachidude,2009-07-24T13:32Z,"@KK
hey i noticed that too.
and i believe u 100%,those who dont should stop downloading ur uploads.ur 1 of the best.
thank u for uploading"
,isisx3,2009-07-24T17:12Z,"Hi, could I make a request? I've been looking for this program Zillatube everywhere and I can't find it. If you could crack it and upload it that'd be really great :) Thanks ahead."
