Filename,Size,Unit
How to Cheat in Photoshop CS5 - The Art of Creating Realistic Photomontages (Sixth Edition).rar,291.87,M
Adobe Photoshop CS5 for Photographers - A Professional Image Editor's Guide to the Creative Use of Photoshop for the Macintosh and PC.rar,267.52,M
The Photoshop Book for Digital Photographers.rar,246.8,M
Understanding Shutter Speed.rar,201.17,M
Contemporary Wedding Photography.rar,193.71,M
The Art of Bird Photography II.rar,176.67,M
Understanding Photography Field Guide - How to Shoot Great Photographs with Any Camera.rar,168.58,M
Fotografía de Alta Calidad - Técnica y Método.rar,160.27,M
"Learning to See Creatively - Design, Color & Composition in Photography (Revised Edition).rar",137.88,M
The Digital Photography Book Volume 2 (2008).rar,137.41,M
20th Century Photography.rar,127.95,M
"Small-Format Aerial Photography - Principles, Techniques and Geoscience Applications.rar",125.52,M
The Complete Guide to Professional Wedding Photography - Creating a More Profitable and Fulfilling Business.rar,121.38,M
The Creative Digital Darkroom (1).rar,117.52,M
The Creative Digital Darkroom.rar,117.52,M
The Art of Pregnancy Photography.rar,110.28,M
Perfect Exposure - The Professional Guide to Capturing Perfect Digital Photographs.rar,107.3,M
Fotografía Digital de Aproximación - La Guía Imprescindible para el Fotógrafo Digital.rar,95.53,M
The Adobe Photoshop CS4 Book for Digital Photographers.rar,90.65,M
Teach Yourself Visually - Adobe Photoshop Elements 8.rar,90.6,M
Teach Yourself Visually - iPhoto '09.rar,85.01,M
The Art of Digital Photography.rar,84.87,M
The Ansel Adams Photography Series II - The Negative.rar,83.23,M
Digital Nature Photography - The Art and the Science.rar,82.6,M
"The Permanence and Care of Color Photographs - Traditional and Digital Color Prints, Color Negatives, Slides, and Motion Pictures.rar",79.01,M
Classic Glamour Photography - Techniques of the Top Glamour Photographers (Revised Edition).rar,76.99,M
Teach Yourself Visually - Adobe Photoshop CS5.rar,74.97,M
Apple Aperture 3 - A Workflow Guide for Digital Photographers.rar,73.72,M
Nude Photography - The Art and the Craft.rar,68.28,M
Closeups in Nature - The Photographer's Guide to Techniques in the Field.rar,64.65,M
Advanced Digital Black & White Photography.rar,64.56,M
Photoshop CS4 Down & Dirty Tricks.rar,64.26,M
Adobe Photoshop CS4 for Photographers - A Professional Image Editor's Guide to the Creative Use of Photoshop for the Macintosh and PC.rar,62.21,M
The Ansel Adams Photography Series III - The Print.rar,61.37,M
The Best of Wedding Photography - Techniques and Images from the Pros (2nd. Edition).rar,60.15,M
"A Digital Photographer's Guide to Model Releases - Making the Best Business Decisions with Your Photos of People, Places and Things.rar",59.86,M
Advanced Crime Scene Photography.rar,57.81,M
The Ansel Adams Photography Series I - The Camera.rar,57.29,M
Fotografía Digital de Alta Calidad (3ra. Edición).rar,56.96,M
The Adobe Photoshop Lightroom 2 Book - The Complete Guide for Photographers.rar,56.59,M
Night Photography - Finding Your Way in the Dark.rar,54.09,M
Basics Photography - 02 Lighting.rar,53.65,M
Color Confidence - The Digital Photographers Guide to Color Management.rar,53.06,M
Portrait Photography - Secrets of Posing & Lighting.rar,52.64,M
Painter 11 for Photographers - Creating Painterly Images Step by Step.rar,50.94,M
Professional Interior Photography (Third Edition).rar,48.32,M
"Stoppee's Guide to Photography and Light - What Digital Photographers, Illustrators, and Creative Professionals Must Know.rar",47.85,M
Nature Photography Field Guide.rar,46.7,M
Light Science and Magic - An Introduction to Photographic Lighting (Third Edition).rar,44.31,M
"Getting Started with Digital Imaging - Tips, Tools and Techniques for Photographers.rar",44,M
Photoshop Blending Modes Cookbook for Digital Photographers.rar,43.72,M
Digital Sports Photography (Second Edition).rar,43.32,M
Photoshop for Right-Brainers - The Art of Photo Manipulation.rar,41.84,M
Photo Retouching with Photoshop - A Designer's Notebook.rar,41.45,M
Focal Encyclopedia of Photography (4th. Edition).rar,41.28,M
Faster Smarter Digital Photography.rar,41.04,M
Photography Foundations for Art and Design - The Creative Photography Handbook (Fourth Edition).rar,40.99,M
Digital Black and White Printing - Techniques for Creating High Quality Prints.rar,40.1,M
HDR Photography Photo Workshop.rar,40.05,M
HDR Photography Secrets for Digital Photographers.rar,39.49,M
Understanding Close-Up Photography - Creative Close Encounters With or Without a Macro Lens.rar,37.54,M
Perfect Digital Photography - Brilliant Pixels from the Digital Darkroom (Second Edition).rar,37.37,M
Nature Photography - Insider Secrets from the World's Top Digital Photography Professionals.rar,36.97,M
Creative Composition - Digital Photography Tips & Techniques.rar,36.55,M
Digital Landscape Photography.rar,36.44,M
Digital Infrared Photography Photo Workshop.rar,36.04,M
Digital Boudoir Photography - A Step-by-Step Guide to Creating Fabulous Images of Any Woman.rar,35.36,M
Lighting Photo Workshop.rar,34.66,M
Photoshop CS4 Top 100 Simplified Tips & Tricks.rar,34.57,M
The Ultimate Guide to Digital Photography (Fully Updated 4th. Edition).rar,34.16,M
Understanding Exposure - How to Shoot Great Photographs with a Film or Digital Camera.rar,33.9,M
Location Photography - Essential Skills (Second Edition).rar,33.88,M
"Black and White in Photoshop CS4 and Photoshop Lightroom - A Complete Integrated Workflow Solution for Creating Stunning Monochromatic Images in Photoshop CS4, Photoshop Lightroom, and Beyond.rar",33.85,M
Alternative Digital Photography.rar,33.65,M
The Photographer's Guide to Photoshop - Everything You Need to Improve Your Digital Photos Today!.rar,33.55,M
Photoshop Retouching Cookbook for Digital Photographers.rar,32.98,M
Photoshop CS5 All-in-One for Dummies.rar,32.93,M
Getting Started in Digital Photography - Improve Your Photo Skills and Take Better Pictures.rar,32.7,M
Photoshop Effects for Portrait Photographers.rar,32.27,M
"Adobe Photoshop CS5 on Demand - What You Need, When You Need It!.rar",32.1,M
"Photographic Possibilities - The Expressive Use of Ideas, Materials, and Processes (Second Edition).rar",31.85,M
Plastic Cameras - Toying with Creativity.rar,31.64,M
Composing the Photo - Creating Order from the Chaos (Bonus Version).rar,31.57,M
"Photographic Possibilities - The Expressive Use of Equipment, Ideas, Materials, and Processes.rar",30.92,M
The Digital Photography Book Volume 1 (2006).rar,29.73,M
The Elements of Photography - Understanding and Creating Sophisticated Images.rar,29.7,M
Digital Photography Simplified.rar,29.58,M
Creative Shutter Speed - Master Your Camera's Most Powerful Control.rar,29.47,M
301 Inkjet Tips and Techniques - An Essential Printing Resource for Photographers.rar,29.23,M
Top 100 Simplified Tips & Tricks - Adobe Photoshop CS5.rar,28.82,M
Encyclopedia of Twentieth-Century Photography.rar,28.66,M
"High Dynamic Range Imaging - Acquisition, Display, and Image-Based Lighting.rar",28.61,M
The Hot Shoe Diaries - Big Light from Small Flashes.rar,28.36,M
Photoshop Elements 8 All in One for Dummies.rar,27.99,M
How to Cheat in Photoshop Elements 7 - Create Stunning Photomontages on a Budget.rar,27.75,M
Adobe Photoshop CS5 Bible.rar,27.71,M
Digital Photography and Imaging - Stop Taking Snapshots and Start Taking Photographs.rar,27.66,M
The Photoshop Darkroom - Creative Digital Post-Processing.rar,27.65,M
RAW Workflow from Capture to Archives - A Complete Digital Photographer's Guide to RAW Imaging.rar,27.57,M
Studio and Location Lighting Secrets for Digital Photographers.rar,27.16,M
Creative Close-Ups - Digital Photography Tips & Techniques.rar,27.13,M
Digital Art Photography for Dummies.rar,26.72,M
Shooting Digital - Pro Tips for Taking Great Pictures with Your Digital Camera (Second Edition).rar,26.23,M
How to Photograph the Moon and Planets with Your Digital Camera.rar,26.11,M
Within the Frame -The Journey of Photographic Vision.rar,25.91,M
How to Do Everything with Digital Photography.rar,25.53,M
The 50 Greatest Photo Opportunities in San Francisco.rar,25.45,M
The Photographer's Eye - Composition and Design for Better Digital Photos.rar,25.34,M
Digital Photography for 3D Imaging and Animation.rar,25,M
Photoshop CS4 Workflow - The Digital Photographer's Guide.rar,24.98,M
Painting for Photographers - Steps and Art Lessons for Painting Photos in Corel Painter and Adobe Photoshop.rar,24.95,M
Photoshop CS4 for Nature Photographers - A Workshop in a Book.rar,24.87,M
Adobe Photoshop Lightroom 2 for Digital Photographers Only.rar,24.73,M
The Perfect Portrait Guide - How to Photograph People.rar,24.38,M
Starting Your Career As a Freelance Photographer.rar,24.26,M
The 50 Greatest Photo Opportunities in New York City.rar,24.06,M
The Concise Focal Encyclopedia of Photography - From the First Photo on Paper to the Digital Revolution.rar,23.72,M
Adobe Photoshop CS4 Studio Techniques.rar,23.6,M
Apple Aperture 2 - A Workflow Guide for Photographers.rar,23.55,M
101 Quick and Easy Secrets to Create Winning Photographs.rar,23.54,M
Digital Restoration from Start to Finish - How to Repair Old and Damaged Photographs.rar,23.53,M
Camera Raw with Photoshop for Dummies.rar,23.47,M
Learning Corel PaintShop Photo Pro X3.rar,23.26,M
The Photographer's Guide to the Studio.rar,23.08,M
Complete Guide to High Dynamic Range Digital Photography.rar,22.94,M
Photoshop CS5 for Dummies.rar,22.71,M
Complete Guide to Digital Infrared Photography.rar,22.66,M
Mastering Digital Wedding Photography - A Complete and Practical Guide to Digital Wedding Photography.rar,22.53,M
Langford's Starting Photography - The Guide to Creating Great Images (6th. Edition).rar,22.44,M
Digital Photography in Available Light - Essential Skills (Third Edition).rar,22.37,M
Photo Restoration and Retouching Using Corel PaintShop Photo Pro (Second Edition).rar,21.7,M
Understanding Digital Cameras - Getting the Best Image from Capture to Output.rar,21.43,M
Basics Photography - 01 Composition.rar,21.33,M
Photoshop CS5 for Nature Photographers - A Workshop in a Book.rar,21.3,M
Adobe Photoshop Lightroom 3 - Streamlining Your Digital Photography Process.rar,21.21,M
Mastering Digital Black and White - A Photographer's Guide to High Quality Black and White Imaging and Printing.rar,21.17,M
Light and Lens - Photography in the Digital Age.rar,21.04,M
Photoshop Elements 8 for Windows - The Missing Manual.rar,20.95,M
"Image Ethics - The Moral Rights of Subjects in Photographs, Film, and Television.rar",20.94,M
Digital Nature Photography and Adobe Photoshop.rar,20.5,M
Complete Digital Photography (Fourth Edition).rar,20.28,M
The Art of RAW Conversion - Optimal Image Quality from Photoshop CS2 and Leading RAW Converters.rar,20.22,M
The Photoshop Lightroom Workbook - Workflow not Workslow in Lightroom 2.rar,20.09,M
Photography - A Middle-brow Art.rar,19.99,M
How Digital Photography Works (Second Edition).rar,19.72,M
Camera Raw with Adobe Photoshop CS.rar,19.69,M
Aerial - The Art of Photography from the Sky.rar,19.66,M
Mastering Digital Photography and Imaging.rar,19.28,M
500 Poses for Photographing Women - A Visual Sourcebook for Portrait Photographers.rar,19.26,M
Photographic Lighting - Essential Skills (Fourth Edition).rar,19.11,M
Female Nudes.rar,19.03,M
Adobe Photoshop CS5 Digital Classroom - A Complete Training Package!.rar,19,M
Food Styling for Photographers - A Guide to Creating Your Own Appetizing Art.rar,18.95,M
Digital Photography for Dummies (6th. Edition).rar,18.85,M
Digital Photography Bucket List - 100 Great Digital Photos You Must Take Before You Die.rar,18.76,M
Getting the Most of Your Digital SLR Camera - Step-by-Step Instruction for Taking Great Photographs of Your World.rar,18.63,M
Digital Negatives - Using Photoshop to Create Digital Negatives for Silver and Alternative Process Printing.rar,18.5,M
Master Posing Guide for Wedding Photographers.rar,18.5,M
The Hasselblad Manual (Seventh Edition).rar,18.49,M
Basic Photography.rar,18.33,M
Killer Photos with Your iPhone.rar,18.22,M
How to Make Money from your Digital Images.rar,17.96,M
Panoramic Photography - From Composition and Exposure to Final Exhibition.rar,17.91,M
Mac OS X for Photographers.rar,17.69,M
The Book of Photography - Simple Techniques for Taking Better Pictures.rar,17.62,M
Top 10 Mistakes in HDR Processing and How to Fix Them.rar,17.56,M
Digital Photography for Seniors for Dummies.rar,17.48,M
Introduction to Digital Astrophotography - Imaging the Universe with a Digital Camera.rar,17.36,M
Basics Photography - 07 Exposure.rar,17.32,M
Irreverent Photo Tools for Digital Photographers.rar,17.3,M
Digital Infrared Pro Secrets.rar,17.3,M
Photographing Children and Babies - How to Take Great Pictures.rar,17.18,M
Hacking Digital Cameras.rar,17.09,M
Adobe Photoshop Elements 8 Digital Classroom - A Complete Training Package!.rar,17.01,M
Photography.rar,16.97,M
The Practical Zone System for Film and Digital Photography (4th. Edition).rar,16.91,M
Mastering Digital SLR Photography - The Serious Photographer's Guide to High-Quality Digital SLR Photography (Second Edition).rar,16.76,M
Color Management for Digital Photographers For Dummies.rar,16.73,M
Iluminación de Retrato en Estudio.rar,16.73,M
The Visual Dictionary of Photography.rar,16.63,M
500 Poses for Photographing Brides - A Visual Sourcebook for Digital Wedding Photographers.rar,16.47,M
How to Do Everything Digital Camera (Fifth Edition).rar,16.46,M
Digital Photo Projects for Dummies.rar,16.45,M
Photography and Literature.rar,16.28,M
The Zeltsman Approach to Traditional Classic Portraiture.rar,15.94,M
Inside Lightroom 2 - The Serious Photographer's Guide to Lightroom Efficiency.rar,15.88,M
The Adobe Photoshop CS4 Layers Book - Harnessing Photoshop's Most Powerful Tool.rar,15.64,M
The Underwater Photographer (Third Edition).rar,15.29,M
Adobe Photoshop Lightroom Photographers' Guide.rar,15.25,M
How to Shoot Great Travel Photos.rar,15.2,M
Photoshop Elements 7 for Dummies.rar,15.18,M
Sports Photography - How to Capture Action and Emotion.rar,15.05,M
Quick Snap Guide to Adobe Photoshop.com - An Instant Start-Up Manual for Editing and Sharing Your Photos Online.rar,14.84,M
Quick Snap Guide to Digital Photography - An Instant Start-Up Manual for New Digital Camera Owners.rar,14.64,M
Digital Portrait Photography for Dummies.rar,14.48,M
Digital Photography Workflow Handbook - Using Photoshop CS and RAW Converters for the Digital Photography Workflow.rar,14.43,M
The Advanced Digital Photographer's Workbook - Professionals Creating and Outputting World-Class Images.rar,14.36,M
"Master Posing Guide for Portrait Photographers - A Complete Guide to Posing Singles, Couples and Groups.rar",14.34,M
Photography for the Web - Discover How Easy is to Create Stunning Photographs.rar,14.29,M
The Photographic Eye - Learning to See with a Camera.rar,14.25,M
"Photographing Washington, D.C. Digital Field Guide.rar",14.25,M
Digital SLR Cameras and Photography for Dummies (3rd. Edition).rar,14.22,M
The Digital Photography Book Volume 3 (2009).rar,14.16,M
Single-Sensor Imaging - Methods and Applications for Digital Cameras.rar,14.14,M
Mastering Exposure and the Zone System for Digital Photographers.rar,14.09,M
Top 100 Simplified Tips & Tricks - Digital Photography (4th. Edition).rar,14.08,M
Advertising Photography - A Straightforward Guide to a Complex Industry.rar,13.61,M
The Spoken Image - Photography & Language.rar,13.58,M
Studio Photography - Essential Skills (Fourth Edition).rar,13.55,M
Camera Works - Photography and the Twentieth-Century Word.rar,13.52,M
Digital Wedding Photographer's Planner.rar,13.51,M
Basic Photographic Materials and Processes (Third Edition).rar,13.19,M
Quick Snap Guide To Lighting.rar,12.95,M
Master Guide for Photographing High School Seniors.rar,12.92,M
Creative Black and White Photography - Advanced Camera and Darkroom Techniques (Revised Edition).rar,12.75,M
Master Lighting Guide for Portrait Photographers.rar,12.72,M
Photography - The Art of Composition.rar,12.67,M
Professional Commercial Photography - Techniques and Images from Master Digital Photographers.rar,12.56,M
Pinhole Photography - From Historic Technique to Digital Application (Fourth Edition).rar,12.38,M
Digital Photography Bible (Desktop Edition).rar,12.37,M
Digital Photography for Teens.rar,12.27,M
Photographic Lighting Simplified.rar,12.25,M
Color Management for Photographers - Hands on Techniques for Photoshop Users.rar,11.97,M
50 Fast Digital Camera Techniques - Step-by-Step Techniques for Taking Terrific Digital Photos.rar,11.89,M
Absolute Beginner's Guide to Digital Photography - No Prior Digital Photography Experience Necessary!.rar,11.77,M
Professional Portrait Photography - Techniques and Images from Master Photographers.rar,11.77,M
Light and Exposure for Digital Photographers.rar,11.74,M
RAW 101 - Better Images with Photoshop & Photoshop Elements.rar,11.66,M
The Beginner's Guide to Underwater Digital Photography.rar,11.59,M
Photographing Yosemite Digital Field Guide.rar,11.46,M
Pet Photography 101 - Tips for Taking Better Photos of Your Dog or Cat.rar,11.42,M
Beginning Digital Image Processing - Using Free Tools for Photographers.rar,11.41,M
Quick Snap Guide to Using Digital SLR Lenses.rar,11.26,M
On Photography.rar,11.18,M
101 Quick and Easy Secrets for Using Your Digital Photographs.rar,10.89,M
Professional Digital Techniques for Photographing Bar and Bat Mitzvahs.rar,10.82,M
Lighting the Nude - Top Photography Professionals Share Their Secrets.rar,10.82,M
Digital Photography - Acquisition and Processing Techniques.rar,10.59,M
"Photo Finish - The Digital Photographer's Guide to Printing, Showing, and Selling Images.rar",10.52,M
Marketable Photography.rar,10.44,M
Creative Black & White - Digital Photography Tips & Techniques.rar,10.3,M
Marilyn Monroe and the Camera.rar,10.26,M
Medium and Large Format Photography - Moving Beyond 35mm for Better Pictures.rar,10.19,M
Photographer's Guide to Wedding Album Design and Sales (Second Edition).rar,10.04,M
iPhoto '09 - Learn iPhoto the Quick and Easy Way!.rar,9.97,M
Langford's Advanced Photography (7th Edition).rar,9.97,M
Digital Photography.rar,9.96,M
Close-Up and Macro Photography.rar,9.9,M
Street Photography for the Purist.rar,9.82,M
The Best of Wedding Photojournalism - Techniques and Images for Professional Digital Photographers (2nd. Edition).rar,9.79,M
The Manual of Photography - Photographic and Digital Imaging (Ninth Edition).rar,9.76,M
Mac Digital Photography.rar,9.69,M
Lighting Techniques for Photographing Model Portfolios - Strategies for Digital Photographers.rar,9.3,M
Speedlights & Speedlites - Creative Flash Photography at Lightspeed.rar,9.3,M
Portrait Lighting For Digital Photographers - The Basics and Beyond.rar,9.29,M
The High Dynamic Range (HDR) Landscape Photography Tutorial.rar,9.28,M
Mastering Digital Color - Digital Process and Print Series.rar,9.1,M
Existing Light Techniques for Wedding and Portrait Photography.rar,8.82,M
Sams Teach Yourself Flickr in 10 minutes.rar,8.79,M
Deep Nature - Photographs from Iowa.rar,8.45,M
"Lights, Camera, Capture - Creative Lighting Techniques for Digital Photographers.rar",8.41,M
Thewebfoto - Curso de fotografia digital.rar,8.39,M
Shoot Like a Pro! - Digital Photography Techniques.rar,8.15,M
Capturing Ghosts on Film - Step-by-Step Instruction for Documenting the Paranormal with Photography and Video.rar,8.1,M
Imaging Beyond the Pinhole Camera.rar,8.09,M
The Beginner's Guide to Photographing Nudes.rar,8.07,M
The Moment it Clicks - Photography Secrets from One of the World's Top Shooters.rar,8.05,M
Better Available Light Digital Photography - How to Make the Most of Your Night and Low-Light Shots (Second Edition).rar,7.97,M
"Digital Photography Solutions - Create, Edit and Share your Digital Photos.rar",7.94,M
Senior Portrait Photography Handbook - A Guide for Professional Digital Photographers.rar,7.85,M
Guide to Head and Shoulders Portrait Photography.rar,7.82,M
Photo Fusion - A Wedding Photographer's Guide to Mixing Digital Photography and Video.rar,7.78,M
Simple Lighting Techniques for Portrait Photographers.rar,7.63,M
Photographing Jewish Weddings - A Complete Handbook for Professionals.rar,7.59,M
Photographers - A Sourcebook for Historical Research (All New Edition).rar,7.58,M
Digital Photography Best Practices and Workflow - A Guide to Staying Ahead of the Workflow Curve.rar,7.52,M
Available Light - Photographic Techniques for Using Existing Light Sources.rar,7.4,M
"Professional Techniques for the Wedding Photographer - A Complete Guide to Lighting, Posing, and Taking Photographs that Sell.rar",7.28,M
New Dimensions in Photo Processes - A Step-by-Step Manual (Third Edition).rar,7.12,M
The Photographer's Guide to Making Money - 150 Ideas for Cutting Costs and Boosting Profits.rar,7.06,M
Professional Architectural Photography (Third Edition).rar,7.06,M
50 Lighting Setups for Portrait Photographers - Easy-to-Follow Lighting Designs and Diagrams.rar,6.86,M
Professional Wedding Photography - Techniques and Images from Master Photographers.rar,6.8,M
Hollywood Portraits - Classic Shots and How to Take Them.rar,6.8,M
Extreme Makeover Techniques for Digital Glamour Photography.rar,6.71,M
Butterfly Photographer's Handbook - A Comprehensive Reference for Nature Photographers.rar,6.64,M
Professional Digital Techniques for Nude & Glamour Photography.rar,6.64,M
100 Techniques for Professional Wedding Photographers.rar,6.62,M
The Linked Photographer's Guide to Online Marketing and Social Media.rar,6.57,M
Guide to Boudoir Photography.rar,6.54,M
Mother and Child Portraits - Techniques for Professional Digital Photographers.rar,6.53,M
National Camera - Photography and Mexico's Image Environment.rar,6.4,M
Digital Imaging for the Underwater Photographer - Computer Applications for Photo Enhancement and Presentation (2nd. Edition).rar,6.2,M
Black & White Photography Techniques with Adobe Photoshop.rar,6.12,M
Illustrated Dictionary of Photography - The Professional's Guide to Terms and Techniques for Film and Digital Imaging.rar,6.09,M
Lumix Guia de Venta - Dominar la Fotografia Paso a Paso.rar,5.78,M
Studio Lighting Techniques for Photography - Tricks of the Trade for Professional Digital Photographers.rar,5.76,M
The Art of Children's Portrait Photography.rar,5.68,M
Digital Photographic Capture.rar,5.66,M
Commercial Photography Handbook - Business Techniques for Professional Digital Photographers.rar,5.64,M
Minimalist Lighting - Professional Techniques for Studio Photography.rar,5.63,M
"Event Photography Handbook - How to Make Money Photographing Award Ceremonies, Corporate Functions, and Other Special Occasions.rar",5.52,M
The Digital Photographer's Software Guide.rar,5.37,M
eBay Photos That Sell - Taking Great Product Shots for eBay and Beyond.rar,5.29,M
The Best of Adobe Photoshop - Techniques and Images from Professional Photographers.rar,5.27,M
Black & White Photography - A Basic Manual (Third Revised Edition).rar,5.17,M
Digital Portrait Photography of Teens and Seniors - Shooting and Selling Techniques for Photographers.rar,5.01,M
Night and Low-Light Techniques for Digital Photography.rar,4.98,M
Creative Wedding Album Design with Adobe Photoshop - Step-by-Step Techniques for Professional Digital Photographers.rar,4.95,M
Professional Portrait Lighting - Techniques and Images from Master Photographers.rar,4.94,M
Digital Photography 99 Easy Tips To Make You Look Like A Pro!.rar,4.87,M
Adobe Photoshop for Underwater Photographers.rar,4.87,M
Do It Your Self - Wedding Photography.rar,4.86,M
How to Start and Operate a Digital Portrait Photography Studio.rar,4.77,M
The Best of Family Portrait Photography - Professional Techniques and Images for Digital and Film Photographers.rar,4.74,M
Digital Photography - The Missing Manual.rar,4.69,M
Master Guide for Underwater Digital Photography.rar,4.49,M
The Art of Sport - The Best of Reuters Sports Photography.rar,4.47,M
The Photoshop CS5 Pocket Guide.rar,4.46,M
The Photography Handbook.rar,4.46,M
Photography and Science.rar,4.38,M
Master's Guide to Wedding Photography - Capturing Unforgettable Moments and Lasting Impressions.rar,4.34,M
Artistic Techniques with Adobe Photoshop and Corel Painter - A Guide for Photographers.rar,4.31,M
Master Guide for Glamour Photography - Digital Techniques and Images.rar,4.25,M
Wedding Photographer's Handbook.rar,4.25,M
Rangefinder's Professional Photography - Techniques and Images from the Pages of Rangefinder Magazine.rar,4.19,M
Garage Glamour - Digital Nude and Beauty Photography Made Simple.rar,4.17,M
The Best of Digital Wedding Photography.rar,4.11,M
Posing Techniques for Glamour Photography.rar,4.1,M
The Best of Portrait Photography - Techniques and Images from the Pros (Second Edition).rar,4.06,M
Posing Techniques for Location Portrait Photography.rar,4.01,M
The Best of Wedding Photography (Third Edition).rar,3.94,M
Basic Critical Theory for Photographers.rar,3.92,M
"Power Marketing, Selling, and Pricing - A Business Guide for Wedding and Portrait Photographers (Second Edition).rar",3.9,M
The Best of Professional Digital Photography.rar,3.88,M
Caborian LAB - Curso de Fotografía Creativa.rar,3.82,M
Posing Techniques for Photographing Model Portfolios.rar,3.79,M
Film & Digital Techniques for Zone System Photography.rar,3.7,M
Classic Portrait Photography - Techniques and Images from a Master Photographer.rar,3.69,M
Professional Children's Portrait Photography - Techniques and Images from Master Photographers.rar,3.61,M
Professional Filter Techniques for Digital Photographers.rar,3.6,M
