Filename,Size,Unit
The Sandy Puc' Guide to Children's Portrait Photography.rar,3.59,M
Master Guide for Team Sports Photography.rar,3.57,M
"Exhibiting Photography - A Practical Guide to Choosing a Space, Displaying Your Work, and Everything in Between.rar",3.55,M
Teaching Photography - Tools for the Imaging Educator.rar,3.5,M
Master Lighting Guide for Wedding Photographers.rar,3.47,M
Children's Portrait Photography Handbook.rar,3.46,M
Master Guide for Professional Photographers.rar,3.44,M
Portrait Photography Handbook.rar,3.42,M
Softbox Lighting Techniques for Professional Photographers.rar,3.42,M
Studio Portrait Photography of Children and Babies (Third Edition).rar,3.39,M
The Best of Photographic Lighting - Techniques and Images for Digital Photographers (Second Edition).rar,3.37,M
Lightroom - Tips and Tricks (Volume 2).rar,3.37,M
Professional Marketing & Selling Techniques for Digital Wedding Photographers (Second Edition).rar,3.25,M
Guide to Sales and Marketing for Professional Photographers.rar,3.21,M
The Chemistry of Photography - From Classical to Digital Technologies.rar,3.15,M
Glamour Photography - Professional Techniques and Images.rar,3.13,M
The Photographer's Guide to Color Management - Professional Techniques for Consistent Results.rar,3.11,M
Group Portrait Photography Handbook for Digital and Film Photographers (2nd. Edition).rar,3.01,M
Master Posing Guide for Children's Portrait Photography.rar,2.98,M
Portrait Photographer's Handbook (Third Edition).rar,2.93,M
The Bride's Guide to Wedding Photography - How to Get the Wedding Photography of Your Dreams.rar,2.88,M
Professional Posing Techniques for Wedding and Portrait Photographers.rar,2.73,M
The Professional Photographer's Legal Handbook.rar,2.71,M
Minimalist Lighting - Professional Techniques for Location Photography.rar,2.66,M
Aprende a Hacer Mejores Fotos en 31 Días.rar,2.66,M
Photography Your Way - A Career Guide to Satisfaction and Success.rar,2.65,M
Digital Stock Photography - How to Shoot and Sell.rar,2.63,M
Master Lighting Guide for Commercial Photographers.rar,2.63,M
Photography and Spirit.rar,2.63,M
Posing for Portrait Photography - A Head-to-Toe Guide for Digital and Film Photographers.rar,2.6,M
Beginner's Guide to Adobe Photoshop - Designed Especially for Photographers (Third Edition).rar,2.58,M
A Short Course in Digital Photography - A Guide to Using Your Digital Camera.rar,2.56,M
Professional Portrait Posing - Techniques and Images from Master Photographers.rar,2.54,M
Digital Capture and Workflow for Professional Photographers.rar,2.43,M
Creative Careers in Photography - Making a Living With or Without a Camera.rar,2.41,M
The Best of Teen and Senior Portrait Photography - Techniques and Images from the Pros.rar,2.38,M
Lightroom - Tips and Tricks.rar,2.32,M
Aperture Digital Photography Fundamentals.rar,2.08,M
The Portrait in Photography.rar,2.07,M
The Art of Bridal Portrait Photography - Techniques for Lighting and Posing.rar,2.06,M
How to Take Great Digital Photos of Your Friend's Wedding.rar,2.05,M
How to Take Great Digital Photos of Your Friend's Wedding (1).rar,2.05,M
Black & White Landscape Photography.rar,2.05,M
The Art and Business of High School Senior Portrait Photography.rar,2.04,M
Profitable Photography in the Digital Age - Strategies for Success.rar,1.97,M
On-Camera Flash - Techniques for Digital Wedding and Portrait Photography.rar,1.93,M
Digital Photography Pocket Guide.rar,1.9,M
Curso de Fotografía para Principiantes - Introducción al Mundo de la Fotografía Digital.rar,1.83,M
Photography - A Very Short Introduction.rar,1.76,M
Art of Professional Photography (First Edition).rar,1.72,M
"Photography, Cinema, Memory - The Crystal Image of Time.rar",1.52,M
Careers in Focus - Photography (Second Edition).rar,1.51,M
Beginner's Guide to Photographic Lighting - Techniques for Success in the Studio or On Location.rar,1.49,M
How to Succeed in Commercial Photography - Insights from a Leading Consultant.rar,1.42,M
Digital Photography Exposed!.rar,1.41,M
Licensing Photography.rar,1.34,M
dZoom-Especial-Destacados de 2009.rar,1.24,M
The Photographer's Guide to Negotiating.rar,1.17,M
Todos los Secretos de la Fotografía HDR en 7 Fantásticos Artículos.rar,1.16,M
Taking and Sharing Digital Photographs - What You Need to Know Now!.rar,1.09,M
The Law (in Plain English) for Photographers.rar,1.07,M
eBay Photography the Smart Way - Creating Great Product Pictures That Will Attract Higher Bids and Sell Your Items Faster.rar,1.06,M
The Beginner's Guide to Pinhole Photography - Kids and Adults Can Take Photos with Home-Made Cameras!.rar,1.02,M
Opportunities in Photography Careers (Revised Edition).rar,985.16,K
Career Opportunities in Photography.rar,736.47,K
On Looking at Photographs - A Practical Guide.rar,700.21,K
Blended Exposures Revisited - A Simpler Approach to Extending Dynamic Range.rar,608.15,K
Photography - An Illustrated History.rar,605.95,K
On Being a Photographer - A Practical Guide (Revised Third Edition).rar,603.18,K
Tutorial para Fotos HDR con Photomatix y Photoshop Paso a Paso.rar,359.79,K
Taking Control Over Depth Of Field.rar,286.7,K
Back-Front Focus Test Chart.rar,279.13,K
7 Tips to Make Crazy Money in Photography - Turning Your Passion for Photography into Huge Amounts of Cash!.rar,241.15,K
Readme.txt,131,B
