User Type,Username,Date,Text
,TehDoktor,2010-01-06T11:29Z,"Give it a while to download everyone. It WILL finish.
I'm not going to stop seeding for a while"
,nmagod,2010-01-06T22:59Z,"the directory WWOEC\mouseboy\images\as\  has an invisible file (even to *nix systems) that disallows deleting the directory.

This needs to be fixed."
,TehDoktor,2010-01-07T07:04Z,I just checked it and it seems to work fine for me
,freeman_nov,2010-01-07T08:14Z,Tell password on zip in /arc???
,TehDoktor,2010-01-07T18:01Z,There isn't a password
,dash551,2010-02-02T23:15Z,"The Reynard's section seems to be outdated, last update  (as displayed on the HTML pages) is 01/24/2007, but there are some newer files on rule34 server like these (even year 2009):

http://rule34.paheal.net/post/view/396506
http://rule34.paheal.net/post/view/231561

TehDoktor, can you please check it?"
,TehDoktor,2010-03-30T00:43Z,"@dash5551
It's actually up to date. Even while I'm writing this it's still up to date
They just never update the members area >."
,TehDoktor,2010-05-14T20:07Z,Torrent is still up to date as of today. Still no updates in their members area
