User Type,Username,Date,Text
[V],dias_vld,2010-05-14T16:55Z,"Oh yeah, mate...im glad someone noticed and left the comment!! :) Lookout for today´s batch...will be off the hook!!! :D"
,ubisuck,2010-05-14T22:24Z,"Dude, you're doing so good posting here that's it's tough and almost impossible to start posting comments in every single torrents you post ;-)

Keep'em coming!"
[V],dias_vld,2010-05-14T23:13Z,"Cmon man, it doesn´t take that many time to post a fucked up comment...i think anything is bette than nothing...right? :) And thanks for the words, i´ll keep them coming!!"
,GameCrax,2010-09-01T15:40Z,Great man! Love it :D
,afaqawan,2011-01-10T12:18Z,Thanx Nice Post
