Filename,Size,Unit
"/01 The Gryphon Trio Piano Trio in C minor, Op.66   I. Allegro energico e con fuoco.mp3",24.47,M
"/05 The Gryphon Trio Piano Trio in A minor, Op.26   I. Allegro appassionato.mp3",22.54,M
"/07 The Gryphon Trio Piano Trio in A minor, Op.26   III. Très lent.mp3",20.19,M
"/04 The Gryphon Trio Piano Trio in C minor, Op.66   IV. Finale.mp3",17.56,M
"/02 The Gryphon Trio Piano Trio in C minor, Op.66   II. Andante espressivo.mp3",17.32,M
"/08 The Gryphon Trio Piano Trio in A minor, Op.26   IV. Allegro molto.mp3",14.35,M
"/06 The Gryphon Trio Piano Trio in A minor, Op.26   II. Presto.mp3",10.62,M
"/03 The Gryphon Trio Piano Trio in C minor, Op.66   III. Scherzo.mp3",8.48,M
