Filename,Size,Unit
The Dennis Prager Show Hr 2 12-Aug-10 CF.mp3,33.52,M
The Dennis Prager Show Hr 3 12-Aug-10 CF.mp3,33.43,M
The Dennis Prager Show Hr 1 12-Aug-10 CF.mp3,32.8,M
Is Obama Winning the Hearts and Mind.mp3,6.34,M
Obama's State Capitalism_ A Failure.mp3,5.47,M
A Holiday from Fiscal Reality    8.1.mp3,5.43,M
Buying Union Votes With Food Stamps.mp3,5.09,M
No Time To Scrimp On Defense   8.11..mp3,4.89,M
Freeing Up Trade   8.11.10.mp3,4.04,M
Jobs Of The Future   8.11.10.mp3,3.81,M
Rush Limbaugh Morning Update 12-Aug-10.mp3,1.45,M
