User Type,Username,Date,Text
,Flopis,2009-09-12T05:26Z,10xs m8!
,MrBean99999,2010-01-24T01:12Z,"World largest collection of Adobe After Effect Plug-ins

http://thepiratebay.org/torrent/5303180 "
,MrBean99999,2010-01-24T04:06Z,"World largest After Effect Plug-in collection
(reseed) first one didn´t work, sry

http://thepiratebay.org/torrent/5303341/World_largest_After_Effect_Plug-in_Collection.rar"
,g37371,2010-03-14T10:48Z,NOT WORKING ON CS4
,phd1974,2010-04-30T09:35Z,Shine does not work in this pack. I d/l from another torrent and it worked. Just FYI - Shine on here does not serialize and therefore will not work.
,mebeeba,2010-08-26T16:30Z,"Ima make some montages now! :D
Btw does this work for CS4?
Or do I have to download cs3?"
,mebeeba,2010-08-26T16:31Z,Cheers man! Im gonna make some montages now! :D
,Photojunkie,2010-09-14T12:24Z,"Could you tell me if particular is the 2. version or the older one, I need the version 2. Thanks."
,Aciaeiig,2010-11-10T18:01Z,"@Photojunkie: I can't remember, it's a while since I uploaded this."
,thamba4u,2011-11-20T18:16Z,not working in cs4
