User Type,Username,Date,Text
,bakern73,2010-08-29T14:02Z,Klarer du engelen i dvd kvalitet også?
[V],Sagablanc,2010-08-29T20:18Z,"Stort sett laster jeg kun opp Xvid -filer her på TPB. DVD`er på lukkede fora. Grunnen til denne opplastningen var problemer med å rippe en feilfri utgave av filmen. Da laster jeg opp hele DVD`en i stedet for å bruke noe mer tid på dette.

Engelen ( http://www.imdb.com/title/tt1208664/ ) kommer opp som Xvid-fil i løpet av september."
,bakern73,2010-08-30T00:27Z,"Ok, da må jeg vel laste ned xvid kvalliteten da vet du :-)
Takk for raskt svar"
,mr-taxidriver,2010-08-31T10:18Z,Hei. du har ikke dagfinn lyngbø siste ? Evolusjon... Får ikke tak i den her i Sverge...
[V],Sagablanc,2010-08-31T19:20Z,Beklager nei
,svenur83,2010-09-01T16:28Z,du får ikke tak i alice i eventyrland med norsk tale vel?
[V],Sagablanc,2010-09-01T17:28Z,"Hmmm svenur, så var det dette med å sjekke på TPB da....
Sjekk linken: 
http://thepiratebay.org/torrent/5669114/Alice_i_Eventyrland.2010.Norsk_tale.Xvid.saga"
,fth078,2010-12-04T23:29Z,Hvordan finner man slike lukkede forum? 
,malossi666,2011-08-24T21:30Z,Noen som har noen Gode norske filmer?
