User Type,Username,Date,Text
,mrpunk50,2010-04-27T19:30Z,"Hi oneanight. Many thanks for this upload and all your other Bob Marley uploads. Just to let you know, the tracklist in the description is for the wrong album. The torrent itself is fine, but the description is erroneous. Thanks again."
[V],oneanight,2010-04-27T22:52Z,"Yeah Your Right Not Sure How That Happened... Eager Beaver.

Thanks for Letting Me Know... Have Corrected It Now... ;)"
,NeoCentox,2011-02-11T07:20Z,"Thanks, one of my favorites!
peace!"
,GingerJedi,2011-05-11T07:11Z,Many thanks for all the Bob
,Bicherl,2012-01-09T16:36Z,"Many, many thanks, oneanight."
