User Type,Username,Date,Text
,marianoodd1,2010-09-24T22:41Z,Fake?
,Awesomo42,2010-09-25T09:52Z,"Why would it be?

Sheesh, people these days, they cry 'wolf' at anything that moves. x_x"
,FLiP21,2010-09-26T21:34Z,I can guarantee that this is NOT fake. I've tested it on my PS3 and it works perfectly.   PLEASE SEED!!!!!! Thanks.
,jmasterchief06,2010-09-29T02:23Z,"This torrent has an availability ratio of .095 so until the original uploader or someone who managed to download the entire thing starts uploading, this is a waste of time."
