User Type,Username,Date,Text
,Olli-Kolli,2009-09-15T13:00Z,Thanks 8-)
,karl-lelliott,2009-09-15T20:30Z,"Best album I have heard in years!!

Thanks."
,TraumaHound,2009-09-16T20:06Z,"Definitely picking this up when it comes out. I want all the extras plus it's KISS, why wouldn't I buy it?!"
,Holo_no,2009-09-18T17:34Z,"Best album in years!

I have already pre-ordered the 2CD + DVD package :D"
,monster.1965,2009-09-19T23:33Z,Thanx
,jlsmetalhead,2009-09-23T22:37Z,"Thank You.   Will Be Buying This One For Sure &
 Am Going To See Em In Atlanta 10/26. 
  It's Going To Be Awesome!!!!!!"
,TheBigHase,2009-09-28T08:55Z,Get yourself KISSed! Rock'n Roll! Love the guys for over thirty years now...
,nashyy,2009-12-02T20:43Z,Good to see Kiss with  a great album!! CHEERS! thnks alot uploader :)
,lenny283,2011-02-06T01:19Z,cheers mate
