User Type,Username,Date,Text
,phoebe7,2010-05-21T15:56Z,"thx. File is valid. installation and crack worked. haven't tried program function yet, but overall it looks just fine. :)"
,comounpicaflor,2010-09-04T17:34Z,Crack didn't work for me
,belm1605,2011-05-11T01:32Z,"Worked pretty fine for me
Thanks!"
,belm1605,2011-05-11T14:50Z,"talked too soon... crack didn't work, after all..."
,cradie,2011-06-02T18:53Z,"sorry artpepper, please try to fix crack because program works but no files imported to work with."
