User Type,Username,Date,Text
[V],HolyRoses,2010-11-30T19:52Z,"YOU WILL BE PROMPTED TO ENTER A PASSWORD TO DECRYPT THE FILES, contact me.


wtf?"
,bluecar5556,2010-11-30T23:25Z,"ATTENTION - THIS TORRENT IS INTENDED FOR ONE INDIVIDUAL ONLY, STOP DOWNLOADING NOW BECAUSE YOU ARE WASTING YOUR TIME!  Do not bother brute forcing the password either, it's as long as the earth is wide with letters, numbers, and symbols."
[V],HolyRoses,2010-12-01T00:51Z,sounds like a challenge.
,suazeey,2012-05-24T06:09Z,Everything about this is weird. No more of either for you.
