User Type,Username,Date,Text
,daperdon,2010-09-24T04:51Z,i found psjailbreak so if i put it on a flash drive will it work like the real chip
,MrWaX95,2010-09-24T09:35Z,How Can i play This Games on my ps3 ? Like.. How do i install them ? =)
,spazzyjim,2010-09-24T13:23Z,this has no english on it!
,daperdon,2010-09-24T15:06Z,@MrWax95 you have to jailbreak your ps3 by getting a psjailbreak mod chip just google or youtube and check it out
,COTTAD0,2010-09-24T15:53Z,... lol
,hypno777,2010-09-26T07:53Z,Can someone please help and give detailed instructions on how to install this on PS3 (v.3.50)
,min0,2010-09-26T10:25Z,"RLLY SLOW DOWNLOAD SPEED ONLY WORK'S IF U HAVE A JAILBROKEN PS3 ON FIRMWARE 3.41 TO MOVE THE GAME TO THE INTERNAL HARD DRIVE 
USE FOR (MAC) : CYBERDOCK
USE FOR (XP/V) : FILEZILLA"
,simer007,2010-09-26T13:44Z,its not released yet this  is fake
,martian_neighbour,2010-09-28T00:29Z,"wHAT AN IDIOT UPLOADER!!

THIS IS PS2 SECTION NOT PS3 !!!! (BASH)"
,progamer61,2010-09-28T21:20Z,"Great torrent.. Thanks Mate!
Im downloading it right now.."
,Juicy_one,2010-09-29T09:26Z,"Doesn't work, tried loading it. ""Error Eboot.bin invalid"""
,ziisharma,2010-10-06T09:31Z,"plz upload it for PS2
if u can thanks"
,ahmed919,2010-10-06T17:56Z,Thanks for the upload... CAN SOME ONE AT PIRATEBAY PLEASE CREATE A SECTION FOR PS3  ALREADYY! !!!!!!!
,ezPS3,2010-10-08T07:41Z,"The game works on my PS3, but there is no english option."
,simer007,2010-10-11T13:31Z,plz upload in english man
,berkaaant,2010-10-13T08:54Z,"Thanx for the upload bro.

But could u upload the football game: Pure football please?"
,mr.spok,2010-10-17T23:55Z,"yo, UTFG to find english: http://www.ps3news.com/PS3-Hacks/play-pro-evolution-soccer-2011-eur-in-english-on-playstation-3/
PS: upload NHL 2011 plz, cause nobody did it yet :("
,dzaki88,2010-12-26T13:40Z,ok i download this game and stored in my jailbreak ps3 when i try to start i'm geting black screan. i think this game is fake it dosen't working
,jarisaizprua,2011-03-02T04:09Z,"It works perfectly on KNEW 3.55 and ROGER MANAGER 8.1. If you need help, please contact to me jarisaizprua@hotmail.com"
