User Type,Username,Date,Text
[T],whaleoilbeefhooked,2009-08-25T23:42Z,yw m8 i thought it was  well interestin+im a city fan lol
,sniderjinx,2009-08-26T00:42Z,Your not a true blue if you uploaded this trash u red nose!!!
[T],whaleoilbeefhooked,2009-08-28T10:23Z,oooooooooo>>>holds handbag 2 chin-back 2 skool next month eh lmao
[T],whaleoilbeefhooked,2010-09-02T11:43Z,"fuck off snider you pratt,yu are a typical plastic fan who knows nothon about nothin,you support chelsea when they win-man ure when they win =YOU ARE A FAGGOT"
[T],whaleoilbeefhooked,2011-01-12T07:05Z,"CMON YER FUCKIN GAYLORD YU STARTED THIS-NOW YU DONT HAV THE BOTTLE 2 COMEBACK,TYPICAL MAN URE SUPPORTER,7 YEARS OLD & LIVES IN LONDON-WHEN I SED INTERESTIN -I MEANT HOW UNITED BOUGHT EVERY TITLE THEY EVER WON & THAT THEY ONCVE STOLE CITYS MANAGER & 3 PLAYERS ION 1 WEEK & FERGIE WHINES ABOUT TEVEZ!! MAN URE WOULDNT EVEN EXIST IF NOT FER CITY YOU FUCKIN PRATT"
