User Type,Username,Date,Text
,scoot1417,2010-03-29T07:54Z,"By the looks of this it is the whole album on 2 tracks, so 1 track per disc.... bit weird"
,halomoe,2010-04-18T07:16Z,I hate this style of uploading. WHY WOULDNT YOU JUST SPLIT THE TRACKS??? You're making trouble for everyone else...
,qwerty1954,2010-04-28T13:13Z,"has anyone got the 3 cd release of the underground 2010?
Struggling to find it on the internet."
,djstanxtc,2010-07-25T11:00Z,"try Medieval CUE splitter, just drop the .cue file then it's done... "
