Filename,Size,Unit
Covert Affairs S1E01 (Pilot)_x264_HDTV.900p.mkv,2.87,G
Covert Affairs s1e02 Walter's Walk_x264_HDTV.900p.mkv,1.54,G
Covert Affairs s1e03 Southbound Suarez_x264_HDTV.900p.mkv,1.92,G
Covert Affairs s1e04 No Quarter _x264_HDTV.900p.mkv,1.78,G
Covert Affairs s1e05 In the Light_x264_HDTV.900p.mkv,1.7,G
Covert Affairs s1e06 Houses of the Holy_x264_HDTV.900p.mkv,1.52,G
Covert Affairs s1e07 Communication Breakdown_x264_HDTV.900p.mkv,1.61,G
Covert Affairs s1e08 What Is and What Should Never Be_x264_HDTV.900p.mkv,1.58,G
Covert Affairs s1e09 Fool in the Rain_x264_HDTV.900p.mkv,1.79,G
Covert Affairs s1e10  I Can't Quit You Baby_x264_HDTV.900p.mkv,1.67,G
Covert Affairs s1e11 When the Levee Breaks_x264_HDTV.900p.mkv,1.89,G
Info.txt,236,B
