User Type,Username,Date,Text
,tnokli,2009-12-24T21:19Z,"Köszi szépen!
Meg annak a seedernek is, akit?l ilyen jól jött :)"
,tnokli,2009-12-27T15:00Z,"Kira a film, bár nekem a könyv jobban tetszett.
Mint általában a könyvb?l készült filmek.
Érdekelne még a Brazil c. film is szinkronnal, ha egyáltalán szinkronizálták. Tudna valaki segíteni?"
,Spacehole,2010-01-01T01:17Z,"Az a srác, akitöl olyan gyorsan lejött, az valószínüleg én voltam. Jó, hogy ilyen gyors a le/feltöltési sebességem, mi?

A Brazil címü film pedig itt található szinkronosan: http://thepiratebay.org/torrent/5104539/BRAZIL.HUNDUB.PAL%281985%29

Bocs a késö válaszért, lusta disznó vagyok. És boldog új évet!"
,tnokli,2010-01-02T14:23Z,"Köszi!
BUÉK!"
