User Type,Username,Date,Text
,Sallie,2010-02-07T19:07Z,"Underbart! Kommer du lägga ut hela showen i bitar eller kommer du lägga ut programmet i sin helhet med? *håller tummarna*
"
[V],RosaMannen,2010-02-07T19:09Z,"jag delar ju alltid upp framträdandena.men du kan tanka hem hela showen här:
http://thepiratebay.org/torrent/5343795/Melodifestivalen.2010.Deltavling1.SWEDiSH.PDTV.XviD-REMAiN"
,carolafans,2010-02-07T21:40Z,Behållningen av gårdagens deltävlig var just Pausen med dolph Lundgren..märkliga att oftast är det just pausunderhållningen bättre är själva tävligen
