User Type,Username,Date,Text
,cyaninternetdog,2010-03-05T02:03Z,FAKE! go fuck yourself you pot smoking bisexual liberal cunt!
[T],lilmjkl,2010-03-05T09:37Z,"Sinds When is this fake?

You did'nt even have the file because no one have the file so you can't even say its fake.

First Download it, that watch it and you will see its not fake -.-

(please other people, after download it say its not fake so people will stil download it?)"
[T],lilmjkl,2010-03-05T09:38Z,"BTW, Put first self some stuff on The Piratebay Before you say something like this XD"
,Crazyowner,2010-03-30T20:49Z,"Thanks man, goeie torrent :)"
[T],lilmjkl,2010-04-01T18:04Z,"Gelukkig zijn er nog mensen die mijn films wel waarderen, "
,SgtKenneth,2010-04-14T18:44Z,"Good torrent!
Downloaded like a charm 1 mb/s !"
,Mathijs_Nat,2010-05-04T22:43Z,Geweldige film !!! 
,-wkr-,2010-07-13T20:41Z,THANKS!!!! gr8 work :):)
,Djgrazy,2010-10-22T22:29Z,"kan hem niet downloaden staat toegang geweigerd?? waar moet ik me registreren dan?

(Can't download it. says acces not allowed (or like it) where do i need to register?)"
