User Type,Username,Date,Text
,Capt.Klaa,2009-12-26T05:06Z,"Another Fucken password RAR. 

Just a link to some add"
,mr_trust,2009-12-26T10:38Z,Password protected file. What a cock...
,mr_trust,2009-12-26T10:53Z,"BTW the final link to get the password after u've drudged thru all the ads/survey does NOT work. No hyperlink attached, just a picture of a link button. Pure waste of time. Again.... what a cock..."
,Capt.Klaa,2009-12-26T13:32Z,Password -  chumpchange
,lilly15,2009-12-27T02:20Z,passworded torrents are a crock
