User Type,Username,Date,Text
,djfredmiami,2010-02-10T06:09Z,Interesting on uploading stuff here is that nobody thanks anybody! 
,kellendeanneX,2010-02-27T23:17Z,I'm thanking you! Thank you! I love this song . 
[T],JugzG0nn4G3tY4,2010-03-03T07:11Z,Loved it. Great job on the editing and I use two huge monitors for all my shows and this is just fantastic! +1 djfredmiami
,stixdogg,2010-05-25T06:59Z,"This one doesnt end abruptly like the other 2 I have found that contain the 'talking"" parts, however, they all end before the video is acutally over.  the other two cut off right in the middle of luda saying face down ass up, and this ends before.  can someone upload the full video? that would be awesome! :)"
,stixdogg,2010-05-25T18:48Z,"my bad, its not missing anything but the talking.  the black bars are encoded with it to make it 4:3."
