User Type,Username,Date,Text
,gastonneke35,2010-03-31T11:43Z,bedankt !!!!
,King-R,2010-03-31T20:21Z,Thanks !!
,movelikeme,2010-04-01T12:53Z,Dit is de tweede maal dat ik een film download waar van verwacht een dvdrip te krijgen en ik slechte kwaliteit krijg dit is geen dvdrip maar gefilmd uit een cinema . als het geen dvdrip is beloof het dan ook niet . danku
,casajax,2010-04-01T15:20Z,"@ movelikeme je moet niet bij formaat kijken 
maar bij bron en daar staat duidelijk ts dus cam 
eerst kijken voordat je gaat zeuren 

tnx"
,Ouzotime,2010-04-02T18:09Z,nice up however a sample wouldnt hurt :p
,Twoface538,2010-04-08T19:08Z,"Ben benieuwd, maar toch THX"
,DimmuBorgir666NL,2010-04-08T19:44Z,waar de hell haal je die films weg...?
,jellebie,2010-04-17T19:25Z,"Als je een beetje kan lezen movelikeme zie je vast wel xvid staan geen DVDrip!

Wees blij dat ze bij DIVXNL team zulke goeie films hebben en snel!

Bedankt voor weer een mooie film DIVXNL!!!
Als we jullie niet hadden..."
