User Type,Username,Date,Text
,andyhk92,2009-12-28T18:23Z,seed
,jstnext2u,2010-01-11T18:46Z,thx.... it's a  great copy really enjoyed it... 
,sic.root,2010-01-23T08:47Z,Episode one..... Minute and 40 seconds? wtf?
,CaranthiZ,2010-02-25T11:30Z,when is next update?
,andrehagglund,2010-03-16T17:24Z,"Omfg.... This is season 8 ffs.....
WHAT IS THIS I WANNA KICK SOMEONE IN THE HEAD. "
,andrehagglund,2010-03-16T17:26Z,0r not checked wrong file :p soz
,BamBuff,2010-05-04T12:41Z,It IS season 8. He just renamed the episodes. 3GB down the drain.
