Filename,Size,Unit
The Dennis Prager Show Hr 1 10-Sep-10 Not CF.mp3,48.25,M
The Dennis Prager Show Hr 2 10-Sep-10 Not CF.mp3,48.07,M
The Dennis Prager Show Hr 3 10-Sep-10 Not CF.mp3,48.07,M
The Eternal Flame of Muslim Outrage.mp3,6.41,M
Barack Obama's 5 Cacophonous Notes.mp3,6.1,M
Media Bias_ The Chasm Widens   9.9.1.mp3,5.73,M
Never Forget   9.9.10.mp3,5.58,M
The Rev. Jones and Both Sidesism   9.mp3,5.41,M
With Savings Like These ...   9.9.10.mp3,4.85,M
Is U.S. Losing Its Competitive Edge_.mp3,4.83,M
The Ego Of A RINO    9.9.10.mp3,4.82,M
Burning The Quran  9.9.10.mp3,4.43,M
Castro's Confession    9.9.10.mp3,3.64,M
Rush Limbaugh Morning Update 10-Sep-10.mp3,2.51,M
Torrent downloaded from Demonoid.com.txt,47,B
