User Type,Username,Date,Text
,massdale,2010-06-12T00:28Z,"Thanx man for the upload, I really appreciate it!"
,ElectroKing,2011-02-04T15:26Z,"Thanks for the upload  ;)

Do some of u guys know, what album Corner store and Papoose ft. Mike Jones - Who You Know are on ?? 

Know its old but i think its the best one, my computer just got fucked up, thats why i am asking u guys,,.....

Thanks !!"
,egg311,2011-04-01T03:55Z,"ElectroKing: Papoose's ""Sharades"" 2005 has ""Who You Know"" feat. Mike Jones, but I don't know about Corner Store. I'm gonna be uploading a complete Papoose discography soon"
,egg311,2011-04-01T03:58Z,"Oh yeah, thanks for the upload focused"
