User Type,Username,Date,Text
,Bafucin,2010-08-21T23:24Z,http://www.imdb.com/title/tt1270296/
,dardardar67,2010-08-22T09:18Z,FAKE
,dsgjsd2,2010-08-22T20:28Z,"a 10 , v 10 and thanks for the dl!!!"
,freentx,2010-08-23T01:51Z,"well, one says ""fake and one says ""a/v 10""?? not a trusted upper. showing 2000 + seeders alotho only up for one day, i'm thinking fake.
would any one of u alleged 2154 people who have dl'd this care to comment?"
,X-prope,2010-08-23T03:31Z,I can confirm that this one sadly is a fake.
[V],SAFCukO09,2010-08-23T03:49Z,Idiots .........If you think its fake fo for it ...check my ups before shouting fake next time
,J4CK_THE_R1PPER,2010-08-23T10:37Z,"Dumb asses.. Anyways, SAFCukO09, didn't you used to have a skull next to your name?? What happened?? Why did they take it off??"
,snilloc,2010-08-23T11:37Z,"Sorry for this uploader but the comments people have posted say not nice things.
So thanks for those who have given warnings. 
Fake, not fake. Had a pink skull now no skull :(
I am out of here"
,JPolywog,2010-08-23T14:20Z,Have not watched entire movie yet but I can confirm that Audio and Video are 10. Thanks to SAFCuk009.
[V],SAFCukO09,2010-08-24T11:00Z,"I did have a pink skull i was a VIP Trusted uploader but someone hacked my account so i guess i start from scratch ..The idiots who shout fake make some miss out ..Have you ever wondered why fake is shouted as much ,maybe someone doesnt want you downloading "
,beefur,2011-02-26T18:17Z,"Anybody that claims this is fake needs to ride the short bus with an extra thick helmet. Sure, it is in a zip file, big freakin deal...Extract it, and it works, video and audio are great.  Btw, thx SAFCukO09 for the quality upload. Peace."
,beefur,2011-02-26T19:00Z,"For those who claim fake....STFU, it's a legit zip file, and audio/video is of great quality. "
