User Type,Username,Date,Text
[T],n2kmaster,2010-06-22T17:49Z,Should add i put this in mp4 format. Why? Cuz its my favorite format.
,misterw,2010-06-22T19:01Z,"If you have the time to play about with a shit copy why not.  Confucius  say... YOU CAN,T POLISH A TURD "
,GeekHillbilly,2010-06-23T14:16Z,And the mythbusters proved that you could polish a turd. :-)
,misterw,2010-06-23T15:20Z,"Must have missed that piece of crap ,as i was to busy having a life.."
,abishekr,2010-06-26T16:07Z,"old chinese saying-""u can take the ass outta the turd but not the turd outta the ass"""
