User Type,Username,Date,Text
,FieroGT,2010-02-22T10:18Z,"any word on this?  i tried it , but cant get the setup to run correctly.  even with trial dl from their site. setup starts, asks what language, then nuthin... it still shows it running it task man, but nuthin on screen....  :(     windows 7 ult 64."
,gregduc,2010-02-22T16:03Z,"any word on this? i tried it , but cant get the setup to run correctly. even with trial dl from their site. setup starts, asks what language, then nuthin... it still shows it running it task man, but nuthin on screen.... :( windows 7 ult 64. "
,gregduc,2010-02-22T16:05Z,"Excuse me, error handling

You must delete all processes starting with prtgn in administrator mode"
,agungsp2000,2011-09-14T04:22Z,"doesnt work, as gregduc/fierogt said..."
,chrisbdu,2012-04-18T07:54Z,"download ok
please explain how to install,"
,chrisbdu,2012-04-18T08:16Z,"please can someone tell me which version  to install,and which files to copy from crack.ta"
,=BW=,2012-05-25T13:29Z,Don't waste your time on this torrent... Get this one instead...   http://thepiratebay.se/torrent/7298132/PRTG.Network.Monitor.v12.2.1.1767-SHOCK
