User Type,Username,Date,Text
,Miiqu,2009-10-27T14:03Z,"Wtf is this. Just a few minutes ago my friend asked me if I could get him Brother Bear 1 (on swedish though) and now you upload the movie.

Is this karma or are we just ment to be together?!?! (if your a man, never mind :) )"
,de_spijker,2009-10-27T21:00Z,bedankt.  (^_*)
,mgd37,2010-10-27T22:29Z,Thanks voor de post Pioen.
,werchter001,2011-02-07T02:44Z,keep up the good work! 
,sheriff88,2012-02-14T18:29Z,whats with all the files? They play but i'm confused.. do i put them in playlist or what?
