User Type,Username,Date,Text
[V],merzedes,2009-10-07T16:46Z,I cant upload screens from SAS so you have to find them yourself :-) Go to www Kink.com and to SAS :-) Cheerz 
[V],merzedes,2009-10-07T21:42Z,"383 peers at this time and no thanx , whats the matter with you out there .Dident any of you wanted more from this site :-( Its up to you   Cheerz"
,deadrody69,2009-10-07T22:20Z,Thanks as usual merzedez.  
,mafiadog,2009-10-07T23:37Z,thank you so much for all your excellent work.
,JbearL,2009-10-08T00:06Z,"Muchas Gracias, M."
,dk1854,2009-10-08T01:36Z,Thanks a million Merzedes!  Anything from SAS is always great.  Keep up all the good work!
,pr908,2009-10-08T22:44Z,Thanks Mercedes. We love your UL. 
,hdsoaw,2009-10-10T02:41Z,you r simply the best
,SirSwed,2009-10-13T00:14Z,"As always, thanks for your work!"
,Axe666,2009-10-17T17:36Z,Quality upload merzedes.....thanks !
,NewHarding,2009-10-17T19:34Z,Thanks Merzedes!
,jeepy94,2010-01-26T20:50Z,"Merc:

Excellent work as usual. Thanks a lot!"
,dlmax63,2010-05-16T02:25Z,Thanks for the up
