User Type,Username,Date,Text
,chitchatid,2011-03-19T07:18Z,i love blind faith on the cherry pie. tq
,alejandro70,2011-07-30T01:48Z,GRACIAS !!!!!!!!!!!!!!!!!!!!!!!!!!!!!!!!!!!!!!!!!!!!!!!!!!!!!!!!!!1
,sexpanther,2011-08-12T16:02Z,"Had to come back and grab this...can't believe I didn't have it already!

So long Jani, and thanks for Cherry Pie - that album was freaking awesome."
,starwolf1001,2011-08-14T09:23Z,Jani Lane died thursday August 11th :(
,snarlydog,2011-09-19T18:37Z,"
rock n roll wud have been much better if he's alive

"
