User Type,Username,Date,Text
,do_not_delete_me,2010-11-09T15:00Z,Plz Seed Someone....Hey ChattChitto can u tell me how to seed a torrent very much.....i also have a torrent uploaded and i want to seed it...
,do_not_delete_me,2010-11-09T15:03Z,Hey how do u create an exe file....plz tell me...im dying!U Rock AS ALWAYS CHATTCHITTO!!!!
[V],Anacondaz,2010-11-09T16:47Z,"installed fine in my win7 32 bit
thanks a lot mate
iam one of ur great fans
thanks a lot mate
thanks a milllionnnnnnnnnnnnnnnn
thanks a lot 
ur music is always different and great mate"
,calipolkid,2010-11-16T06:43Z,Awesome. It is my first download from you and it works Great and is SOOOOO easy to install. THANK YOU VERY MUCH! I am downloading few more things from you. Again Thanks I will so Donate!
,hussain8,2010-11-22T11:15Z,thankssssssssssssssss
,RavBreck,2010-11-22T23:34Z,"Hey
Works great on my win7 32. Thank youuuuu very much, you rock"
,D4RTH,2010-11-24T15:56Z,thank you baba :)
,hippapotica,2010-12-19T08:59Z,"thank you very much. very easy, no rubbish here!"
,adm1riker1,2010-12-23T17:37Z,Congrats!  Nothing but PERFECT!  Appreciate it much!
,jb_2011,2010-12-28T00:45Z,"You are the man!
Thumbs up..."
,tekrunner26,2011-01-06T10:44Z,"Works first time and like all of ChattChitto posts, works everytime. "
,kcjo,2011-01-11T06:10Z,"your are a software God!

I always trust your torrents.
I have so many of them :D

Good job once again!"
,ctmpsfc,2011-01-13T17:52Z,Nice job! Thank you
,ctmpsfc,2011-01-13T18:00Z,"works great. just made a donation to your forum. How about an invite to the forum?...
Thank you"
,duvasae,2011-01-14T13:49Z,thanks yet again!!  works perfectly
,coderX,2011-01-20T20:53Z,Works great as of 1-20-11
,Gary812X,2011-02-01T23:15Z,"Just Installed / Works Freakin GREAT   Thanks for all the hard work, u da man!!!"
,cross143,2011-02-04T04:24Z,"works great as of Feb 3, 2011!! Thanks dude! :D"
,prajwalrae,2011-02-19T14:50Z,tq....................dude
,xSareth,2011-02-19T17:09Z,"Wha? Why does uTorrent tell me ""Access is denied""?"
,jagan16,2011-02-20T16:12Z,"Thank you, very nice i got winzip"
,dolekabaap,2011-02-25T17:46Z,"wah bete...kya baat hai....hamesha ki tarah .....you rocks......and bete IDM nhi aaya abhi tak..
.
.
we need IDM latest version.!!"
,plus__one,2011-02-26T03:21Z,"installed very nicely, worked fine...nice intro menu thing, gay music though =P"
,mgfman1,2011-03-07T19:52Z,Hi  I always support your work mate hats off to ya
,milady71,2011-03-11T22:15Z,Thanks a lot Chattchitto!
,nothingreallymatters,2011-03-12T14:26Z,"@MrAntiVirus: Are you paid or you just like to spam for free? Have you noticed, your remarks just strengthens the torrent popularity. Condescending remarks will not get you anywhere.  "
,dalek963,2011-03-17T09:38Z,Once again another great torrent! Over 9000 internets to you!
,soundimpressions,2011-03-18T18:28Z,Mine quit downloading at 99.7% :(
,rebeldevil,2011-03-23T16:15Z,Thanks CC!!
,peteconde,2011-03-24T14:08Z,Awsome job ChattChitto....thanks
,capt.b,2011-03-25T01:34Z,love your torrents A+++
,Sobirbek,2011-03-26T09:56Z,"Thanks, ChittChatto! I enjoy using it!"
,xCogy420x,2011-03-28T05:12Z,legit! preciate... easy to install and keys worked perfectly.
,buckshee123,2011-04-01T10:51Z,Chattchitto - As always a big thank you
,piratebootyjapan,2011-04-05T15:38Z,"Thanks a bunch, ChattChitto!"
,Minot13,2011-04-10T06:51Z,Nice work but pls dont keep such nude photos. i wanted to give it to my uncle but couldnt give because of nude pic.
,bando101,2011-04-12T00:32Z,"dude thanks, since ""the one"" left :( you've been my #1 uploader on TPB, thanks again "
,Gr3ggles657,2011-04-14T17:48Z,"ALL OF YOUR STUFF ALWAYS WORKS !!!!!!!
FUC***G AWSOME !!!!!!!! Thanks m8"
,snilloc,2011-04-26T06:15Z,"Never a problem with your stuff. 

10/10

THANK YOU VERY MUCH FOR ALL YOUR HARD WORK :-)"
,stelios68,2011-04-26T07:57Z,"ChattChitto: The Best.
Thanks!!!"
,1tpblover,2011-04-26T13:03Z,"ChattChitto RG, Thank u.. worked very well.."
,TheMisterDutchy,2011-05-07T11:52Z,"Cool, works great"
,Aevyl,2011-05-14T04:18Z,"nice  work
btw whats the song in the installer called? it's awesome"
,Aevyl,2011-05-14T04:21Z,"nice work!
btw the song in the installer is awesome
what is it and who sings it ?"
,Aevyl,2011-05-14T04:41Z,"good work 
and i love the song in the installer
what is it's name/artist?"
,Aevyl,2011-05-14T18:41Z,"sorry about the multiple posts
didnt see them show up so i 
thought it messed up and 
tried posting again
sorry"
,enotbugm,2011-06-03T03:34Z,"Yo man, I need to ask a favor. I don't know if you can do this really... I been trying to find a cracked HMA! VPN Pro but can't find any... I want to know if you can get this for me. Thanks"
,12hes21,2011-06-08T16:29Z,the se/le ratio is a lie. its about 1600 and 1200
,pwnerman,2011-06-12T09:27Z,is this Winzip 15.5?
,Mathijs13,2011-06-12T11:40Z,"Download time:
57sec
I will seed for a month."
,Wellsj,2011-07-14T08:55Z,I ain't installed this yet but I know it will work great cos all your stuff does. Thanks a lot son.
,thebaddad,2011-07-23T17:18Z,"I've downloaded lots from ThePirateBay but this is my first comment!  Great download. Fast, efficient and setup was actually entertaining with the music playing. lol   Good job and thanks."
,harishmg,2011-07-24T08:08Z,thank u chat chitto rg
,harishmg,2011-07-24T08:18Z,thank u chattchitto rg
,luke1980,2011-08-05T13:02Z,thankyou
,chokefrantic,2011-08-10T06:55Z,"No viruses or anything, simple installation, works great! Thanks!"
,laserboy_69,2011-08-19T06:56Z,"Thanks for all of the work ChattChitto, always the best stuff anywhere.  I always look for your uploads first when I need something."
,ght2000,2011-08-23T07:10Z,ChattChitto: Thanks for sharing.  Works well.
,fcamacho164,2011-08-29T17:34Z,"Awesome, as is all your work. Thanks!"
,noxiousCaitSith,2011-08-31T18:43Z,easiest program i've installed and finally got rid of the winzip trial version after all these years. bahaha. thank you
,surfnturff124,2011-09-10T19:51Z,Thanx bro. good stuff
,DevRocks,2011-09-15T17:09Z,u r the best!!!!!!!!!!!
,btdguy,2011-09-19T04:11Z,"every code i put in came up with an ""error 5"" message. help?"
,liamsullyinc,2011-09-22T16:27Z,fast and effective works 100% thankyou [ChattChitto RG] 
,gamyl79,2011-09-25T16:41Z,Thanx you're the best!
,blenderzoo,2011-09-26T17:25Z,Well embarassing enough i am real new to this but how do i get it to install without asking me to register or just try it for 45 days?
,blenderzoo,2011-09-26T17:31Z,nevermind i figured it out all by myself...
,Skipper_dk,2011-10-04T23:30Z,"Great upload, many thanks ;) Keep it up!"
,midoda,2011-10-06T09:00Z,"thank you chattchitto , U R the Best"
,voraxith,2011-10-12T09:22Z,"Thanks for uploading this, ChattChitto!  All I really needed was the registry key as the eval version I was using is actually more recent than this one, but hey--THANKS!!!"
,eastindiaco,2011-10-21T20:39Z,"Yup! It works! And serial no.3 is good, too.

I remember there used to be a keygen for earlier versions which used to gen keys for any name...

any chance of a keygen? just wanna avoid lame usernames - didn't plan on using own name, for sure!

MSSE didn't complain when I ran the appy, so assuming it's clean..."
,BaconMonster,2011-10-22T11:24Z,"This is great, great job! Anyone know what the song is called? lol"
,nengza,2011-10-24T13:37Z,Thanks bro! U rule....
,ukroadie,2011-10-24T17:50Z,"Fantastic!! Simple to install & a great program.
I am seeding this.... YOU should too!!!
Thanks ChattChitto RG, you are a star."
,jcorday,2011-11-07T04:16Z,"just got notification ""invalid registration using a cracked version""  then gave option to purchase..this is after a few months of using it working just fine"
,48oldtimer,2011-11-09T03:28Z,Works perfectly. Thank you
,k.calvin,2011-11-14T09:17Z,well
,Snurre__,2011-12-03T03:30Z,"Personally I think ""Peazip"" is the best file manager / file archiver plus in works equally well for Microsoft Windows as GNU/Linux.

You can find Peazip at: http://www.peazip.org/
Info: http://en.wikipedia.org/wiki/PeaZip"
,SpiralAE,2011-12-03T05:34Z,7zip is open source and awesome.
,Ispeachy,2011-12-03T07:00Z,"When I open up a program and try to extract a file, it asks for a password? Anyone have that?"
,Snurre__,2011-12-03T10:05Z,"@Ispeachy
Funny man ...
Yes it's ""I'am a virus"""
,mizzhoney1123,2011-12-04T07:55Z,Awesome! Works perfectly! No problems at all!
,JewBoo,2011-12-07T10:53Z,"thanks man. i had no problems installing this. works perfect. sincerely

- Mista Jew"
,Dandy007,2011-12-24T00:43Z,thnx m8y.
,hexenII,2012-01-02T00:17Z,"Excellent!! cann't get any better, thks."
,MizTickle,2012-01-02T19:17Z,"Cheers! ... name: WinZIP didn't work, but the 1st one, ChattChitto, worked.  "
,hannssoni,2012-01-06T15:16Z,winrar is THE BEST ONE 
,Snurre__,2012-01-13T20:39Z,"Check out ""Peazip"" better and free file manager / file archiver, this means no more serials, cracks, adware or other hassel. Plus in works equally well for Microsoft Windows as GNU/Linux.

You can find Peazip at: http://www.peazip.org/
Info: http://en.wikipedia.org/wiki/PeaZip"
,Snurre__,2012-01-13T20:53Z,"Check out ""Peazip"" better and free file manager / file archiver, this means no more serials, cracks, adware or other hassle. Plus in works equally well for Microsoft Windows as GNU/Linux.

You can find Peazip at: http://www.peazip.org/
Info: http://en.wikipedia.org/wiki/PeaZip"
,Caitlinann,2012-01-26T00:17Z,First time doing this and the easy to follow instructions were great. It works perfectly thank you very much! Will seed as long as possible. :)
,Eitsubishi_McLipse,2012-02-23T22:36Z,"I see ""ChattChitto"" and automatically know it's 100%"
,TECfReAk,2012-03-19T01:44Z,"You are tHĂ¨ MAN, ChattChitto. Thank you for all your xcelent DL's. It AlWays work. Brilliant"
,parteeboi,2012-03-23T21:05Z,THANK YOU! THANK YOU MAN!!! You are the BEST! I am seeding!
,mufuka,2012-03-28T17:27Z,Thanks!  So good!
,mlogun,2012-04-26T06:13Z,Easy to install and very user friendly thanks for the gr8 upload =o) keep up the good work.
,jedimoose,2012-05-07T09:25Z,Worked like a charm as always! Thanks a lot CC!
,quinn222,2012-05-30T19:37Z,The serials don't work for me. Thanks anyway.
,blackestsheep,2012-06-06T21:36Z,"works perfect
install
it  will ask to register
copy and paste username and serial code from included notepad file
continue clicking and installing
done
seed
go back to your life
thanks"
