User Type,Username,Date,Text
,SamanthaSweet,2010-12-08T05:42Z,Hello.  Is it possible to get Hell's Bells I?  I see you posted II.  My friend plays guitar in part I.  Thanks!
,canefaith,2011-02-14T20:39Z,"Hi indianChristian,

Do you have a mail or somthing?

I was wondering if you want to chat?

You can mail me on naveen@live.nl

Greets"
,Triana1958,2011-05-30T06:03Z,"Hey IC are you still uploading Christian movies? I am looking for a movie called ""the grace card"" with louis gossett jr that came out in Feb 2011 and also waiting on the new movie ""Courageous"" made by the same people that brought us ""Fireproof"" that comes out in Sept 2011..can you get those for me....many thanks and God Bless you!"
