User Type,Username,Date,Text
,SannyKlas,2009-12-04T03:51Z,"Da det, i princip, inte varit nagon feedback alls rekommenderar vi att de som ar intresserade koper de julkalendrar de vill ha.

Att ladda ner en torrent kostar inga pengar, och det gor inte heller ett tack, eller en kommentar. Enbart vi har seedat dag 1 till narmare 30 personer, och det har inte lett till ett enda tack eller nagon kommentar.

Detta projekt ar nagot som tagit, och tar, en hel del tid av var fritid. Nar positiv och negativ kritik da uteblir ter det sig inte sarskilt meningsfullt att fortsatta anvanda det fatal lediga timmar vi har per dag at att halla pa med detta."
,Flummig_Badboll,2009-12-04T07:32Z,Tackar f?r dessa delar
,Flummig_Badboll,2009-12-04T07:36Z,"kom igen SannyKlas. det är inte många som tackar på mina torrents heller, men sånt e livet."
,old_upploader,2009-12-04T07:54Z,Takar tackar
,plashvra8,2009-12-04T12:46Z,"Tack så hemskt mycket för denna! Jag uppskattar den verkligen, jag hoppas verkligen att du fortsätter att ladda upp för att dessa är verkligen svåra att få tag på.

Jag, precis som alla andra både seedar precis allt och jag personligen skall kommentera alla dina uppladdningar om du fortsätter. Du anar inte vilken stor insats du gör!

Säg vad du vill göra så gör jag det, bara du fortsätter :D"
,marcus_83,2009-12-04T13:13Z,"Detta v?cker verkligen minnen tillbaka! dessa ?r det b?sta p? hela dagen, det ?r dessa som man ser fram i mot n?r man kommer hen. forts?tt g?rna med det du g?r. det uppskattas verkligen av alla!"
,gearloose,2009-12-12T22:34Z,"Klockrent, jag har letat efter den här, stort tack!"
,grov37,2011-12-03T16:25Z,"det händer ju inte ett skit det går bra till 99,8 och sen stanna den bara men jag vill ha hem alla Julkalendern"
