User Type,Username,Date,Text
,isisx3,2009-07-24T17:16Z,"Hi, could I make a request? I've been looking for this program Zillatube everywhere and I can't find it. If you could crack it and upload it that'd be really great :) Thanks ahead."
,kaboum,2009-10-04T22:52Z,Does this version has the offset problem ?
,kaboum,2009-10-04T22:58Z,"Yep, I see the offset problem."
,gericb,2010-01-04T14:54Z,"I remember seeing something about this offset issue in the past, I assumed it was a flaw in the version of software at time, so would have assumed it to not be in this version.  

Can you tell me what the issue is, please?

Thank You!"
,FrasseDaMan,2010-01-13T01:10Z,"@gericb

It's NOT a map making flaw with the offset error. It's stupidity enforced by the Chinese government.
China had some regulations for civil mapping in their country. At first only Garmin GPS units from the Chinese reseller with Chinese firmware was designed to minimize the offset error. The Chinese security ban to mislead civilian usage and usage by foreigners was lifted in the autumn of 2008. "
,gonzpre,2010-03-30T13:22Z,guys... request for the spider man software if you have
