User Type,Username,Date,Text
,WindTrade,2009-07-28T11:21Z,Thanks!
,John13114,2010-04-29T19:59Z,Thanks a lot !! Great up.
,Harutik_11,2010-05-04T01:18Z,keeybee is the best
[T],insinuendo,2010-08-24T01:45Z,Thanks! 
,Amadorrr,2010-10-17T16:27Z,Thanx! I like it.
,RenanCastroBR,2011-01-09T21:57Z,"Grande Charles Aznavour, verdadeiro brega, 贸timo para momentos rom芒nticos com uma bela mulher ao lado ^.^"
,gunnar_vds,2011-03-19T17:50Z,Well done! Thanks for this :)
,fthieus,2011-04-09T23:20Z,"A San Marino, il 1978 ho comperato una cassetta di Charles Aznavour che cantava in Italiano. Non ho sentito da allora musica piu' bella nella mia vita.-"
,musicfromrizzo,2011-09-19T02:45Z,"mp3 version here: (with xtra duets too)

http://thepiratebay.org/torrent/6685628/Charles_Aznavour_Greatest_Hits_and_more_(mp3)(musicfromrizzo)

even a couple of Italian song versions thrown in for you"
,forex7,2011-10-01T17:38Z,thank you i enjoy
