User Type,Username,Date,Text
,lsoearth,2009-08-07T12:11Z,"I see that this torrent has gotten a few takers. Please let me know what you think.

Please, keep seeding!!"
,arranopola,2010-07-21T00:07Z,Thx!
,andrewflores17,2010-08-17T04:14Z,"love the books read my son the younger one and am reading this if anyone gets the chance id recomend his short storys kiss kiss and he had a tv show about his short storys realy good 

thnkx for the torrent "
,lsoearth,2011-08-15T09:32Z,"Thx to all those that have kept seeding. To any new downloaders, please feel free to ignore the text file in this torrent...life has changed, and improved, much since then."
