User Type,Username,Date,Text
,msh123,2011-09-11T11:45Z,"Hi
Why stop when not finnished?
max 99.2% - and lots are waiting..."
,Tyllis,2011-09-24T07:42Z,I have check this torrent and it's go to 100%
,Gazooo,2011-11-12T17:14Z,"No it's not going to 100%, it will end at 99,2%, that means that the last 4 songs on the last album are not there.
Well, I can live with that.
Because you still have the rest to listen to!!...
Thanks very much for this nice Up Load.
Greetings from Amsterdam, to all Hansi fans!!...
Gazooo"
