User Type,Username,Date,Text
,xpcro,2010-11-30T17:12Z,Bine baieti!
,Todoran_Virgil,2010-12-07T03:00Z,"Counter-Strike 1.6 V42 1.2 ""V42 "" :))) versiunea patruzeci si 2 ma? :))))) ai naibi .....  pfhahahah .... adik aia de la digitalzone sunt 40.1 si voi pe 42 pahahaha.... omg , copii cu kituri de pe google :)) terminati ma cu dianstea ca ne faceti de rahat!"
,sebastijan93,2010-12-16T22:40Z,sa-mi bag pula in tine si in tot neamul tau!!Nu se poate baga nici un IP server!!! FUCK OFF!!
,sebastijan93,2010-12-16T22:40Z,DO NOT DOWNLOADING THIS GAME!!
,sebastijan93,2010-12-16T22:41Z,Sugemi pula!!!!
,Dorin0301,2010-12-27T18:38Z,"@sebastijan93, don't make spam... this relase is best for pro skils"
,elex123,2011-05-01T21:13Z,this one works better than that of what i thought it would work for a non steam multiplayer but this does not contain any bots in it so if any one knows how to add bots then pls tell and one more problem is that it works fine while playing but when i quit the game it shows half life launcher has stopped working every time this is showed when i quit game how to solve this problem 
