User Type,Username,Date,Text
,OldSchoolDJ,2010-10-17T20:51Z,Come on. I dont want to waste time having to unzip it. Do it right the first time.  
,siennadry,2010-11-03T09:48Z,"^agreed. not worth downloading when each of the albums is individually listed with more seeds than this discography. also, a discography usually at least includes a bands singles as well as the studio releases."
,sseanbroken,2011-03-27T21:52Z,http://thepiratebay.org/torrent/6276007/BLINK_182_UP_ALL_NIGHT_%28_REAL____%29
,DNATorrents,2011-12-11T19:44Z,Come on. I dont want to waste time having to unzip it. Do it right the first time....AGREED 
,grossout,2012-05-14T15:22Z,Altought have to unzip Great Upload!
,alejandro70pb,2012-06-02T03:57Z,GRACIAS!!!!!!!!!!!!!!!!!!!!!!!!!!!!!!!!!!!!!!!!!!!
