User Type,Username,Date,Text
,ryanstevens,2009-11-09T07:10Z,Thanx man....You always come thru.
,blackhawks116,2009-11-09T18:22Z,"Thanks a lot, EZTV"
,jengiscan,2009-11-09T19:20Z,"I usually have no problem with the torrents from eztv here but I am getting an 'invalid torrent file' message when i download the torrent, any idea why?"
,SeaFlat,2009-11-09T22:06Z,Thanks.
,feather22,2009-11-10T06:34Z,EZTV is a hero of mine.
[V],neon,2009-11-13T16:59Z,thanks very much eztv
,jengiscan,2009-11-14T14:18Z,sorted the problem I had some security stuff running at the same time.
