User Type,Username,Date,Text
[T],soagg,2009-11-09T17:36Z,"Hey before you start asking for 09-13 please be informed that DVD's are not yet out. The difference can obviously seen once you get a copy of 005-008 episodes which are iTunes Rip.

Please be patient and I will try to get them as soon as possible.

Thanks for your patience and great response on previous Shippuden torrent.

Enjoy!!"
,Knight_Auron,2009-11-16T00:38Z,Can you upload the latest BLEACH episodes?
,Kretenulis,2009-11-16T21:22Z,"OMG soagg man u are the best there is
jsut keep up the good work
i have the worst upload ever but still i seeded this torrent 2 times cuz of respect :)
Thx "
,Knight_Auron,2009-11-17T02:53Z,Please upload BLEACH episodes 165 and 166.
,Knight_Auron,2009-11-18T00:48Z,"Please, I want the new BLEACH episodes!"
,Mulletron517,2009-11-18T18:26Z,*facepalm*  here we go again...
,soagg1,2009-11-19T01:59Z,"I am unable to login to this account on TPB so I have created a new account. Please use

tpb/user/soagg1 from here on for my torrents"
,bamsen82,2009-11-20T00:26Z,Danm man you Rock
,seedosi18,2009-11-25T00:33Z,"been wondering where u went soagg ;)

thanks for all your awsome torrents!

will enjoy watching tons of anime this thanksgiving with my cousins ;)"
,Lord_Nitros,2009-12-05T00:41Z,yeaa thx soo much
,bamsen82,2009-12-06T02:44Z,http://www.narutoget.com/.. you can see naruto shippuden esp 1- 138.. on this page... for free...
,cooljay3,2010-01-20T15:58Z,"Keep up the great work soagg. nuff respect man from us here in Jamaica. I just got a litle fav to ask though can u upload DUEL MASTERS I CAN'T SEEN TO FIND IT ANYWHERE. MUCH APPRECIATED THNX. 
Frm: The coolmaster"
,psphackerowned,2010-01-21T00:36Z,cool someone should up the first shippuden boxset
,kdavies9688,2010-01-28T16:38Z,Hey Soagg ur awsome anyway u can upload Gantz Season 1 & 2 english Dubbed no good ones out there yet
,gowog,2010-03-24T22:04Z,soagg bro can upload one piece in dubbed version(english) please
