User Type,Username,Date,Text
[V],Anacondaz,2010-09-19T02:31Z,thanks for the nice upload mate
,lf_1301,2010-09-22T16:53Z,"what's this .exe ?
it's not signed by URSoft, Inc.
how comes ?
there's a passworded file into the exe."
,Straydog1st,2010-10-09T01:04Z,This keugen doesn't work for a download from the original site. Must look for anothr one
,forthe18,2010-10-26T04:51Z,"go to google, and download this program first anyway, and you can activate it with the password above on this page"
,forthe18,2010-10-26T04:53Z,i mean serial number
