User Type,Username,Date,Text
[V],harry711,2009-10-05T01:47Z,"Wow, you virus makers aren't even TRYING to disguise yourself anymore................"
,blackiceheart,2009-10-05T01:49Z,"all thats in the zip file is .txt files the read me and the other 2 you have to rename them 2 create the virus read the read me it explains everything dude, Peace, Love & Clarity"
,blackiceheart,2009-10-05T01:50Z,whats the point lol people gonna find out xD Peace. Love & Clarity
[V],harry711,2009-10-05T01:52Z,"Oh, I see now. Apologies :)"
,blackiceheart,2009-10-05T01:53Z,"no need my friend :) Peace, Love & Clarity"
,blackiceheart,2009-10-10T08:18Z,"lol i no but i have so many uploads lol Peace, Love & Clarity x"
