User Type,Username,Date,Text
,jox74,2009-11-27T11:31Z,Seed plz i am stuck i will seed when done
,pircedmetal,2009-12-01T20:58Z,im trying to seed asmuch as i can the snatch n runners dont help
,LucBorg,2009-12-01T23:18Z,"PLEASE please please seed, i am stuck at 51%"
,lerie1997,2009-12-10T13:05Z,"I am stuck at 59 to, im sorry im new at this, how do you seed, so I can help????"
,pnfkwfl,2009-12-23T23:22Z,This is a GREAT collection.  Too bad no one is seeding.
,pnfkwfl,2009-12-24T13:39Z,After over two weeks TRYING to download this I am over it.  I downloaded everything separate and gave up on this one.  Nice package too bad no one is seeding it out.
,wim17,2010-01-02T19:31Z,"Come on people! Such a quality torrent with the entire Alien and Predator collection, and no one is seeding?

I've been trying for 2 DAYS and all I have is 86MB, less than 2%. Where are the 27 seeders? Right now, there are exactly 0."
,X-43bfn,2010-01-21T05:49Z,I... Love... This Torrent! You are my fucking savior! 0_0
,MRTH,2011-04-14T20:46Z,i will SEED this when im done xP Thanks 
,pircedmetal,2011-06-15T17:09Z,thanks seeders .......soz so many snatch and run thats why i upload to mostly privet sites now the only when to keep files going dam selfish snatch and runs
