User Type,Username,Date,Text
,Dragonlight2,2010-01-08T03:45Z,"Hope you like my seedig speed :)

Cheers!"
,KoalaKnight,2010-06-18T15:29Z,"Seems to be missing chapter 139, but great so far other than that, thanks!"
,dpsci1,2011-07-26T04:25Z,Could you please upload the chapters after 358?  That would be awesome since now there are a lot more manga chapters
,randomperson1234321,2011-10-07T11:44Z,"Missing Chapters 139 and 299 from this pack. Also, will you be doing the rest?

Thanks for the torrent btw"
