User Type,Username,Date,Text
,saber91101,2009-11-02T01:42Z,d00d i 
,saber91101,2009-11-02T01:43Z,umm last comment f'ed up...anyways thnx 4 the down tso rox
,djl93,2009-11-04T04:56Z,Great Torrent thanks for it!
,chuckasarus,2009-11-07T15:05Z,Thank you for the music!
,Sidewinder11055,2009-11-22T21:48Z,"Many thanks; was at their concert yesterday; one of the most spectacular performances I've ever seen!
If you get the chance, see 'um..."
,hailmarduk,2009-11-29T09:42Z,thank you
,arabica2k,2009-12-24T05:10Z,"Just got back from their show tonight 12/23 and I agree, the show is over the top excellent.  Ordered the CD this will hold me till then. Hot chix rocking violins - what is not to love"
